Sheet: Results - Summary
A1: Threads | B1: Furious opssec | C1: Furious mean | D1: Furious stddev | E1: Generic opssec | F1: Generic mean | G1: Generic stddev | H1: Queue opssec | I1: Queue mean | J1: Queue stddev | K1: Stack opssec | L1: Stack mean | M1: Stack stddev
A2: 1 / Results - Detailed | B2: of:=[$'Results - Detailed'.$B$2] -> 4662800 | C2: of:=[$'Results - Detailed'.$C$2] -> 0.000136 | D2: of:=[$'Results - Detailed'.$D$2] -> 0.097057 | E2: of:=[$'Results - Detailed'.$E$2] -> 2020400 | F2: of:=[$'Results - Detailed'.$F$2] -> 0.000435 | G2: of:=[$'Results - Detailed'.$G$2] -> 0.164793 | H2: of:=[$'Results - Detailed'.$H$2] -> 2792400 | I2: of:=[$'Results - Detailed'.$I$2] -> 0.000292 | J2: of:=[$'Results - Detailed'.$J$2] -> 0.135488 | K2: of:=[$'Results - Detailed'.$K$2] -> 2510800 | L2: of:=[$'Results - Detailed'.$L$2] -> 0.000335 | M2: of:=[$'Results - Detailed'.$M$2] -> 0.145019
B3: of:=[$'Results - Detailed'.$B$3] -> 4647400 | C3: of:=[$'Results - Detailed'.$C$3] -> 0.000147 | D3: of:=[$'Results - Detailed'.$D$3] -> 0.097972 | E3: of:=[$'Results - Detailed'.$E$3] -> 2021400 | F3: of:=[$'Results - Detailed'.$F$3] -> 0.000439 | G3: of:=[$'Results - Detailed'.$G$3] -> 0.16608 | H3: of:=[$'Results - Detailed'.$H$3] -> 2761800 | I3: of:=[$'Results - Detailed'.$I$3] -> 0.000287 | J3: of:=[$'Results - Detailed'.$J$3] -> 0.137285 | K3: of:=[$'Results - Detailed'.$K$3] -> 2512400 | L3: of:=[$'Results - Detailed'.$L$3] -> 0.000326 | M3: of:=[$'Results - Detailed'.$M$3] -> 0.146092
B4: of:=[$'Results - Detailed'.$B$4] -> 4673000 | C4: of:=[$'Results - Detailed'.$C$4] -> 0.000144 | D4: of:=[$'Results - Detailed'.$D$4] -> 0.098438 | E4: of:=[$'Results - Detailed'.$E$4] -> 2019200 | F4: of:=[$'Results - Detailed'.$F$4] -> 0.000432 | G4: of:=[$'Results - Detailed'.$G$4] -> 0.167465 | H4: of:=[$'Results - Detailed'.$H$4] -> 2783400 | I4: of:=[$'Results - Detailed'.$I$4] -> 0.000303 | J4: of:=[$'Results - Detailed'.$J$4] -> 0.137852 | K4: of:=[$'Results - Detailed'.$K$4] -> 2518200 | L4: of:=[$'Results - Detailed'.$L$4] -> 0.000337 | M4: of:=[$'Results - Detailed'.$M$4] -> 0.147073
B5: of:=[$'Results - Detailed'.$B$5] -> 4680400 | C5: of:=[$'Results - Detailed'.$C$5] -> 0.000144 | D5: of:=[$'Results - Detailed'.$D$5] -> 0.099088 | E5: of:=[$'Results - Detailed'.$E$5] -> 2020600 | F5: of:=[$'Results - Detailed'.$F$5] -> 0.000427 | G5: of:=[$'Results - Detailed'.$G$5] -> 0.168677 | H5: of:=[$'Results - Detailed'.$H$5] -> 2780200 | I5: of:=[$'Results - Detailed'.$I$5] -> 0.000296 | J5: of:=[$'Results - Detailed'.$J$5] -> 0.139002 | K5: of:=[$'Results - Detailed'.$K$5] -> 2522400 | L5: of:=[$'Results - Detailed'.$L$5] -> 0.00033 | M5: of:=[$'Results - Detailed'.$M$5] -> 0.148068
B6: of:=[$'Results - Detailed'.$B$6] -> 4659800 | C6: of:=[$'Results - Detailed'.$C$6] -> 0.000145 | D6: of:=[$'Results - Detailed'.$D$6] -> 0.100036 | E6: of:=[$'Results - Detailed'.$E$6] -> 2016400 | F6: of:=[$'Results - Detailed'.$F$6] -> 0.000427 | G6: of:=[$'Results - Detailed'.$G$6] -> 0.17011 | H6: of:=[$'Results - Detailed'.$H$6] -> 2794600 | I6: of:=[$'Results - Detailed'.$I$6] -> 0.000283 | J6: of:=[$'Results - Detailed'.$J$6] -> 0.139662 | K6: of:=[$'Results - Detailed'.$K$6] -> 2517000 | L6: of:=[$'Results - Detailed'.$L$6] -> 0.000339 | M6: of:=[$'Results - Detailed'.$M$6] -> 0.149367
B7: of:=[$'Results - Detailed'.$B$7] -> 4689800 | C7: of:=[$'Results - Detailed'.$C$7] -> 0.000146 | D7: of:=[$'Results - Detailed'.$D$7] -> 0.100445 | E7: of:=[$'Results - Detailed'.$E$7] -> 2023600 | F7: of:=[$'Results - Detailed'.$F$7] -> 0.000427 | G7: of:=[$'Results - Detailed'.$G$7] -> 0.17106 | H7: of:=[$'Results - Detailed'.$H$7] -> 2798600 | I7: of:=[$'Results - Detailed'.$I$7] -> 0.000282 | J7: of:=[$'Results - Detailed'.$J$7] -> 0.14057 | K7: of:=[$'Results - Detailed'.$K$7] -> 2523200 | L7: of:=[$'Results - Detailed'.$L$7] -> 0.000327 | M7: of:=[$'Results - Detailed'.$M$7] -> 0.150274
B8: of:=[$'Results - Detailed'.$B$8] -> 4655000 | C8: of:=[$'Results - Detailed'.$C$8] -> 0.000143 | D8: of:=[$'Results - Detailed'.$D$8] -> 0.101524 | E8: of:=[$'Results - Detailed'.$E$8] -> 2026200 | F8: of:=[$'Results - Detailed'.$F$8] -> 0.000434 | G8: of:=[$'Results - Detailed'.$G$8] -> 0.172216 | H8: of:=[$'Results - Detailed'.$H$8] -> 2778200 | I8: of:=[$'Results - Detailed'.$I$8] -> 0.00029 | J8: of:=[$'Results - Detailed'.$J$8] -> 0.142109 | K8: of:=[$'Results - Detailed'.$K$8] -> 2519400 | L8: of:=[$'Results - Detailed'.$L$8] -> 0.000323 | M8: of:=[$'Results - Detailed'.$M$8] -> 0.151458
B9: of:=[$'Results - Detailed'.$B$9] -> 4666000 | C9: of:=[$'Results - Detailed'.$C$9] -> 0.000145 | D9: of:=[$'Results - Detailed'.$D$9] -> 0.102116 | E9: of:=[$'Results - Detailed'.$E$9] -> 2021200 | F9: of:=[$'Results - Detailed'.$F$9] -> 0.000425 | G9: of:=[$'Results - Detailed'.$G$9] -> 0.173658 | H9: of:=[$'Results - Detailed'.$H$9] -> 2804600 | I9: of:=[$'Results - Detailed'.$I$9] -> 0.000285 | J9: of:=[$'Results - Detailed'.$J$9] -> 0.142444 | K9: of:=[$'Results - Detailed'.$K$9] -> 2517000 | L9: of:=[$'Results - Detailed'.$L$9] -> 0.000334 | M9: of:=[$'Results - Detailed'.$M$9] -> 0.152627
B10: of:=[$'Results - Detailed'.$B$10] -> 4676000 | C10: of:=[$'Results - Detailed'.$C$10] -> 0.000144 | D10: of:=[$'Results - Detailed'.$D$10] -> 0.102711 | E10: of:=[$'Results - Detailed'.$E$10] -> 2021400 | F10: of:=[$'Results - Detailed'.$F$10] -> 0.000426 | G10: of:=[$'Results - Detailed'.$G$10] -> 0.174873 | H10: of:=[$'Results - Detailed'.$H$10] -> 2773800 | I10: of:=[$'Results - Detailed'.$I$10] -> 0.0003 | J10: of:=[$'Results - Detailed'.$J$10] -> 0.144275 | K10: of:=[$'Results - Detailed'.$K$10] -> 2517800 | L10: of:=[$'Results - Detailed'.$L$10] -> 0.000329 | M10: of:=[$'Results - Detailed'.$M$10] -> 0.153677
B11: of:=[$'Results - Detailed'.$B$11] -> 4684000 | C11: of:=[$'Results - Detailed'.$C$11] -> 0.00014 | D11: of:=[$'Results - Detailed'.$D$11] -> 0.103304 | E11: of:=[$'Results - Detailed'.$E$11] -> 2022400 | F11: of:=[$'Results - Detailed'.$F$11] -> 0.000434 | G11: of:=[$'Results - Detailed'.$G$11] -> 0.176067 | H11: of:=[$'Results - Detailed'.$H$11] -> 2800800 | I11: of:=[$'Results - Detailed'.$I$11] -> 0.000283 | J11: of:=[$'Results - Detailed'.$J$11] -> 0.144562 | K11: of:=[$'Results - Detailed'.$K$11] -> 2521200 | L11: of:=[$'Results - Detailed'.$L$11] -> 0.000326 | M11: of:=[$'Results - Detailed'.$M$11] -> 0.154631
B12: of:=[$'Results - Detailed'.$B$12] -> 4533200 | C12: of:=[$'Results - Detailed'.$C$12] -> 0.000154 | D12: of:=[$'Results - Detailed'.$D$12] -> 0.098497 | E12: of:=[$'Results - Detailed'.$E$12] -> 2008200 | F12: of:=[$'Results - Detailed'.$F$12] -> 0.000423 | G12: of:=[$'Results - Detailed'.$G$12] -> 0.164952 | H12: of:=[$'Results - Detailed'.$H$12] -> 2753400 | I12: of:=[$'Results - Detailed'.$I$12] -> 0.000307 | J12: of:=[$'Results - Detailed'.$J$12] -> 0.136422 | K12: of:=[$'Results - Detailed'.$K$12] -> 2514800 | L12: of:=[$'Results - Detailed'.$L$12] -> 0.000343 | M12: of:=[$'Results - Detailed'.$M$12] -> 0.144797
B13: of:=[$'Results - Detailed'.$B$13] -> 4541000 | C13: of:=[$'Results - Detailed'.$C$13] -> 0.000151 | D13: of:=[$'Results - Detailed'.$D$13] -> 0.099177 | E13: of:=[$'Results - Detailed'.$E$13] -> 2010400 | F13: of:=[$'Results - Detailed'.$F$13] -> 0.000424 | G13: of:=[$'Results - Detailed'.$G$13] -> 0.166142 | H13: of:=[$'Results - Detailed'.$H$13] -> 2755600 | I13: of:=[$'Results - Detailed'.$I$13] -> 0.000299 | J13: of:=[$'Results - Detailed'.$J$13] -> 0.13746 | K13: of:=[$'Results - Detailed'.$K$13] -> 2518400 | L13: of:=[$'Results - Detailed'.$L$13] -> 0.000326 | M13: of:=[$'Results - Detailed'.$M$13] -> 0.145817
B14: of:=[$'Results - Detailed'.$B$14] -> 4552400 | C14: of:=[$'Results - Detailed'.$C$14] -> 0.000144 | D14: of:=[$'Results - Detailed'.$D$14] -> 0.099778 | E14: of:=[$'Results - Detailed'.$E$14] -> 2012200 | F14: of:=[$'Results - Detailed'.$F$14] -> 0.00044 | G14: of:=[$'Results - Detailed'.$G$14] -> 0.167388 | H14: of:=[$'Results - Detailed'.$H$14] -> 2744600 | I14: of:=[$'Results - Detailed'.$I$14] -> 0.000308 | J14: of:=[$'Results - Detailed'.$J$14] -> 0.138847 | K14: of:=[$'Results - Detailed'.$K$14] -> 2518000 | L14: of:=[$'Results - Detailed'.$L$14] -> 0.000326 | M14: of:=[$'Results - Detailed'.$M$14] -> 0.146944
B15: of:=[$'Results - Detailed'.$B$15] -> 4550200 | C15: of:=[$'Results - Detailed'.$C$15] -> 0.000144 | D15: of:=[$'Results - Detailed'.$D$15] -> 0.100522 | E15: of:=[$'Results - Detailed'.$E$15] -> 2012200 | F15: of:=[$'Results - Detailed'.$F$15] -> 0.000433 | G15: of:=[$'Results - Detailed'.$G$15] -> 0.168678 | H15: of:=[$'Results - Detailed'.$H$15] -> 2760400 | I15: of:=[$'Results - Detailed'.$I$15] -> 0.000298 | J15: of:=[$'Results - Detailed'.$J$15] -> 0.13952 | K15: of:=[$'Results - Detailed'.$K$15] -> 2520200 | L15: of:=[$'Results - Detailed'.$L$15] -> 0.00034 | M15: of:=[$'Results - Detailed'.$M$15] -> 0.148031
B16: of:=[$'Results - Detailed'.$B$16] -> 4553400 | C16: of:=[$'Results - Detailed'.$C$16] -> 0.000146 | D16: of:=[$'Results - Detailed'.$D$16] -> 0.101209 | E16: of:=[$'Results - Detailed'.$E$16] -> 2010600 | F16: of:=[$'Results - Detailed'.$F$16] -> 0.00044 | G16: of:=[$'Results - Detailed'.$G$16] -> 0.170043 | H16: of:=[$'Results - Detailed'.$H$16] -> 2753200 | I16: of:=[$'Results - Detailed'.$I$16] -> 0.000293 | J16: of:=[$'Results - Detailed'.$J$16] -> 0.140747 | K16: of:=[$'Results - Detailed'.$K$16] -> 2508000 | L16: of:=[$'Results - Detailed'.$L$16] -> 0.000331 | M16: of:=[$'Results - Detailed'.$M$16] -> 0.149502
B17: of:=[$'Results - Detailed'.$B$17] -> 4545800 | C17: of:=[$'Results - Detailed'.$C$17] -> 0.00015 | D17: of:=[$'Results - Detailed'.$D$17] -> 0.10203 | E17: of:=[$'Results - Detailed'.$E$17] -> 2013200 | F17: of:=[$'Results - Detailed'.$F$17] -> 0.000419 | G17: of:=[$'Results - Detailed'.$G$17] -> 0.171162 | H17: of:=[$'Results - Detailed'.$H$17] -> 2765200 | I17: of:=[$'Results - Detailed'.$I$17] -> 0.000306 | J17: of:=[$'Results - Detailed'.$J$17] -> 0.141526 | K17: of:=[$'Results - Detailed'.$K$17] -> 2517800 | L17: of:=[$'Results - Detailed'.$L$17] -> 0.000346 | M17: of:=[$'Results - Detailed'.$M$17] -> 0.150364
B18: of:=[$'Results - Detailed'.$B$18] -> 4558400 | C18: of:=[$'Results - Detailed'.$C$18] -> 0.000155 | D18: of:=[$'Results - Detailed'.$D$18] -> 0.102648 | E18: of:=[$'Results - Detailed'.$E$18] -> 2012000 | F18: of:=[$'Results - Detailed'.$F$18] -> 0.000419 | G18: of:=[$'Results - Detailed'.$G$18] -> 0.172434 | H18: of:=[$'Results - Detailed'.$H$18] -> 2755800 | I18: of:=[$'Results - Detailed'.$I$18] -> 0.000294 | J18: of:=[$'Results - Detailed'.$J$18] -> 0.1428 | K18: of:=[$'Results - Detailed'.$K$18] -> 2508600 | L18: of:=[$'Results - Detailed'.$L$18] -> 0.000334 | M18: of:=[$'Results - Detailed'.$M$18] -> 0.151744
B19: of:=[$'Results - Detailed'.$B$19] -> 4532800 | C19: of:=[$'Results - Detailed'.$C$19] -> 0.000148 | D19: of:=[$'Results - Detailed'.$D$19] -> 0.103653 | E19: of:=[$'Results - Detailed'.$E$19] -> 2009400 | F19: of:=[$'Results - Detailed'.$F$19] -> 0.00044 | G19: of:=[$'Results - Detailed'.$G$19] -> 0.173815 | H19: of:=[$'Results - Detailed'.$H$19] -> 2763200 | I19: of:=[$'Results - Detailed'.$I$19] -> 0.000283 | J19: of:=[$'Results - Detailed'.$J$19] -> 0.143597 | K19: of:=[$'Results - Detailed'.$K$19] -> 2509800 | L19: of:=[$'Results - Detailed'.$L$19] -> 0.000331 | M19: of:=[$'Results - Detailed'.$M$19] -> 0.152794
B20: of:=[$'Results - Detailed'.$B$20] -> 4555800 | C20: of:=[$'Results - Detailed'.$C$20] -> 0.00015 | D20: of:=[$'Results - Detailed'.$D$20] -> 0.104114 | E20: of:=[$'Results - Detailed'.$E$20] -> 2011400 | F20: of:=[$'Results - Detailed'.$F$20] -> 0.00043 | G20: of:=[$'Results - Detailed'.$G$20] -> 0.174961 | H20: of:=[$'Results - Detailed'.$H$20] -> 2742800 | I20: of:=[$'Results - Detailed'.$I$20] -> 0.000311 | J20: of:=[$'Results - Detailed'.$J$20] -> 0.145212 | K20: of:=[$'Results - Detailed'.$K$20] -> 2513200 | L20: of:=[$'Results - Detailed'.$L$20] -> 0.000328 | M20: of:=[$'Results - Detailed'.$M$20] -> 0.15376
B21: of:=[$'Results - Detailed'.$B$21] -> 4539600 | C21: of:=[$'Results - Detailed'.$C$21] -> 0.000151 | D21: of:=[$'Results - Detailed'.$D$21] -> 0.105022 | E21: of:=[$'Results - Detailed'.$E$21] -> 2008200 | F21: of:=[$'Results - Detailed'.$F$21] -> 0.000443 | G21: of:=[$'Results - Detailed'.$G$21] -> 0.176361 | H21: of:=[$'Results - Detailed'.$H$21] -> 2760400 | I21: of:=[$'Results - Detailed'.$I$21] -> 0.000287 | J21: of:=[$'Results - Detailed'.$J$21] -> 0.145736 | K21: of:=[$'Results - Detailed'.$K$21] -> 2516600 | L21: of:=[$'Results - Detailed'.$L$21] -> 0.000325 | M21: of:=[$'Results - Detailed'.$M$21] -> 0.154711
B22: of:=[$'Results - Detailed'.$B$22] -> 4594400 | C22: of:=[$'Results - Detailed'.$C$22] -> 0.000152 | D22: of:=[$'Results - Detailed'.$D$22] -> 0.098826 | E22: of:=[$'Results - Detailed'.$E$22] -> 2019400 | F22: of:=[$'Results - Detailed'.$F$22] -> 0.000433 | G22: of:=[$'Results - Detailed'.$G$22] -> 0.164368 | H22: of:=[$'Results - Detailed'.$H$22] -> 2757000 | I22: of:=[$'Results - Detailed'.$I$22] -> 0.0003 | J22: of:=[$'Results - Detailed'.$J$22] -> 0.136102 | K22: of:=[$'Results - Detailed'.$K$22] -> 2516000 | L22: of:=[$'Results - Detailed'.$L$22] -> 0.000335 | M22: of:=[$'Results - Detailed'.$M$22] -> 0.144845
B23: of:=[$'Results - Detailed'.$B$23] -> 4618200 | C23: of:=[$'Results - Detailed'.$C$23] -> 0.000148 | D23: of:=[$'Results - Detailed'.$D$23] -> 0.09932 | E23: of:=[$'Results - Detailed'.$E$23] -> 2017600 | F23: of:=[$'Results - Detailed'.$F$23] -> 0.000421 | G23: of:=[$'Results - Detailed'.$G$23] -> 0.165717 | H23: of:=[$'Results - Detailed'.$H$23] -> 2757800 | I23: of:=[$'Results - Detailed'.$I$23] -> 0.000289 | J23: of:=[$'Results - Detailed'.$J$23] -> 0.137138 | K23: of:=[$'Results - Detailed'.$K$23] -> 2510600 | L23: of:=[$'Results - Detailed'.$L$23] -> 0.000331 | M23: of:=[$'Results - Detailed'.$M$23] -> 0.146136
B24: of:=[$'Results - Detailed'.$B$24] -> 4622400 | C24: of:=[$'Results - Detailed'.$C$24] -> 0.000151 | D24: of:=[$'Results - Detailed'.$D$24] -> 0.100032 | E24: of:=[$'Results - Detailed'.$E$24] -> 2020800 | F24: of:=[$'Results - Detailed'.$F$24] -> 0.000434 | G24: of:=[$'Results - Detailed'.$G$24] -> 0.166893 | H24: of:=[$'Results - Detailed'.$H$24] -> 2757600 | I24: of:=[$'Results - Detailed'.$I$24] -> 0.000297 | J24: of:=[$'Results - Detailed'.$J$24] -> 0.138221 | K24: of:=[$'Results - Detailed'.$K$24] -> 2507400 | L24: of:=[$'Results - Detailed'.$L$24] -> 0.000333 | M24: of:=[$'Results - Detailed'.$M$24] -> 0.147365
B25: of:=[$'Results - Detailed'.$B$25] -> 4624200 | C25: of:=[$'Results - Detailed'.$C$25] -> 0.000145 | D25: of:=[$'Results - Detailed'.$D$25] -> 0.100735 | E25: of:=[$'Results - Detailed'.$E$25] -> 2014400 | F25: of:=[$'Results - Detailed'.$F$25] -> 0.000432 | G25: of:=[$'Results - Detailed'.$G$25] -> 0.168444 | H25: of:=[$'Results - Detailed'.$H$25] -> 2756200 | I25: of:=[$'Results - Detailed'.$I$25] -> 0.000291 | J25: of:=[$'Results - Detailed'.$J$25] -> 0.139304 | K25: of:=[$'Results - Detailed'.$K$25] -> 2524400 | L25: of:=[$'Results - Detailed'.$L$25] -> 0.000338 | M25: of:=[$'Results - Detailed'.$M$25] -> 0.148012
B26: of:=[$'Results - Detailed'.$B$26] -> 4610800 | C26: of:=[$'Results - Detailed'.$C$26] -> 0.000154 | D26: of:=[$'Results - Detailed'.$D$26] -> 0.101643 | E26: of:=[$'Results - Detailed'.$E$26] -> 2016800 | F26: of:=[$'Results - Detailed'.$F$26] -> 0.000424 | G26: of:=[$'Results - Detailed'.$G$26] -> 0.1696 | H26: of:=[$'Results - Detailed'.$H$26] -> 2760600 | I26: of:=[$'Results - Detailed'.$I$26] -> 0.000288 | J26: of:=[$'Results - Detailed'.$J$26] -> 0.140225 | K26: of:=[$'Results - Detailed'.$K$26] -> 2525600 | L26: of:=[$'Results - Detailed'.$L$26] -> 0.000331 | M26: of:=[$'Results - Detailed'.$M$26] -> 0.149091
B27: of:=[$'Results - Detailed'.$B$27] -> 4602400 | C27: of:=[$'Results - Detailed'.$C$27] -> 0.000145 | D27: of:=[$'Results - Detailed'.$D$27] -> 0.102445 | E27: of:=[$'Results - Detailed'.$E$27] -> 2021200 | F27: of:=[$'Results - Detailed'.$F$27] -> 0.000419 | G27: of:=[$'Results - Detailed'.$G$27] -> 0.170646 | H27: of:=[$'Results - Detailed'.$H$27] -> 2760400 | I27: of:=[$'Results - Detailed'.$I$27] -> 0.00029 | J27: of:=[$'Results - Detailed'.$J$27] -> 0.14126 | K27: of:=[$'Results - Detailed'.$K$27] -> 2526800 | L27: of:=[$'Results - Detailed'.$L$27] -> 0.000328 | M27: of:=[$'Results - Detailed'.$M$27] -> 0.150151
B28: of:=[$'Results - Detailed'.$B$28] -> 4621000 | C28: of:=[$'Results - Detailed'.$C$28] -> 0.000143 | D28: of:=[$'Results - Detailed'.$D$28] -> 0.102935 | E28: of:=[$'Results - Detailed'.$E$28] -> 2018600 | F28: of:=[$'Results - Detailed'.$F$28] -> 0.00044 | G28: of:=[$'Results - Detailed'.$G$28] -> 0.172039 | H28: of:=[$'Results - Detailed'.$H$28] -> 2762600 | I28: of:=[$'Results - Detailed'.$I$28] -> 0.000302 | J28: of:=[$'Results - Detailed'.$J$28] -> 0.142268 | K28: of:=[$'Results - Detailed'.$K$28] -> 2522200 | L28: of:=[$'Results - Detailed'.$L$28] -> 0.000336 | M28: of:=[$'Results - Detailed'.$M$28] -> 0.151403
B29: of:=[$'Results - Detailed'.$B$29] -> 4623800 | C29: of:=[$'Results - Detailed'.$C$29] -> 0.00016 | D29: of:=[$'Results - Detailed'.$D$29] -> 0.103678 | E29: of:=[$'Results - Detailed'.$E$29] -> 2012600 | F29: of:=[$'Results - Detailed'.$F$29] -> 0.000436 | G29: of:=[$'Results - Detailed'.$G$29] -> 0.173557 | H29: of:=[$'Results - Detailed'.$H$29] -> 2750000 | I29: of:=[$'Results - Detailed'.$I$29] -> 0.000297 | J29: of:=[$'Results - Detailed'.$J$29] -> 0.143631 | K29: of:=[$'Results - Detailed'.$K$29] -> 2524800 | L29: of:=[$'Results - Detailed'.$L$29] -> 0.000322 | M29: of:=[$'Results - Detailed'.$M$29] -> 0.152384
B30: of:=[$'Results - Detailed'.$B$30] -> 4595800 | C30: of:=[$'Results - Detailed'.$C$30] -> 0.00015 | D30: of:=[$'Results - Detailed'.$D$30] -> 0.104713 | E30: of:=[$'Results - Detailed'.$E$30] -> 2020200 | F30: of:=[$'Results - Detailed'.$F$30] -> 0.000433 | G30: of:=[$'Results - Detailed'.$G$30] -> 0.174475 | H30: of:=[$'Results - Detailed'.$H$30] -> 2760400 | I30: of:=[$'Results - Detailed'.$I$30] -> 0.000294 | J30: of:=[$'Results - Detailed'.$J$30] -> 0.144382 | K30: of:=[$'Results - Detailed'.$K$30] -> 2524600 | L30: of:=[$'Results - Detailed'.$L$30] -> 0.000332 | M30: of:=[$'Results - Detailed'.$M$30] -> 0.153475
B31: of:=[$'Results - Detailed'.$B$31] -> 4619000 | C31: of:=[$'Results - Detailed'.$C$31] -> 0.00015 | D31: of:=[$'Results - Detailed'.$D$31] -> 0.105166 | E31: of:=[$'Results - Detailed'.$E$31] -> 2019400 | F31: of:=[$'Results - Detailed'.$F$31] -> 0.00043 | G31: of:=[$'Results - Detailed'.$G$31] -> 0.175736 | H31: of:=[$'Results - Detailed'.$H$31] -> 2754400 | I31: of:=[$'Results - Detailed'.$I$31] -> 0.000302 | J31: of:=[$'Results - Detailed'.$J$31] -> 0.14558 | K31: of:=[$'Results - Detailed'.$K$31] -> 2520600 | L31: of:=[$'Results - Detailed'.$L$31] -> 0.000332 | M31: of:=[$'Results - Detailed'.$M$31] -> 0.154672
A32: 1 | B32: of:=AVERAGE([.B2:.B31]) -> 4609626.66666667 | C32: of:=AVERAGE([.C2:.C31]) -> 0.0001475 | D32: of:=AVERAGE([.D2:.D31]) -> 0.101294466666667 | E32: of:=AVERAGE([.E2:.E31]) -> 2016720 | F32: of:=AVERAGE([.F2:.F31]) -> 0.000430633333333333 | G32: of:=AVERAGE([.G2:.G31]) -> 0.170413666666667 | H32: of:=AVERAGE([.H2:.H31]) -> 2766666.66666667 | I32: of:=AVERAGE([.I2:.I31]) -> 0.000294566666666667 | J32: of:=AVERAGE([.J2:.J31]) -> 0.140774233333333 | K32: of:=AVERAGE([.K2:.K31]) -> 2517593.33333333 | L32: of:=AVERAGE([.L2:.L31]) -> 0.0003318 | M32: of:=AVERAGE([.M2:.M31]) -> 0.149809466666667
A33: 2 / Results - Detailed | B33: of:=[$'Results - Detailed'.$B$32] -> 2868000 | C33: of:=[$'Results - Detailed'.$C$32] -> 0.000553 | D33: of:=[$'Results - Detailed'.$D$32] -> 0.196969 | E33: of:=[$'Results - Detailed'.$E$32] -> 843400 | F33: of:=[$'Results - Detailed'.$F$32] -> 0.002269 | G33: of:=[$'Results - Detailed'.$G$32] -> 0.378463 | H33: of:=[$'Results - Detailed'.$H$32] -> 2655400 | I33: of:=[$'Results - Detailed'.$I$32] -> 0.000645 | J33: of:=[$'Results - Detailed'.$J$32] -> 0.204168 | K33: of:=[$'Results - Detailed'.$K$32] -> 987400 | L33: of:=[$'Results - Detailed'.$L$32] -> 0.00194 | M33: of:=[$'Results - Detailed'.$M$32] -> 0.348532
B34: of:=[$'Results - Detailed'.$B$33] -> 2948800 | C34: of:=[$'Results - Detailed'.$C$33] -> 0.000552 | D34: of:=[$'Results - Detailed'.$D$33] -> 0.195668 | E34: of:=[$'Results - Detailed'.$E$33] -> 844800 | F34: of:=[$'Results - Detailed'.$F$33] -> 0.002273 | G34: of:=[$'Results - Detailed'.$G$33] -> 0.381142 | H34: of:=[$'Results - Detailed'.$H$33] -> 2648000 | I34: of:=[$'Results - Detailed'.$I$33] -> 0.000631 | J34: of:=[$'Results - Detailed'.$J$33] -> 0.205991 | K34: of:=[$'Results - Detailed'.$K$33] -> 999800 | L34: of:=[$'Results - Detailed'.$L$33] -> 0.001894 | M34: of:=[$'Results - Detailed'.$M$33] -> 0.349089
B35: of:=[$'Results - Detailed'.$B$34] -> 2914000 | C35: of:=[$'Results - Detailed'.$C$34] -> 0.000572 | D35: of:=[$'Results - Detailed'.$D$34] -> 0.198279 | E35: of:=[$'Results - Detailed'.$E$34] -> 842800 | F35: of:=[$'Results - Detailed'.$F$34] -> 0.002288 | G35: of:=[$'Results - Detailed'.$G$34] -> 0.38458 | H35: of:=[$'Results - Detailed'.$H$34] -> 2657800 | I35: of:=[$'Results - Detailed'.$I$34] -> 0.000628 | J35: of:=[$'Results - Detailed'.$J$34] -> 0.207132 | K35: of:=[$'Results - Detailed'.$K$34] -> 992200 | L35: of:=[$'Results - Detailed'.$L$34] -> 0.001899 | M35: of:=[$'Results - Detailed'.$M$34] -> 0.353122
B36: of:=[$'Results - Detailed'.$B$35] -> 2951000 | C36: of:=[$'Results - Detailed'.$C$35] -> 0.000556 | D36: of:=[$'Results - Detailed'.$D$35] -> 0.198438 | E36: of:=[$'Results - Detailed'.$E$35] -> 843800 | F36: of:=[$'Results - Detailed'.$F$35] -> 0.002301 | G36: of:=[$'Results - Detailed'.$G$35] -> 0.387334 | H36: of:=[$'Results - Detailed'.$H$35] -> 2645000 | I36: of:=[$'Results - Detailed'.$I$35] -> 0.000654 | J36: of:=[$'Results - Detailed'.$J$35] -> 0.209201 | K36: of:=[$'Results - Detailed'.$K$35] -> 1004600 | L36: of:=[$'Results - Detailed'.$L$35] -> 0.001899 | M36: of:=[$'Results - Detailed'.$M$35] -> 0.353631
B37: of:=[$'Results - Detailed'.$B$36] -> 2947200 | C37: of:=[$'Results - Detailed'.$C$36] -> 0.00054 | D37: of:=[$'Results - Detailed'.$D$36] -> 0.199921 | E37: of:=[$'Results - Detailed'.$E$36] -> 841600 | F37: of:=[$'Results - Detailed'.$F$36] -> 0.00225 | G37: of:=[$'Results - Detailed'.$G$36] -> 0.390731 | H37: of:=[$'Results - Detailed'.$H$36] -> 2655200 | I37: of:=[$'Results - Detailed'.$I$36] -> 0.000626 | J37: of:=[$'Results - Detailed'.$J$36] -> 0.210293 | K37: of:=[$'Results - Detailed'.$K$36] -> 998600 | L37: of:=[$'Results - Detailed'.$L$36] -> 0.001883 | M37: of:=[$'Results - Detailed'.$M$36] -> 0.357336
B38: of:=[$'Results - Detailed'.$B$37] -> 2975200 | C38: of:=[$'Results - Detailed'.$C$37] -> 0.000542 | D38: of:=[$'Results - Detailed'.$D$37] -> 0.200337 | E38: of:=[$'Results - Detailed'.$E$37] -> 846000 | F38: of:=[$'Results - Detailed'.$F$37] -> 0.002255 | G38: of:=[$'Results - Detailed'.$G$37] -> 0.392597 | H38: of:=[$'Results - Detailed'.$H$37] -> 2648000 | I38: of:=[$'Results - Detailed'.$I$37] -> 0.000635 | J38: of:=[$'Results - Detailed'.$J$37] -> 0.212081 | K38: of:=[$'Results - Detailed'.$K$37] -> 1001200 | L38: of:=[$'Results - Detailed'.$L$37] -> 0.0019 | M38: of:=[$'Results - Detailed'.$M$37] -> 0.359524
B39: of:=[$'Results - Detailed'.$B$38] -> 2843600 | C39: of:=[$'Results - Detailed'.$C$38] -> 0.000535 | D39: of:=[$'Results - Detailed'.$D$38] -> 0.20622 | E39: of:=[$'Results - Detailed'.$E$38] -> 841800 | F39: of:=[$'Results - Detailed'.$F$38] -> 0.002271 | G39: of:=[$'Results - Detailed'.$G$38] -> 0.39645 | H39: of:=[$'Results - Detailed'.$H$38] -> 2649000 | I39: of:=[$'Results - Detailed'.$I$38] -> 0.000643 | J39: of:=[$'Results - Detailed'.$J$38] -> 0.213551 | K39: of:=[$'Results - Detailed'.$K$38] -> 1001800 | L39: of:=[$'Results - Detailed'.$L$38] -> 0.001897 | M39: of:=[$'Results - Detailed'.$M$38] -> 0.362045
B40: of:=[$'Results - Detailed'.$B$39] -> 2956200 | C40: of:=[$'Results - Detailed'.$C$39] -> 0.000546 | D40: of:=[$'Results - Detailed'.$D$39] -> 0.2036 | E40: of:=[$'Results - Detailed'.$E$39] -> 848400 | F40: of:=[$'Results - Detailed'.$F$39] -> 0.002263 | G40: of:=[$'Results - Detailed'.$G$39] -> 0.39776 | H40: of:=[$'Results - Detailed'.$H$39] -> 2642400 | I40: of:=[$'Results - Detailed'.$I$39] -> 0.00064 | J40: of:=[$'Results - Detailed'.$J$39] -> 0.21531 | K40: of:=[$'Results - Detailed'.$K$39] -> 1001000 | L40: of:=[$'Results - Detailed'.$L$39] -> 0.00191 | M40: of:=[$'Results - Detailed'.$M$39] -> 0.364817
B41: of:=[$'Results - Detailed'.$B$40] -> 2859600 | C41: of:=[$'Results - Detailed'.$C$40] -> 0.000535 | D41: of:=[$'Results - Detailed'.$D$40] -> 0.208299 | E41: of:=[$'Results - Detailed'.$E$40] -> 841400 | F41: of:=[$'Results - Detailed'.$F$40] -> 0.002268 | G41: of:=[$'Results - Detailed'.$G$40] -> 0.40224 | H41: of:=[$'Results - Detailed'.$H$40] -> 2639800 | I41: of:=[$'Results - Detailed'.$I$40] -> 0.000648 | J41: of:=[$'Results - Detailed'.$J$40] -> 0.216914 | K41: of:=[$'Results - Detailed'.$K$40] -> 993000 | L41: of:=[$'Results - Detailed'.$L$40] -> 0.001934 | M41: of:=[$'Results - Detailed'.$M$40] -> 0.368913
B42: of:=[$'Results - Detailed'.$B$41] -> 2844600 | C42: of:=[$'Results - Detailed'.$C$41] -> 0.00054 | D42: of:=[$'Results - Detailed'.$D$41] -> 0.210136 | E42: of:=[$'Results - Detailed'.$E$41] -> 839200 | F42: of:=[$'Results - Detailed'.$F$41] -> 0.002288 | G42: of:=[$'Results - Detailed'.$G$41] -> 0.405597 | H42: of:=[$'Results - Detailed'.$H$41] -> 2647400 | I42: of:=[$'Results - Detailed'.$I$41] -> 0.000649 | J42: of:=[$'Results - Detailed'.$J$41] -> 0.218095 | K42: of:=[$'Results - Detailed'.$K$41] -> 990200 | L42: of:=[$'Results - Detailed'.$L$41] -> 0.001899 | M42: of:=[$'Results - Detailed'.$M$41] -> 0.371995
B43: of:=[$'Results - Detailed'.$B$42] -> 2661800 | C43: of:=[$'Results - Detailed'.$C$42] -> 0.000643 | D43: of:=[$'Results - Detailed'.$D$42] -> 0.201518 | E43: of:=[$'Results - Detailed'.$E$42] -> 830600 | F43: of:=[$'Results - Detailed'.$F$42] -> 0.002309 | G43: of:=[$'Results - Detailed'.$G$42] -> 0.381604 | H43: of:=[$'Results - Detailed'.$H$42] -> 2666400 | I43: of:=[$'Results - Detailed'.$I$42] -> 0.000641 | J43: of:=[$'Results - Detailed'.$J$42] -> 0.203071 | K43: of:=[$'Results - Detailed'.$K$42] -> 974400 | L43: of:=[$'Results - Detailed'.$L$42] -> 0.001954 | M43: of:=[$'Results - Detailed'.$M$42] -> 0.35787
B44: of:=[$'Results - Detailed'.$B$43] -> 2686200 | C44: of:=[$'Results - Detailed'.$C$43] -> 0.000641 | D44: of:=[$'Results - Detailed'.$D$43] -> 0.202193 | E44: of:=[$'Results - Detailed'.$E$43] -> 838600 | F44: of:=[$'Results - Detailed'.$F$43] -> 0.00227 | G44: of:=[$'Results - Detailed'.$G$43] -> 0.382758 | H44: of:=[$'Results - Detailed'.$H$43] -> 2660600 | I44: of:=[$'Results - Detailed'.$I$43] -> 0.000646 | J44: of:=[$'Results - Detailed'.$J$43] -> 0.204875 | K44: of:=[$'Results - Detailed'.$K$43] -> 968600 | L44: of:=[$'Results - Detailed'.$L$43] -> 0.001986 | M44: of:=[$'Results - Detailed'.$M$43] -> 0.361696
B45: of:=[$'Results - Detailed'.$B$44] -> 2659000 | C45: of:=[$'Results - Detailed'.$C$44] -> 0.000642 | D45: of:=[$'Results - Detailed'.$D$44] -> 0.204797 | E45: of:=[$'Results - Detailed'.$E$44] -> 831400 | F45: of:=[$'Results - Detailed'.$F$44] -> 0.002305 | G45: of:=[$'Results - Detailed'.$G$44] -> 0.387397 | H45: of:=[$'Results - Detailed'.$H$44] -> 2664600 | I45: of:=[$'Results - Detailed'.$I$44] -> 0.000646 | J45: of:=[$'Results - Detailed'.$J$44] -> 0.206291 | K45: of:=[$'Results - Detailed'.$K$44] -> 974600 | L45: of:=[$'Results - Detailed'.$L$44] -> 0.001966 | M45: of:=[$'Results - Detailed'.$M$44] -> 0.363297
B46: of:=[$'Results - Detailed'.$B$45] -> 2602400 | C46: of:=[$'Results - Detailed'.$C$45] -> 0.000624 | D46: of:=[$'Results - Detailed'.$D$45] -> 0.208514 | E46: of:=[$'Results - Detailed'.$E$45] -> 835000 | F46: of:=[$'Results - Detailed'.$F$45] -> 0.002297 | G46: of:=[$'Results - Detailed'.$G$45] -> 0.389521 | H46: of:=[$'Results - Detailed'.$H$45] -> 2659200 | I46: of:=[$'Results - Detailed'.$I$45] -> 0.000641 | J46: of:=[$'Results - Detailed'.$J$45] -> 0.208046 | K46: of:=[$'Results - Detailed'.$K$45] -> 979000 | L46: of:=[$'Results - Detailed'.$L$45] -> 0.001949 | M46: of:=[$'Results - Detailed'.$M$45] -> 0.365158
B47: of:=[$'Results - Detailed'.$B$46] -> 2672200 | C47: of:=[$'Results - Detailed'.$C$46] -> 0.000647 | D47: of:=[$'Results - Detailed'.$D$46] -> 0.207338 | E47: of:=[$'Results - Detailed'.$E$46] -> 833800 | F47: of:=[$'Results - Detailed'.$F$46] -> 0.002281 | G47: of:=[$'Results - Detailed'.$G$46] -> 0.392716 | H47: of:=[$'Results - Detailed'.$H$46] -> 2650400 | I47: of:=[$'Results - Detailed'.$I$46] -> 0.000638 | J47: of:=[$'Results - Detailed'.$J$46] -> 0.209918 | K47: of:=[$'Results - Detailed'.$K$46] -> 972200 | L47: of:=[$'Results - Detailed'.$L$46] -> 0.001963 | M47: of:=[$'Results - Detailed'.$M$46] -> 0.369101
B48: of:=[$'Results - Detailed'.$B$47] -> 2680800 | C48: of:=[$'Results - Detailed'.$C$47] -> 0.000625 | D48: of:=[$'Results - Detailed'.$D$47] -> 0.208509 | E48: of:=[$'Results - Detailed'.$E$47] -> 835800 | F48: of:=[$'Results - Detailed'.$F$47] -> 0.002283 | G48: of:=[$'Results - Detailed'.$G$47] -> 0.395145 | H48: of:=[$'Results - Detailed'.$H$47] -> 2659800 | I48: of:=[$'Results - Detailed'.$I$47] -> 0.000638 | J48: of:=[$'Results - Detailed'.$J$47] -> 0.211062 | K48: of:=[$'Results - Detailed'.$K$47] -> 975400 | L48: of:=[$'Results - Detailed'.$L$47] -> 0.001946 | M48: of:=[$'Results - Detailed'.$M$47] -> 0.371126
B49: of:=[$'Results - Detailed'.$B$48] -> 2681400 | C49: of:=[$'Results - Detailed'.$C$48] -> 0.000631 | D49: of:=[$'Results - Detailed'.$D$48] -> 0.209994 | E49: of:=[$'Results - Detailed'.$E$48] -> 830200 | F49: of:=[$'Results - Detailed'.$F$48] -> 0.002332 | G49: of:=[$'Results - Detailed'.$G$48] -> 0.399406 | H49: of:=[$'Results - Detailed'.$H$48] -> 2663000 | I49: of:=[$'Results - Detailed'.$I$48] -> 0.000641 | J49: of:=[$'Results - Detailed'.$J$48] -> 0.212449 | K49: of:=[$'Results - Detailed'.$K$48] -> 970400 | L49: of:=[$'Results - Detailed'.$L$48] -> 0.001977 | M49: of:=[$'Results - Detailed'.$M$48] -> 0.374727
B50: of:=[$'Results - Detailed'.$B$49] -> 2685200 | C50: of:=[$'Results - Detailed'.$C$49] -> 0.000639 | D50: of:=[$'Results - Detailed'.$D$49] -> 0.211362 | E50: of:=[$'Results - Detailed'.$E$49] -> 828200 | F50: of:=[$'Results - Detailed'.$F$49] -> 0.002345 | G50: of:=[$'Results - Detailed'.$G$49] -> 0.402809 | H50: of:=[$'Results - Detailed'.$H$49] -> 2653600 | I50: of:=[$'Results - Detailed'.$I$49] -> 0.000654 | J50: of:=[$'Results - Detailed'.$J$49] -> 0.214356 | K50: of:=[$'Results - Detailed'.$K$49] -> 971000 | L50: of:=[$'Results - Detailed'.$L$49] -> 0.001988 | M50: of:=[$'Results - Detailed'.$M$49] -> 0.377255
B51: of:=[$'Results - Detailed'.$B$50] -> 2558200 | C51: of:=[$'Results - Detailed'.$C$50] -> 0.000652 | D51: of:=[$'Results - Detailed'.$D$50] -> 0.218046 | E51: of:=[$'Results - Detailed'.$E$50] -> 838600 | F51: of:=[$'Results - Detailed'.$F$50] -> 0.002285 | G51: of:=[$'Results - Detailed'.$G$50] -> 0.403147 | H51: of:=[$'Results - Detailed'.$H$50] -> 2656000 | I51: of:=[$'Results - Detailed'.$I$50] -> 0.000646 | J51: of:=[$'Results - Detailed'.$J$50] -> 0.215762 | K51: of:=[$'Results - Detailed'.$K$50] -> 969200 | L51: of:=[$'Results - Detailed'.$L$50] -> 0.001971 | M51: of:=[$'Results - Detailed'.$M$50] -> 0.380206
B52: of:=[$'Results - Detailed'.$B$51] -> 2681600 | C52: of:=[$'Results - Detailed'.$C$51] -> 0.000625 | D52: of:=[$'Results - Detailed'.$D$51] -> 0.214432 | E52: of:=[$'Results - Detailed'.$E$51] -> 827400 | F52: of:=[$'Results - Detailed'.$F$51] -> 0.002308 | G52: of:=[$'Results - Detailed'.$G$51] -> 0.4087 | H52: of:=[$'Results - Detailed'.$H$51] -> 2658200 | I52: of:=[$'Results - Detailed'.$I$51] -> 0.000636 | J52: of:=[$'Results - Detailed'.$J$51] -> 0.217141 | K52: of:=[$'Results - Detailed'.$K$51] -> 977800 | L52: of:=[$'Results - Detailed'.$L$51] -> 0.00197 | M52: of:=[$'Results - Detailed'.$M$51] -> 0.381123
B53: of:=[$'Results - Detailed'.$B$52] -> 3247800 | C53: of:=[$'Results - Detailed'.$C$52] -> 0.000526 | D53: of:=[$'Results - Detailed'.$D$52] -> 0.180346 | E53: of:=[$'Results - Detailed'.$E$52] -> 805400 | F53: of:=[$'Results - Detailed'.$F$52] -> 0.002374 | G53: of:=[$'Results - Detailed'.$G$52] -> 0.387442 | H53: of:=[$'Results - Detailed'.$H$52] -> 2588000 | I53: of:=[$'Results - Detailed'.$I$52] -> 0.000666 | J53: of:=[$'Results - Detailed'.$J$52] -> 0.205582 | K53: of:=[$'Results - Detailed'.$K$52] -> 1017400 | L53: of:=[$'Results - Detailed'.$L$52] -> 0.001871 | M53: of:=[$'Results - Detailed'.$M$52] -> 0.344872
B54: of:=[$'Results - Detailed'.$B$53] -> 3244400 | C54: of:=[$'Results - Detailed'.$C$53] -> 0.000531 | D54: of:=[$'Results - Detailed'.$D$53] -> 0.181905 | E54: of:=[$'Results - Detailed'.$E$53] -> 803400 | F54: of:=[$'Results - Detailed'.$F$53] -> 0.00242 | G54: of:=[$'Results - Detailed'.$G$53] -> 0.39103 | H54: of:=[$'Results - Detailed'.$H$53] -> 2598800 | I54: of:=[$'Results - Detailed'.$I$53] -> 0.000663 | J54: of:=[$'Results - Detailed'.$J$53] -> 0.206765 | K54: of:=[$'Results - Detailed'.$K$53] -> 979000 | L54: of:=[$'Results - Detailed'.$L$53] -> 0.001955 | M54: of:=[$'Results - Detailed'.$M$53] -> 0.35434
B55: of:=[$'Results - Detailed'.$B$54] -> 3248400 | C55: of:=[$'Results - Detailed'.$C$54] -> 0.000524 | D55: of:=[$'Results - Detailed'.$D$54] -> 0.183228 | E55: of:=[$'Results - Detailed'.$E$54] -> 808600 | F55: of:=[$'Results - Detailed'.$F$54] -> 0.002372 | G55: of:=[$'Results - Detailed'.$G$54] -> 0.392802 | H55: of:=[$'Results - Detailed'.$H$54] -> 2592400 | I55: of:=[$'Results - Detailed'.$I$54] -> 0.000665 | J55: of:=[$'Results - Detailed'.$J$54] -> 0.20862 | K55: of:=[$'Results - Detailed'.$K$54] -> 1006800 | L55: of:=[$'Results - Detailed'.$L$54] -> 0.001893 | M55: of:=[$'Results - Detailed'.$M$54] -> 0.352113
B56: of:=[$'Results - Detailed'.$B$55] -> 3256400 | C56: of:=[$'Results - Detailed'.$C$55] -> 0.000524 | D56: of:=[$'Results - Detailed'.$D$55] -> 0.184429 | E56: of:=[$'Results - Detailed'.$E$55] -> 801800 | F56: of:=[$'Results - Detailed'.$F$55] -> 0.002365 | G56: of:=[$'Results - Detailed'.$G$55] -> 0.39745 | H56: of:=[$'Results - Detailed'.$H$55] -> 2574800 | I56: of:=[$'Results - Detailed'.$I$55] -> 0.000661 | J56: of:=[$'Results - Detailed'.$J$55] -> 0.210904 | K56: of:=[$'Results - Detailed'.$K$55] -> 980600 | L56: of:=[$'Results - Detailed'.$L$55] -> 0.001966 | M56: of:=[$'Results - Detailed'.$M$55] -> 0.35953
B57: of:=[$'Results - Detailed'.$B$56] -> 3023600 | C57: of:=[$'Results - Detailed'.$C$56] -> 0.00054 | D57: of:=[$'Results - Detailed'.$D$56] -> 0.192804 | E57: of:=[$'Results - Detailed'.$E$56] -> 809400 | F57: of:=[$'Results - Detailed'.$F$56] -> 0.00236 | G57: of:=[$'Results - Detailed'.$G$56] -> 0.398551 | H57: of:=[$'Results - Detailed'.$H$56] -> 2594400 | I57: of:=[$'Results - Detailed'.$I$56] -> 0.000668 | J57: of:=[$'Results - Detailed'.$J$56] -> 0.211689 | K57: of:=[$'Results - Detailed'.$K$56] -> 1007800 | L57: of:=[$'Results - Detailed'.$L$56] -> 0.001911 | M57: of:=[$'Results - Detailed'.$M$56] -> 0.35733
B58: of:=[$'Results - Detailed'.$B$57] -> 3216000 | C58: of:=[$'Results - Detailed'.$C$57] -> 0.00054 | D58: of:=[$'Results - Detailed'.$D$57] -> 0.188386 | E58: of:=[$'Results - Detailed'.$E$57] -> 831400 | F58: of:=[$'Results - Detailed'.$F$57] -> 0.002285 | G58: of:=[$'Results - Detailed'.$G$57] -> 0.396138 | H58: of:=[$'Results - Detailed'.$H$57] -> 2575400 | I58: of:=[$'Results - Detailed'.$I$57] -> 0.000662 | J58: of:=[$'Results - Detailed'.$J$57] -> 0.21402 | K58: of:=[$'Results - Detailed'.$K$57] -> 976600 | L58: of:=[$'Results - Detailed'.$L$57] -> 0.001954 | M58: of:=[$'Results - Detailed'.$M$57] -> 0.365674
B59: of:=[$'Results - Detailed'.$B$58] -> 3033200 | C59: of:=[$'Results - Detailed'.$C$58] -> 0.000544 | D59: of:=[$'Results - Detailed'.$D$58] -> 0.195376 | E59: of:=[$'Results - Detailed'.$E$58] -> 836800 | F59: of:=[$'Results - Detailed'.$F$58] -> 0.002263 | G59: of:=[$'Results - Detailed'.$G$58] -> 0.397714 | H59: of:=[$'Results - Detailed'.$H$58] -> 2583800 | I59: of:=[$'Results - Detailed'.$I$58] -> 0.00067 | J59: of:=[$'Results - Detailed'.$J$58] -> 0.215235 | K59: of:=[$'Results - Detailed'.$K$58] -> 1025600 | L59: of:=[$'Results - Detailed'.$L$58] -> 0.001882 | M59: of:=[$'Results - Detailed'.$M$58] -> 0.359459
B60: of:=[$'Results - Detailed'.$B$59] -> 3017000 | C60: of:=[$'Results - Detailed'.$C$59] -> 0.000519 | D60: of:=[$'Results - Detailed'.$D$59] -> 0.197221 | E60: of:=[$'Results - Detailed'.$E$59] -> 834000 | F60: of:=[$'Results - Detailed'.$F$59] -> 0.002269 | G60: of:=[$'Results - Detailed'.$G$59] -> 0.401218 | H60: of:=[$'Results - Detailed'.$H$59] -> 2610400 | I60: of:=[$'Results - Detailed'.$I$59] -> 0.000664 | J60: of:=[$'Results - Detailed'.$J$59] -> 0.215681 | K60: of:=[$'Results - Detailed'.$K$59] -> 973600 | L60: of:=[$'Results - Detailed'.$L$59] -> 0.001993 | M60: of:=[$'Results - Detailed'.$M$59] -> 0.371624
B61: of:=[$'Results - Detailed'.$B$60] -> 3253000 | C61: of:=[$'Results - Detailed'.$C$60] -> 0.000531 | D61: of:=[$'Results - Detailed'.$D$60] -> 0.191324 | E61: of:=[$'Results - Detailed'.$E$60] -> 836200 | F61: of:=[$'Results - Detailed'.$F$60] -> 0.002301 | G61: of:=[$'Results - Detailed'.$G$60] -> 0.40355 | H61: of:=[$'Results - Detailed'.$H$60] -> 2525800 | I61: of:=[$'Results - Detailed'.$I$60] -> 0.000684 | J61: of:=[$'Results - Detailed'.$J$60] -> 0.220817 | K61: of:=[$'Results - Detailed'.$K$60] -> 1028800 | L61: of:=[$'Results - Detailed'.$L$60] -> 0.00188 | M61: of:=[$'Results - Detailed'.$M$60] -> 0.364107
B62: of:=[$'Results - Detailed'.$B$61] -> 3022000 | C62: of:=[$'Results - Detailed'.$C$61] -> 0.000545 | D62: of:=[$'Results - Detailed'.$D$61] -> 0.199869 | E62: of:=[$'Results - Detailed'.$E$61] -> 841000 | F62: of:=[$'Results - Detailed'.$F$61] -> 0.002276 | G62: of:=[$'Results - Detailed'.$G$61] -> 0.405215 | H62: of:=[$'Results - Detailed'.$H$61] -> 2600200 | I62: of:=[$'Results - Detailed'.$I$61] -> 0.000656 | J62: of:=[$'Results - Detailed'.$J$61] -> 0.219138 | K62: of:=[$'Results - Detailed'.$K$61] -> 979400 | L62: of:=[$'Results - Detailed'.$L$61] -> 0.001962 | M62: of:=[$'Results - Detailed'.$M$61] -> 0.375797
A63: 2 | B63: of:=AVERAGE([.B33:.B62]) -> 2907960 | C63: of:=AVERAGE([.C33:.C62]) -> 0.000572133333333334 | D63: of:=AVERAGE([.D33:.D62]) -> 0.199981933333333 | E63: of:=AVERAGE([.E33:.E62]) -> 832360 | F63: of:=AVERAGE([.F33:.F62]) -> 0.00230086666666667 | G63: of:=AVERAGE([.G33:.G62]) -> 0.394373566666667 | H63: of:=AVERAGE([.H33:.H62]) -> 2630793.33333333 | I63: of:=AVERAGE([.I33:.I62]) -> 0.0006495 | J63: of:=AVERAGE([.J33:.J62]) -> 0.211471933333333 | K63: of:=AVERAGE([.K33:.K62]) -> 989266.666666667 | L63: of:=AVERAGE([.L33:.L62]) -> 0.00193306666666667 | M63: of:=AVERAGE([.M33:.M62]) -> 0.3631803
A64: 3 / Results - Detailed | B64: of:=[$'Results - Detailed'.$B$62] -> 2194600 | C64: of:=[$'Results - Detailed'.$C$62] -> 0.001238 | D64: of:=[$'Results - Detailed'.$D$62] -> 0.281626 | E64: of:=[$'Results - Detailed'.$E$62] -> 774800 | F64: of:=[$'Results - Detailed'.$F$62] -> 0.00374 | G64: of:=[$'Results - Detailed'.$G$62] -> 0.4865 | H64: of:=[$'Results - Detailed'.$H$62] -> 2255800 | I64: of:=[$'Results - Detailed'.$I$62] -> 0.001174 | J64: of:=[$'Results - Detailed'.$J$62] -> 0.277888 | K64: of:=[$'Results - Detailed'.$K$62] -> 922400 | L64: of:=[$'Results - Detailed'.$L$62] -> 0.003163 | M64: of:=[$'Results - Detailed'.$M$62] -> 0.448045
B65: of:=[$'Results - Detailed'.$B$63] -> 2196200 | C65: of:=[$'Results - Detailed'.$C$63] -> 0.001218 | D65: of:=[$'Results - Detailed'.$D$63] -> 0.283678 | E65: of:=[$'Results - Detailed'.$E$63] -> 777400 | F65: of:=[$'Results - Detailed'.$F$63] -> 0.003759 | G65: of:=[$'Results - Detailed'.$G$63] -> 0.489539 | H65: of:=[$'Results - Detailed'.$H$63] -> 2228400 | I65: of:=[$'Results - Detailed'.$I$63] -> 0.001191 | J65: of:=[$'Results - Detailed'.$J$63] -> 0.281742 | K65: of:=[$'Results - Detailed'.$K$63] -> 931800 | L65: of:=[$'Results - Detailed'.$L$63] -> 0.003127 | M65: of:=[$'Results - Detailed'.$M$63] -> 0.449274
B66: of:=[$'Results - Detailed'.$B$64] -> 2198200 | C66: of:=[$'Results - Detailed'.$C$64] -> 0.001221 | D66: of:=[$'Results - Detailed'.$D$64] -> 0.285693 | E66: of:=[$'Results - Detailed'.$E$64] -> 772800 | F66: of:=[$'Results - Detailed'.$F$64] -> 0.00376 | G66: of:=[$'Results - Detailed'.$G$64] -> 0.494809 | H66: of:=[$'Results - Detailed'.$H$64] -> 2235000 | I66: of:=[$'Results - Detailed'.$I$64] -> 0.001209 | J66: of:=[$'Results - Detailed'.$J$64] -> 0.283466 | K66: of:=[$'Results - Detailed'.$K$64] -> 928200 | L66: of:=[$'Results - Detailed'.$L$64] -> 0.003137 | M66: of:=[$'Results - Detailed'.$M$64] -> 0.453615
B67: of:=[$'Results - Detailed'.$B$65] -> 2196200 | C67: of:=[$'Results - Detailed'.$C$65] -> 0.001242 | D67: of:=[$'Results - Detailed'.$D$65] -> 0.287988 | E67: of:=[$'Results - Detailed'.$E$65] -> 776400 | F67: of:=[$'Results - Detailed'.$F$65] -> 0.003753 | G67: of:=[$'Results - Detailed'.$G$65] -> 0.497447 | H67: of:=[$'Results - Detailed'.$H$65] -> 2251600 | I67: of:=[$'Results - Detailed'.$I$65] -> 0.00119 | J67: of:=[$'Results - Detailed'.$J$65] -> 0.284519 | K67: of:=[$'Results - Detailed'.$K$65] -> 930800 | L67: of:=[$'Results - Detailed'.$L$65] -> 0.003133 | M67: of:=[$'Results - Detailed'.$M$65] -> 0.456426
B68: of:=[$'Results - Detailed'.$B$66] -> 2199000 | C68: of:=[$'Results - Detailed'.$C$66] -> 0.001239 | D68: of:=[$'Results - Detailed'.$D$66] -> 0.289949 | E68: of:=[$'Results - Detailed'.$E$66] -> 773000 | F68: of:=[$'Results - Detailed'.$F$66] -> 0.003772 | G68: of:=[$'Results - Detailed'.$G$66] -> 0.502309 | H68: of:=[$'Results - Detailed'.$H$66] -> 2242800 | I68: of:=[$'Results - Detailed'.$I$66] -> 0.001201 | J68: of:=[$'Results - Detailed'.$J$66] -> 0.287175 | K68: of:=[$'Results - Detailed'.$K$66] -> 931200 | L68: of:=[$'Results - Detailed'.$L$66] -> 0.003112 | M68: of:=[$'Results - Detailed'.$M$66] -> 0.459726
B69: of:=[$'Results - Detailed'.$B$67] -> 2196800 | C69: of:=[$'Results - Detailed'.$C$67] -> 0.001245 | D69: of:=[$'Results - Detailed'.$D$67] -> 0.292231 | E69: of:=[$'Results - Detailed'.$E$67] -> 775800 | F69: of:=[$'Results - Detailed'.$F$67] -> 0.003759 | G69: of:=[$'Results - Detailed'.$G$67] -> 0.505136 | H69: of:=[$'Results - Detailed'.$H$67] -> 2256200 | I69: of:=[$'Results - Detailed'.$I$67] -> 0.001176 | J69: of:=[$'Results - Detailed'.$J$67] -> 0.288368 | K69: of:=[$'Results - Detailed'.$K$67] -> 935600 | L69: of:=[$'Results - Detailed'.$L$67] -> 0.003104 | M69: of:=[$'Results - Detailed'.$M$67] -> 0.462015
B70: of:=[$'Results - Detailed'.$B$68] -> 2195800 | C70: of:=[$'Results - Detailed'.$C$68] -> 0.001235 | D70: of:=[$'Results - Detailed'.$D$68] -> 0.294403 | E70: of:=[$'Results - Detailed'.$E$68] -> 774800 | F70: of:=[$'Results - Detailed'.$F$68] -> 0.003766 | G70: of:=[$'Results - Detailed'.$G$68] -> 0.509174 | H70: of:=[$'Results - Detailed'.$H$68] -> 2242600 | I70: of:=[$'Results - Detailed'.$I$68] -> 0.001197 | J70: of:=[$'Results - Detailed'.$J$68] -> 0.291303 | K70: of:=[$'Results - Detailed'.$K$68] -> 929800 | L70: of:=[$'Results - Detailed'.$L$68] -> 0.003115 | M70: of:=[$'Results - Detailed'.$M$68] -> 0.466802
B71: of:=[$'Results - Detailed'.$B$69] -> 2198400 | C71: of:=[$'Results - Detailed'.$C$69] -> 0.001237 | D71: of:=[$'Results - Detailed'.$D$69] -> 0.296324 | E71: of:=[$'Results - Detailed'.$E$69] -> 775200 | F71: of:=[$'Results - Detailed'.$F$69] -> 0.003733 | G71: of:=[$'Results - Detailed'.$G$69] -> 0.512696 | H71: of:=[$'Results - Detailed'.$H$69] -> 2239200 | I71: of:=[$'Results - Detailed'.$I$69] -> 0.001183 | J71: of:=[$'Results - Detailed'.$J$69] -> 0.293547 | K71: of:=[$'Results - Detailed'.$K$69] -> 928400 | L71: of:=[$'Results - Detailed'.$L$69] -> 0.003119 | M71: of:=[$'Results - Detailed'.$M$69] -> 0.47048
B72: of:=[$'Results - Detailed'.$B$70] -> 2196800 | C72: of:=[$'Results - Detailed'.$C$70] -> 0.00124 | D72: of:=[$'Results - Detailed'.$D$70] -> 0.298516 | E72: of:=[$'Results - Detailed'.$E$70] -> 778200 | F72: of:=[$'Results - Detailed'.$F$70] -> 0.003724 | G72: of:=[$'Results - Detailed'.$G$70] -> 0.515333 | H72: of:=[$'Results - Detailed'.$H$70] -> 2253800 | I72: of:=[$'Results - Detailed'.$I$70] -> 0.001186 | J72: of:=[$'Results - Detailed'.$J$70] -> 0.294613 | K72: of:=[$'Results - Detailed'.$K$70] -> 928400 | L72: of:=[$'Results - Detailed'.$L$70] -> 0.00313 | M72: of:=[$'Results - Detailed'.$M$70] -> 0.473795
B73: of:=[$'Results - Detailed'.$B$71] -> 2198000 | C73: of:=[$'Results - Detailed'.$C$71] -> 0.001214 | D73: of:=[$'Results - Detailed'.$D$71] -> 0.300461 | E73: of:=[$'Results - Detailed'.$E$71] -> 775800 | F73: of:=[$'Results - Detailed'.$F$71] -> 0.003769 | G73: of:=[$'Results - Detailed'.$G$71] -> 0.519768 | H73: of:=[$'Results - Detailed'.$H$71] -> 2243600 | I73: of:=[$'Results - Detailed'.$I$71] -> 0.001187 | J73: of:=[$'Results - Detailed'.$J$71] -> 0.297286 | K73: of:=[$'Results - Detailed'.$K$71] -> 928800 | L73: of:=[$'Results - Detailed'.$L$71] -> 0.003131 | M73: of:=[$'Results - Detailed'.$M$71] -> 0.476986
B74: of:=[$'Results - Detailed'.$B$72] -> 2575600 | C74: of:=[$'Results - Detailed'.$C$72] -> 0.000956 | D74: of:=[$'Results - Detailed'.$D$72] -> 0.248875 | E74: of:=[$'Results - Detailed'.$E$72] -> 787000 | F74: of:=[$'Results - Detailed'.$F$72] -> 0.003715 | G74: of:=[$'Results - Detailed'.$G$72] -> 0.482698 | H74: of:=[$'Results - Detailed'.$H$72] -> 2927400 | I74: of:=[$'Results - Detailed'.$I$72] -> 0.00087 | J74: of:=[$'Results - Detailed'.$J$72] -> 0.233586 | K74: of:=[$'Results - Detailed'.$K$72] -> 931200 | L74: of:=[$'Results - Detailed'.$L$72] -> 0.003104 | M74: of:=[$'Results - Detailed'.$M$72] -> 0.443119
B75: of:=[$'Results - Detailed'.$B$73] -> 2562800 | C75: of:=[$'Results - Detailed'.$C$73] -> 0.000975 | D75: of:=[$'Results - Detailed'.$D$73] -> 0.251442 | E75: of:=[$'Results - Detailed'.$E$73] -> 781000 | F75: of:=[$'Results - Detailed'.$F$73] -> 0.003759 | G75: of:=[$'Results - Detailed'.$G$73] -> 0.488412 | H75: of:=[$'Results - Detailed'.$H$73] -> 2887000 | I75: of:=[$'Results - Detailed'.$I$73] -> 0.00089 | J75: of:=[$'Results - Detailed'.$J$73] -> 0.237099 | K75: of:=[$'Results - Detailed'.$K$73] -> 928600 | L75: of:=[$'Results - Detailed'.$L$73] -> 0.003104 | M75: of:=[$'Results - Detailed'.$M$73] -> 0.447222
B76: of:=[$'Results - Detailed'.$B$74] -> 2561200 | C76: of:=[$'Results - Detailed'.$C$74] -> 0.001001 | D76: of:=[$'Results - Detailed'.$D$74] -> 0.253502 | E76: of:=[$'Results - Detailed'.$E$74] -> 789800 | F76: of:=[$'Results - Detailed'.$F$74] -> 0.00369 | G76: of:=[$'Results - Detailed'.$G$74] -> 0.489468 | H76: of:=[$'Results - Detailed'.$H$74] -> 2924600 | I76: of:=[$'Results - Detailed'.$I$74] -> 0.000851 | J76: of:=[$'Results - Detailed'.$J$74] -> 0.237371 | K76: of:=[$'Results - Detailed'.$K$74] -> 923000 | L76: of:=[$'Results - Detailed'.$L$74] -> 0.003142 | M76: of:=[$'Results - Detailed'.$M$74] -> 0.452065
B77: of:=[$'Results - Detailed'.$B$75] -> 2568200 | C77: of:=[$'Results - Detailed'.$C$75] -> 0.000977 | D77: of:=[$'Results - Detailed'.$D$75] -> 0.25508 | E77: of:=[$'Results - Detailed'.$E$75] -> 784800 | F77: of:=[$'Results - Detailed'.$F$75] -> 0.003667 | G77: of:=[$'Results - Detailed'.$G$75] -> 0.494745 | H77: of:=[$'Results - Detailed'.$H$75] -> 2898000 | I77: of:=[$'Results - Detailed'.$I$75] -> 0.000885 | J77: of:=[$'Results - Detailed'.$J$75] -> 0.240307 | K77: of:=[$'Results - Detailed'.$K$75] -> 921200 | L77: of:=[$'Results - Detailed'.$L$75] -> 0.003124 | M77: of:=[$'Results - Detailed'.$M$75] -> 0.455946
B78: of:=[$'Results - Detailed'.$B$76] -> 2567800 | C78: of:=[$'Results - Detailed'.$C$76] -> 0.000988 | D78: of:=[$'Results - Detailed'.$D$76] -> 0.257028 | E78: of:=[$'Results - Detailed'.$E$76] -> 787400 | F78: of:=[$'Results - Detailed'.$F$76] -> 0.003706 | G78: of:=[$'Results - Detailed'.$G$76] -> 0.497664 | H78: of:=[$'Results - Detailed'.$H$76] -> 2904400 | I78: of:=[$'Results - Detailed'.$I$76] -> 0.000889 | J78: of:=[$'Results - Detailed'.$J$76] -> 0.241886 | K78: of:=[$'Results - Detailed'.$K$76] -> 924600 | L78: of:=[$'Results - Detailed'.$L$76] -> 0.003119 | M78: of:=[$'Results - Detailed'.$M$76] -> 0.458521
B79: of:=[$'Results - Detailed'.$B$77] -> 2563600 | C79: of:=[$'Results - Detailed'.$C$77] -> 0.000993 | D79: of:=[$'Results - Detailed'.$D$77] -> 0.259162 | E79: of:=[$'Results - Detailed'.$E$77] -> 784400 | F79: of:=[$'Results - Detailed'.$F$77] -> 0.003753 | G79: of:=[$'Results - Detailed'.$G$77] -> 0.502364 | H79: of:=[$'Results - Detailed'.$H$77] -> 2903800 | I79: of:=[$'Results - Detailed'.$I$77] -> 0.000886 | J79: of:=[$'Results - Detailed'.$J$77] -> 0.243735 | K79: of:=[$'Results - Detailed'.$K$77] -> 931400 | L79: of:=[$'Results - Detailed'.$L$77] -> 0.003122 | M79: of:=[$'Results - Detailed'.$M$77] -> 0.460248
B80: of:=[$'Results - Detailed'.$B$78] -> 2567800 | C80: of:=[$'Results - Detailed'.$C$78] -> 0.000961 | D80: of:=[$'Results - Detailed'.$D$78] -> 0.260799 | E80: of:=[$'Results - Detailed'.$E$78] -> 784800 | F80: of:=[$'Results - Detailed'.$F$78] -> 0.003726 | G80: of:=[$'Results - Detailed'.$G$78] -> 0.505932 | H80: of:=[$'Results - Detailed'.$H$78] -> 2906600 | I80: of:=[$'Results - Detailed'.$I$78] -> 0.00087 | J80: of:=[$'Results - Detailed'.$J$78] -> 0.245396 | K80: of:=[$'Results - Detailed'.$K$78] -> 917600 | L80: of:=[$'Results - Detailed'.$L$78] -> 0.003173 | M80: of:=[$'Results - Detailed'.$M$78] -> 0.467105
B81: of:=[$'Results - Detailed'.$B$79] -> 2566000 | C81: of:=[$'Results - Detailed'.$C$79] -> 0.000969 | D81: of:=[$'Results - Detailed'.$D$79] -> 0.262741 | E81: of:=[$'Results - Detailed'.$E$79] -> 783600 | F81: of:=[$'Results - Detailed'.$F$79] -> 0.003757 | G81: of:=[$'Results - Detailed'.$G$79] -> 0.510016 | H81: of:=[$'Results - Detailed'.$H$79] -> 2926800 | I81: of:=[$'Results - Detailed'.$I$79] -> 0.000866 | J81: of:=[$'Results - Detailed'.$J$79] -> 0.246312 | K81: of:=[$'Results - Detailed'.$K$79] -> 920000 | L81: of:=[$'Results - Detailed'.$L$79] -> 0.003161 | M81: of:=[$'Results - Detailed'.$M$79] -> 0.469871
B82: of:=[$'Results - Detailed'.$B$80] -> 2555000 | C82: of:=[$'Results - Detailed'.$C$80] -> 0.00099 | D82: of:=[$'Results - Detailed'.$D$80] -> 0.265179 | E82: of:=[$'Results - Detailed'.$E$80] -> 785200 | F82: of:=[$'Results - Detailed'.$F$80] -> 0.003719 | G82: of:=[$'Results - Detailed'.$G$80] -> 0.513133 | H82: of:=[$'Results - Detailed'.$H$80] -> 2903200 | I82: of:=[$'Results - Detailed'.$I$80] -> 0.000867 | J82: of:=[$'Results - Detailed'.$J$80] -> 0.249057 | K82: of:=[$'Results - Detailed'.$K$80] -> 923200 | L82: of:=[$'Results - Detailed'.$L$80] -> 0.00313 | M82: of:=[$'Results - Detailed'.$M$80] -> 0.472382
B83: of:=[$'Results - Detailed'.$B$81] -> 2561400 | C83: of:=[$'Results - Detailed'.$C$81] -> 0.00097 | D83: of:=[$'Results - Detailed'.$D$81] -> 0.266672 | E83: of:=[$'Results - Detailed'.$E$81] -> 783600 | F83: of:=[$'Results - Detailed'.$F$81] -> 0.003744 | G83: of:=[$'Results - Detailed'.$G$81] -> 0.517288 | H83: of:=[$'Results - Detailed'.$H$81] -> 2915800 | I83: of:=[$'Results - Detailed'.$I$81] -> 0.000859 | J83: of:=[$'Results - Detailed'.$J$81] -> 0.250242 | K83: of:=[$'Results - Detailed'.$K$81] -> 927000 | L83: of:=[$'Results - Detailed'.$L$81] -> 0.003135 | M83: of:=[$'Results - Detailed'.$M$81] -> 0.474726
B84: of:=[$'Results - Detailed'.$B$82] -> 2563000 | C84: of:=[$'Results - Detailed'.$C$82] -> 0.001061 | D84: of:=[$'Results - Detailed'.$D$82] -> 0.25999 | E84: of:=[$'Results - Detailed'.$E$82] -> 757400 | F84: of:=[$'Results - Detailed'.$F$82] -> 0.003821 | G84: of:=[$'Results - Detailed'.$G$82] -> 0.492571 | H84: of:=[$'Results - Detailed'.$H$82] -> 2259800 | I84: of:=[$'Results - Detailed'.$I$82] -> 0.001197 | J84: of:=[$'Results - Detailed'.$J$82] -> 0.274181 | K84: of:=[$'Results - Detailed'.$K$82] -> 848000 | L84: of:=[$'Results - Detailed'.$L$82] -> 0.003425 | M84: of:=[$'Results - Detailed'.$M$82] -> 0.466789
B85: of:=[$'Results - Detailed'.$B$83] -> 2568400 | C85: of:=[$'Results - Detailed'.$C$83] -> 0.001057 | D85: of:=[$'Results - Detailed'.$D$83] -> 0.261744 | E85: of:=[$'Results - Detailed'.$E$83] -> 759600 | F85: of:=[$'Results - Detailed'.$F$83] -> 0.003852 | G85: of:=[$'Results - Detailed'.$G$83] -> 0.495757 | H85: of:=[$'Results - Detailed'.$H$83] -> 2266000 | I85: of:=[$'Results - Detailed'.$I$83] -> 0.001176 | J85: of:=[$'Results - Detailed'.$J$83] -> 0.275944 | K85: of:=[$'Results - Detailed'.$K$83] -> 861200 | L85: of:=[$'Results - Detailed'.$L$83] -> 0.00337 | M85: of:=[$'Results - Detailed'.$M$83] -> 0.466821
B86: of:=[$'Results - Detailed'.$B$84] -> 2565200 | C86: of:=[$'Results - Detailed'.$C$84] -> 0.001053 | D86: of:=[$'Results - Detailed'.$D$84] -> 0.263909 | E86: of:=[$'Results - Detailed'.$E$84] -> 760200 | F86: of:=[$'Results - Detailed'.$F$84] -> 0.003833 | G86: of:=[$'Results - Detailed'.$G$84] -> 0.499414 | H86: of:=[$'Results - Detailed'.$H$84] -> 2262400 | I86: of:=[$'Results - Detailed'.$I$84] -> 0.001186 | J86: of:=[$'Results - Detailed'.$J$84] -> 0.278303 | K86: of:=[$'Results - Detailed'.$K$84] -> 857000 | L86: of:=[$'Results - Detailed'.$L$84] -> 0.003368 | M86: of:=[$'Results - Detailed'.$M$84] -> 0.471548
B87: of:=[$'Results - Detailed'.$B$85] -> 2557800 | C87: of:=[$'Results - Detailed'.$C$85] -> 0.001055 | D87: of:=[$'Results - Detailed'.$D$85] -> 0.266279 | E87: of:=[$'Results - Detailed'.$E$85] -> 755800 | F87: of:=[$'Results - Detailed'.$F$85] -> 0.003874 | G87: of:=[$'Results - Detailed'.$G$85] -> 0.504718 | H87: of:=[$'Results - Detailed'.$H$85] -> 2272600 | I87: of:=[$'Results - Detailed'.$I$85] -> 0.001175 | J87: of:=[$'Results - Detailed'.$J$85] -> 0.279785 | K87: of:=[$'Results - Detailed'.$K$85] -> 850600 | L87: of:=[$'Results - Detailed'.$L$85] -> 0.003412 | M87: of:=[$'Results - Detailed'.$M$85] -> 0.476909
B88: of:=[$'Results - Detailed'.$B$86] -> 2574200 | C88: of:=[$'Results - Detailed'.$C$86] -> 0.001054 | D88: of:=[$'Results - Detailed'.$D$86] -> 0.267408 | E88: of:=[$'Results - Detailed'.$E$86] -> 756800 | F88: of:=[$'Results - Detailed'.$F$86] -> 0.003835 | G88: of:=[$'Results - Detailed'.$G$86] -> 0.508172 | H88: of:=[$'Results - Detailed'.$H$86] -> 2273600 | I88: of:=[$'Results - Detailed'.$I$86] -> 0.001177 | J88: of:=[$'Results - Detailed'.$J$86] -> 0.28182 | K88: of:=[$'Results - Detailed'.$K$86] -> 858200 | L88: of:=[$'Results - Detailed'.$L$86] -> 0.003384 | M88: of:=[$'Results - Detailed'.$M$86] -> 0.478343
B89: of:=[$'Results - Detailed'.$B$87] -> 2554200 | C89: of:=[$'Results - Detailed'.$C$87] -> 0.001062 | D89: of:=[$'Results - Detailed'.$D$87] -> 0.270423 | E89: of:=[$'Results - Detailed'.$E$87] -> 761000 | F89: of:=[$'Results - Detailed'.$F$87] -> 0.003832 | G89: of:=[$'Results - Detailed'.$G$87] -> 0.510534 | H89: of:=[$'Results - Detailed'.$H$87] -> 2270400 | I89: of:=[$'Results - Detailed'.$I$87] -> 0.001179 | J89: of:=[$'Results - Detailed'.$J$87] -> 0.2841 | K89: of:=[$'Results - Detailed'.$K$87] -> 857000 | L89: of:=[$'Results - Detailed'.$L$87] -> 0.003419 | M89: of:=[$'Results - Detailed'.$M$87] -> 0.482235
B90: of:=[$'Results - Detailed'.$B$88] -> 2554000 | C90: of:=[$'Results - Detailed'.$C$88] -> 0.001067 | D90: of:=[$'Results - Detailed'.$D$88] -> 0.272398 | E90: of:=[$'Results - Detailed'.$E$88] -> 759400 | F90: of:=[$'Results - Detailed'.$F$88] -> 0.003861 | G90: of:=[$'Results - Detailed'.$G$88] -> 0.514835 | H90: of:=[$'Results - Detailed'.$H$88] -> 2275800 | I90: of:=[$'Results - Detailed'.$I$88] -> 0.001164 | J90: of:=[$'Results - Detailed'.$J$88] -> 0.285808 | K90: of:=[$'Results - Detailed'.$K$88] -> 859000 | L90: of:=[$'Results - Detailed'.$L$88] -> 0.003376 | M90: of:=[$'Results - Detailed'.$M$88] -> 0.485166
B91: of:=[$'Results - Detailed'.$B$89] -> 2558000 | C91: of:=[$'Results - Detailed'.$C$89] -> 0.001077 | D91: of:=[$'Results - Detailed'.$D$89] -> 0.274156 | E91: of:=[$'Results - Detailed'.$E$89] -> 758400 | F91: of:=[$'Results - Detailed'.$F$89] -> 0.003837 | G91: of:=[$'Results - Detailed'.$G$89] -> 0.518885 | H91: of:=[$'Results - Detailed'.$H$89] -> 2276400 | I91: of:=[$'Results - Detailed'.$I$89] -> 0.00118 | J91: of:=[$'Results - Detailed'.$J$89] -> 0.287827 | K91: of:=[$'Results - Detailed'.$K$89] -> 858600 | L91: of:=[$'Results - Detailed'.$L$89] -> 0.003392 | M91: of:=[$'Results - Detailed'.$M$89] -> 0.48876
B92: of:=[$'Results - Detailed'.$B$90] -> 2557200 | C92: of:=[$'Results - Detailed'.$C$90] -> 0.001069 | D92: of:=[$'Results - Detailed'.$D$90] -> 0.276142 | E92: of:=[$'Results - Detailed'.$E$90] -> 752200 | F92: of:=[$'Results - Detailed'.$F$90] -> 0.003858 | G92: of:=[$'Results - Detailed'.$G$90] -> 0.524708 | H92: of:=[$'Results - Detailed'.$H$90] -> 2273000 | I92: of:=[$'Results - Detailed'.$I$90] -> 0.001169 | J92: of:=[$'Results - Detailed'.$J$90] -> 0.290065 | K92: of:=[$'Results - Detailed'.$K$90] -> 851800 | L92: of:=[$'Results - Detailed'.$L$90] -> 0.003372 | M92: of:=[$'Results - Detailed'.$M$90] -> 0.494131
B93: of:=[$'Results - Detailed'.$B$91] -> 2574800 | C93: of:=[$'Results - Detailed'.$C$91] -> 0.001041 | D93: of:=[$'Results - Detailed'.$D$91] -> 0.277081 | E93: of:=[$'Results - Detailed'.$E$91] -> 761200 | F93: of:=[$'Results - Detailed'.$F$91] -> 0.003818 | G93: of:=[$'Results - Detailed'.$G$91] -> 0.525244 | H93: of:=[$'Results - Detailed'.$H$91] -> 2257000 | I93: of:=[$'Results - Detailed'.$I$91] -> 0.001198 | J93: of:=[$'Results - Detailed'.$J$91] -> 0.293142 | K93: of:=[$'Results - Detailed'.$K$91] -> 854800 | L93: of:=[$'Results - Detailed'.$L$91] -> 0.003369 | M93: of:=[$'Results - Detailed'.$M$91] -> 0.496667
A94: 3 | B94: of:=AVERAGE([.B64:.B93]) -> 2441540 | C94: of:=AVERAGE([.C64:.C93]) -> 0.00109016666666667 | D94: of:=AVERAGE([.D64:.D93]) -> 0.272695966666667 | E94: of:=AVERAGE([.E64:.E93]) -> 772926.666666667 | F94: of:=AVERAGE([.F64:.F93]) -> 0.00377306666666667 | G94: of:=AVERAGE([.G64:.G93]) -> 0.504308966666667 | H94: of:=AVERAGE([.H64:.H93]) -> 2474453.33333333 | I94: of:=AVERAGE([.I64:.I93]) -> 0.00108093333333333 | J94: of:=AVERAGE([.J64:.J93]) -> 0.271195766666667 | K94: of:=AVERAGE([.K64:.K93]) -> 903313.333333333 | L94: of:=AVERAGE([.L64:.L93]) -> 0.00321573333333333 | M94: of:=AVERAGE([.M64:.M93]) -> 0.4675246
A95: 4 / Results - Detailed | B95: of:=[$'Results - Detailed'.$B$92] -> 2515800 | C95: of:=[$'Results - Detailed'.$C$92] -> 0.001468 | D95: of:=[$'Results - Detailed'.$D$92] -> 0.305993 | E95: of:=[$'Results - Detailed'.$E$92] -> 770000 | F95: of:=[$'Results - Detailed'.$F$92] -> 0.005078 | G95: of:=[$'Results - Detailed'.$G$92] -> 0.593769 | H95: of:=[$'Results - Detailed'.$H$92] -> 1869400 | I95: of:=[$'Results - Detailed'.$I$92] -> 0.002001 | J95: of:=[$'Results - Detailed'.$J$92] -> 0.353639 | K95: of:=[$'Results - Detailed'.$K$92] -> 930400 | L95: of:=[$'Results - Detailed'.$L$92] -> 0.004187 | M95: of:=[$'Results - Detailed'.$M$92] -> 0.517434
B96: of:=[$'Results - Detailed'.$B$93] -> 2518800 | C96: of:=[$'Results - Detailed'.$C$93] -> 0.001485 | D96: of:=[$'Results - Detailed'.$D$93] -> 0.308229 | E96: of:=[$'Results - Detailed'.$E$93] -> 771200 | F96: of:=[$'Results - Detailed'.$F$93] -> 0.005073 | G96: of:=[$'Results - Detailed'.$G$93] -> 0.597566 | H96: of:=[$'Results - Detailed'.$H$93] -> 1874400 | I96: of:=[$'Results - Detailed'.$I$93] -> 0.001975 | J96: of:=[$'Results - Detailed'.$J$93] -> 0.355953 | K96: of:=[$'Results - Detailed'.$K$93] -> 930000 | L96: of:=[$'Results - Detailed'.$L$93] -> 0.004185 | M96: of:=[$'Results - Detailed'.$M$93] -> 0.521573
B97: of:=[$'Results - Detailed'.$B$94] -> 2517600 | C97: of:=[$'Results - Detailed'.$C$94] -> 0.001472 | D97: of:=[$'Results - Detailed'.$D$94] -> 0.31068 | E97: of:=[$'Results - Detailed'.$E$94] -> 771600 | F97: of:=[$'Results - Detailed'.$F$94] -> 0.005086 | G97: of:=[$'Results - Detailed'.$G$94] -> 0.601652 | H97: of:=[$'Results - Detailed'.$H$94] -> 1877000 | I97: of:=[$'Results - Detailed'.$I$94] -> 0.001982 | J97: of:=[$'Results - Detailed'.$J$94] -> 0.358481 | K97: of:=[$'Results - Detailed'.$K$94] -> 925800 | L97: of:=[$'Results - Detailed'.$L$94] -> 0.004234 | M97: of:=[$'Results - Detailed'.$M$94] -> 0.526789
B98: of:=[$'Results - Detailed'.$B$95] -> 2517800 | C98: of:=[$'Results - Detailed'.$C$95] -> 0.001485 | D98: of:=[$'Results - Detailed'.$D$95] -> 0.313048 | E98: of:=[$'Results - Detailed'.$E$95] -> 771800 | F98: of:=[$'Results - Detailed'.$F$95] -> 0.005069 | G98: of:=[$'Results - Detailed'.$G$95] -> 0.605773 | H98: of:=[$'Results - Detailed'.$H$95] -> 1879200 | I98: of:=[$'Results - Detailed'.$I$95] -> 0.001986 | J98: of:=[$'Results - Detailed'.$J$95] -> 0.361032 | K98: of:=[$'Results - Detailed'.$K$95] -> 927000 | L98: of:=[$'Results - Detailed'.$L$95] -> 0.004203 | M98: of:=[$'Results - Detailed'.$M$95] -> 0.530425
B99: of:=[$'Results - Detailed'.$B$96] -> 2523800 | C99: of:=[$'Results - Detailed'.$C$96] -> 0.001474 | D99: of:=[$'Results - Detailed'.$D$96] -> 0.315024 | E99: of:=[$'Results - Detailed'.$E$96] -> 774200 | F99: of:=[$'Results - Detailed'.$F$96] -> 0.005035 | G99: of:=[$'Results - Detailed'.$G$96] -> 0.608981 | H99: of:=[$'Results - Detailed'.$H$96] -> 1864200 | I99: of:=[$'Results - Detailed'.$I$96] -> 0.001987 | J99: of:=[$'Results - Detailed'.$J$96] -> 0.365212 | K99: of:=[$'Results - Detailed'.$K$96] -> 933000 | L99: of:=[$'Results - Detailed'.$L$96] -> 0.004174 | M99: of:=[$'Results - Detailed'.$M$96] -> 0.532649
B100: of:=[$'Results - Detailed'.$B$97] -> 2513200 | C100: of:=[$'Results - Detailed'.$C$97] -> 0.001482 | D100: of:=[$'Results - Detailed'.$D$97] -> 0.318026 | E100: of:=[$'Results - Detailed'.$E$97] -> 769000 | F100: of:=[$'Results - Detailed'.$F$97] -> 0.0051 | G100: of:=[$'Results - Detailed'.$G$97] -> 0.615196 | H100: of:=[$'Results - Detailed'.$H$97] -> 1883000 | I100: of:=[$'Results - Detailed'.$I$97] -> 0.001938 | J100: of:=[$'Results - Detailed'.$J$97] -> 0.366042 | K100: of:=[$'Results - Detailed'.$K$97] -> 929400 | L100: of:=[$'Results - Detailed'.$L$97] -> 0.004192 | M100: of:=[$'Results - Detailed'.$M$97] -> 0.537592
B101: of:=[$'Results - Detailed'.$B$98] -> 2516800 | C101: of:=[$'Results - Detailed'.$C$98] -> 0.001482 | D101: of:=[$'Results - Detailed'.$D$98] -> 0.320144 | E101: of:=[$'Results - Detailed'.$E$98] -> 772400 | F101: of:=[$'Results - Detailed'.$F$98] -> 0.005091 | G101: of:=[$'Results - Detailed'.$G$98] -> 0.617973 | H101: of:=[$'Results - Detailed'.$H$98] -> 1871800 | I101: of:=[$'Results - Detailed'.$I$98] -> 0.001993 | J101: of:=[$'Results - Detailed'.$J$98] -> 0.369839 | K101: of:=[$'Results - Detailed'.$K$98] -> 926800 | L101: of:=[$'Results - Detailed'.$L$98] -> 0.00418 | M101: of:=[$'Results - Detailed'.$M$98] -> 0.542214
B102: of:=[$'Results - Detailed'.$B$99] -> 2514600 | C102: of:=[$'Results - Detailed'.$C$99] -> 0.001471 | D102: of:=[$'Results - Detailed'.$D$99] -> 0.322573 | E102: of:=[$'Results - Detailed'.$E$99] -> 773800 | F102: of:=[$'Results - Detailed'.$F$99] -> 0.005074 | G102: of:=[$'Results - Detailed'.$G$99] -> 0.621509 | H102: of:=[$'Results - Detailed'.$H$99] -> 1871800 | I102: of:=[$'Results - Detailed'.$I$99] -> 0.001955 | J102: of:=[$'Results - Detailed'.$J$99] -> 0.372473 | K102: of:=[$'Results - Detailed'.$K$99] -> 930000 | L102: of:=[$'Results - Detailed'.$L$99] -> 0.004172 | M102: of:=[$'Results - Detailed'.$M$99] -> 0.545121
B103: of:=[$'Results - Detailed'.$B$100] -> 2510400 | C103: of:=[$'Results - Detailed'.$C$100] -> 0.001498 | D103: of:=[$'Results - Detailed'.$D$100] -> 0.325154 | E103: of:=[$'Results - Detailed'.$E$100] -> 774200 | F103: of:=[$'Results - Detailed'.$F$100] -> 0.00505 | G103: of:=[$'Results - Detailed'.$G$100] -> 0.625399 | H103: of:=[$'Results - Detailed'.$H$100] -> 1869400 | I103: of:=[$'Results - Detailed'.$I$100] -> 0.001977 | J103: of:=[$'Results - Detailed'.$J$100] -> 0.375355 | K103: of:=[$'Results - Detailed'.$K$100] -> 929600 | L103: of:=[$'Results - Detailed'.$L$100] -> 0.004189 | M103: of:=[$'Results - Detailed'.$M$100] -> 0.549066
B104: of:=[$'Results - Detailed'.$B$101] -> 2521400 | C104: of:=[$'Results - Detailed'.$C$101] -> 0.00148 | D104: of:=[$'Results - Detailed'.$D$101] -> 0.326717 | E104: of:=[$'Results - Detailed'.$E$101] -> 773000 | F104: of:=[$'Results - Detailed'.$F$101] -> 0.005071 | G104: of:=[$'Results - Detailed'.$G$101] -> 0.629922 | H104: of:=[$'Results - Detailed'.$H$101] -> 1874800 | I104: of:=[$'Results - Detailed'.$I$101] -> 0.001966 | J104: of:=[$'Results - Detailed'.$J$101] -> 0.377428 | K104: of:=[$'Results - Detailed'.$K$101] -> 929800 | L104: of:=[$'Results - Detailed'.$L$101] -> 0.004166 | M104: of:=[$'Results - Detailed'.$M$101] -> 0.552789
B105: of:=[$'Results - Detailed'.$B$102] -> 2479800 | C105: of:=[$'Results - Detailed'.$C$102] -> 0.001501 | D105: of:=[$'Results - Detailed'.$D$102] -> 0.308551 | E105: of:=[$'Results - Detailed'.$E$102] -> 790400 | F105: of:=[$'Results - Detailed'.$F$102] -> 0.004942 | G105: of:=[$'Results - Detailed'.$G$102] -> 0.569365 | H105: of:=[$'Results - Detailed'.$H$102] -> 1853200 | I105: of:=[$'Results - Detailed'.$I$102] -> 0.002016 | J105: of:=[$'Results - Detailed'.$J$102] -> 0.359584 | K105: of:=[$'Results - Detailed'.$K$102] -> 948200 | L105: of:=[$'Results - Detailed'.$L$102] -> 0.004115 | M105: of:=[$'Results - Detailed'.$M$102] -> 0.513511
B106: of:=[$'Results - Detailed'.$B$103] -> 2442200 | C106: of:=[$'Results - Detailed'.$C$103] -> 0.001537 | D106: of:=[$'Results - Detailed'.$D$103] -> 0.313379 | E106: of:=[$'Results - Detailed'.$E$103] -> 786400 | F106: of:=[$'Results - Detailed'.$F$103] -> 0.004952 | G106: of:=[$'Results - Detailed'.$G$103] -> 0.575132 | H106: of:=[$'Results - Detailed'.$H$103] -> 1837200 | I106: of:=[$'Results - Detailed'.$I$103] -> 0.002066 | J106: of:=[$'Results - Detailed'.$J$103] -> 0.363996 | K106: of:=[$'Results - Detailed'.$K$103] -> 948000 | L106: of:=[$'Results - Detailed'.$L$103] -> 0.004124 | M106: of:=[$'Results - Detailed'.$M$103] -> 0.517565
B107: of:=[$'Results - Detailed'.$B$104] -> 2431800 | C107: of:=[$'Results - Detailed'.$C$104] -> 0.001527 | D107: of:=[$'Results - Detailed'.$D$104] -> 0.316471 | E107: of:=[$'Results - Detailed'.$E$104] -> 784800 | F107: of:=[$'Results - Detailed'.$F$104] -> 0.004995 | G107: of:=[$'Results - Detailed'.$G$104] -> 0.580039 | H107: of:=[$'Results - Detailed'.$H$104] -> 1844400 | I107: of:=[$'Results - Detailed'.$I$104] -> 0.002054 | J107: of:=[$'Results - Detailed'.$J$104] -> 0.366101 | K107: of:=[$'Results - Detailed'.$K$104] -> 950200 | L107: of:=[$'Results - Detailed'.$L$104] -> 0.00413 | M107: of:=[$'Results - Detailed'.$M$104] -> 0.520944
B108: of:=[$'Results - Detailed'.$B$105] -> 2426800 | C108: of:=[$'Results - Detailed'.$C$105] -> 0.001521 | D108: of:=[$'Results - Detailed'.$D$105] -> 0.319189 | E108: of:=[$'Results - Detailed'.$E$105] -> 787800 | F108: of:=[$'Results - Detailed'.$F$105] -> 0.004961 | G108: of:=[$'Results - Detailed'.$G$105] -> 0.583203 | H108: of:=[$'Results - Detailed'.$H$105] -> 1845400 | I108: of:=[$'Results - Detailed'.$I$105] -> 0.002042 | J108: of:=[$'Results - Detailed'.$J$105] -> 0.368807 | K108: of:=[$'Results - Detailed'.$K$105] -> 946000 | L108: of:=[$'Results - Detailed'.$L$105] -> 0.004123 | M108: of:=[$'Results - Detailed'.$M$105] -> 0.526033
B109: of:=[$'Results - Detailed'.$B$106] -> 2432000 | C109: of:=[$'Results - Detailed'.$C$106] -> 0.001528 | D109: of:=[$'Results - Detailed'.$D$106] -> 0.321235 | E109: of:=[$'Results - Detailed'.$E$106] -> 775400 | F109: of:=[$'Results - Detailed'.$F$106] -> 0.00504 | G109: of:=[$'Results - Detailed'.$G$106] -> 0.592118 | H109: of:=[$'Results - Detailed'.$H$106] -> 1830800 | I109: of:=[$'Results - Detailed'.$I$106] -> 0.00208 | J109: of:=[$'Results - Detailed'.$J$106] -> 0.373072 | K109: of:=[$'Results - Detailed'.$K$106] -> 949200 | L109: of:=[$'Results - Detailed'.$L$106] -> 0.004111 | M109: of:=[$'Results - Detailed'.$M$106] -> 0.529045
B110: of:=[$'Results - Detailed'.$B$107] -> 2426600 | C110: of:=[$'Results - Detailed'.$C$107] -> 0.001543 | D110: of:=[$'Results - Detailed'.$D$107] -> 0.323982 | E110: of:=[$'Results - Detailed'.$E$107] -> 787400 | F110: of:=[$'Results - Detailed'.$F$107] -> 0.004958 | G110: of:=[$'Results - Detailed'.$G$107] -> 0.591793 | H110: of:=[$'Results - Detailed'.$H$107] -> 1853400 | I110: of:=[$'Results - Detailed'.$I$107] -> 0.002031 | J110: of:=[$'Results - Detailed'.$J$107] -> 0.37384 | K110: of:=[$'Results - Detailed'.$K$107] -> 946200 | L110: of:=[$'Results - Detailed'.$L$107] -> 0.00412 | M110: of:=[$'Results - Detailed'.$M$107] -> 0.533756
B111: of:=[$'Results - Detailed'.$B$108] -> 2442600 | C111: of:=[$'Results - Detailed'.$C$108] -> 0.001534 | D111: of:=[$'Results - Detailed'.$D$108] -> 0.325293 | E111: of:=[$'Results - Detailed'.$E$108] -> 783800 | F111: of:=[$'Results - Detailed'.$F$108] -> 0.004983 | G111: of:=[$'Results - Detailed'.$G$108] -> 0.597337 | H111: of:=[$'Results - Detailed'.$H$108] -> 1855400 | I111: of:=[$'Results - Detailed'.$I$108] -> 0.002024 | J111: of:=[$'Results - Detailed'.$J$108] -> 0.376358 | K111: of:=[$'Results - Detailed'.$K$108] -> 954400 | L111: of:=[$'Results - Detailed'.$L$108] -> 0.004101 | M111: of:=[$'Results - Detailed'.$M$108] -> 0.535302
B112: of:=[$'Results - Detailed'.$B$109] -> 2438000 | C112: of:=[$'Results - Detailed'.$C$109] -> 0.001525 | D112: of:=[$'Results - Detailed'.$D$109] -> 0.327933 | E112: of:=[$'Results - Detailed'.$E$109] -> 789000 | F112: of:=[$'Results - Detailed'.$F$109] -> 0.00494 | G112: of:=[$'Results - Detailed'.$G$109] -> 0.5995 | H112: of:=[$'Results - Detailed'.$H$109] -> 1838000 | I112: of:=[$'Results - Detailed'.$I$109] -> 0.00205 | J112: of:=[$'Results - Detailed'.$J$109] -> 0.380836 | K112: of:=[$'Results - Detailed'.$K$109] -> 952400 | L112: of:=[$'Results - Detailed'.$L$109] -> 0.004078 | M112: of:=[$'Results - Detailed'.$M$109] -> 0.539656
B113: of:=[$'Results - Detailed'.$B$110] -> 2427800 | C113: of:=[$'Results - Detailed'.$C$110] -> 0.001526 | D113: of:=[$'Results - Detailed'.$D$110] -> 0.330935 | E113: of:=[$'Results - Detailed'.$E$110] -> 789000 | F113: of:=[$'Results - Detailed'.$F$110] -> 0.004953 | G113: of:=[$'Results - Detailed'.$G$110] -> 0.603617 | H113: of:=[$'Results - Detailed'.$H$110] -> 1844600 | I113: of:=[$'Results - Detailed'.$I$110] -> 0.002023 | J113: of:=[$'Results - Detailed'.$J$110] -> 0.382806 | K113: of:=[$'Results - Detailed'.$K$110] -> 953200 | L113: of:=[$'Results - Detailed'.$L$110] -> 0.004087 | M113: of:=[$'Results - Detailed'.$M$110] -> 0.543205
B114: of:=[$'Results - Detailed'.$B$111] -> 2436800 | C114: of:=[$'Results - Detailed'.$C$111] -> 0.001514 | D114: of:=[$'Results - Detailed'.$D$111] -> 0.332608 | E114: of:=[$'Results - Detailed'.$E$111] -> 787400 | F114: of:=[$'Results - Detailed'.$F$111] -> 0.00495 | G114: of:=[$'Results - Detailed'.$G$111] -> 0.608312 | H114: of:=[$'Results - Detailed'.$H$111] -> 1842000 | I114: of:=[$'Results - Detailed'.$I$111] -> 0.00203 | J114: of:=[$'Results - Detailed'.$J$111] -> 0.385717 | K114: of:=[$'Results - Detailed'.$K$111] -> 953200 | L114: of:=[$'Results - Detailed'.$L$111] -> 0.004081 | M114: of:=[$'Results - Detailed'.$M$111] -> 0.546948
B115: of:=[$'Results - Detailed'.$B$112] -> 2448000 | C115: of:=[$'Results - Detailed'.$C$112] -> 0.001482 | D115: of:=[$'Results - Detailed'.$D$112] -> 0.309159 | E115: of:=[$'Results - Detailed'.$E$112] -> 782800 | F115: of:=[$'Results - Detailed'.$F$112] -> 0.005015 | G115: of:=[$'Results - Detailed'.$G$112] -> 0.576532 | H115: of:=[$'Results - Detailed'.$H$112] -> 1834600 | I115: of:=[$'Results - Detailed'.$I$112] -> 0.002069 | J115: of:=[$'Results - Detailed'.$J$112] -> 0.360283 | K115: of:=[$'Results - Detailed'.$K$112] -> 930000 | L115: of:=[$'Results - Detailed'.$L$112] -> 0.004209 | M115: of:=[$'Results - Detailed'.$M$112] -> 0.515025
B116: of:=[$'Results - Detailed'.$B$113] -> 2440400 | C116: of:=[$'Results - Detailed'.$C$113] -> 0.001517 | D116: of:=[$'Results - Detailed'.$D$113] -> 0.312088 | E116: of:=[$'Results - Detailed'.$E$113] -> 783600 | F116: of:=[$'Results - Detailed'.$F$113] -> 0.005003 | G116: of:=[$'Results - Detailed'.$G$113] -> 0.580562 | H116: of:=[$'Results - Detailed'.$H$113] -> 1831400 | I116: of:=[$'Results - Detailed'.$I$113] -> 0.002054 | J116: of:=[$'Results - Detailed'.$J$113] -> 0.363462 | K116: of:=[$'Results - Detailed'.$K$113] -> 931200 | L116: of:=[$'Results - Detailed'.$L$113] -> 0.004197 | M116: of:=[$'Results - Detailed'.$M$113] -> 0.518754
B117: of:=[$'Results - Detailed'.$B$114] -> 2454400 | C117: of:=[$'Results - Detailed'.$C$114] -> 0.001483 | D117: of:=[$'Results - Detailed'.$D$114] -> 0.313571 | E117: of:=[$'Results - Detailed'.$E$114] -> 785200 | F117: of:=[$'Results - Detailed'.$F$114] -> 0.005 | G117: of:=[$'Results - Detailed'.$G$114] -> 0.584265 | H117: of:=[$'Results - Detailed'.$H$114] -> 1845000 | I117: of:=[$'Results - Detailed'.$I$114] -> 0.002042 | J117: of:=[$'Results - Detailed'.$J$114] -> 0.364929 | K117: of:=[$'Results - Detailed'.$K$114] -> 925600 | L117: of:=[$'Results - Detailed'.$L$114] -> 0.004246 | M117: of:=[$'Results - Detailed'.$M$114] -> 0.524385
B118: of:=[$'Results - Detailed'.$B$115] -> 2443000 | C118: of:=[$'Results - Detailed'.$C$115] -> 0.0015 | D118: of:=[$'Results - Detailed'.$D$115] -> 0.316678 | E118: of:=[$'Results - Detailed'.$E$115] -> 785200 | F118: of:=[$'Results - Detailed'.$F$115] -> 0.004977 | G118: of:=[$'Results - Detailed'.$G$115] -> 0.588509 | H118: of:=[$'Results - Detailed'.$H$115] -> 1840000 | I118: of:=[$'Results - Detailed'.$I$115] -> 0.002047 | J118: of:=[$'Results - Detailed'.$J$115] -> 0.368214 | K118: of:=[$'Results - Detailed'.$K$115] -> 933200 | L118: of:=[$'Results - Detailed'.$L$115] -> 0.004203 | M118: of:=[$'Results - Detailed'.$M$115] -> 0.526254
B119: of:=[$'Results - Detailed'.$B$116] -> 2456000 | C119: of:=[$'Results - Detailed'.$C$116] -> 0.0015 | D119: of:=[$'Results - Detailed'.$D$116] -> 0.318205 | E119: of:=[$'Results - Detailed'.$E$116] -> 787600 | F119: of:=[$'Results - Detailed'.$F$116] -> 0.004937 | G119: of:=[$'Results - Detailed'.$G$116] -> 0.591798 | H119: of:=[$'Results - Detailed'.$H$116] -> 1831200 | I119: of:=[$'Results - Detailed'.$I$116] -> 0.00205 | J119: of:=[$'Results - Detailed'.$J$116] -> 0.371865 | K119: of:=[$'Results - Detailed'.$K$116] -> 927400 | L119: of:=[$'Results - Detailed'.$L$116] -> 0.004216 | M119: of:=[$'Results - Detailed'.$M$116] -> 0.531875
B120: of:=[$'Results - Detailed'.$B$117] -> 2450800 | C120: of:=[$'Results - Detailed'.$C$117] -> 0.00151 | D120: of:=[$'Results - Detailed'.$D$117] -> 0.320903 | E120: of:=[$'Results - Detailed'.$E$117] -> 781600 | F120: of:=[$'Results - Detailed'.$F$117] -> 0.005003 | G120: of:=[$'Results - Detailed'.$G$117] -> 0.59826 | H120: of:=[$'Results - Detailed'.$H$117] -> 1825000 | I120: of:=[$'Results - Detailed'.$I$117] -> 0.002044 | J120: of:=[$'Results - Detailed'.$J$117] -> 0.375229 | K120: of:=[$'Results - Detailed'.$K$117] -> 928600 | L120: of:=[$'Results - Detailed'.$L$117] -> 0.004204 | M120: of:=[$'Results - Detailed'.$M$117] -> 0.535472
B121: of:=[$'Results - Detailed'.$B$118] -> 2450800 | C121: of:=[$'Results - Detailed'.$C$118] -> 0.001502 | D121: of:=[$'Results - Detailed'.$D$118] -> 0.323234 | E121: of:=[$'Results - Detailed'.$E$118] -> 785600 | F121: of:=[$'Results - Detailed'.$F$118] -> 0.004924 | G121: of:=[$'Results - Detailed'.$G$118] -> 0.600847 | H121: of:=[$'Results - Detailed'.$H$118] -> 1827600 | I121: of:=[$'Results - Detailed'.$I$118] -> 0.002054 | J121: of:=[$'Results - Detailed'.$J$118] -> 0.377691 | K121: of:=[$'Results - Detailed'.$K$118] -> 929400 | L121: of:=[$'Results - Detailed'.$L$118] -> 0.004226 | M121: of:=[$'Results - Detailed'.$M$118] -> 0.539175
B122: of:=[$'Results - Detailed'.$B$119] -> 2442400 | C122: of:=[$'Results - Detailed'.$C$119] -> 0.001509 | D122: of:=[$'Results - Detailed'.$D$119] -> 0.326112 | E122: of:=[$'Results - Detailed'.$E$119] -> 778000 | F122: of:=[$'Results - Detailed'.$F$119] -> 0.005054 | G122: of:=[$'Results - Detailed'.$G$119] -> 0.607945 | H122: of:=[$'Results - Detailed'.$H$119] -> 1820200 | I122: of:=[$'Results - Detailed'.$I$119] -> 0.002064 | J122: of:=[$'Results - Detailed'.$J$119] -> 0.381175 | K122: of:=[$'Results - Detailed'.$K$119] -> 935800 | L122: of:=[$'Results - Detailed'.$L$119] -> 0.004176 | M122: of:=[$'Results - Detailed'.$M$119] -> 0.5412
B123: of:=[$'Results - Detailed'.$B$120] -> 2459000 | C123: of:=[$'Results - Detailed'.$C$120] -> 0.001508 | D123: of:=[$'Results - Detailed'.$D$120] -> 0.327328 | E123: of:=[$'Results - Detailed'.$E$120] -> 785400 | F123: of:=[$'Results - Detailed'.$F$120] -> 0.004981 | G123: of:=[$'Results - Detailed'.$G$120] -> 0.609176 | H123: of:=[$'Results - Detailed'.$H$120] -> 1826400 | I123: of:=[$'Results - Detailed'.$I$120] -> 0.002042 | J123: of:=[$'Results - Detailed'.$J$120] -> 0.383201 | K123: of:=[$'Results - Detailed'.$K$120] -> 932600 | L123: of:=[$'Results - Detailed'.$L$120] -> 0.004175 | M123: of:=[$'Results - Detailed'.$M$120] -> 0.545965
B124: of:=[$'Results - Detailed'.$B$121] -> 2452000 | C124: of:=[$'Results - Detailed'.$C$121] -> 0.001498 | D124: of:=[$'Results - Detailed'.$D$121] -> 0.330073 | E124: of:=[$'Results - Detailed'.$E$121] -> 781200 | F124: of:=[$'Results - Detailed'.$F$121] -> 0.005036 | G124: of:=[$'Results - Detailed'.$G$121] -> 0.61492 | H124: of:=[$'Results - Detailed'.$H$121] -> 1830800 | I124: of:=[$'Results - Detailed'.$I$121] -> 0.002067 | J124: of:=[$'Results - Detailed'.$J$121] -> 0.385431 | K124: of:=[$'Results - Detailed'.$K$121] -> 930800 | L124: of:=[$'Results - Detailed'.$L$121] -> 0.004209 | M124: of:=[$'Results - Detailed'.$M$121] -> 0.550331
A125: 4 | B125: of:=AVERAGE([.B95:.B124]) -> 2468380 | C125: of:=AVERAGE([.C95:.C124]) -> 0.00150206666666667 | D125: of:=AVERAGE([.D95:.D124]) -> 0.319417166666667 | E125: of:=AVERAGE([.E95:.E124]) -> 780626.666666667 | F125: of:=AVERAGE([.F95:.F124]) -> 0.00501103333333333 | G125: of:=AVERAGE([.G95:.G124]) -> 0.599032333333333 | H125: of:=AVERAGE([.H95:.H124]) -> 1849720 | I125: of:=AVERAGE([.I95:.I124]) -> 0.00202363333333333 | J125: of:=AVERAGE([.J95:.J124]) -> 0.3706017 | K125: of:=AVERAGE([.K95:.K124]) -> 936580 | L125: of:=AVERAGE([.L95:.L124]) -> 0.0041671 | M125: of:=AVERAGE([.M95:.M124]) -> 0.533001766666667
A126: 5 / Results - Detailed | B126: of:=[$'Results - Detailed'.$B$122] -> 2507000 | C126: of:=[$'Results - Detailed'.$C$122] -> 0.001863 | D126: of:=[$'Results - Detailed'.$D$122] -> 0.352629 | E126: of:=[$'Results - Detailed'.$E$122] -> 740800 | F126: of:=[$'Results - Detailed'.$F$122] -> 0.00665 | G126: of:=[$'Results - Detailed'.$G$122] -> 0.647089 | H126: of:=[$'Results - Detailed'.$H$122] -> 1879800 | I126: of:=[$'Results - Detailed'.$I$122] -> 0.002524 | J126: of:=[$'Results - Detailed'.$J$122] -> 0.409861 | K126: of:=[$'Results - Detailed'.$K$122] -> 886800 | L126: of:=[$'Results - Detailed'.$L$122] -> 0.005519 | M126: of:=[$'Results - Detailed'.$M$122] -> 0.593596
B127: of:=[$'Results - Detailed'.$B$123] -> 2504400 | C127: of:=[$'Results - Detailed'.$C$123] -> 0.001854 | D127: of:=[$'Results - Detailed'.$D$123] -> 0.355431 | E127: of:=[$'Results - Detailed'.$E$123] -> 740600 | F127: of:=[$'Results - Detailed'.$F$123] -> 0.006595 | G127: of:=[$'Results - Detailed'.$G$123] -> 0.652252 | H127: of:=[$'Results - Detailed'.$H$123] -> 1861000 | I127: of:=[$'Results - Detailed'.$I$123] -> 0.002556 | J127: of:=[$'Results - Detailed'.$J$123] -> 0.415016 | K127: of:=[$'Results - Detailed'.$K$123] -> 901800 | L127: of:=[$'Results - Detailed'.$L$123] -> 0.005434 | M127: of:=[$'Results - Detailed'.$M$123] -> 0.593236
B128: of:=[$'Results - Detailed'.$B$124] -> 2514200 | C128: of:=[$'Results - Detailed'.$C$124] -> 0.001852 | D128: of:=[$'Results - Detailed'.$D$124] -> 0.357365 | E128: of:=[$'Results - Detailed'.$E$124] -> 738200 | F128: of:=[$'Results - Detailed'.$F$124] -> 0.006646 | G128: of:=[$'Results - Detailed'.$G$124] -> 0.658378 | H128: of:=[$'Results - Detailed'.$H$124] -> 1874000 | I128: of:=[$'Results - Detailed'.$I$124] -> 0.002511 | J128: of:=[$'Results - Detailed'.$J$124] -> 0.416599 | K128: of:=[$'Results - Detailed'.$K$124] -> 900600 | L128: of:=[$'Results - Detailed'.$L$124] -> 0.005445 | M128: of:=[$'Results - Detailed'.$M$124] -> 0.5982
B129: of:=[$'Results - Detailed'.$B$125] -> 2507400 | C129: of:=[$'Results - Detailed'.$C$125] -> 0.001851 | D129: of:=[$'Results - Detailed'.$D$125] -> 0.360426 | E129: of:=[$'Results - Detailed'.$E$125] -> 741200 | F129: of:=[$'Results - Detailed'.$F$125] -> 0.006624 | G129: of:=[$'Results - Detailed'.$G$125] -> 0.662066 | H129: of:=[$'Results - Detailed'.$H$125] -> 1864800 | I129: of:=[$'Results - Detailed'.$I$125] -> 0.002509 | J129: of:=[$'Results - Detailed'.$J$125] -> 0.420618 | K129: of:=[$'Results - Detailed'.$K$125] -> 897400 | L129: of:=[$'Results - Detailed'.$L$125] -> 0.005447 | M129: of:=[$'Results - Detailed'.$M$125] -> 0.603793
B130: of:=[$'Results - Detailed'.$B$126] -> 2496400 | C130: of:=[$'Results - Detailed'.$C$126] -> 0.001872 | D130: of:=[$'Results - Detailed'.$D$126] -> 0.363802 | E130: of:=[$'Results - Detailed'.$E$126] -> 739200 | F130: of:=[$'Results - Detailed'.$F$126] -> 0.006656 | G130: of:=[$'Results - Detailed'.$G$126] -> 0.667962 | H130: of:=[$'Results - Detailed'.$H$126] -> 1869600 | I130: of:=[$'Results - Detailed'.$I$126] -> 0.002505 | J130: of:=[$'Results - Detailed'.$J$126] -> 0.42305 | K130: of:=[$'Results - Detailed'.$K$126] -> 900800 | L130: of:=[$'Results - Detailed'.$L$126] -> 0.005406 | M130: of:=[$'Results - Detailed'.$M$126] -> 0.607121
B131: of:=[$'Results - Detailed'.$B$127] -> 2477200 | C131: of:=[$'Results - Detailed'.$C$127] -> 0.00188 | D131: of:=[$'Results - Detailed'.$D$127] -> 0.367774 | E131: of:=[$'Results - Detailed'.$E$127] -> 740800 | F131: of:=[$'Results - Detailed'.$F$127] -> 0.006639 | G131: of:=[$'Results - Detailed'.$G$127] -> 0.672197 | H131: of:=[$'Results - Detailed'.$H$127] -> 1859200 | I131: of:=[$'Results - Detailed'.$I$127] -> 0.002515 | J131: of:=[$'Results - Detailed'.$J$127] -> 0.427185 | K131: of:=[$'Results - Detailed'.$K$127] -> 901400 | L131: of:=[$'Results - Detailed'.$L$127] -> 0.005445 | M131: of:=[$'Results - Detailed'.$M$127] -> 0.611388
B132: of:=[$'Results - Detailed'.$B$128] -> 2487400 | C132: of:=[$'Results - Detailed'.$C$128] -> 0.00189 | D132: of:=[$'Results - Detailed'.$D$128] -> 0.369586 | E132: of:=[$'Results - Detailed'.$E$128] -> 741600 | F132: of:=[$'Results - Detailed'.$F$128] -> 0.006632 | G132: of:=[$'Results - Detailed'.$G$128] -> 0.676752 | H132: of:=[$'Results - Detailed'.$H$128] -> 1880800 | I132: of:=[$'Results - Detailed'.$I$128] -> 0.002503 | J132: of:=[$'Results - Detailed'.$J$128] -> 0.427662 | K132: of:=[$'Results - Detailed'.$K$128] -> 897600 | L132: of:=[$'Results - Detailed'.$L$128] -> 0.005457 | M132: of:=[$'Results - Detailed'.$M$128] -> 0.617118
B133: of:=[$'Results - Detailed'.$B$129] -> 2497400 | C133: of:=[$'Results - Detailed'.$C$129] -> 0.001882 | D133: of:=[$'Results - Detailed'.$D$129] -> 0.371388 | E133: of:=[$'Results - Detailed'.$E$129] -> 742600 | F133: of:=[$'Results - Detailed'.$F$129] -> 0.006636 | G133: of:=[$'Results - Detailed'.$G$129] -> 0.681184 | H133: of:=[$'Results - Detailed'.$H$129] -> 1862000 | I133: of:=[$'Results - Detailed'.$I$129] -> 0.002527 | J133: of:=[$'Results - Detailed'.$J$129] -> 0.432745 | K133: of:=[$'Results - Detailed'.$K$129] -> 901000 | L133: of:=[$'Results - Detailed'.$L$129] -> 0.005443 | M133: of:=[$'Results - Detailed'.$M$129] -> 0.620355
B134: of:=[$'Results - Detailed'.$B$130] -> 2496200 | C134: of:=[$'Results - Detailed'.$C$130] -> 0.001871 | D134: of:=[$'Results - Detailed'.$D$130] -> 0.373986 | E134: of:=[$'Results - Detailed'.$E$130] -> 741000 | F134: of:=[$'Results - Detailed'.$F$130] -> 0.006634 | G134: of:=[$'Results - Detailed'.$G$130] -> 0.686767 | H134: of:=[$'Results - Detailed'.$H$130] -> 1870400 | I134: of:=[$'Results - Detailed'.$I$130] -> 0.002512 | J134: of:=[$'Results - Detailed'.$J$130] -> 0.434672 | K134: of:=[$'Results - Detailed'.$K$130] -> 896800 | L134: of:=[$'Results - Detailed'.$L$130] -> 0.005486 | M134: of:=[$'Results - Detailed'.$M$130] -> 0.626202
B135: of:=[$'Results - Detailed'.$B$131] -> 2498400 | C135: of:=[$'Results - Detailed'.$C$131] -> 0.001862 | D135: of:=[$'Results - Detailed'.$D$131] -> 0.376304 | E135: of:=[$'Results - Detailed'.$E$131] -> 739200 | F135: of:=[$'Results - Detailed'.$F$131] -> 0.006631 | G135: of:=[$'Results - Detailed'.$G$131] -> 0.692408 | H135: of:=[$'Results - Detailed'.$H$131] -> 1859600 | I135: of:=[$'Results - Detailed'.$I$131] -> 0.002532 | J135: of:=[$'Results - Detailed'.$J$131] -> 0.438826 | K135: of:=[$'Results - Detailed'.$K$131] -> 899000 | L135: of:=[$'Results - Detailed'.$L$131] -> 0.005453 | M135: of:=[$'Results - Detailed'.$M$131] -> 0.629779
B136: of:=[$'Results - Detailed'.$B$132] -> 2452000 | C136: of:=[$'Results - Detailed'.$C$132] -> 0.001918 | D136: of:=[$'Results - Detailed'.$D$132] -> 0.355492 | E136: of:=[$'Results - Detailed'.$E$132] -> 812200 | F136: of:=[$'Results - Detailed'.$F$132] -> 0.00605 | G136: of:=[$'Results - Detailed'.$G$132] -> 0.618085 | H136: of:=[$'Results - Detailed'.$H$132] -> 2086400 | I136: of:=[$'Results - Detailed'.$I$132] -> 0.002263 | J136: of:=[$'Results - Detailed'.$J$132] -> 0.379833 | K136: of:=[$'Results - Detailed'.$K$132] -> 928400 | L136: of:=[$'Results - Detailed'.$L$132] -> 0.005274 | M136: of:=[$'Results - Detailed'.$M$132] -> 0.577603
B137: of:=[$'Results - Detailed'.$B$133] -> 2458800 | C137: of:=[$'Results - Detailed'.$C$133] -> 0.001904 | D137: of:=[$'Results - Detailed'.$D$133] -> 0.357672 | E137: of:=[$'Results - Detailed'.$E$133] -> 811600 | F137: of:=[$'Results - Detailed'.$F$133] -> 0.006033 | G137: of:=[$'Results - Detailed'.$G$133] -> 0.623173 | H137: of:=[$'Results - Detailed'.$H$133] -> 2090000 | I137: of:=[$'Results - Detailed'.$I$133] -> 0.002257 | J137: of:=[$'Results - Detailed'.$J$133] -> 0.382468 | K137: of:=[$'Results - Detailed'.$K$133] -> 921400 | L137: of:=[$'Results - Detailed'.$L$133] -> 0.005338 | M137: of:=[$'Results - Detailed'.$M$133] -> 0.584378
B138: of:=[$'Results - Detailed'.$B$134] -> 2466000 | C138: of:=[$'Results - Detailed'.$C$134] -> 0.001921 | D138: of:=[$'Results - Detailed'.$D$134] -> 0.359829 | E138: of:=[$'Results - Detailed'.$E$134] -> 810200 | F138: of:=[$'Results - Detailed'.$F$134] -> 0.006065 | G138: of:=[$'Results - Detailed'.$G$134] -> 0.628554 | H138: of:=[$'Results - Detailed'.$H$134] -> 2093800 | I138: of:=[$'Results - Detailed'.$I$134] -> 0.002262 | J138: of:=[$'Results - Detailed'.$J$134] -> 0.385069 | K138: of:=[$'Results - Detailed'.$K$134] -> 926200 | L138: of:=[$'Results - Detailed'.$L$134] -> 0.005293 | M138: of:=[$'Results - Detailed'.$M$134] -> 0.587385
B139: of:=[$'Results - Detailed'.$B$135] -> 2443000 | C139: of:=[$'Results - Detailed'.$C$135] -> 0.001945 | D139: of:=[$'Results - Detailed'.$D$135] -> 0.364206 | E139: of:=[$'Results - Detailed'.$E$135] -> 812000 | F139: of:=[$'Results - Detailed'.$F$135] -> 0.006067 | G139: of:=[$'Results - Detailed'.$G$135] -> 0.63267 | H139: of:=[$'Results - Detailed'.$H$135] -> 2084600 | I139: of:=[$'Results - Detailed'.$I$135] -> 0.002241 | J139: of:=[$'Results - Detailed'.$J$135] -> 0.388811 | K139: of:=[$'Results - Detailed'.$K$135] -> 923000 | L139: of:=[$'Results - Detailed'.$L$135] -> 0.005298 | M139: of:=[$'Results - Detailed'.$M$135] -> 0.592887
B140: of:=[$'Results - Detailed'.$B$136] -> 2462800 | C140: of:=[$'Results - Detailed'.$C$136] -> 0.001932 | D140: of:=[$'Results - Detailed'.$D$136] -> 0.365393 | E140: of:=[$'Results - Detailed'.$E$136] -> 811800 | F140: of:=[$'Results - Detailed'.$F$136] -> 0.00607 | G140: of:=[$'Results - Detailed'.$G$136] -> 0.637527 | H140: of:=[$'Results - Detailed'.$H$136] -> 2098000 | I140: of:=[$'Results - Detailed'.$I$136] -> 0.002274 | J140: of:=[$'Results - Detailed'.$J$136] -> 0.390489 | K140: of:=[$'Results - Detailed'.$K$136] -> 926200 | L140: of:=[$'Results - Detailed'.$L$136] -> 0.005258 | M140: of:=[$'Results - Detailed'.$M$136] -> 0.596287
B141: of:=[$'Results - Detailed'.$B$137] -> 2478400 | C141: of:=[$'Results - Detailed'.$C$137] -> 0.001895 | D141: of:=[$'Results - Detailed'.$D$137] -> 0.366886 | E141: of:=[$'Results - Detailed'.$E$137] -> 810600 | F141: of:=[$'Results - Detailed'.$F$137] -> 0.006079 | G141: of:=[$'Results - Detailed'.$G$137] -> 0.642745 | H141: of:=[$'Results - Detailed'.$H$137] -> 2093600 | I141: of:=[$'Results - Detailed'.$I$137] -> 0.002268 | J141: of:=[$'Results - Detailed'.$J$137] -> 0.39379 | K141: of:=[$'Results - Detailed'.$K$137] -> 924800 | L141: of:=[$'Results - Detailed'.$L$137] -> 0.005307 | M141: of:=[$'Results - Detailed'.$M$137] -> 0.601168
B142: of:=[$'Results - Detailed'.$B$138] -> 2462400 | C142: of:=[$'Results - Detailed'.$C$138] -> 0.00191 | D142: of:=[$'Results - Detailed'.$D$138] -> 0.370662 | E142: of:=[$'Results - Detailed'.$E$138] -> 810600 | F142: of:=[$'Results - Detailed'.$F$138] -> 0.00606 | G142: of:=[$'Results - Detailed'.$G$138] -> 0.647442 | H142: of:=[$'Results - Detailed'.$H$138] -> 2089400 | I142: of:=[$'Results - Detailed'.$I$138] -> 0.002269 | J142: of:=[$'Results - Detailed'.$J$138] -> 0.397052 | K142: of:=[$'Results - Detailed'.$K$138] -> 929200 | L142: of:=[$'Results - Detailed'.$L$138] -> 0.005252 | M142: of:=[$'Results - Detailed'.$M$138] -> 0.604106
B143: of:=[$'Results - Detailed'.$B$139] -> 2463600 | C143: of:=[$'Results - Detailed'.$C$139] -> 0.001921 | D143: of:=[$'Results - Detailed'.$D$139] -> 0.373154 | E143: of:=[$'Results - Detailed'.$E$139] -> 825200 | F143: of:=[$'Results - Detailed'.$F$139] -> 0.005991 | G143: of:=[$'Results - Detailed'.$G$139] -> 0.646655 | H143: of:=[$'Results - Detailed'.$H$139] -> 2091000 | I143: of:=[$'Results - Detailed'.$I$139] -> 0.002264 | J143: of:=[$'Results - Detailed'.$J$139] -> 0.399742 | K143: of:=[$'Results - Detailed'.$K$139] -> 925400 | L143: of:=[$'Results - Detailed'.$L$139] -> 0.005282 | M143: of:=[$'Results - Detailed'.$M$139] -> 0.609692
B144: of:=[$'Results - Detailed'.$B$140] -> 2470400 | C144: of:=[$'Results - Detailed'.$C$140] -> 0.001913 | D144: of:=[$'Results - Detailed'.$D$140] -> 0.375198 | E144: of:=[$'Results - Detailed'.$E$140] -> 814800 | F144: of:=[$'Results - Detailed'.$F$140] -> 0.006033 | G144: of:=[$'Results - Detailed'.$G$140] -> 0.655388 | H144: of:=[$'Results - Detailed'.$H$140] -> 2093400 | I144: of:=[$'Results - Detailed'.$I$140] -> 0.002255 | J144: of:=[$'Results - Detailed'.$J$140] -> 0.402325 | K144: of:=[$'Results - Detailed'.$K$140] -> 926200 | L144: of:=[$'Results - Detailed'.$L$140] -> 0.005247 | M144: of:=[$'Results - Detailed'.$M$140] -> 0.613719
B145: of:=[$'Results - Detailed'.$B$141] -> 2468200 | C145: of:=[$'Results - Detailed'.$C$141] -> 0.001904 | D145: of:=[$'Results - Detailed'.$D$141] -> 0.377893 | E145: of:=[$'Results - Detailed'.$E$141] -> 811000 | F145: of:=[$'Results - Detailed'.$F$141] -> 0.006079 | G145: of:=[$'Results - Detailed'.$G$141] -> 0.661532 | H145: of:=[$'Results - Detailed'.$H$141] -> 2089600 | I145: of:=[$'Results - Detailed'.$I$141] -> 0.00228 | J145: of:=[$'Results - Detailed'.$J$141] -> 0.405512 | K145: of:=[$'Results - Detailed'.$K$141] -> 927000 | L145: of:=[$'Results - Detailed'.$L$141] -> 0.005271 | M145: of:=[$'Results - Detailed'.$M$141] -> 0.617735
B146: of:=[$'Results - Detailed'.$B$142] -> 2347600 | C146: of:=[$'Results - Detailed'.$C$142] -> 0.002016 | D146: of:=[$'Results - Detailed'.$D$142] -> 0.359144 | E146: of:=[$'Results - Detailed'.$E$142] -> 785400 | F146: of:=[$'Results - Detailed'.$F$142] -> 0.006257 | G146: of:=[$'Results - Detailed'.$G$142] -> 0.628379 | H146: of:=[$'Results - Detailed'.$H$142] -> 2175000 | I146: of:=[$'Results - Detailed'.$I$142] -> 0.002172 | J146: of:=[$'Results - Detailed'.$J$142] -> 0.37169 | K146: of:=[$'Results - Detailed'.$K$142] -> 947000 | L146: of:=[$'Results - Detailed'.$L$142] -> 0.005145 | M146: of:=[$'Results - Detailed'.$M$142] -> 0.571085
B147: of:=[$'Results - Detailed'.$B$143] -> 2347000 | C147: of:=[$'Results - Detailed'.$C$143] -> 0.002016 | D147: of:=[$'Results - Detailed'.$D$143] -> 0.361986 | E147: of:=[$'Results - Detailed'.$E$143] -> 781000 | F147: of:=[$'Results - Detailed'.$F$143] -> 0.006287 | G147: of:=[$'Results - Detailed'.$G$143] -> 0.635115 | H147: of:=[$'Results - Detailed'.$H$143] -> 2177200 | I147: of:=[$'Results - Detailed'.$I$143] -> 0.002153 | J147: of:=[$'Results - Detailed'.$J$143] -> 0.374389 | K147: of:=[$'Results - Detailed'.$K$143] -> 952400 | L147: of:=[$'Results - Detailed'.$L$143] -> 0.005113 | M147: of:=[$'Results - Detailed'.$M$143] -> 0.573936
B148: of:=[$'Results - Detailed'.$B$144] -> 2355000 | C148: of:=[$'Results - Detailed'.$C$144] -> 0.002004 | D148: of:=[$'Results - Detailed'.$D$144] -> 0.364133 | E148: of:=[$'Results - Detailed'.$E$144] -> 782400 | F148: of:=[$'Results - Detailed'.$F$144] -> 0.006276 | G148: of:=[$'Results - Detailed'.$G$144] -> 0.639473 | H148: of:=[$'Results - Detailed'.$H$144] -> 2171000 | I148: of:=[$'Results - Detailed'.$I$144] -> 0.002179 | J148: of:=[$'Results - Detailed'.$J$144] -> 0.377817 | K148: of:=[$'Results - Detailed'.$K$144] -> 947600 | L148: of:=[$'Results - Detailed'.$L$144] -> 0.005156 | M148: of:=[$'Results - Detailed'.$M$144] -> 0.579851
B149: of:=[$'Results - Detailed'.$B$145] -> 2355400 | C149: of:=[$'Results - Detailed'.$C$145] -> 0.001995 | D149: of:=[$'Results - Detailed'.$D$145] -> 0.366831 | E149: of:=[$'Results - Detailed'.$E$145] -> 780000 | F149: of:=[$'Results - Detailed'.$F$145] -> 0.006274 | G149: of:=[$'Results - Detailed'.$G$145] -> 0.645336 | H149: of:=[$'Results - Detailed'.$H$145] -> 2174200 | I149: of:=[$'Results - Detailed'.$I$145] -> 0.002177 | J149: of:=[$'Results - Detailed'.$J$145] -> 0.380422 | K149: of:=[$'Results - Detailed'.$K$145] -> 948800 | L149: of:=[$'Results - Detailed'.$L$145] -> 0.005169 | M149: of:=[$'Results - Detailed'.$M$145] -> 0.583927
B150: of:=[$'Results - Detailed'.$B$146] -> 2351400 | C150: of:=[$'Results - Detailed'.$C$146] -> 0.002015 | D150: of:=[$'Results - Detailed'.$D$146] -> 0.369877 | E150: of:=[$'Results - Detailed'.$E$146] -> 780400 | F150: of:=[$'Results - Detailed'.$F$146] -> 0.006287 | G150: of:=[$'Results - Detailed'.$G$146] -> 0.650024 | H150: of:=[$'Results - Detailed'.$H$146] -> 2162200 | I150: of:=[$'Results - Detailed'.$I$146] -> 0.002166 | J150: of:=[$'Results - Detailed'.$J$146] -> 0.384305 | K150: of:=[$'Results - Detailed'.$K$146] -> 947000 | L150: of:=[$'Results - Detailed'.$L$146] -> 0.005172 | M150: of:=[$'Results - Detailed'.$M$146] -> 0.588889
B151: of:=[$'Results - Detailed'.$B$147] -> 2354000 | C151: of:=[$'Results - Detailed'.$C$147] -> 0.00201 | D151: of:=[$'Results - Detailed'.$D$147] -> 0.372382 | E151: of:=[$'Results - Detailed'.$E$147] -> 783600 | F151: of:=[$'Results - Detailed'.$F$147] -> 0.006276 | G151: of:=[$'Results - Detailed'.$G$147] -> 0.653515 | H151: of:=[$'Results - Detailed'.$H$147] -> 2174200 | I151: of:=[$'Results - Detailed'.$I$147] -> 0.002161 | J151: of:=[$'Results - Detailed'.$J$147] -> 0.386052 | K151: of:=[$'Results - Detailed'.$K$147] -> 949800 | L151: of:=[$'Results - Detailed'.$L$147] -> 0.005161 | M151: of:=[$'Results - Detailed'.$M$147] -> 0.592393
B152: of:=[$'Results - Detailed'.$B$148] -> 2351800 | C152: of:=[$'Results - Detailed'.$C$148] -> 0.002007 | D152: of:=[$'Results - Detailed'.$D$148] -> 0.37524 | E152: of:=[$'Results - Detailed'.$E$148] -> 782000 | F152: of:=[$'Results - Detailed'.$F$148] -> 0.006281 | G152: of:=[$'Results - Detailed'.$G$148] -> 0.658966 | H152: of:=[$'Results - Detailed'.$H$148] -> 2180000 | I152: of:=[$'Results - Detailed'.$I$148] -> 0.00216 | J152: of:=[$'Results - Detailed'.$J$148] -> 0.388328 | K152: of:=[$'Results - Detailed'.$K$148] -> 951000 | L152: of:=[$'Results - Detailed'.$L$148] -> 0.005148 | M152: of:=[$'Results - Detailed'.$M$148] -> 0.596351
B153: of:=[$'Results - Detailed'.$B$149] -> 2348800 | C153: of:=[$'Results - Detailed'.$C$149] -> 0.002026 | D153: of:=[$'Results - Detailed'.$D$149] -> 0.378167 | E153: of:=[$'Results - Detailed'.$E$149] -> 782200 | F153: of:=[$'Results - Detailed'.$F$149] -> 0.00629 | G153: of:=[$'Results - Detailed'.$G$149] -> 0.663638 | H153: of:=[$'Results - Detailed'.$H$149] -> 2181000 | I153: of:=[$'Results - Detailed'.$I$149] -> 0.002159 | J153: of:=[$'Results - Detailed'.$J$149] -> 0.39101 | K153: of:=[$'Results - Detailed'.$K$149] -> 952400 | L153: of:=[$'Results - Detailed'.$L$149] -> 0.005128 | M153: of:=[$'Results - Detailed'.$M$149] -> 0.6002
B154: of:=[$'Results - Detailed'.$B$150] -> 2343200 | C154: of:=[$'Results - Detailed'.$C$150] -> 0.002003 | D154: of:=[$'Results - Detailed'.$D$150] -> 0.381255 | E154: of:=[$'Results - Detailed'.$E$150] -> 783800 | F154: of:=[$'Results - Detailed'.$F$150] -> 0.006277 | G154: of:=[$'Results - Detailed'.$G$150] -> 0.667678 | H154: of:=[$'Results - Detailed'.$H$150] -> 2164800 | I154: of:=[$'Results - Detailed'.$I$150] -> 0.002173 | J154: of:=[$'Results - Detailed'.$J$150] -> 0.395228 | K154: of:=[$'Results - Detailed'.$K$150] -> 951800 | L154: of:=[$'Results - Detailed'.$L$150] -> 0.005144 | M154: of:=[$'Results - Detailed'.$M$150] -> 0.604658
B155: of:=[$'Results - Detailed'.$B$151] -> 2352200 | C155: of:=[$'Results - Detailed'.$C$151] -> 0.002021 | D155: of:=[$'Results - Detailed'.$D$151] -> 0.383171 | E155: of:=[$'Results - Detailed'.$E$151] -> 781400 | F155: of:=[$'Results - Detailed'.$F$151] -> 0.006299 | G155: of:=[$'Results - Detailed'.$G$151] -> 0.673396 | H155: of:=[$'Results - Detailed'.$H$151] -> 2165800 | I155: of:=[$'Results - Detailed'.$I$151] -> 0.002171 | J155: of:=[$'Results - Detailed'.$J$151] -> 0.397875 | K155: of:=[$'Results - Detailed'.$K$151] -> 951000 | L155: of:=[$'Results - Detailed'.$L$151] -> 0.005129 | M155: of:=[$'Results - Detailed'.$M$151] -> 0.609137
A156: 5 | B156: of:=AVERAGE([.B126:.B155]) -> 2437266.66666667 | C156: of:=AVERAGE([.C126:.C155]) -> 0.00193176666666667 | D156: of:=AVERAGE([.D126:.D155]) -> 0.3675754 | E156: of:=AVERAGE([.E126:.E155]) -> 778580 | F156: of:=AVERAGE([.F126:.F155]) -> 0.00632246666666667 | G156: of:=AVERAGE([.G126:.G155]) -> 0.653544866666667 | H156: of:=AVERAGE([.H126:.H155]) -> 2043880 | I156: of:=AVERAGE([.I126:.I155]) -> 0.0023166 | J156: of:=AVERAGE([.J126:.J155]) -> 0.4006147 | K156: of:=AVERAGE([.K126:.K155]) -> 924660 | L156: of:=AVERAGE([.L126:.L155]) -> 0.005294 | M156: of:=AVERAGE([.M126:.M155]) -> 0.599539166666667
A157: 6 / Results - Detailed | B157: of:=[$'Results - Detailed'.$B$152] -> 2487000 | C157: of:=[$'Results - Detailed'.$C$152] -> 0.0023 | D157: of:=[$'Results - Detailed'.$D$152] -> 0.38085 | E157: of:=[$'Results - Detailed'.$E$152] -> 801400 | F157: of:=[$'Results - Detailed'.$F$152] -> 0.007362 | G157: of:=[$'Results - Detailed'.$G$152] -> 0.681202 | H157: of:=[$'Results - Detailed'.$H$152] -> 2010200 | I157: of:=[$'Results - Detailed'.$I$152] -> 0.002834 | J157: of:=[$'Results - Detailed'.$J$152] -> 0.426678 | K157: of:=[$'Results - Detailed'.$K$152] -> 863600 | L157: of:=[$'Results - Detailed'.$L$152] -> 0.006839 | M157: of:=[$'Results - Detailed'.$M$152] -> 0.662039
B158: of:=[$'Results - Detailed'.$B$153] -> 2490400 | C158: of:=[$'Results - Detailed'.$C$153] -> 0.002314 | D158: of:=[$'Results - Detailed'.$D$153] -> 0.38364 | E158: of:=[$'Results - Detailed'.$E$153] -> 800800 | F158: of:=[$'Results - Detailed'.$F$153] -> 0.007363 | G158: of:=[$'Results - Detailed'.$G$153] -> 0.686838 | H158: of:=[$'Results - Detailed'.$H$153] -> 2018000 | I158: of:=[$'Results - Detailed'.$I$153] -> 0.002853 | J158: of:=[$'Results - Detailed'.$J$153] -> 0.42919 | K158: of:=[$'Results - Detailed'.$K$153] -> 866400 | L158: of:=[$'Results - Detailed'.$L$153] -> 0.006801 | M158: of:=[$'Results - Detailed'.$M$153] -> 0.666093
B159: of:=[$'Results - Detailed'.$B$154] -> 2477800 | C159: of:=[$'Results - Detailed'.$C$154] -> 0.00231 | D159: of:=[$'Results - Detailed'.$D$154] -> 0.387606 | E159: of:=[$'Results - Detailed'.$E$154] -> 808600 | F159: of:=[$'Results - Detailed'.$F$154] -> 0.007297 | G159: of:=[$'Results - Detailed'.$G$154] -> 0.688834 | H159: of:=[$'Results - Detailed'.$H$154] -> 2021800 | I159: of:=[$'Results - Detailed'.$I$154] -> 0.002834 | J159: of:=[$'Results - Detailed'.$J$154] -> 0.432079 | K159: of:=[$'Results - Detailed'.$K$154] -> 864600 | L159: of:=[$'Results - Detailed'.$L$154] -> 0.006822 | M159: of:=[$'Results - Detailed'.$M$154] -> 0.671881
B160: of:=[$'Results - Detailed'.$B$155] -> 2482200 | C160: of:=[$'Results - Detailed'.$C$155] -> 0.002313 | D160: of:=[$'Results - Detailed'.$D$155] -> 0.390238 | E160: of:=[$'Results - Detailed'.$E$155] -> 803600 | F160: of:=[$'Results - Detailed'.$F$155] -> 0.007344 | G160: of:=[$'Results - Detailed'.$G$155] -> 0.696268 | H160: of:=[$'Results - Detailed'.$H$155] -> 2005400 | I160: of:=[$'Results - Detailed'.$I$155] -> 0.002871 | J160: of:=[$'Results - Detailed'.$J$155] -> 0.437138 | K160: of:=[$'Results - Detailed'.$K$155] -> 868200 | L160: of:=[$'Results - Detailed'.$L$155] -> 0.006796 | M160: of:=[$'Results - Detailed'.$M$155] -> 0.675536
B161: of:=[$'Results - Detailed'.$B$156] -> 2484600 | C161: of:=[$'Results - Detailed'.$C$156] -> 0.002295 | D161: of:=[$'Results - Detailed'.$D$156] -> 0.39298 | E161: of:=[$'Results - Detailed'.$E$156] -> 796600 | F161: of:=[$'Results - Detailed'.$F$156] -> 0.007424 | G161: of:=[$'Results - Detailed'.$G$156] -> 0.704608 | H161: of:=[$'Results - Detailed'.$H$156] -> 2015800 | I161: of:=[$'Results - Detailed'.$I$156] -> 0.002843 | J161: of:=[$'Results - Detailed'.$J$156] -> 0.439257 | K161: of:=[$'Results - Detailed'.$K$156] -> 864400 | L161: of:=[$'Results - Detailed'.$L$156] -> 0.006819 | M161: of:=[$'Results - Detailed'.$M$156] -> 0.682036
B162: of:=[$'Results - Detailed'.$B$157] -> 2474800 | C162: of:=[$'Results - Detailed'.$C$157] -> 0.002319 | D162: of:=[$'Results - Detailed'.$D$157] -> 0.396703 | E162: of:=[$'Results - Detailed'.$E$157] -> 797200 | F162: of:=[$'Results - Detailed'.$F$157] -> 0.007383 | G162: of:=[$'Results - Detailed'.$G$157] -> 0.709565 | H162: of:=[$'Results - Detailed'.$H$157] -> 2022200 | I162: of:=[$'Results - Detailed'.$I$157] -> 0.00284 | J162: of:=[$'Results - Detailed'.$J$157] -> 0.441788 | K162: of:=[$'Results - Detailed'.$K$157] -> 869000 | L162: of:=[$'Results - Detailed'.$L$157] -> 0.006799 | M162: of:=[$'Results - Detailed'.$M$157] -> 0.685208
B163: of:=[$'Results - Detailed'.$B$158] -> 2477800 | C163: of:=[$'Results - Detailed'.$C$158] -> 0.002321 | D163: of:=[$'Results - Detailed'.$D$158] -> 0.399378 | E163: of:=[$'Results - Detailed'.$E$158] -> 803600 | F163: of:=[$'Results - Detailed'.$F$158] -> 0.007374 | G163: of:=[$'Results - Detailed'.$G$158] -> 0.711932 | H163: of:=[$'Results - Detailed'.$H$158] -> 2010200 | I163: of:=[$'Results - Detailed'.$I$158] -> 0.002861 | J163: of:=[$'Results - Detailed'.$J$158] -> 0.446321 | K163: of:=[$'Results - Detailed'.$K$158] -> 866400 | L163: of:=[$'Results - Detailed'.$L$158] -> 0.006777 | M163: of:=[$'Results - Detailed'.$M$158] -> 0.691156
B164: of:=[$'Results - Detailed'.$B$159] -> 2475200 | C164: of:=[$'Results - Detailed'.$C$159] -> 0.002313 | D164: of:=[$'Results - Detailed'.$D$159] -> 0.402472 | E164: of:=[$'Results - Detailed'.$E$159] -> 805200 | F164: of:=[$'Results - Detailed'.$F$159] -> 0.007327 | G164: of:=[$'Results - Detailed'.$G$159] -> 0.716375 | H164: of:=[$'Results - Detailed'.$H$159] -> 2010600 | I164: of:=[$'Results - Detailed'.$I$159] -> 0.002859 | J164: of:=[$'Results - Detailed'.$J$159] -> 0.449469 | K164: of:=[$'Results - Detailed'.$K$159] -> 868200 | L164: of:=[$'Results - Detailed'.$L$159] -> 0.006775 | M164: of:=[$'Results - Detailed'.$M$159] -> 0.695328
B165: of:=[$'Results - Detailed'.$B$160] -> 2469200 | C165: of:=[$'Results - Detailed'.$C$160] -> 0.00232 | D165: of:=[$'Results - Detailed'.$D$160] -> 0.405829 | E165: of:=[$'Results - Detailed'.$E$160] -> 803000 | F165: of:=[$'Results - Detailed'.$F$160] -> 0.00737 | G165: of:=[$'Results - Detailed'.$G$160] -> 0.722474 | H165: of:=[$'Results - Detailed'.$H$160] -> 2014800 | I165: of:=[$'Results - Detailed'.$I$160] -> 0.002854 | J165: of:=[$'Results - Detailed'.$J$160] -> 0.452167 | K165: of:=[$'Results - Detailed'.$K$160] -> 864800 | L165: of:=[$'Results - Detailed'.$L$160] -> 0.006829 | M165: of:=[$'Results - Detailed'.$M$160] -> 0.701577
B166: of:=[$'Results - Detailed'.$B$161] -> 2482400 | C166: of:=[$'Results - Detailed'.$C$161] -> 0.002307 | D166: of:=[$'Results - Detailed'.$D$161] -> 0.407589 | E166: of:=[$'Results - Detailed'.$E$161] -> 802200 | F166: of:=[$'Results - Detailed'.$F$161] -> 0.007357 | G166: of:=[$'Results - Detailed'.$G$161] -> 0.727905 | H166: of:=[$'Results - Detailed'.$H$161] -> 2016400 | I166: of:=[$'Results - Detailed'.$I$161] -> 0.00285 | J166: of:=[$'Results - Detailed'.$J$161] -> 0.455129 | K166: of:=[$'Results - Detailed'.$K$161] -> 870000 | L166: of:=[$'Results - Detailed'.$L$161] -> 0.006784 | M166: of:=[$'Results - Detailed'.$M$161] -> 0.70431
B167: of:=[$'Results - Detailed'.$B$162] -> 2388600 | C167: of:=[$'Results - Detailed'.$C$162] -> 0.002388 | D167: of:=[$'Results - Detailed'.$D$162] -> 0.412458 | E167: of:=[$'Results - Detailed'.$E$162] -> 774600 | F167: of:=[$'Results - Detailed'.$F$162] -> 0.007622 | G167: of:=[$'Results - Detailed'.$G$162] -> 0.694147 | H167: of:=[$'Results - Detailed'.$H$162] -> 2053000 | I167: of:=[$'Results - Detailed'.$I$162] -> 0.002812 | J167: of:=[$'Results - Detailed'.$J$162] -> 0.424114 | K167: of:=[$'Results - Detailed'.$K$162] -> 907200 | L167: of:=[$'Results - Detailed'.$L$162] -> 0.006479 | M167: of:=[$'Results - Detailed'.$M$162] -> 0.641882
B168: of:=[$'Results - Detailed'.$B$163] -> 2380600 | C168: of:=[$'Results - Detailed'.$C$163] -> 0.002412 | D168: of:=[$'Results - Detailed'.$D$163] -> 0.416059 | E168: of:=[$'Results - Detailed'.$E$163] -> 772000 | F168: of:=[$'Results - Detailed'.$F$163] -> 0.007637 | G168: of:=[$'Results - Detailed'.$G$163] -> 0.700785 | H168: of:=[$'Results - Detailed'.$H$163] -> 2051200 | I168: of:=[$'Results - Detailed'.$I$163] -> 0.002821 | J168: of:=[$'Results - Detailed'.$J$163] -> 0.427611 | K168: of:=[$'Results - Detailed'.$K$163] -> 902800 | L168: of:=[$'Results - Detailed'.$L$163] -> 0.006535 | M168: of:=[$'Results - Detailed'.$M$163] -> 0.648502
B169: of:=[$'Results - Detailed'.$B$164] -> 2383400 | C169: of:=[$'Results - Detailed'.$C$164] -> 0.002403 | D169: of:=[$'Results - Detailed'.$D$164] -> 0.418695 | E169: of:=[$'Results - Detailed'.$E$164] -> 774400 | F169: of:=[$'Results - Detailed'.$F$164] -> 0.007624 | G169: of:=[$'Results - Detailed'.$G$164] -> 0.705125 | H169: of:=[$'Results - Detailed'.$H$164] -> 2045600 | I169: of:=[$'Results - Detailed'.$I$164] -> 0.002819 | J169: of:=[$'Results - Detailed'.$J$164] -> 0.431474 | K169: of:=[$'Results - Detailed'.$K$164] -> 906800 | L169: of:=[$'Results - Detailed'.$L$164] -> 0.00652 | M169: of:=[$'Results - Detailed'.$M$164] -> 0.652089
B170: of:=[$'Results - Detailed'.$B$165] -> 2379000 | C170: of:=[$'Results - Detailed'.$C$165] -> 0.002426 | D170: of:=[$'Results - Detailed'.$D$165] -> 0.421966 | E170: of:=[$'Results - Detailed'.$E$165] -> 773200 | F170: of:=[$'Results - Detailed'.$F$165] -> 0.007625 | G170: of:=[$'Results - Detailed'.$G$165] -> 0.711055 | H170: of:=[$'Results - Detailed'.$H$165] -> 2059400 | I170: of:=[$'Results - Detailed'.$I$165] -> 0.00281 | J170: of:=[$'Results - Detailed'.$J$165] -> 0.433281 | K170: of:=[$'Results - Detailed'.$K$165] -> 903000 | L170: of:=[$'Results - Detailed'.$L$165] -> 0.006543 | M170: of:=[$'Results - Detailed'.$M$165] -> 0.658447
B171: of:=[$'Results - Detailed'.$B$166] -> 2387200 | C171: of:=[$'Results - Detailed'.$C$166] -> 0.002411 | D171: of:=[$'Results - Detailed'.$D$166] -> 0.424093 | E171: of:=[$'Results - Detailed'.$E$166] -> 771000 | F171: of:=[$'Results - Detailed'.$F$166] -> 0.007652 | G171: of:=[$'Results - Detailed'.$G$166] -> 0.717422 | H171: of:=[$'Results - Detailed'.$H$166] -> 2049400 | I171: of:=[$'Results - Detailed'.$I$166] -> 0.002798 | J171: of:=[$'Results - Detailed'.$J$166] -> 0.437546 | K171: of:=[$'Results - Detailed'.$K$166] -> 904000 | L171: of:=[$'Results - Detailed'.$L$166] -> 0.006504 | M171: of:=[$'Results - Detailed'.$M$166] -> 0.663006
B172: of:=[$'Results - Detailed'.$B$167] -> 2379200 | C172: of:=[$'Results - Detailed'.$C$167] -> 0.002412 | D172: of:=[$'Results - Detailed'.$D$167] -> 0.427635 | E172: of:=[$'Results - Detailed'.$E$167] -> 769800 | F172: of:=[$'Results - Detailed'.$F$167] -> 0.007683 | G172: of:=[$'Results - Detailed'.$G$167] -> 0.723311 | H172: of:=[$'Results - Detailed'.$H$167] -> 2042800 | I172: of:=[$'Results - Detailed'.$I$167] -> 0.002817 | J172: of:=[$'Results - Detailed'.$J$167] -> 0.441454 | K172: of:=[$'Results - Detailed'.$K$167] -> 900800 | L172: of:=[$'Results - Detailed'.$L$167] -> 0.006528 | M172: of:=[$'Results - Detailed'.$M$167] -> 0.669079
B173: of:=[$'Results - Detailed'.$B$168] -> 2387200 | C173: of:=[$'Results - Detailed'.$C$168] -> 0.002381 | D173: of:=[$'Results - Detailed'.$D$168] -> 0.429697 | E173: of:=[$'Results - Detailed'.$E$168] -> 774200 | F173: of:=[$'Results - Detailed'.$F$168] -> 0.007649 | G173: of:=[$'Results - Detailed'.$G$168] -> 0.726536 | H173: of:=[$'Results - Detailed'.$H$168] -> 2055400 | I173: of:=[$'Results - Detailed'.$I$168] -> 0.002796 | J173: of:=[$'Results - Detailed'.$J$168] -> 0.443263 | K173: of:=[$'Results - Detailed'.$K$168] -> 902000 | L173: of:=[$'Results - Detailed'.$L$168] -> 0.006523 | M173: of:=[$'Results - Detailed'.$M$168] -> 0.673494
B174: of:=[$'Results - Detailed'.$B$169] -> 2379000 | C174: of:=[$'Results - Detailed'.$C$169] -> 0.002405 | D174: of:=[$'Results - Detailed'.$D$169] -> 0.433222 | E174: of:=[$'Results - Detailed'.$E$169] -> 776400 | F174: of:=[$'Results - Detailed'.$F$169] -> 0.007586 | G174: of:=[$'Results - Detailed'.$G$169] -> 0.730716 | H174: of:=[$'Results - Detailed'.$H$169] -> 2055000 | I174: of:=[$'Results - Detailed'.$I$169] -> 0.002802 | J174: of:=[$'Results - Detailed'.$J$169] -> 0.446456 | K174: of:=[$'Results - Detailed'.$K$169] -> 905800 | L174: of:=[$'Results - Detailed'.$L$169] -> 0.00652 | M174: of:=[$'Results - Detailed'.$M$169] -> 0.676913
B175: of:=[$'Results - Detailed'.$B$170] -> 2385400 | C175: of:=[$'Results - Detailed'.$C$170] -> 0.00241 | D175: of:=[$'Results - Detailed'.$D$170] -> 0.435417 | E175: of:=[$'Results - Detailed'.$E$170] -> 775200 | F175: of:=[$'Results - Detailed'.$F$170] -> 0.007647 | G175: of:=[$'Results - Detailed'.$G$170] -> 0.736491 | H175: of:=[$'Results - Detailed'.$H$170] -> 2052200 | I175: of:=[$'Results - Detailed'.$I$170] -> 0.002824 | J175: of:=[$'Results - Detailed'.$J$170] -> 0.44991 | K175: of:=[$'Results - Detailed'.$K$170] -> 906000 | L175: of:=[$'Results - Detailed'.$L$170] -> 0.006503 | M175: of:=[$'Results - Detailed'.$M$170] -> 0.681626
B176: of:=[$'Results - Detailed'.$B$171] -> 2389000 | C176: of:=[$'Results - Detailed'.$C$171] -> 0.002402 | D176: of:=[$'Results - Detailed'.$D$171] -> 0.437841 | E176: of:=[$'Results - Detailed'.$E$171] -> 771800 | F176: of:=[$'Results - Detailed'.$F$171] -> 0.007657 | G176: of:=[$'Results - Detailed'.$G$171] -> 0.74328 | H176: of:=[$'Results - Detailed'.$H$171] -> 2051000 | I176: of:=[$'Results - Detailed'.$I$171] -> 0.002818 | J176: of:=[$'Results - Detailed'.$J$171] -> 0.453161 | K176: of:=[$'Results - Detailed'.$K$171] -> 903400 | L176: of:=[$'Results - Detailed'.$L$171] -> 0.006555 | M176: of:=[$'Results - Detailed'.$M$171] -> 0.68739
B177: of:=[$'Results - Detailed'.$B$172] -> 2337400 | C177: of:=[$'Results - Detailed'.$C$172] -> 0.002464 | D177: of:=[$'Results - Detailed'.$D$172] -> 0.393942 | E177: of:=[$'Results - Detailed'.$E$172] -> 790800 | F177: of:=[$'Results - Detailed'.$F$172] -> 0.007446 | G177: of:=[$'Results - Detailed'.$G$172] -> 0.687398 | H177: of:=[$'Results - Detailed'.$H$172] -> 1852600 | I177: of:=[$'Results - Detailed'.$I$172] -> 0.003108 | J177: of:=[$'Results - Detailed'.$J$172] -> 0.455054 | K177: of:=[$'Results - Detailed'.$K$172] -> 919000 | L177: of:=[$'Results - Detailed'.$L$172] -> 0.006448 | M177: of:=[$'Results - Detailed'.$M$172] -> 0.640756
B178: of:=[$'Results - Detailed'.$B$173] -> 2359000 | C178: of:=[$'Results - Detailed'.$C$173] -> 0.002427 | D178: of:=[$'Results - Detailed'.$D$173] -> 0.395217 | E178: of:=[$'Results - Detailed'.$E$173] -> 790800 | F178: of:=[$'Results - Detailed'.$F$173] -> 0.007476 | G178: of:=[$'Results - Detailed'.$G$173] -> 0.692815 | H178: of:=[$'Results - Detailed'.$H$173] -> 1852000 | I178: of:=[$'Results - Detailed'.$I$173] -> 0.003109 | J178: of:=[$'Results - Detailed'.$J$173] -> 0.458531 | K178: of:=[$'Results - Detailed'.$K$173] -> 915400 | L178: of:=[$'Results - Detailed'.$L$173] -> 0.006412 | M178: of:=[$'Results - Detailed'.$M$173] -> 0.64699
B179: of:=[$'Results - Detailed'.$B$174] -> 2333800 | C179: of:=[$'Results - Detailed'.$C$174] -> 0.002451 | D179: of:=[$'Results - Detailed'.$D$174] -> 0.400418 | E179: of:=[$'Results - Detailed'.$E$174] -> 788600 | F179: of:=[$'Results - Detailed'.$F$174] -> 0.007512 | G179: of:=[$'Results - Detailed'.$G$174] -> 0.699173 | H179: of:=[$'Results - Detailed'.$H$174] -> 1847200 | I179: of:=[$'Results - Detailed'.$I$174] -> 0.003128 | J179: of:=[$'Results - Detailed'.$J$174] -> 0.46252 | K179: of:=[$'Results - Detailed'.$K$174] -> 915800 | L179: of:=[$'Results - Detailed'.$L$174] -> 0.006412 | M179: of:=[$'Results - Detailed'.$M$174] -> 0.651786
B180: of:=[$'Results - Detailed'.$B$175] -> 2355600 | C180: of:=[$'Results - Detailed'.$C$175] -> 0.002424 | D180: of:=[$'Results - Detailed'.$D$175] -> 0.40159 | E180: of:=[$'Results - Detailed'.$E$175] -> 792400 | F180: of:=[$'Results - Detailed'.$F$175] -> 0.007494 | G180: of:=[$'Results - Detailed'.$G$175] -> 0.702846 | H180: of:=[$'Results - Detailed'.$H$175] -> 1842800 | I180: of:=[$'Results - Detailed'.$I$175] -> 0.003133 | J180: of:=[$'Results - Detailed'.$J$175] -> 0.466443 | K180: of:=[$'Results - Detailed'.$K$175] -> 917200 | L180: of:=[$'Results - Detailed'.$L$175] -> 0.006413 | M180: of:=[$'Results - Detailed'.$M$175] -> 0.656193
B181: of:=[$'Results - Detailed'.$B$176] -> 2333600 | C181: of:=[$'Results - Detailed'.$C$176] -> 0.002468 | D181: of:=[$'Results - Detailed'.$D$176] -> 0.406526 | E181: of:=[$'Results - Detailed'.$E$176] -> 759000 | F181: of:=[$'Results - Detailed'.$F$176] -> 0.00781 | G181: of:=[$'Results - Detailed'.$G$176] -> 0.72356 | H181: of:=[$'Results - Detailed'.$H$176] -> 1851600 | I181: of:=[$'Results - Detailed'.$I$176] -> 0.003124 | J181: of:=[$'Results - Detailed'.$J$176] -> 0.468678 | K181: of:=[$'Results - Detailed'.$K$176] -> 916400 | L181: of:=[$'Results - Detailed'.$L$176] -> 0.00643 | M181: of:=[$'Results - Detailed'.$M$176] -> 0.661358
B182: of:=[$'Results - Detailed'.$B$177] -> 2347600 | C182: of:=[$'Results - Detailed'.$C$177] -> 0.002442 | D182: of:=[$'Results - Detailed'.$D$177] -> 0.408314 | E182: of:=[$'Results - Detailed'.$E$177] -> 758600 | F182: of:=[$'Results - Detailed'.$F$177] -> 0.007772 | G182: of:=[$'Results - Detailed'.$G$177] -> 0.7291 | H182: of:=[$'Results - Detailed'.$H$177] -> 1847600 | I182: of:=[$'Results - Detailed'.$I$177] -> 0.003126 | J182: of:=[$'Results - Detailed'.$J$177] -> 0.472504 | K182: of:=[$'Results - Detailed'.$K$177] -> 915200 | L182: of:=[$'Results - Detailed'.$L$177] -> 0.006429 | M182: of:=[$'Results - Detailed'.$M$177] -> 0.666631
B183: of:=[$'Results - Detailed'.$B$178] -> 2332000 | C183: of:=[$'Results - Detailed'.$C$178] -> 0.002459 | D183: of:=[$'Results - Detailed'.$D$178] -> 0.412667 | E183: of:=[$'Results - Detailed'.$E$178] -> 757200 | F183: of:=[$'Results - Detailed'.$F$178] -> 0.007824 | G183: of:=[$'Results - Detailed'.$G$178] -> 0.735114 | H183: of:=[$'Results - Detailed'.$H$178] -> 1848800 | I183: of:=[$'Results - Detailed'.$I$178] -> 0.003117 | J183: of:=[$'Results - Detailed'.$J$178] -> 0.475639 | K183: of:=[$'Results - Detailed'.$K$178] -> 916800 | L183: of:=[$'Results - Detailed'.$L$178] -> 0.006414 | M183: of:=[$'Results - Detailed'.$M$178] -> 0.670847
B184: of:=[$'Results - Detailed'.$B$179] -> 2348000 | C184: of:=[$'Results - Detailed'.$C$179] -> 0.002439 | D184: of:=[$'Results - Detailed'.$D$179] -> 0.414213 | E184: of:=[$'Results - Detailed'.$E$179] -> 756000 | F184: of:=[$'Results - Detailed'.$F$179] -> 0.007817 | G184: of:=[$'Results - Detailed'.$G$179] -> 0.740992 | H184: of:=[$'Results - Detailed'.$H$179] -> 1848400 | I184: of:=[$'Results - Detailed'.$I$179] -> 0.003136 | J184: of:=[$'Results - Detailed'.$J$179] -> 0.478975 | K184: of:=[$'Results - Detailed'.$K$179] -> 915600 | L184: of:=[$'Results - Detailed'.$L$179] -> 0.006459 | M184: of:=[$'Results - Detailed'.$M$179] -> 0.67608
B185: of:=[$'Results - Detailed'.$B$180] -> 2335000 | C185: of:=[$'Results - Detailed'.$C$180] -> 0.002461 | D185: of:=[$'Results - Detailed'.$D$180] -> 0.418316 | E185: of:=[$'Results - Detailed'.$E$180] -> 753400 | F185: of:=[$'Results - Detailed'.$F$180] -> 0.007863 | G185: of:=[$'Results - Detailed'.$G$180] -> 0.747547 | H185: of:=[$'Results - Detailed'.$H$180] -> 1856800 | I185: of:=[$'Results - Detailed'.$I$180] -> 0.003113 | J185: of:=[$'Results - Detailed'.$J$180] -> 0.481449 | K185: of:=[$'Results - Detailed'.$K$180] -> 915800 | L185: of:=[$'Results - Detailed'.$L$180] -> 0.006414 | M185: of:=[$'Results - Detailed'.$M$180] -> 0.680734
B186: of:=[$'Results - Detailed'.$B$181] -> 2353000 | C186: of:=[$'Results - Detailed'.$C$181] -> 0.002433 | D186: of:=[$'Results - Detailed'.$D$181] -> 0.419623 | E186: of:=[$'Results - Detailed'.$E$181] -> 758200 | F186: of:=[$'Results - Detailed'.$F$181] -> 0.007813 | G186: of:=[$'Results - Detailed'.$G$181] -> 0.750401 | H186: of:=[$'Results - Detailed'.$H$181] -> 1849200 | I186: of:=[$'Results - Detailed'.$I$181] -> 0.003128 | J186: of:=[$'Results - Detailed'.$J$181] -> 0.485668 | K186: of:=[$'Results - Detailed'.$K$181] -> 913800 | L186: of:=[$'Results - Detailed'.$L$181] -> 0.006422 | M186: of:=[$'Results - Detailed'.$M$181] -> 0.686174
A187: 6 | B187: of:=AVERAGE([.B157:.B186]) -> 2402500 | C187: of:=AVERAGE([.C157:.C186]) -> 0.00238766666666667 | D187: of:=AVERAGE([.D157:.D186]) -> 0.409173133333333 | E187: of:=AVERAGE([.E157:.E186]) -> 781993.333333333 | F187: of:=AVERAGE([.F157:.F186]) -> 0.00756033333333333 | G187: of:=AVERAGE([.G157:.G186]) -> 0.714793833333333 | H187: of:=AVERAGE([.H157:.H186]) -> 1971913.33333333 | I187: of:=AVERAGE([.I157:.I186]) -> 0.00292793333333333 | J187: of:=AVERAGE([.J157:.J186]) -> 0.450098233333333 | K187: of:=AVERAGE([.K157:.K186]) -> 895613.333333333 | L187: of:=AVERAGE([.L157:.L186]) -> 0.00658346666666667 | M187: of:=AVERAGE([.M157:.M186]) -> 0.670838033333333
A188: 8 / Results - Detailed | B188: of:=[$'Results - Detailed'.$B$182] -> 2414600 | C188: of:=[$'Results - Detailed'.$C$182] -> 0.0032 | D188: of:=[$'Results - Detailed'.$D$182] -> 0.464683 | E188: of:=[$'Results - Detailed'.$E$182] -> 763200 | F188: of:=[$'Results - Detailed'.$F$182] -> 0.010356 | G188: of:=[$'Results - Detailed'.$G$182] -> 0.809203 | H188: of:=[$'Results - Detailed'.$H$182] -> 1945000 | I188: of:=[$'Results - Detailed'.$I$182] -> 0.004003 | J188: of:=[$'Results - Detailed'.$J$182] -> 0.531543 | K188: of:=[$'Results - Detailed'.$K$182] -> 883800 | L188: of:=[$'Results - Detailed'.$L$182] -> 0.008952 | M188: of:=[$'Results - Detailed'.$M$182] -> 0.750318
B189: of:=[$'Results - Detailed'.$B$183] -> 2414000 | C189: of:=[$'Results - Detailed'.$C$183] -> 0.003191 | D189: of:=[$'Results - Detailed'.$D$183] -> 0.468162 | E189: of:=[$'Results - Detailed'.$E$183] -> 768000 | F189: of:=[$'Results - Detailed'.$F$183] -> 0.010315 | G189: of:=[$'Results - Detailed'.$G$183] -> 0.813039 | H189: of:=[$'Results - Detailed'.$H$183] -> 1928200 | I189: of:=[$'Results - Detailed'.$I$183] -> 0.00403 | J189: of:=[$'Results - Detailed'.$J$183] -> 0.537615 | K189: of:=[$'Results - Detailed'.$K$183] -> 886200 | L189: of:=[$'Results - Detailed'.$L$183] -> 0.008912 | M189: of:=[$'Results - Detailed'.$M$183] -> 0.755225
B190: of:=[$'Results - Detailed'.$B$184] -> 2413000 | C190: of:=[$'Results - Detailed'.$C$184] -> 0.003206 | D190: of:=[$'Results - Detailed'.$D$184] -> 0.471669 | E190: of:=[$'Results - Detailed'.$E$184] -> 763600 | F190: of:=[$'Results - Detailed'.$F$184] -> 0.010354 | G190: of:=[$'Results - Detailed'.$G$184] -> 0.821702 | H190: of:=[$'Results - Detailed'.$H$184] -> 1935600 | I190: of:=[$'Results - Detailed'.$I$184] -> 0.004014 | J190: of:=[$'Results - Detailed'.$J$184] -> 0.540314 | K190: of:=[$'Results - Detailed'.$K$184] -> 879600 | L190: of:=[$'Results - Detailed'.$L$184] -> 0.008993 | M190: of:=[$'Results - Detailed'.$M$184] -> 0.763961
B191: of:=[$'Results - Detailed'.$B$185] -> 2420400 | C191: of:=[$'Results - Detailed'.$C$185] -> 0.003177 | D191: of:=[$'Results - Detailed'.$D$185] -> 0.474309 | E191: of:=[$'Results - Detailed'.$E$185] -> 767800 | F191: of:=[$'Results - Detailed'.$F$185] -> 0.010323 | G191: of:=[$'Results - Detailed'.$G$185] -> 0.825726 | H191: of:=[$'Results - Detailed'.$H$185] -> 1942200 | I191: of:=[$'Results - Detailed'.$I$185] -> 0.003993 | J191: of:=[$'Results - Detailed'.$J$185] -> 0.543084 | K191: of:=[$'Results - Detailed'.$K$185] -> 884800 | L191: of:=[$'Results - Detailed'.$L$185] -> 0.008938 | M191: of:=[$'Results - Detailed'.$M$185] -> 0.767558
B192: of:=[$'Results - Detailed'.$B$186] -> 2422800 | C192: of:=[$'Results - Detailed'.$C$186] -> 0.003181 | D192: of:=[$'Results - Detailed'.$D$186] -> 0.47743 | E192: of:=[$'Results - Detailed'.$E$186] -> 764800 | F192: of:=[$'Results - Detailed'.$F$186] -> 0.010335 | G192: of:=[$'Results - Detailed'.$G$186] -> 0.833566 | H192: of:=[$'Results - Detailed'.$H$186] -> 1930600 | I192: of:=[$'Results - Detailed'.$I$186] -> 0.004005 | J192: of:=[$'Results - Detailed'.$J$186] -> 0.548377 | K192: of:=[$'Results - Detailed'.$K$186] -> 885000 | L192: of:=[$'Results - Detailed'.$L$186] -> 0.008949 | M192: of:=[$'Results - Detailed'.$M$186] -> 0.773279
B193: of:=[$'Results - Detailed'.$B$187] -> 2406800 | C193: of:=[$'Results - Detailed'.$C$187] -> 0.003219 | D193: of:=[$'Results - Detailed'.$D$187] -> 0.482363 | E193: of:=[$'Results - Detailed'.$E$187] -> 766400 | F193: of:=[$'Results - Detailed'.$F$187] -> 0.010287 | G193: of:=[$'Results - Detailed'.$G$187] -> 0.838851 | H193: of:=[$'Results - Detailed'.$H$187] -> 1944600 | I193: of:=[$'Results - Detailed'.$I$187] -> 0.003997 | J193: of:=[$'Results - Detailed'.$J$187] -> 0.550045 | K193: of:=[$'Results - Detailed'.$K$187] -> 884200 | L193: of:=[$'Results - Detailed'.$L$187] -> 0.008944 | M193: of:=[$'Results - Detailed'.$M$187] -> 0.779388
B194: of:=[$'Results - Detailed'.$B$188] -> 2409400 | C194: of:=[$'Results - Detailed'.$C$188] -> 0.00321 | D194: of:=[$'Results - Detailed'.$D$188] -> 0.48542 | E194: of:=[$'Results - Detailed'.$E$188] -> 766600 | F194: of:=[$'Results - Detailed'.$F$188] -> 0.010277 | G194: of:=[$'Results - Detailed'.$G$188] -> 0.844845 | H194: of:=[$'Results - Detailed'.$H$188] -> 1926000 | I194: of:=[$'Results - Detailed'.$I$188] -> 0.004023 | J194: of:=[$'Results - Detailed'.$J$188] -> 0.556322 | K194: of:=[$'Results - Detailed'.$K$188] -> 884400 | L194: of:=[$'Results - Detailed'.$L$188] -> 0.008917 | M194: of:=[$'Results - Detailed'.$M$188] -> 0.785
B195: of:=[$'Results - Detailed'.$B$189] -> 2409400 | C195: of:=[$'Results - Detailed'.$C$189] -> 0.003211 | D195: of:=[$'Results - Detailed'.$D$189] -> 0.488716 | E195: of:=[$'Results - Detailed'.$E$189] -> 769000 | F195: of:=[$'Results - Detailed'.$F$189] -> 0.010255 | G195: of:=[$'Results - Detailed'.$G$189] -> 0.849616 | H195: of:=[$'Results - Detailed'.$H$189] -> 1936200 | I195: of:=[$'Results - Detailed'.$I$189] -> 0.004034 | J195: of:=[$'Results - Detailed'.$J$189] -> 0.558477 | K195: of:=[$'Results - Detailed'.$K$189] -> 887600 | L195: of:=[$'Results - Detailed'.$L$189] -> 0.008898 | M195: of:=[$'Results - Detailed'.$M$189] -> 0.789241
B196: of:=[$'Results - Detailed'.$B$190] -> 2410600 | C196: of:=[$'Results - Detailed'.$C$190] -> 0.003208 | D196: of:=[$'Results - Detailed'.$D$190] -> 0.491867 | E196: of:=[$'Results - Detailed'.$E$190] -> 765200 | F196: of:=[$'Results - Detailed'.$F$190] -> 0.010319 | G196: of:=[$'Results - Detailed'.$G$190] -> 0.857759 | H196: of:=[$'Results - Detailed'.$H$190] -> 1935800 | I196: of:=[$'Results - Detailed'.$I$190] -> 0.004008 | J196: of:=[$'Results - Detailed'.$J$190] -> 0.562111 | K196: of:=[$'Results - Detailed'.$K$190] -> 885000 | L196: of:=[$'Results - Detailed'.$L$190] -> 0.008908 | M196: of:=[$'Results - Detailed'.$M$190] -> 0.796015
B197: of:=[$'Results - Detailed'.$B$191] -> 2407400 | C197: of:=[$'Results - Detailed'.$C$191] -> 0.003222 | D197: of:=[$'Results - Detailed'.$D$191] -> 0.495455 | E197: of:=[$'Results - Detailed'.$E$191] -> 765200 | F197: of:=[$'Results - Detailed'.$F$191] -> 0.010355 | G197: of:=[$'Results - Detailed'.$G$191] -> 0.863774 | H197: of:=[$'Results - Detailed'.$H$191] -> 1934400 | I197: of:=[$'Results - Detailed'.$I$191] -> 0.004025 | J197: of:=[$'Results - Detailed'.$J$191] -> 0.565882 | K197: of:=[$'Results - Detailed'.$K$191] -> 881200 | L197: of:=[$'Results - Detailed'.$L$191] -> 0.008956 | M197: of:=[$'Results - Detailed'.$M$191] -> 0.803323
B198: of:=[$'Results - Detailed'.$B$192] -> 2362200 | C198: of:=[$'Results - Detailed'.$C$192] -> 0.003248 | D198: of:=[$'Results - Detailed'.$D$192] -> 0.480634 | E198: of:=[$'Results - Detailed'.$E$192] -> 819000 | F198: of:=[$'Results - Detailed'.$F$192] -> 0.009658 | G198: of:=[$'Results - Detailed'.$G$192] -> 0.82758 | H198: of:=[$'Results - Detailed'.$H$192] -> 1668600 | I198: of:=[$'Results - Detailed'.$I$192] -> 0.004675 | J198: of:=[$'Results - Detailed'.$J$192] -> 0.545611 | K198: of:=[$'Results - Detailed'.$K$192] -> 878200 | L198: of:=[$'Results - Detailed'.$L$192] -> 0.009009 | M198: of:=[$'Results - Detailed'.$M$192] -> 0.764665
B199: of:=[$'Results - Detailed'.$B$193] -> 2351800 | C199: of:=[$'Results - Detailed'.$C$193] -> 0.003275 | D199: of:=[$'Results - Detailed'.$D$193] -> 0.485083 | E199: of:=[$'Results - Detailed'.$E$193] -> 819200 | F199: of:=[$'Results - Detailed'.$F$193] -> 0.00968 | G199: of:=[$'Results - Detailed'.$G$193] -> 0.833307 | H199: of:=[$'Results - Detailed'.$H$193] -> 1667000 | I199: of:=[$'Results - Detailed'.$I$193] -> 0.004673 | J199: of:=[$'Results - Detailed'.$J$193] -> 0.550136 | K199: of:=[$'Results - Detailed'.$K$193] -> 880400 | L199: of:=[$'Results - Detailed'.$L$193] -> 0.00895 | M199: of:=[$'Results - Detailed'.$M$193] -> 0.769547
B200: of:=[$'Results - Detailed'.$B$194] -> 2358800 | C200: of:=[$'Results - Detailed'.$C$194] -> 0.003259 | D200: of:=[$'Results - Detailed'.$D$194] -> 0.487715 | E200: of:=[$'Results - Detailed'.$E$194] -> 820600 | F200: of:=[$'Results - Detailed'.$F$194] -> 0.009625 | G200: of:=[$'Results - Detailed'.$G$194] -> 0.838357 | H200: of:=[$'Results - Detailed'.$H$194] -> 1662600 | I200: of:=[$'Results - Detailed'.$I$194] -> 0.004688 | J200: of:=[$'Results - Detailed'.$J$194] -> 0.555113 | K200: of:=[$'Results - Detailed'.$K$194] -> 882000 | L200: of:=[$'Results - Detailed'.$L$194] -> 0.008971 | M200: of:=[$'Results - Detailed'.$M$194] -> 0.77466
B201: of:=[$'Results - Detailed'.$B$195] -> 2364400 | C201: of:=[$'Results - Detailed'.$C$195] -> 0.003268 | D201: of:=[$'Results - Detailed'.$D$195] -> 0.490481 | E201: of:=[$'Results - Detailed'.$E$195] -> 820200 | F201: of:=[$'Results - Detailed'.$F$195] -> 0.009632 | G201: of:=[$'Results - Detailed'.$G$195] -> 0.844284 | H201: of:=[$'Results - Detailed'.$H$195] -> 1662800 | I201: of:=[$'Results - Detailed'.$I$195] -> 0.004694 | J201: of:=[$'Results - Detailed'.$J$195] -> 0.559293 | K201: of:=[$'Results - Detailed'.$K$195] -> 880400 | L201: of:=[$'Results - Detailed'.$L$195] -> 0.008971 | M201: of:=[$'Results - Detailed'.$M$195] -> 0.781128
B202: of:=[$'Results - Detailed'.$B$196] -> 2368400 | C202: of:=[$'Results - Detailed'.$C$196] -> 0.003269 | D202: of:=[$'Results - Detailed'.$D$196] -> 0.49339 | E202: of:=[$'Results - Detailed'.$E$196] -> 821400 | F202: of:=[$'Results - Detailed'.$F$196] -> 0.009627 | G202: of:=[$'Results - Detailed'.$G$196] -> 0.849354 | H202: of:=[$'Results - Detailed'.$H$196] -> 1669800 | I202: of:=[$'Results - Detailed'.$I$196] -> 0.004674 | J202: of:=[$'Results - Detailed'.$J$196] -> 0.562301 | K202: of:=[$'Results - Detailed'.$K$196] -> 878200 | L202: of:=[$'Results - Detailed'.$L$196] -> 0.008998 | M202: of:=[$'Results - Detailed'.$M$196] -> 0.787837
B203: of:=[$'Results - Detailed'.$B$197] -> 2354000 | C203: of:=[$'Results - Detailed'.$C$197] -> 0.003284 | D203: of:=[$'Results - Detailed'.$D$197] -> 0.498203 | E203: of:=[$'Results - Detailed'.$E$197] -> 823600 | F203: of:=[$'Results - Detailed'.$F$197] -> 0.009599 | G203: of:=[$'Results - Detailed'.$G$197] -> 0.853859 | H203: of:=[$'Results - Detailed'.$H$197] -> 1669200 | I203: of:=[$'Results - Detailed'.$I$197] -> 0.004675 | J203: of:=[$'Results - Detailed'.$J$197] -> 0.566588 | K203: of:=[$'Results - Detailed'.$K$197] -> 879400 | L203: of:=[$'Results - Detailed'.$L$197] -> 0.009008 | M203: of:=[$'Results - Detailed'.$M$197] -> 0.792999
B204: of:=[$'Results - Detailed'.$B$198] -> 2358400 | C204: of:=[$'Results - Detailed'.$C$198] -> 0.003262 | D204: of:=[$'Results - Detailed'.$D$198] -> 0.501004 | E204: of:=[$'Results - Detailed'.$E$198] -> 820400 | F204: of:=[$'Results - Detailed'.$F$198] -> 0.009617 | G204: of:=[$'Results - Detailed'.$G$198] -> 0.861125 | H204: of:=[$'Results - Detailed'.$H$198] -> 1659600 | I204: of:=[$'Results - Detailed'.$I$198] -> 0.004683 | J204: of:=[$'Results - Detailed'.$J$198] -> 0.57233 | K204: of:=[$'Results - Detailed'.$K$198] -> 880200 | L204: of:=[$'Results - Detailed'.$L$198] -> 0.008993 | M204: of:=[$'Results - Detailed'.$M$198] -> 0.798292
B205: of:=[$'Results - Detailed'.$B$199] -> 2356800 | C205: of:=[$'Results - Detailed'.$C$199] -> 0.003272 | D205: of:=[$'Results - Detailed'.$D$199] -> 0.504428 | E205: of:=[$'Results - Detailed'.$E$199] -> 818600 | F205: of:=[$'Results - Detailed'.$F$199] -> 0.00966 | G205: of:=[$'Results - Detailed'.$G$199] -> 0.867656 | H205: of:=[$'Results - Detailed'.$H$199] -> 1672000 | I205: of:=[$'Results - Detailed'.$I$199] -> 0.00466 | J205: of:=[$'Results - Detailed'.$J$199] -> 0.574276 | K205: of:=[$'Results - Detailed'.$K$199] -> 881200 | L205: of:=[$'Results - Detailed'.$L$199] -> 0.008949 | M205: of:=[$'Results - Detailed'.$M$199] -> 0.803428
B206: of:=[$'Results - Detailed'.$B$200] -> 2361200 | C206: of:=[$'Results - Detailed'.$C$200] -> 0.003269 | D206: of:=[$'Results - Detailed'.$D$200] -> 0.507191 | E206: of:=[$'Results - Detailed'.$E$200] -> 822400 | F206: of:=[$'Results - Detailed'.$F$200] -> 0.009628 | G206: of:=[$'Results - Detailed'.$G$200] -> 0.871192 | H206: of:=[$'Results - Detailed'.$H$200] -> 1662600 | I206: of:=[$'Results - Detailed'.$I$200] -> 0.004703 | J206: of:=[$'Results - Detailed'.$J$200] -> 0.579966 | K206: of:=[$'Results - Detailed'.$K$200] -> 882200 | L206: of:=[$'Results - Detailed'.$L$200] -> 0.008955 | M206: of:=[$'Results - Detailed'.$M$200] -> 0.808529
B207: of:=[$'Results - Detailed'.$B$201] -> 2365200 | C207: of:=[$'Results - Detailed'.$C$201] -> 0.003244 | D207: of:=[$'Results - Detailed'.$D$201] -> 0.509952 | E207: of:=[$'Results - Detailed'.$E$201] -> 822000 | F207: of:=[$'Results - Detailed'.$F$201] -> 0.00962 | G207: of:=[$'Results - Detailed'.$G$201] -> 0.876907 | H207: of:=[$'Results - Detailed'.$H$201] -> 1667600 | I207: of:=[$'Results - Detailed'.$I$201] -> 0.0047 | J207: of:=[$'Results - Detailed'.$J$201] -> 0.58314 | K207: of:=[$'Results - Detailed'.$K$201] -> 877800 | L207: of:=[$'Results - Detailed'.$L$201] -> 0.009013 | M207: of:=[$'Results - Detailed'.$M$201] -> 0.816094
B208: of:=[$'Results - Detailed'.$B$202] -> 2462800 | C208: of:=[$'Results - Detailed'.$C$202] -> 0.003133 | D208: of:=[$'Results - Detailed'.$D$202] -> 0.444482 | E208: of:=[$'Results - Detailed'.$E$202] -> 805400 | F208: of:=[$'Results - Detailed'.$F$202] -> 0.009799 | G208: of:=[$'Results - Detailed'.$G$202] -> 0.809816 | H208: of:=[$'Results - Detailed'.$H$202] -> 1748200 | I208: of:=[$'Results - Detailed'.$I$202] -> 0.004445 | J208: of:=[$'Results - Detailed'.$J$202] -> 0.53889 | K208: of:=[$'Results - Detailed'.$K$202] -> 862600 | L208: of:=[$'Results - Detailed'.$L$202] -> 0.009135 | M208: of:=[$'Results - Detailed'.$M$202] -> 0.763797
B209: of:=[$'Results - Detailed'.$B$203] -> 2452800 | C209: of:=[$'Results - Detailed'.$C$203] -> 0.003143 | D209: of:=[$'Results - Detailed'.$D$203] -> 0.448901 | E209: of:=[$'Results - Detailed'.$E$203] -> 810600 | F209: of:=[$'Results - Detailed'.$F$203] -> 0.009748 | G209: of:=[$'Results - Detailed'.$G$203] -> 0.813251 | H209: of:=[$'Results - Detailed'.$H$203] -> 1739000 | I209: of:=[$'Results - Detailed'.$I$203] -> 0.004475 | J209: of:=[$'Results - Detailed'.$J$203] -> 0.544439 | K209: of:=[$'Results - Detailed'.$K$203] -> 857600 | L209: of:=[$'Results - Detailed'.$L$203] -> 0.009186 | M209: of:=[$'Results - Detailed'.$M$203] -> 0.771992
B210: of:=[$'Results - Detailed'.$B$204] -> 2461800 | C210: of:=[$'Results - Detailed'.$C$204] -> 0.003138 | D210: of:=[$'Results - Detailed'.$D$204] -> 0.451568 | E210: of:=[$'Results - Detailed'.$E$204] -> 804000 | F210: of:=[$'Results - Detailed'.$F$204] -> 0.009831 | G210: of:=[$'Results - Detailed'.$G$204] -> 0.82258 | H210: of:=[$'Results - Detailed'.$H$204] -> 1742600 | I210: of:=[$'Results - Detailed'.$I$204] -> 0.004454 | J210: of:=[$'Results - Detailed'.$J$204] -> 0.547956 | K210: of:=[$'Results - Detailed'.$K$204] -> 867800 | L210: of:=[$'Results - Detailed'.$L$204] -> 0.009092 | M210: of:=[$'Results - Detailed'.$M$204] -> 0.773343
B211: of:=[$'Results - Detailed'.$B$205] -> 2456200 | C211: of:=[$'Results - Detailed'.$C$205] -> 0.003143 | D211: of:=[$'Results - Detailed'.$D$205] -> 0.455546 | E211: of:=[$'Results - Detailed'.$E$205] -> 808800 | F211: of:=[$'Results - Detailed'.$F$205] -> 0.009763 | G211: of:=[$'Results - Detailed'.$G$205] -> 0.826066 | H211: of:=[$'Results - Detailed'.$H$205] -> 1743600 | I211: of:=[$'Results - Detailed'.$I$205] -> 0.004455 | J211: of:=[$'Results - Detailed'.$J$205] -> 0.55185 | K211: of:=[$'Results - Detailed'.$K$205] -> 853200 | L211: of:=[$'Results - Detailed'.$L$205] -> 0.009231 | M211: of:=[$'Results - Detailed'.$M$205] -> 0.785827
B212: of:=[$'Results - Detailed'.$B$206] -> 2462400 | C212: of:=[$'Results - Detailed'.$C$206] -> 0.00313 | D212: of:=[$'Results - Detailed'.$D$206] -> 0.458399 | E212: of:=[$'Results - Detailed'.$E$206] -> 805200 | F212: of:=[$'Results - Detailed'.$F$206] -> 0.009804 | G212: of:=[$'Results - Detailed'.$G$206] -> 0.83381 | H212: of:=[$'Results - Detailed'.$H$206] -> 1741600 | I212: of:=[$'Results - Detailed'.$I$206] -> 0.004461 | J212: of:=[$'Results - Detailed'.$J$206] -> 0.556192 | K212: of:=[$'Results - Detailed'.$K$206] -> 866800 | L212: of:=[$'Results - Detailed'.$L$206] -> 0.0091 | M212: of:=[$'Results - Detailed'.$M$206] -> 0.785453
B213: of:=[$'Results - Detailed'.$B$207] -> 2459000 | C213: of:=[$'Results - Detailed'.$C$207] -> 0.003141 | D213: of:=[$'Results - Detailed'.$D$207] -> 0.462127 | E213: of:=[$'Results - Detailed'.$E$207] -> 806400 | F213: of:=[$'Results - Detailed'.$F$207] -> 0.009804 | G213: of:=[$'Results - Detailed'.$G$207] -> 0.839052 | H213: of:=[$'Results - Detailed'.$H$207] -> 1741200 | I213: of:=[$'Results - Detailed'.$I$207] -> 0.004469 | J213: of:=[$'Results - Detailed'.$J$207] -> 0.560259 | K213: of:=[$'Results - Detailed'.$K$207] -> 861200 | L213: of:=[$'Results - Detailed'.$L$207] -> 0.009159 | M213: of:=[$'Results - Detailed'.$M$207] -> 0.793793
B214: of:=[$'Results - Detailed'.$B$208] -> 2459800 | C214: of:=[$'Results - Detailed'.$C$208] -> 0.003139 | D214: of:=[$'Results - Detailed'.$D$208] -> 0.465437 | E214: of:=[$'Results - Detailed'.$E$208] -> 804000 | F214: of:=[$'Results - Detailed'.$F$208] -> 0.009861 | G214: of:=[$'Results - Detailed'.$G$208] -> 0.84615 | H214: of:=[$'Results - Detailed'.$H$208] -> 1740000 | I214: of:=[$'Results - Detailed'.$I$208] -> 0.00447 | J214: of:=[$'Results - Detailed'.$J$208] -> 0.564426 | K214: of:=[$'Results - Detailed'.$K$208] -> 869600 | L214: of:=[$'Results - Detailed'.$L$208] -> 0.009078 | M214: of:=[$'Results - Detailed'.$M$208] -> 0.795675
B215: of:=[$'Results - Detailed'.$B$209] -> 2467800 | C215: of:=[$'Results - Detailed'.$C$209] -> 0.00312 | D215: of:=[$'Results - Detailed'.$D$209] -> 0.468027 | E215: of:=[$'Results - Detailed'.$E$209] -> 806000 | F215: of:=[$'Results - Detailed'.$F$209] -> 0.009772 | G215: of:=[$'Results - Detailed'.$G$209] -> 0.850862 | H215: of:=[$'Results - Detailed'.$H$209] -> 1740200 | I215: of:=[$'Results - Detailed'.$I$209] -> 0.004459 | J215: of:=[$'Results - Detailed'.$J$209] -> 0.56833 | K215: of:=[$'Results - Detailed'.$K$209] -> 856600 | L215: of:=[$'Results - Detailed'.$L$209] -> 0.009185 | M215: of:=[$'Results - Detailed'.$M$209] -> 0.807398
B216: of:=[$'Results - Detailed'.$B$210] -> 2458800 | C216: of:=[$'Results - Detailed'.$C$210] -> 0.003136 | D216: of:=[$'Results - Detailed'.$D$210] -> 0.472215 | E216: of:=[$'Results - Detailed'.$E$210] -> 804800 | F216: of:=[$'Results - Detailed'.$F$210] -> 0.009786 | G216: of:=[$'Results - Detailed'.$G$210] -> 0.857224 | H216: of:=[$'Results - Detailed'.$H$210] -> 1737600 | I216: of:=[$'Results - Detailed'.$I$210] -> 0.004491 | J216: of:=[$'Results - Detailed'.$J$210] -> 0.57269 | K216: of:=[$'Results - Detailed'.$K$210] -> 864000 | L216: of:=[$'Results - Detailed'.$L$210] -> 0.009155 | M216: of:=[$'Results - Detailed'.$M$210] -> 0.809606
B217: of:=[$'Results - Detailed'.$B$211] -> 2458200 | C217: of:=[$'Results - Detailed'.$C$211] -> 0.003132 | D217: of:=[$'Results - Detailed'.$D$211] -> 0.475576 | E217: of:=[$'Results - Detailed'.$E$211] -> 808000 | F217: of:=[$'Results - Detailed'.$F$211] -> 0.00976 | G217: of:=[$'Results - Detailed'.$G$211] -> 0.86121 | H217: of:=[$'Results - Detailed'.$H$211] -> 1748800 | I217: of:=[$'Results - Detailed'.$I$211] -> 0.004444 | J217: of:=[$'Results - Detailed'.$J$211] -> 0.574774 | K217: of:=[$'Results - Detailed'.$K$211] -> 876200 | L217: of:=[$'Results - Detailed'.$L$211] -> 0.009037 | M217: of:=[$'Results - Detailed'.$M$211] -> 0.809552
A218: 8 | B218: of:=AVERAGE([.B188:.B217]) -> 2410973.33333333 | C218: of:=AVERAGE([.C188:.C217]) -> 0.003201 | D218: of:=AVERAGE([.D188:.D217]) -> 0.4786811 | E218: of:=AVERAGE([.E188:.E217]) -> 797680 | F218: of:=AVERAGE([.F188:.F217]) -> 0.009915 | G218: of:=AVERAGE([.G188:.G217]) -> 0.841390766666667 | H218: of:=AVERAGE([.H188:.H217]) -> 1781440 | I218: of:=AVERAGE([.I188:.I217]) -> 0.004386 | J218: of:=AVERAGE([.J188:.J217]) -> 0.557411 | K218: of:=AVERAGE([.K188:.K217]) -> 875913.333333333 | L218: of:=AVERAGE([.L188:.L217]) -> 0.00901806666666667 | M218: of:=AVERAGE([.M188:.M217]) -> 0.785230766666667
A219: 10 / Results - Detailed | B219: of:=[$'Results - Detailed'.$B$212] -> 2480600 | C219: of:=[$'Results - Detailed'.$C$212] -> 0.003928 | D219: of:=[$'Results - Detailed'.$D$212] -> 0.507024 | E219: of:=[$'Results - Detailed'.$E$212] -> 734000 | F219: of:=[$'Results - Detailed'.$F$212] -> 0.01349 | G219: of:=[$'Results - Detailed'.$G$212] -> 0.922529 | H219: of:=[$'Results - Detailed'.$H$212] -> 1721200 | I219: of:=[$'Results - Detailed'.$I$212] -> 0.005694 | J219: of:=[$'Results - Detailed'.$J$212] -> 0.615254 | K219: of:=[$'Results - Detailed'.$K$212] -> 841200 | L219: of:=[$'Results - Detailed'.$L$212] -> 0.011728 | M219: of:=[$'Results - Detailed'.$M$212] -> 0.867076
B220: of:=[$'Results - Detailed'.$B$213] -> 2477800 | C220: of:=[$'Results - Detailed'.$C$213] -> 0.003913 | D220: of:=[$'Results - Detailed'.$D$213] -> 0.511153 | E220: of:=[$'Results - Detailed'.$E$213] -> 733200 | F220: of:=[$'Results - Detailed'.$F$213] -> 0.013511 | G220: of:=[$'Results - Detailed'.$G$213] -> 0.930322 | H220: of:=[$'Results - Detailed'.$H$213] -> 1717600 | I220: of:=[$'Results - Detailed'.$I$213] -> 0.005706 | J220: of:=[$'Results - Detailed'.$J$213] -> 0.620513 | K220: of:=[$'Results - Detailed'.$K$213] -> 843000 | L220: of:=[$'Results - Detailed'.$L$213] -> 0.01173 | M220: of:=[$'Results - Detailed'.$M$213] -> 0.872895
B221: of:=[$'Results - Detailed'.$B$214] -> 2476200 | C221: of:=[$'Results - Detailed'.$C$214] -> 0.003925 | D221: of:=[$'Results - Detailed'.$D$214] -> 0.515142 | E221: of:=[$'Results - Detailed'.$E$214] -> 734800 | F221: of:=[$'Results - Detailed'.$F$214] -> 0.013484 | G221: of:=[$'Results - Detailed'.$G$214] -> 0.936536 | H221: of:=[$'Results - Detailed'.$H$214] -> 1725400 | I221: of:=[$'Results - Detailed'.$I$214] -> 0.005661 | J221: of:=[$'Results - Detailed'.$J$214] -> 0.623664 | K221: of:=[$'Results - Detailed'.$K$214] -> 844200 | L221: of:=[$'Results - Detailed'.$L$214] -> 0.011696 | M221: of:=[$'Results - Detailed'.$M$214] -> 0.878953
B222: of:=[$'Results - Detailed'.$B$215] -> 2474600 | C222: of:=[$'Results - Detailed'.$C$215] -> 0.003934 | D222: of:=[$'Results - Detailed'.$D$215] -> 0.519111 | E222: of:=[$'Results - Detailed'.$E$215] -> 734000 | F222: of:=[$'Results - Detailed'.$F$215] -> 0.013471 | G222: of:=[$'Results - Detailed'.$G$215] -> 0.944207 | H222: of:=[$'Results - Detailed'.$H$215] -> 1720000 | I222: of:=[$'Results - Detailed'.$I$215] -> 0.005676 | J222: of:=[$'Results - Detailed'.$J$215] -> 0.629169 | K222: of:=[$'Results - Detailed'.$K$215] -> 843600 | L222: of:=[$'Results - Detailed'.$L$215] -> 0.011714 | M222: of:=[$'Results - Detailed'.$M$215] -> 0.885902
B223: of:=[$'Results - Detailed'.$B$216] -> 2448600 | C223: of:=[$'Results - Detailed'.$C$216] -> 0.003952 | D223: of:=[$'Results - Detailed'.$D$216] -> 0.525633 | E223: of:=[$'Results - Detailed'.$E$216] -> 730400 | F223: of:=[$'Results - Detailed'.$F$216] -> 0.013535 | G223: of:=[$'Results - Detailed'.$G$216] -> 0.953654 | H223: of:=[$'Results - Detailed'.$H$216] -> 1723800 | I223: of:=[$'Results - Detailed'.$I$216] -> 0.005671 | J223: of:=[$'Results - Detailed'.$J$216] -> 0.632971 | K223: of:=[$'Results - Detailed'.$K$216] -> 842800 | L223: of:=[$'Results - Detailed'.$L$216] -> 0.011725 | M223: of:=[$'Results - Detailed'.$M$216] -> 0.892912
B224: of:=[$'Results - Detailed'.$B$217] -> 2470200 | C224: of:=[$'Results - Detailed'.$C$217] -> 0.003899 | D224: of:=[$'Results - Detailed'.$D$217] -> 0.527042 | E224: of:=[$'Results - Detailed'.$E$217] -> 733200 | F224: of:=[$'Results - Detailed'.$F$217] -> 0.013543 | G224: of:=[$'Results - Detailed'.$G$217] -> 0.958919 | H224: of:=[$'Results - Detailed'.$H$217] -> 1721000 | I224: of:=[$'Results - Detailed'.$I$217] -> 0.005672 | J224: of:=[$'Results - Detailed'.$J$217] -> 0.637964 | K224: of:=[$'Results - Detailed'.$K$217] -> 842800 | L224: of:=[$'Results - Detailed'.$L$217] -> 0.011692 | M224: of:=[$'Results - Detailed'.$M$217] -> 0.899436
B225: of:=[$'Results - Detailed'.$B$218] -> 2467400 | C225: of:=[$'Results - Detailed'.$C$218] -> 0.003931 | D225: of:=[$'Results - Detailed'.$D$218] -> 0.531055 | E225: of:=[$'Results - Detailed'.$E$218] -> 731400 | F225: of:=[$'Results - Detailed'.$F$218] -> 0.013577 | G225: of:=[$'Results - Detailed'.$G$218] -> 0.967142 | H225: of:=[$'Results - Detailed'.$H$218] -> 1723000 | I225: of:=[$'Results - Detailed'.$I$218] -> 0.005642 | J225: of:=[$'Results - Detailed'.$J$218] -> 0.642003 | K225: of:=[$'Results - Detailed'.$K$218] -> 838000 | L225: of:=[$'Results - Detailed'.$L$218] -> 0.011792 | M225: of:=[$'Results - Detailed'.$M$218] -> 0.908521
B226: of:=[$'Results - Detailed'.$B$219] -> 2461200 | C226: of:=[$'Results - Detailed'.$C$219] -> 0.003941 | D226: of:=[$'Results - Detailed'.$D$219] -> 0.535417 | E226: of:=[$'Results - Detailed'.$E$219] -> 734600 | F226: of:=[$'Results - Detailed'.$F$219] -> 0.013482 | G226: of:=[$'Results - Detailed'.$G$219] -> 0.971995 | H226: of:=[$'Results - Detailed'.$H$219] -> 1721200 | I226: of:=[$'Results - Detailed'.$I$219] -> 0.005684 | J226: of:=[$'Results - Detailed'.$J$219] -> 0.646748 | K226: of:=[$'Results - Detailed'.$K$219] -> 846000 | L226: of:=[$'Results - Detailed'.$L$219] -> 0.011702 | M226: of:=[$'Results - Detailed'.$M$219] -> 0.910663
B227: of:=[$'Results - Detailed'.$B$220] -> 2472200 | C227: of:=[$'Results - Detailed'.$C$220] -> 0.003915 | D227: of:=[$'Results - Detailed'.$D$220] -> 0.537876 | E227: of:=[$'Results - Detailed'.$E$220] -> 733400 | F227: of:=[$'Results - Detailed'.$F$220] -> 0.013526 | G227: of:=[$'Results - Detailed'.$G$220] -> 0.979716 | H227: of:=[$'Results - Detailed'.$H$220] -> 1726200 | I227: of:=[$'Results - Detailed'.$I$220] -> 0.005654 | J227: of:=[$'Results - Detailed'.$J$220] -> 0.650173 | K227: of:=[$'Results - Detailed'.$K$220] -> 846400 | L227: of:=[$'Results - Detailed'.$L$220] -> 0.011673 | M227: of:=[$'Results - Detailed'.$M$220] -> 0.916836
B228: of:=[$'Results - Detailed'.$B$221] -> 2465400 | C228: of:=[$'Results - Detailed'.$C$221] -> 0.003917 | D228: of:=[$'Results - Detailed'.$D$221] -> 0.542241 | E228: of:=[$'Results - Detailed'.$E$221] -> 732600 | F228: of:=[$'Results - Detailed'.$F$221] -> 0.013508 | G228: of:=[$'Results - Detailed'.$G$221] -> 0.987118 | H228: of:=[$'Results - Detailed'.$H$221] -> 1722600 | I228: of:=[$'Results - Detailed'.$I$221] -> 0.005643 | J228: of:=[$'Results - Detailed'.$J$221] -> 0.655173 | K228: of:=[$'Results - Detailed'.$K$221] -> 849000 | L228: of:=[$'Results - Detailed'.$L$221] -> 0.011661 | M228: of:=[$'Results - Detailed'.$M$221] -> 0.921778
B229: of:=[$'Results - Detailed'.$B$222] -> 2417200 | C229: of:=[$'Results - Detailed'.$C$222] -> 0.003987 | D229: of:=[$'Results - Detailed'.$D$222] -> 0.507784 | E229: of:=[$'Results - Detailed'.$E$222] -> 777600 | F229: of:=[$'Results - Detailed'.$F$222] -> 0.012737 | G229: of:=[$'Results - Detailed'.$G$222] -> 0.898176 | H229: of:=[$'Results - Detailed'.$H$222] -> 1759600 | I229: of:=[$'Results - Detailed'.$I$222] -> 0.005534 | J229: of:=[$'Results - Detailed'.$J$222] -> 0.625602 | K229: of:=[$'Results - Detailed'.$K$222] -> 907000 | L229: of:=[$'Results - Detailed'.$L$222] -> 0.010911 | M229: of:=[$'Results - Detailed'.$M$222] -> 0.830502
B230: of:=[$'Results - Detailed'.$B$223] -> 2404800 | C230: of:=[$'Results - Detailed'.$C$223] -> 0.004032 | D230: of:=[$'Results - Detailed'.$D$223] -> 0.513036 | E230: of:=[$'Results - Detailed'.$E$223] -> 774000 | F230: of:=[$'Results - Detailed'.$F$223] -> 0.012809 | G230: of:=[$'Results - Detailed'.$G$223] -> 0.907348 | H230: of:=[$'Results - Detailed'.$H$223] -> 1748000 | I230: of:=[$'Results - Detailed'.$I$223] -> 0.005572 | J230: of:=[$'Results - Detailed'.$J$223] -> 0.632113 | K230: of:=[$'Results - Detailed'.$K$223] -> 915400 | L230: of:=[$'Results - Detailed'.$L$223] -> 0.010826 | M230: of:=[$'Results - Detailed'.$M$223] -> 0.833205
B231: of:=[$'Results - Detailed'.$B$224] -> 2420000 | C231: of:=[$'Results - Detailed'.$C$224] -> 0.003999 | D231: of:=[$'Results - Detailed'.$D$224] -> 0.515317 | E231: of:=[$'Results - Detailed'.$E$224] -> 774800 | F231: of:=[$'Results - Detailed'.$F$224] -> 0.012785 | G231: of:=[$'Results - Detailed'.$G$224] -> 0.913902 | H231: of:=[$'Results - Detailed'.$H$224] -> 1756400 | I231: of:=[$'Results - Detailed'.$I$224] -> 0.005553 | J231: of:=[$'Results - Detailed'.$J$224] -> 0.634988 | K231: of:=[$'Results - Detailed'.$K$224] -> 911600 | L231: of:=[$'Results - Detailed'.$L$224] -> 0.010878 | M231: of:=[$'Results - Detailed'.$M$224] -> 0.841428
B232: of:=[$'Results - Detailed'.$B$225] -> 2415000 | C232: of:=[$'Results - Detailed'.$C$225] -> 0.004035 | D232: of:=[$'Results - Detailed'.$D$225] -> 0.519746 | E232: of:=[$'Results - Detailed'.$E$225] -> 779600 | F232: of:=[$'Results - Detailed'.$F$225] -> 0.012719 | G232: of:=[$'Results - Detailed'.$G$225] -> 0.918038 | H232: of:=[$'Results - Detailed'.$H$225] -> 1750800 | I232: of:=[$'Results - Detailed'.$I$225] -> 0.005569 | J232: of:=[$'Results - Detailed'.$J$225] -> 0.640366 | K232: of:=[$'Results - Detailed'.$K$225] -> 910200 | L232: of:=[$'Results - Detailed'.$L$225] -> 0.010894 | M232: of:=[$'Results - Detailed'.$M$225] -> 0.848519
B233: of:=[$'Results - Detailed'.$B$226] -> 2409200 | C233: of:=[$'Results - Detailed'.$C$226] -> 0.004022 | D233: of:=[$'Results - Detailed'.$D$226] -> 0.524222 | E233: of:=[$'Results - Detailed'.$E$226] -> 774600 | F233: of:=[$'Results - Detailed'.$F$226] -> 0.012791 | G233: of:=[$'Results - Detailed'.$G$226] -> 0.927914 | H233: of:=[$'Results - Detailed'.$H$226] -> 1758600 | I233: of:=[$'Results - Detailed'.$I$226] -> 0.005564 | J233: of:=[$'Results - Detailed'.$J$226] -> 0.643283 | K233: of:=[$'Results - Detailed'.$K$226] -> 908200 | L233: of:=[$'Results - Detailed'.$L$226] -> 0.010918 | M233: of:=[$'Results - Detailed'.$M$226] -> 0.855855
B234: of:=[$'Results - Detailed'.$B$227] -> 2405800 | C234: of:=[$'Results - Detailed'.$C$227] -> 0.004022 | D234: of:=[$'Results - Detailed'.$D$227] -> 0.528412 | E234: of:=[$'Results - Detailed'.$E$227] -> 776600 | F234: of:=[$'Results - Detailed'.$F$227] -> 0.01273 | G234: of:=[$'Results - Detailed'.$G$227] -> 0.933562 | H234: of:=[$'Results - Detailed'.$H$227] -> 1746000 | I234: of:=[$'Results - Detailed'.$I$227] -> 0.005584 | J234: of:=[$'Results - Detailed'.$J$227] -> 0.64991 | K234: of:=[$'Results - Detailed'.$K$227] -> 914000 | L234: of:=[$'Results - Detailed'.$L$227] -> 0.01084 | M234: of:=[$'Results - Detailed'.$M$227] -> 0.859466
B235: of:=[$'Results - Detailed'.$B$228] -> 2411800 | C235: of:=[$'Results - Detailed'.$C$228] -> 0.004015 | D235: of:=[$'Results - Detailed'.$D$228] -> 0.531545 | E235: of:=[$'Results - Detailed'.$E$228] -> 771400 | F235: of:=[$'Results - Detailed'.$F$228] -> 0.012836 | G235: of:=[$'Results - Detailed'.$G$228] -> 0.943529 | H235: of:=[$'Results - Detailed'.$H$228] -> 1758400 | I235: of:=[$'Results - Detailed'.$I$228] -> 0.005556 | J235: of:=[$'Results - Detailed'.$J$228] -> 0.65189 | K235: of:=[$'Results - Detailed'.$K$228] -> 905600 | L235: of:=[$'Results - Detailed'.$L$228] -> 0.010892 | M235: of:=[$'Results - Detailed'.$M$228] -> 0.869727
B236: of:=[$'Results - Detailed'.$B$229] -> 2416800 | C236: of:=[$'Results - Detailed'.$C$229] -> 0.004011 | D236: of:=[$'Results - Detailed'.$D$229] -> 0.534758 | E236: of:=[$'Results - Detailed'.$E$229] -> 778200 | F236: of:=[$'Results - Detailed'.$F$229] -> 0.012709 | G236: of:=[$'Results - Detailed'.$G$229] -> 0.946163 | H236: of:=[$'Results - Detailed'.$H$229] -> 1758200 | I236: of:=[$'Results - Detailed'.$I$229] -> 0.005532 | J236: of:=[$'Results - Detailed'.$J$229] -> 0.656157 | K236: of:=[$'Results - Detailed'.$K$229] -> 910400 | L236: of:=[$'Results - Detailed'.$L$229] -> 0.010877 | M236: of:=[$'Results - Detailed'.$M$229] -> 0.873678
B237: of:=[$'Results - Detailed'.$B$230] -> 2414200 | C237: of:=[$'Results - Detailed'.$C$230] -> 0.004028 | D237: of:=[$'Results - Detailed'.$D$230] -> 0.538797 | E237: of:=[$'Results - Detailed'.$E$230] -> 774200 | F237: of:=[$'Results - Detailed'.$F$230] -> 0.012787 | G237: of:=[$'Results - Detailed'.$G$230] -> 0.95532 | H237: of:=[$'Results - Detailed'.$H$230] -> 1754200 | I237: of:=[$'Results - Detailed'.$I$230] -> 0.005563 | J237: of:=[$'Results - Detailed'.$J$230] -> 0.661125 | K237: of:=[$'Results - Detailed'.$K$230] -> 906600 | L237: of:=[$'Results - Detailed'.$L$230] -> 0.010942 | M237: of:=[$'Results - Detailed'.$M$230] -> 0.881733
B238: of:=[$'Results - Detailed'.$B$231] -> 2416600 | C238: of:=[$'Results - Detailed'.$C$231] -> 0.003997 | D238: of:=[$'Results - Detailed'.$D$231] -> 0.542241 | E238: of:=[$'Results - Detailed'.$E$231] -> 776400 | F238: of:=[$'Results - Detailed'.$F$231] -> 0.012764 | G238: of:=[$'Results - Detailed'.$G$231] -> 0.960633 | H238: of:=[$'Results - Detailed'.$H$231] -> 1750600 | I238: of:=[$'Results - Detailed'.$I$231] -> 0.005576 | J238: of:=[$'Results - Detailed'.$J$231] -> 0.666004 | K238: of:=[$'Results - Detailed'.$K$231] -> 915000 | L238: of:=[$'Results - Detailed'.$L$231] -> 0.010855 | M238: of:=[$'Results - Detailed'.$M$231] -> 0.883839
B239: of:=[$'Results - Detailed'.$B$232] -> 2546200 | C239: of:=[$'Results - Detailed'.$C$232] -> 0.003836 | D239: of:=[$'Results - Detailed'.$D$232] -> 0.501752 | E239: of:=[$'Results - Detailed'.$E$232] -> 767600 | F239: of:=[$'Results - Detailed'.$F$232] -> 0.012903 | G239: of:=[$'Results - Detailed'.$G$232] -> 0.981983 | H239: of:=[$'Results - Detailed'.$H$232] -> 2144200 | I239: of:=[$'Results - Detailed'.$I$232] -> 0.004538 | J239: of:=[$'Results - Detailed'.$J$232] -> 0.539375 | K239: of:=[$'Results - Detailed'.$K$232] -> 908000 | L239: of:=[$'Results - Detailed'.$L$232] -> 0.010919 | M239: of:=[$'Results - Detailed'.$M$232] -> 0.83244
B240: of:=[$'Results - Detailed'.$B$233] -> 2535800 | C240: of:=[$'Results - Detailed'.$C$233] -> 0.003854 | D240: of:=[$'Results - Detailed'.$D$233] -> 0.506598 | E240: of:=[$'Results - Detailed'.$E$233] -> 768000 | F240: of:=[$'Results - Detailed'.$F$233] -> 0.012891 | G240: of:=[$'Results - Detailed'.$G$233] -> 0.988271 | H240: of:=[$'Results - Detailed'.$H$233] -> 2149200 | I240: of:=[$'Results - Detailed'.$I$233] -> 0.004506 | J240: of:=[$'Results - Detailed'.$J$233] -> 0.542913 | K240: of:=[$'Results - Detailed'.$K$233] -> 909200 | L240: of:=[$'Results - Detailed'.$L$233] -> 0.010867 | M240: of:=[$'Results - Detailed'.$M$233] -> 0.838397
B241: of:=[$'Results - Detailed'.$B$234] -> 2531000 | C241: of:=[$'Results - Detailed'.$C$234] -> 0.003853 | D241: of:=[$'Results - Detailed'.$D$234] -> 0.510863 | E241: of:=[$'Results - Detailed'.$E$234] -> 765400 | F241: of:=[$'Results - Detailed'.$F$234] -> 0.012934 | G241: of:=[$'Results - Detailed'.$G$234] -> 0.99646 | H241: of:=[$'Results - Detailed'.$H$234] -> 2153800 | I241: of:=[$'Results - Detailed'.$I$234] -> 0.004515 | J241: of:=[$'Results - Detailed'.$J$234] -> 0.546479 | K241: of:=[$'Results - Detailed'.$K$234] -> 906200 | L241: of:=[$'Results - Detailed'.$L$234] -> 0.010925 | M241: of:=[$'Results - Detailed'.$M$234] -> 0.846262
B242: of:=[$'Results - Detailed'.$B$235] -> 2551800 | C242: of:=[$'Results - Detailed'.$C$235] -> 0.003825 | D242: of:=[$'Results - Detailed'.$D$235] -> 0.512535 | E242: of:=[$'Results - Detailed'.$E$235] -> 761400 | F242: of:=[$'Results - Detailed'.$F$235] -> 0.012987 | G242: of:=[$'Results - Detailed'.$G$235] -> 1.005708 | H242: of:=[$'Results - Detailed'.$H$235] -> 2160000 | I242: of:=[$'Results - Detailed'.$I$235] -> 0.004503 | J242: of:=[$'Results - Detailed'.$J$235] -> 0.549805 | K242: of:=[$'Results - Detailed'.$K$235] -> 905800 | L242: of:=[$'Results - Detailed'.$L$235] -> 0.010921 | M242: of:=[$'Results - Detailed'.$M$235] -> 0.852876
B243: of:=[$'Results - Detailed'.$B$236] -> 2539000 | C243: of:=[$'Results - Detailed'.$C$236] -> 0.003842 | D243: of:=[$'Results - Detailed'.$D$236] -> 0.51756 | E243: of:=[$'Results - Detailed'.$E$236] -> 764800 | F243: of:=[$'Results - Detailed'.$F$236] -> 0.012958 | G243: of:=[$'Results - Detailed'.$G$236] -> 1.009906 | H243: of:=[$'Results - Detailed'.$H$236] -> 2157800 | I243: of:=[$'Results - Detailed'.$I$236] -> 0.004482 | J243: of:=[$'Results - Detailed'.$J$236] -> 0.55419 | K243: of:=[$'Results - Detailed'.$K$236] -> 907800 | L243: of:=[$'Results - Detailed'.$L$236] -> 0.010912 | M243: of:=[$'Results - Detailed'.$M$236] -> 0.858316
B244: of:=[$'Results - Detailed'.$B$237] -> 2530400 | C244: of:=[$'Results - Detailed'.$C$237] -> 0.003865 | D244: of:=[$'Results - Detailed'.$D$237] -> 0.522152 | E244: of:=[$'Results - Detailed'.$E$237] -> 768800 | F244: of:=[$'Results - Detailed'.$F$237] -> 0.012888 | G244: of:=[$'Results - Detailed'.$G$237] -> 1.013653 | H244: of:=[$'Results - Detailed'.$H$237] -> 2139800 | I244: of:=[$'Results - Detailed'.$I$237] -> 0.004531 | J244: of:=[$'Results - Detailed'.$J$237] -> 0.560572 | K244: of:=[$'Results - Detailed'.$K$237] -> 907800 | L244: of:=[$'Results - Detailed'.$L$237] -> 0.010901 | M244: of:=[$'Results - Detailed'.$M$237] -> 0.864643
B245: of:=[$'Results - Detailed'.$B$238] -> 2536000 | C245: of:=[$'Results - Detailed'.$C$238] -> 0.003861 | D245: of:=[$'Results - Detailed'.$D$238] -> 0.525264 | E245: of:=[$'Results - Detailed'.$E$238] -> 769800 | F245: of:=[$'Results - Detailed'.$F$238] -> 0.012915 | G245: of:=[$'Results - Detailed'.$G$238] -> 1.019349 | H245: of:=[$'Results - Detailed'.$H$238] -> 2164600 | I245: of:=[$'Results - Detailed'.$I$238] -> 0.004496 | J245: of:=[$'Results - Detailed'.$J$238] -> 0.56137 | K245: of:=[$'Results - Detailed'.$K$238] -> 909000 | L245: of:=[$'Results - Detailed'.$L$238] -> 0.010871 | M245: of:=[$'Results - Detailed'.$M$238] -> 0.87034
B246: of:=[$'Results - Detailed'.$B$239] -> 2540200 | C246: of:=[$'Results - Detailed'.$C$239] -> 0.003846 | D246: of:=[$'Results - Detailed'.$D$239] -> 0.528481 | E246: of:=[$'Results - Detailed'.$E$239] -> 768600 | F246: of:=[$'Results - Detailed'.$F$239] -> 0.012868 | G246: of:=[$'Results - Detailed'.$G$239] -> 1.026432 | H246: of:=[$'Results - Detailed'.$H$239] -> 2139000 | I246: of:=[$'Results - Detailed'.$I$239] -> 0.004545 | J246: of:=[$'Results - Detailed'.$J$239] -> 0.568729 | K246: of:=[$'Results - Detailed'.$K$239] -> 905600 | L246: of:=[$'Results - Detailed'.$L$239] -> 0.010928 | M246: of:=[$'Results - Detailed'.$M$239] -> 0.878216
B247: of:=[$'Results - Detailed'.$B$240] -> 2541200 | C247: of:=[$'Results - Detailed'.$C$240] -> 0.003849 | D247: of:=[$'Results - Detailed'.$D$240] -> 0.532007 | E247: of:=[$'Results - Detailed'.$E$240] -> 768800 | F247: of:=[$'Results - Detailed'.$F$240] -> 0.012849 | G247: of:=[$'Results - Detailed'.$G$240] -> 1.03254 | H247: of:=[$'Results - Detailed'.$H$240] -> 2155800 | I247: of:=[$'Results - Detailed'.$I$240] -> 0.004513 | J247: of:=[$'Results - Detailed'.$J$240] -> 0.570479 | K247: of:=[$'Results - Detailed'.$K$240] -> 906400 | L247: of:=[$'Results - Detailed'.$L$240] -> 0.01094 | M247: of:=[$'Results - Detailed'.$M$240] -> 0.884037
B248: of:=[$'Results - Detailed'.$B$241] -> 2529800 | C248: of:=[$'Results - Detailed'.$C$241] -> 0.003859 | D248: of:=[$'Results - Detailed'.$D$241] -> 0.53681 | E248: of:=[$'Results - Detailed'.$E$241] -> 770000 | F248: of:=[$'Results - Detailed'.$F$241] -> 0.012881 | G248: of:=[$'Results - Detailed'.$G$241] -> 1.037958 | H248: of:=[$'Results - Detailed'.$H$241] -> 2137400 | I248: of:=[$'Results - Detailed'.$I$241] -> 0.004549 | J248: of:=[$'Results - Detailed'.$J$241] -> 0.576943 | K248: of:=[$'Results - Detailed'.$K$241] -> 906000 | L248: of:=[$'Results - Detailed'.$L$241] -> 0.010912 | M248: of:=[$'Results - Detailed'.$M$241] -> 0.890382
A249: 10 | B249: of:=AVERAGE([.B219:.B248]) -> 2473566.66666667 | C249: of:=AVERAGE([.C219:.C248]) -> 0.00392976666666667 | D249: of:=AVERAGE([.D219:.D248]) -> 0.5233858 | E249: of:=AVERAGE([.E219:.E248]) -> 758740 | F249: of:=AVERAGE([.F219:.F248]) -> 0.0130622666666667 | G249: of:=AVERAGE([.G219:.G248]) -> 0.965632766666667 | H249: of:=AVERAGE([.H219:.H248]) -> 1875480 | I249: of:=AVERAGE([.I219:.I248]) -> 0.00524946666666667 | J249: of:=AVERAGE([.J219:.J248]) -> 0.612864166666667 | K249: of:=AVERAGE([.K219:.K248]) -> 887093.333333333 | L249: of:=AVERAGE([.L219:.L248]) -> 0.0111680666666667 | M249: of:=AVERAGE([.M219:.M248]) -> 0.871627766666666
A250: 12 / Results - Detailed | B250: of:=[$'Results - Detailed'.$B$242] -> 2407000 | C250: of:=[$'Results - Detailed'.$C$242] -> 0.004875 | D250: of:=[$'Results - Detailed'.$D$242] -> 0.568124 | E250: of:=[$'Results - Detailed'.$E$242] -> 674400 | F250: of:=[$'Results - Detailed'.$F$242] -> 0.017654 | G250: of:=[$'Results - Detailed'.$G$242] -> 1.069857 | H250: of:=[$'Results - Detailed'.$H$242] -> 2022800 | I250: of:=[$'Results - Detailed'.$I$242] -> 0.005829 | J250: of:=[$'Results - Detailed'.$J$242] -> 0.608271 | K250: of:=[$'Results - Detailed'.$K$242] -> 846800 | L250: of:=[$'Results - Detailed'.$L$242] -> 0.014015 | M250: of:=[$'Results - Detailed'.$M$242] -> 0.943178
B251: of:=[$'Results - Detailed'.$B$243] -> 2411200 | C251: of:=[$'Results - Detailed'.$C$243] -> 0.00487 | D251: of:=[$'Results - Detailed'.$D$243] -> 0.571902 | E251: of:=[$'Results - Detailed'.$E$243] -> 670000 | F251: of:=[$'Results - Detailed'.$F$243] -> 0.017767 | G251: of:=[$'Results - Detailed'.$G$243] -> 1.081608 | H251: of:=[$'Results - Detailed'.$H$243] -> 2020800 | I251: of:=[$'Results - Detailed'.$I$243] -> 0.005813 | J251: of:=[$'Results - Detailed'.$J$243] -> 0.613329 | K251: of:=[$'Results - Detailed'.$K$243] -> 846200 | L251: of:=[$'Results - Detailed'.$L$243] -> 0.014025 | M251: of:=[$'Results - Detailed'.$M$243] -> 0.950915
B252: of:=[$'Results - Detailed'.$B$244] -> 2407600 | C252: of:=[$'Results - Detailed'.$C$244] -> 0.004862 | D252: of:=[$'Results - Detailed'.$D$244] -> 0.576562 | E252: of:=[$'Results - Detailed'.$E$244] -> 672255 | F252: of:=[$'Results - Detailed'.$F$244] -> 0.01772 | G252: of:=[$'Results - Detailed'.$G$244] -> 1.086896 | H252: of:=[$'Results - Detailed'.$H$244] -> 2016000 | I252: of:=[$'Results - Detailed'.$I$244] -> 0.005815 | J252: of:=[$'Results - Detailed'.$J$244] -> 0.618776 | K252: of:=[$'Results - Detailed'.$K$244] -> 850000 | L252: of:=[$'Results - Detailed'.$L$244] -> 0.013974 | M252: of:=[$'Results - Detailed'.$M$244] -> 0.956123
B253: of:=[$'Results - Detailed'.$B$245] -> 2416800 | C253: of:=[$'Results - Detailed'.$C$245] -> 0.004857 | D253: of:=[$'Results - Detailed'.$D$245] -> 0.579668 | E253: of:=[$'Results - Detailed'.$E$245] -> 672000 | F253: of:=[$'Results - Detailed'.$F$245] -> 0.017729 | G253: of:=[$'Results - Detailed'.$G$245] -> 1.096305 | H253: of:=[$'Results - Detailed'.$H$245] -> 2017800 | I253: of:=[$'Results - Detailed'.$I$245] -> 0.005824 | J253: of:=[$'Results - Detailed'.$J$245] -> 0.62319 | K253: of:=[$'Results - Detailed'.$K$245] -> 846400 | L253: of:=[$'Results - Detailed'.$L$245] -> 0.014062 | M253: of:=[$'Results - Detailed'.$M$245] -> 0.965464
B254: of:=[$'Results - Detailed'.$B$246] -> 2411200 | C254: of:=[$'Results - Detailed'.$C$246] -> 0.004866 | D254: of:=[$'Results - Detailed'.$D$246] -> 0.584518 | E254: of:=[$'Results - Detailed'.$E$246] -> 667600 | F254: of:=[$'Results - Detailed'.$F$246] -> 0.017852 | G254: of:=[$'Results - Detailed'.$G$246] -> 1.107996 | H254: of:=[$'Results - Detailed'.$H$246] -> 2019000 | I254: of:=[$'Results - Detailed'.$I$246] -> 0.005817 | J254: of:=[$'Results - Detailed'.$J$246] -> 0.627656 | K254: of:=[$'Results - Detailed'.$K$246] -> 844112 | L254: of:=[$'Results - Detailed'.$L$246] -> 0.014055 | M254: of:=[$'Results - Detailed'.$M$246] -> 0.973075
B255: of:=[$'Results - Detailed'.$B$247] -> 2410200 | C255: of:=[$'Results - Detailed'.$C$247] -> 0.004872 | D255: of:=[$'Results - Detailed'.$D$247] -> 0.588791 | E255: of:=[$'Results - Detailed'.$E$247] -> 667800 | F255: of:=[$'Results - Detailed'.$F$247] -> 0.017781 | G255: of:=[$'Results - Detailed'.$G$247] -> 1.115828 | H255: of:=[$'Results - Detailed'.$H$247] -> 2015400 | I255: of:=[$'Results - Detailed'.$I$247] -> 0.005835 | J255: of:=[$'Results - Detailed'.$J$247] -> 0.632844 | K255: of:=[$'Results - Detailed'.$K$247] -> 841200 | L255: of:=[$'Results - Detailed'.$L$247] -> 0.014118 | M255: of:=[$'Results - Detailed'.$M$247] -> 0.98294
B256: of:=[$'Results - Detailed'.$B$248] -> 2415600 | C256: of:=[$'Results - Detailed'.$C$248] -> 0.004856 | D256: of:=[$'Results - Detailed'.$D$248] -> 0.592246 | E256: of:=[$'Results - Detailed'.$E$248] -> 672455 | F256: of:=[$'Results - Detailed'.$F$248] -> 0.017679 | G256: of:=[$'Results - Detailed'.$G$248] -> 1.118778 | H256: of:=[$'Results - Detailed'.$H$248] -> 2018600 | I256: of:=[$'Results - Detailed'.$I$248] -> 0.005822 | J256: of:=[$'Results - Detailed'.$J$248] -> 0.63698 | K256: of:=[$'Results - Detailed'.$K$248] -> 844800 | L256: of:=[$'Results - Detailed'.$L$248] -> 0.014044 | M256: of:=[$'Results - Detailed'.$M$248] -> 0.987977
B257: of:=[$'Results - Detailed'.$B$249] -> 2412600 | C257: of:=[$'Results - Detailed'.$C$249] -> 0.004854 | D257: of:=[$'Results - Detailed'.$D$249] -> 0.596695 | E257: of:=[$'Results - Detailed'.$E$249] -> 672200 | F257: of:=[$'Results - Detailed'.$F$249] -> 0.017751 | G257: of:=[$'Results - Detailed'.$G$249] -> 1.128004 | H257: of:=[$'Results - Detailed'.$H$249] -> 2023200 | I257: of:=[$'Results - Detailed'.$I$249] -> 0.005813 | J257: of:=[$'Results - Detailed'.$J$249] -> 0.640807 | K257: of:=[$'Results - Detailed'.$K$249] -> 843000 | L257: of:=[$'Results - Detailed'.$L$249] -> 0.014076 | M257: of:=[$'Results - Detailed'.$M$249] -> 0.996121
B258: of:=[$'Results - Detailed'.$B$250] -> 2413400 | C258: of:=[$'Results - Detailed'.$C$250] -> 0.004852 | D258: of:=[$'Results - Detailed'.$D$250] -> 0.600649 | E258: of:=[$'Results - Detailed'.$E$250] -> 672600 | F258: of:=[$'Results - Detailed'.$F$250] -> 0.017696 | G258: of:=[$'Results - Detailed'.$G$250] -> 1.135488 | H258: of:=[$'Results - Detailed'.$H$250] -> 2021000 | I258: of:=[$'Results - Detailed'.$I$250] -> 0.005832 | J258: of:=[$'Results - Detailed'.$J$250] -> 0.645687 | K258: of:=[$'Results - Detailed'.$K$250] -> 844000 | L258: of:=[$'Results - Detailed'.$L$250] -> 0.014057 | M258: of:=[$'Results - Detailed'.$M$250] -> 1.002566
B259: of:=[$'Results - Detailed'.$B$251] -> 2400800 | C259: of:=[$'Results - Detailed'.$C$251] -> 0.004873 | D259: of:=[$'Results - Detailed'.$D$251] -> 0.606256 | E259: of:=[$'Results - Detailed'.$E$251] -> 669600 | F259: of:=[$'Results - Detailed'.$F$251] -> 0.017808 | G259: of:=[$'Results - Detailed'.$G$251] -> 1.145827 | H259: of:=[$'Results - Detailed'.$H$251] -> 2016600 | I259: of:=[$'Results - Detailed'.$I$251] -> 0.005823 | J259: of:=[$'Results - Detailed'.$J$251] -> 0.65088 | K259: of:=[$'Results - Detailed'.$K$251] -> 844311 | L259: of:=[$'Results - Detailed'.$L$251] -> 0.014038 | M259: of:=[$'Results - Detailed'.$M$251] -> 1.008365
B260: of:=[$'Results - Detailed'.$B$252] -> 2502800 | C260: of:=[$'Results - Detailed'.$C$252] -> 0.004702 | D260: of:=[$'Results - Detailed'.$D$252] -> 0.548819 | E260: of:=[$'Results - Detailed'.$E$252] -> 660600 | F260: of:=[$'Results - Detailed'.$F$252] -> 0.018065 | G260: of:=[$'Results - Detailed'.$G$252] -> 1.06855 | H260: of:=[$'Results - Detailed'.$H$252] -> 1959200 | I260: of:=[$'Results - Detailed'.$I$252] -> 0.00601 | J260: of:=[$'Results - Detailed'.$J$252] -> 0.617477 | K260: of:=[$'Results - Detailed'.$K$252] -> 883200 | L260: of:=[$'Results - Detailed'.$L$252] -> 0.013431 | M260: of:=[$'Results - Detailed'.$M$252] -> 0.922506
B261: of:=[$'Results - Detailed'.$B$253] -> 2498800 | C261: of:=[$'Results - Detailed'.$C$253] -> 0.004701 | D261: of:=[$'Results - Detailed'.$D$253] -> 0.553521 | E261: of:=[$'Results - Detailed'.$E$253] -> 653600 | F261: of:=[$'Results - Detailed'.$F$253] -> 0.018188 | G261: of:=[$'Results - Detailed'.$G$253] -> 1.0827 | H261: of:=[$'Results - Detailed'.$H$253] -> 1958000 | I261: of:=[$'Results - Detailed'.$I$253] -> 0.005996 | J261: of:=[$'Results - Detailed'.$J$253] -> 0.622501 | K261: of:=[$'Results - Detailed'.$K$253] -> 879000 | L261: of:=[$'Results - Detailed'.$L$253] -> 0.01352 | M261: of:=[$'Results - Detailed'.$M$253] -> 0.931988
B262: of:=[$'Results - Detailed'.$B$254] -> 2499200 | C262: of:=[$'Results - Detailed'.$C$254] -> 0.004676 | D262: of:=[$'Results - Detailed'.$D$254] -> 0.557685 | E262: of:=[$'Results - Detailed'.$E$254] -> 649900 | F262: of:=[$'Results - Detailed'.$F$254] -> 0.018277 | G262: of:=[$'Results - Detailed'.$G$254] -> 1.093088 | H262: of:=[$'Results - Detailed'.$H$254] -> 1947800 | I262: of:=[$'Results - Detailed'.$I$254] -> 0.006033 | J262: of:=[$'Results - Detailed'.$J$254] -> 0.628943 | K262: of:=[$'Results - Detailed'.$K$254] -> 882200 | L262: of:=[$'Results - Detailed'.$L$254] -> 0.013484 | M262: of:=[$'Results - Detailed'.$M$254] -> 0.937516
B263: of:=[$'Results - Detailed'.$B$255] -> 2493400 | C263: of:=[$'Results - Detailed'.$C$255] -> 0.004686 | D263: of:=[$'Results - Detailed'.$D$255] -> 0.562514 | E263: of:=[$'Results - Detailed'.$E$255] -> 652600 | F263: of:=[$'Results - Detailed'.$F$255] -> 0.018244 | G263: of:=[$'Results - Detailed'.$G$255] -> 1.100237 | H263: of:=[$'Results - Detailed'.$H$255] -> 1950600 | I263: of:=[$'Results - Detailed'.$I$255] -> 0.006042 | J263: of:=[$'Results - Detailed'.$J$255] -> 0.63328 | K263: of:=[$'Results - Detailed'.$K$255] -> 881000 | L263: of:=[$'Results - Detailed'.$L$255] -> 0.013496 | M263: of:=[$'Results - Detailed'.$M$255] -> 0.94532
B264: of:=[$'Results - Detailed'.$B$256] -> 2489200 | C264: of:=[$'Results - Detailed'.$C$256] -> 0.0047 | D264: of:=[$'Results - Detailed'.$D$256] -> 0.567148 | E264: of:=[$'Results - Detailed'.$E$256] -> 653493 | F264: of:=[$'Results - Detailed'.$F$256] -> 0.018253 | G264: of:=[$'Results - Detailed'.$G$256] -> 1.106689 | H264: of:=[$'Results - Detailed'.$H$256] -> 1955400 | I264: of:=[$'Results - Detailed'.$I$256] -> 0.005993 | J264: of:=[$'Results - Detailed'.$J$256] -> 0.637223 | K264: of:=[$'Results - Detailed'.$K$256] -> 883600 | L264: of:=[$'Results - Detailed'.$L$256] -> 0.013436 | M264: of:=[$'Results - Detailed'.$M$256] -> 0.951019
B265: of:=[$'Results - Detailed'.$B$257] -> 2496200 | C265: of:=[$'Results - Detailed'.$C$257] -> 0.004688 | D265: of:=[$'Results - Detailed'.$D$257] -> 0.570476 | E265: of:=[$'Results - Detailed'.$E$257] -> 660400 | F265: of:=[$'Results - Detailed'.$F$257] -> 0.018022 | G265: of:=[$'Results - Detailed'.$G$257] -> 1.110137 | H265: of:=[$'Results - Detailed'.$H$257] -> 1942600 | I265: of:=[$'Results - Detailed'.$I$257] -> 0.00606 | J265: of:=[$'Results - Detailed'.$J$257] -> 0.64404 | K265: of:=[$'Results - Detailed'.$K$257] -> 877600 | L265: of:=[$'Results - Detailed'.$L$257] -> 0.013551 | M265: of:=[$'Results - Detailed'.$M$257] -> 0.961337
B266: of:=[$'Results - Detailed'.$B$258] -> 2495200 | C266: of:=[$'Results - Detailed'.$C$258] -> 0.004701 | D266: of:=[$'Results - Detailed'.$D$258] -> 0.574694 | E266: of:=[$'Results - Detailed'.$E$258] -> 649600 | F266: of:=[$'Results - Detailed'.$F$258] -> 0.018347 | G266: of:=[$'Results - Detailed'.$G$258] -> 1.127493 | H266: of:=[$'Results - Detailed'.$H$258] -> 1952200 | I266: of:=[$'Results - Detailed'.$I$258] -> 0.006023 | J266: of:=[$'Results - Detailed'.$J$258] -> 0.647125 | K266: of:=[$'Results - Detailed'.$K$258] -> 881600 | L266: of:=[$'Results - Detailed'.$L$258] -> 0.013457 | M266: of:=[$'Results - Detailed'.$M$258] -> 0.966144
B267: of:=[$'Results - Detailed'.$B$259] -> 2490400 | C267: of:=[$'Results - Detailed'.$C$259] -> 0.004707 | D267: of:=[$'Results - Detailed'.$D$259] -> 0.579325 | E267: of:=[$'Results - Detailed'.$E$259] -> 661200 | F267: of:=[$'Results - Detailed'.$F$259] -> 0.018007 | G267: of:=[$'Results - Detailed'.$G$259] -> 1.125594 | H267: of:=[$'Results - Detailed'.$H$259] -> 1959200 | I267: of:=[$'Results - Detailed'.$I$259] -> 0.005975 | J267: of:=[$'Results - Detailed'.$J$259] -> 0.650577 | K267: of:=[$'Results - Detailed'.$K$259] -> 879200 | L267: of:=[$'Results - Detailed'.$L$259] -> 0.013526 | M267: of:=[$'Results - Detailed'.$M$259] -> 0.974427
B268: of:=[$'Results - Detailed'.$B$260] -> 2497200 | C268: of:=[$'Results - Detailed'.$C$260] -> 0.004696 | D268: of:=[$'Results - Detailed'.$D$260] -> 0.58258 | E268: of:=[$'Results - Detailed'.$E$260] -> 654600 | F268: of:=[$'Results - Detailed'.$F$260] -> 0.018213 | G268: of:=[$'Results - Detailed'.$G$260] -> 1.139274 | H268: of:=[$'Results - Detailed'.$H$260] -> 1942400 | I268: of:=[$'Results - Detailed'.$I$260] -> 0.006045 | J268: of:=[$'Results - Detailed'.$J$260] -> 0.657994 | K268: of:=[$'Results - Detailed'.$K$260] -> 882600 | L268: of:=[$'Results - Detailed'.$L$260] -> 0.013438 | M268: of:=[$'Results - Detailed'.$M$260] -> 0.979433
B269: of:=[$'Results - Detailed'.$B$261] -> 2504600 | C269: of:=[$'Results - Detailed'.$C$261] -> 0.004679 | D269: of:=[$'Results - Detailed'.$D$261] -> 0.585726 | E269: of:=[$'Results - Detailed'.$E$261] -> 656800 | F269: of:=[$'Results - Detailed'.$F$261] -> 0.018136 | G269: of:=[$'Results - Detailed'.$G$261] -> 1.14531 | H269: of:=[$'Results - Detailed'.$H$261] -> 1944400 | I269: of:=[$'Results - Detailed'.$I$261] -> 0.006044 | J269: of:=[$'Results - Detailed'.$J$261] -> 0.662234 | K269: of:=[$'Results - Detailed'.$K$261] -> 879400 | L269: of:=[$'Results - Detailed'.$L$261] -> 0.01353 | M269: of:=[$'Results - Detailed'.$M$261] -> 0.988083
B270: of:=[$'Results - Detailed'.$B$262] -> 2280000 | C270: of:=[$'Results - Detailed'.$C$262] -> 0.005149 | D270: of:=[$'Results - Detailed'.$D$262] -> 0.572356 | E270: of:=[$'Results - Detailed'.$E$262] -> 684200 | F270: of:=[$'Results - Detailed'.$F$262] -> 0.017404 | G270: of:=[$'Results - Detailed'.$G$262] -> 1.054798 | H270: of:=[$'Results - Detailed'.$H$262] -> 1920400 | I270: of:=[$'Results - Detailed'.$I$262] -> 0.006123 | J270: of:=[$'Results - Detailed'.$J$262] -> 0.634369 | K270: of:=[$'Results - Detailed'.$K$262] -> 865200 | L270: of:=[$'Results - Detailed'.$L$262] -> 0.013747 | M270: of:=[$'Results - Detailed'.$M$262] -> 0.939486
B271: of:=[$'Results - Detailed'.$B$263] -> 2279800 | C271: of:=[$'Results - Detailed'.$C$263] -> 0.005157 | D271: of:=[$'Results - Detailed'.$D$263] -> 0.576868 | E271: of:=[$'Results - Detailed'.$E$263] -> 683034 | F271: of:=[$'Results - Detailed'.$F$263] -> 0.01744 | G271: of:=[$'Results - Detailed'.$G$263] -> 1.062883 | H271: of:=[$'Results - Detailed'.$H$263] -> 1927200 | I271: of:=[$'Results - Detailed'.$I$263] -> 0.006114 | J271: of:=[$'Results - Detailed'.$J$263] -> 0.638057 | K271: of:=[$'Results - Detailed'.$K$263] -> 863400 | L271: of:=[$'Results - Detailed'.$L$263] -> 0.013725 | M271: of:=[$'Results - Detailed'.$M$263] -> 0.947734
B272: of:=[$'Results - Detailed'.$B$264] -> 2289800 | C272: of:=[$'Results - Detailed'.$C$264] -> 0.005119 | D272: of:=[$'Results - Detailed'.$D$264] -> 0.580037 | E272: of:=[$'Results - Detailed'.$E$264] -> 681600 | F272: of:=[$'Results - Detailed'.$F$264] -> 0.017468 | G272: of:=[$'Results - Detailed'.$G$264] -> 1.073233 | H272: of:=[$'Results - Detailed'.$H$264] -> 1909600 | I272: of:=[$'Results - Detailed'.$I$264] -> 0.006151 | J272: of:=[$'Results - Detailed'.$J$264] -> 0.645771 | K272: of:=[$'Results - Detailed'.$K$264] -> 863400 | L272: of:=[$'Results - Detailed'.$L$264] -> 0.01378 | M272: of:=[$'Results - Detailed'.$M$264] -> 0.954976
B273: of:=[$'Results - Detailed'.$B$265] -> 2289600 | C273: of:=[$'Results - Detailed'.$C$265] -> 0.005121 | D273: of:=[$'Results - Detailed'.$D$265] -> 0.584459 | E273: of:=[$'Results - Detailed'.$E$265] -> 683832 | F273: of:=[$'Results - Detailed'.$F$265] -> 0.017391 | G273: of:=[$'Results - Detailed'.$G$265] -> 1.078511 | H273: of:=[$'Results - Detailed'.$H$265] -> 1920400 | I273: of:=[$'Results - Detailed'.$I$265] -> 0.006135 | J273: of:=[$'Results - Detailed'.$J$265] -> 0.648699 | K273: of:=[$'Results - Detailed'.$K$265] -> 860600 | L273: of:=[$'Results - Detailed'.$L$265] -> 0.013811 | M273: of:=[$'Results - Detailed'.$M$265] -> 0.96372
B274: of:=[$'Results - Detailed'.$B$266] -> 2295000 | C274: of:=[$'Results - Detailed'.$C$266] -> 0.00513 | D274: of:=[$'Results - Detailed'.$D$266] -> 0.588149 | E274: of:=[$'Results - Detailed'.$E$266] -> 679000 | F274: of:=[$'Results - Detailed'.$F$266] -> 0.017541 | G274: of:=[$'Results - Detailed'.$G$266] -> 1.091493 | H274: of:=[$'Results - Detailed'.$H$266] -> 1930200 | I274: of:=[$'Results - Detailed'.$I$266] -> 0.006102 | J274: of:=[$'Results - Detailed'.$J$266] -> 0.651748 | K274: of:=[$'Results - Detailed'.$K$266] -> 862400 | L274: of:=[$'Results - Detailed'.$L$266] -> 0.013799 | M274: of:=[$'Results - Detailed'.$M$266] -> 0.969854
B275: of:=[$'Results - Detailed'.$B$267] -> 2288600 | C275: of:=[$'Results - Detailed'.$C$267] -> 0.005125 | D275: of:=[$'Results - Detailed'.$D$267] -> 0.593305 | E275: of:=[$'Results - Detailed'.$E$267] -> 680600 | F275: of:=[$'Results - Detailed'.$F$267] -> 0.017505 | G275: of:=[$'Results - Detailed'.$G$267] -> 1.098208 | H275: of:=[$'Results - Detailed'.$H$267] -> 1910200 | I275: of:=[$'Results - Detailed'.$I$267] -> 0.006149 | J275: of:=[$'Results - Detailed'.$J$267] -> 0.659827 | K275: of:=[$'Results - Detailed'.$K$267] -> 864600 | L275: of:=[$'Results - Detailed'.$L$267] -> 0.013736 | M275: of:=[$'Results - Detailed'.$M$267] -> 0.975685
B276: of:=[$'Results - Detailed'.$B$268] -> 2271600 | C276: of:=[$'Results - Detailed'.$C$268] -> 0.005166 | D276: of:=[$'Results - Detailed'.$D$268] -> 0.599842 | E276: of:=[$'Results - Detailed'.$E$268] -> 652495 | F276: of:=[$'Results - Detailed'.$F$268] -> 0.018238 | G276: of:=[$'Results - Detailed'.$G$268] -> 1.128607 | H276: of:=[$'Results - Detailed'.$H$268] -> 1911400 | I276: of:=[$'Results - Detailed'.$I$268] -> 0.006141 | J276: of:=[$'Results - Detailed'.$J$268] -> 0.664259 | K276: of:=[$'Results - Detailed'.$K$268] -> 863800 | L276: of:=[$'Results - Detailed'.$L$268] -> 0.01376 | M276: of:=[$'Results - Detailed'.$M$268] -> 0.983159
B277: of:=[$'Results - Detailed'.$B$269] -> 2279000 | C277: of:=[$'Results - Detailed'.$C$269] -> 0.005137 | D277: of:=[$'Results - Detailed'.$D$269] -> 0.60319 | E277: of:=[$'Results - Detailed'.$E$269] -> 655600 | F277: of:=[$'Results - Detailed'.$F$269] -> 0.018145 | G277: of:=[$'Results - Detailed'.$G$269] -> 1.135079 | H277: of:=[$'Results - Detailed'.$H$269] -> 1924800 | I277: of:=[$'Results - Detailed'.$I$269] -> 0.006109 | J277: of:=[$'Results - Detailed'.$J$269] -> 0.666541 | K277: of:=[$'Results - Detailed'.$K$269] -> 861000 | L277: of:=[$'Results - Detailed'.$L$269] -> 0.01381 | M277: of:=[$'Results - Detailed'.$M$269] -> 0.991743
B278: of:=[$'Results - Detailed'.$B$270] -> 2277800 | C278: of:=[$'Results - Detailed'.$C$270] -> 0.005157 | D278: of:=[$'Results - Detailed'.$D$270] -> 0.607607 | E278: of:=[$'Results - Detailed'.$E$270] -> 654800 | F278: of:=[$'Results - Detailed'.$F$270] -> 0.018152 | G278: of:=[$'Results - Detailed'.$G$270] -> 1.143736 | H278: of:=[$'Results - Detailed'.$H$270] -> 1902800 | I278: of:=[$'Results - Detailed'.$I$270] -> 0.006186 | J278: of:=[$'Results - Detailed'.$J$270] -> 0.674981 | K278: of:=[$'Results - Detailed'.$K$270] -> 861600 | L278: of:=[$'Results - Detailed'.$L$270] -> 0.013784 | M278: of:=[$'Results - Detailed'.$M$270] -> 0.998325
B279: of:=[$'Results - Detailed'.$B$271] -> 2280800 | C279: of:=[$'Results - Detailed'.$C$271] -> 0.005149 | D279: of:=[$'Results - Detailed'.$D$271] -> 0.611432 | E279: of:=[$'Results - Detailed'.$E$271] -> 650299 | F279: of:=[$'Results - Detailed'.$F$271] -> 0.018238 | G279: of:=[$'Results - Detailed'.$G$271] -> 1.154469 | H279: of:=[$'Results - Detailed'.$H$271] -> 1918800 | I279: of:=[$'Results - Detailed'.$I$271] -> 0.006155 | J279: of:=[$'Results - Detailed'.$J$271] -> 0.676723 | K279: of:=[$'Results - Detailed'.$K$271] -> 863600 | L279: of:=[$'Results - Detailed'.$L$271] -> 0.013777 | M279: of:=[$'Results - Detailed'.$M$271] -> 1.004053
A280: 12 | B280: of:=AVERAGE([.B250:.B279]) -> 2396846.66666667 | C280: of:=AVERAGE([.C250:.C279]) -> 0.00489943333333333 | D280: of:=AVERAGE([.D250:.D279]) -> 0.582171466666667 | E280: of:=AVERAGE([.E250:.E279]) -> 665638.766666667 | F280: of:=AVERAGE([.F250:.F279]) -> 0.0178903666666667 | G280: of:=AVERAGE([.G250:.G279]) -> 1.1068892 | H280: of:=AVERAGE([.H250:.H279]) -> 1962626.66666667 | I280: of:=AVERAGE([.I250:.I279]) -> 0.00599363333333333 | J280: of:=AVERAGE([.J250:.J279]) -> 0.6420263 | K280: of:=AVERAGE([.K250:.K279]) -> 862994.1 | L280: of:=AVERAGE([.L250:.L279]) -> 0.0137687333333333 | M280: of:=AVERAGE([.M250:.M279]) -> 0.968441066666667
A281: 14 / Results - Detailed | B281: of:=[$'Results - Detailed'.$B$272] -> 2343400 | C281: of:=[$'Results - Detailed'.$C$272] -> 0.005862 | D281: of:=[$'Results - Detailed'.$D$272] -> 0.631636 | E281: of:=[$'Results - Detailed'.$E$272] -> 458483 | F281: of:=[$'Results - Detailed'.$F$272] -> 0.030392 | G281: of:=[$'Results - Detailed'.$G$272] -> 1.39808 | H281: of:=[$'Results - Detailed'.$H$272] -> 1875600 | I281: of:=[$'Results - Detailed'.$I$272] -> 0.007327 | J281: of:=[$'Results - Detailed'.$J$272] -> 0.720961 | K281: of:=[$'Results - Detailed'.$K$272] -> 887400 | L281: of:=[$'Results - Detailed'.$L$272] -> 0.015693 | M281: of:=[$'Results - Detailed'.$M$272] -> 1.003673
B282: of:=[$'Results - Detailed'.$B$273] -> 2339000 | C282: of:=[$'Results - Detailed'.$C$273] -> 0.005865 | D282: of:=[$'Results - Detailed'.$D$273] -> 0.636851 | E282: of:=[$'Results - Detailed'.$E$273] -> 447505 | F282: of:=[$'Results - Detailed'.$F$273] -> 0.031169 | G282: of:=[$'Results - Detailed'.$G$273] -> 1.426261 | H282: of:=[$'Results - Detailed'.$H$273] -> 1878400 | I282: of:=[$'Results - Detailed'.$I$273] -> 0.007328 | J282: of:=[$'Results - Detailed'.$J$273] -> 0.725492 | K282: of:=[$'Results - Detailed'.$K$273] -> 887600 | L282: of:=[$'Results - Detailed'.$L$273] -> 0.015667 | M282: of:=[$'Results - Detailed'.$M$273] -> 1.011336
B283: of:=[$'Results - Detailed'.$B$274] -> 2339200 | C283: of:=[$'Results - Detailed'.$C$274] -> 0.005848 | D283: of:=[$'Results - Detailed'.$D$274] -> 0.641399 | E283: of:=[$'Results - Detailed'.$E$274] -> 452988 | F283: of:=[$'Results - Detailed'.$F$274] -> 0.030761 | G283: of:=[$'Results - Detailed'.$G$274] -> 1.427244 | H283: of:=[$'Results - Detailed'.$H$274] -> 1869200 | I283: of:=[$'Results - Detailed'.$I$274] -> 0.007353 | J283: of:=[$'Results - Detailed'.$J$274] -> 0.732312 | K283: of:=[$'Results - Detailed'.$K$274] -> 887600 | L283: of:=[$'Results - Detailed'.$L$274] -> 0.015671 | M283: of:=[$'Results - Detailed'.$M$274] -> 1.019055
B284: of:=[$'Results - Detailed'.$B$275] -> 2352000 | C284: of:=[$'Results - Detailed'.$C$275] -> 0.005817 | D284: of:=[$'Results - Detailed'.$D$275] -> 0.644183 | E284: of:=[$'Results - Detailed'.$E$275] -> 458084 | F284: of:=[$'Results - Detailed'.$F$275] -> 0.030318 | G284: of:=[$'Results - Detailed'.$G$275] -> 1.431546 | H284: of:=[$'Results - Detailed'.$H$275] -> 1871800 | I284: of:=[$'Results - Detailed'.$I$275] -> 0.007354 | J284: of:=[$'Results - Detailed'.$J$275] -> 0.736811 | K284: of:=[$'Results - Detailed'.$K$275] -> 886000 | L284: of:=[$'Results - Detailed'.$L$275] -> 0.015688 | M284: of:=[$'Results - Detailed'.$M$275] -> 1.027636
B285: of:=[$'Results - Detailed'.$B$276] -> 2343200 | C285: of:=[$'Results - Detailed'.$C$276] -> 0.005856 | D285: of:=[$'Results - Detailed'.$D$276] -> 0.649912 | E285: of:=[$'Results - Detailed'.$E$276] -> 453293 | F285: of:=[$'Results - Detailed'.$F$276] -> 0.030749 | G285: of:=[$'Results - Detailed'.$G$276] -> 1.449929 | H285: of:=[$'Results - Detailed'.$H$276] -> 1879800 | I285: of:=[$'Results - Detailed'.$I$276] -> 0.007314 | J285: of:=[$'Results - Detailed'.$J$276] -> 0.740199 | K285: of:=[$'Results - Detailed'.$K$276] -> 887600 | L285: of:=[$'Results - Detailed'.$L$276] -> 0.015678 | M285: of:=[$'Results - Detailed'.$M$276] -> 1.034316
B286: of:=[$'Results - Detailed'.$B$277] -> 2345400 | C286: of:=[$'Results - Detailed'.$C$277] -> 0.005845 | D286: of:=[$'Results - Detailed'.$D$277] -> 0.65409 | E286: of:=[$'Results - Detailed'.$E$277] -> 453493 | F286: of:=[$'Results - Detailed'.$F$277] -> 0.030682 | G286: of:=[$'Results - Detailed'.$G$277] -> 1.460403 | H286: of:=[$'Results - Detailed'.$H$277] -> 1863600 | I286: of:=[$'Results - Detailed'.$I$277] -> 0.007386 | J286: of:=[$'Results - Detailed'.$J$277] -> 0.74836 | K286: of:=[$'Results - Detailed'.$K$277] -> 886600 | L286: of:=[$'Results - Detailed'.$L$277] -> 0.015685 | M286: of:=[$'Results - Detailed'.$M$277] -> 1.04245
B287: of:=[$'Results - Detailed'.$B$278] -> 2342200 | C287: of:=[$'Results - Detailed'.$C$278] -> 0.005862 | D287: of:=[$'Results - Detailed'.$D$278] -> 0.659 | E287: of:=[$'Results - Detailed'.$E$278] -> 454291 | F287: of:=[$'Results - Detailed'.$F$278] -> 0.03062 | G287: of:=[$'Results - Detailed'.$G$278] -> 1.469811 | H287: of:=[$'Results - Detailed'.$H$278] -> 1864200 | I287: of:=[$'Results - Detailed'.$I$278] -> 0.00738 | J287: of:=[$'Results - Detailed'.$J$278] -> 0.753155 | K287: of:=[$'Results - Detailed'.$K$278] -> 887000 | L287: of:=[$'Results - Detailed'.$L$278] -> 0.015651 | M287: of:=[$'Results - Detailed'.$M$278] -> 1.049697
B288: of:=[$'Results - Detailed'.$B$279] -> 2338800 | C288: of:=[$'Results - Detailed'.$C$279] -> 0.005862 | D288: of:=[$'Results - Detailed'.$D$279] -> 0.663908 | E288: of:=[$'Results - Detailed'.$E$279] -> 461800 | F288: of:=[$'Results - Detailed'.$F$279] -> 0.030169 | G288: of:=[$'Results - Detailed'.$G$279] -> 1.469741 | H288: of:=[$'Results - Detailed'.$H$279] -> 1862800 | I288: of:=[$'Results - Detailed'.$I$279] -> 0.00738 | J288: of:=[$'Results - Detailed'.$J$279] -> 0.75832 | K288: of:=[$'Results - Detailed'.$K$279] -> 882000 | L288: of:=[$'Results - Detailed'.$L$279] -> 0.015773 | M288: of:=[$'Results - Detailed'.$M$279] -> 1.060132
B289: of:=[$'Results - Detailed'.$B$280] -> 2338200 | C289: of:=[$'Results - Detailed'.$C$280] -> 0.005869 | D289: of:=[$'Results - Detailed'.$D$280] -> 0.668398 | E289: of:=[$'Results - Detailed'.$E$280] -> 446906 | F289: of:=[$'Results - Detailed'.$F$280] -> 0.031197 | G289: of:=[$'Results - Detailed'.$G$280] -> 1.503233 | H289: of:=[$'Results - Detailed'.$H$280] -> 1867400 | I289: of:=[$'Results - Detailed'.$I$280] -> 0.007359 | J289: of:=[$'Results - Detailed'.$J$280] -> 0.762247 | K289: of:=[$'Results - Detailed'.$K$280] -> 882200 | L289: of:=[$'Results - Detailed'.$L$280] -> 0.015781 | M289: of:=[$'Results - Detailed'.$M$280] -> 1.067513
B290: of:=[$'Results - Detailed'.$B$281] -> 2342800 | C290: of:=[$'Results - Detailed'.$C$281] -> 0.00585 | D290: of:=[$'Results - Detailed'.$D$281] -> 0.672108 | E290: of:=[$'Results - Detailed'.$E$281] -> 450299 | F290: of:=[$'Results - Detailed'.$F$281] -> 0.030918 | G290: of:=[$'Results - Detailed'.$G$281] -> 1.507985 | H290: of:=[$'Results - Detailed'.$H$281] -> 1871000 | I290: of:=[$'Results - Detailed'.$I$281] -> 0.007323 | J290: of:=[$'Results - Detailed'.$J$281] -> 0.766307 | K290: of:=[$'Results - Detailed'.$K$281] -> 885400 | L290: of:=[$'Results - Detailed'.$L$281] -> 0.015695 | M290: of:=[$'Results - Detailed'.$M$281] -> 1.072922
B291: of:=[$'Results - Detailed'.$B$282] -> 2325800 | C291: of:=[$'Results - Detailed'.$C$282] -> 0.005911 | D291: of:=[$'Results - Detailed'.$D$282] -> 0.612654 | E291: of:=[$'Results - Detailed'.$E$282] -> 441717 | F291: of:=[$'Results - Detailed'.$F$282] -> 0.031586 | G291: of:=[$'Results - Detailed'.$G$282] -> 1.431107 | H291: of:=[$'Results - Detailed'.$H$282] -> 2004000 | I291: of:=[$'Results - Detailed'.$I$282] -> 0.006856 | J291: of:=[$'Results - Detailed'.$J$282] -> 0.68823 | K291: of:=[$'Results - Detailed'.$K$282] -> 838000 | L291: of:=[$'Results - Detailed'.$L$282] -> 0.016597 | M291: of:=[$'Results - Detailed'.$M$282] -> 1.025578
B292: of:=[$'Results - Detailed'.$B$283] -> 2323400 | C292: of:=[$'Results - Detailed'.$C$283] -> 0.005901 | D292: of:=[$'Results - Detailed'.$D$283] -> 0.617765 | E292: of:=[$'Results - Detailed'.$E$283] -> 447800 | F292: of:=[$'Results - Detailed'.$F$283] -> 0.031179 | G292: of:=[$'Results - Detailed'.$G$283] -> 1.433958 | H292: of:=[$'Results - Detailed'.$H$283] -> 2021000 | I292: of:=[$'Results - Detailed'.$I$283] -> 0.006803 | J292: of:=[$'Results - Detailed'.$J$283] -> 0.690275 | K292: of:=[$'Results - Detailed'.$K$283] -> 839000 | L292: of:=[$'Results - Detailed'.$L$283] -> 0.016524 | M292: of:=[$'Results - Detailed'.$M$283] -> 1.032997
B293: of:=[$'Results - Detailed'.$B$284] -> 2324400 | C293: of:=[$'Results - Detailed'.$C$284] -> 0.005882 | D293: of:=[$'Results - Detailed'.$D$284] -> 0.622376 | E293: of:=[$'Results - Detailed'.$E$284] -> 442315 | F293: of:=[$'Results - Detailed'.$F$284] -> 0.031471 | G293: of:=[$'Results - Detailed'.$G$284] -> 1.452586 | H293: of:=[$'Results - Detailed'.$H$284] -> 2005200 | I293: of:=[$'Results - Detailed'.$I$284] -> 0.006839 | J293: of:=[$'Results - Detailed'.$J$284] -> 0.697906 | K293: of:=[$'Results - Detailed'.$K$284] -> 837126 | L293: of:=[$'Results - Detailed'.$L$284] -> 0.016588 | M293: of:=[$'Results - Detailed'.$M$284] -> 1.041117
B294: of:=[$'Results - Detailed'.$B$285] -> 2320400 | C294: of:=[$'Results - Detailed'.$C$285] -> 0.005903 | D294: of:=[$'Results - Detailed'.$D$285] -> 0.627632 | E294: of:=[$'Results - Detailed'.$E$285] -> 444112 | F294: of:=[$'Results - Detailed'.$F$285] -> 0.031321 | G294: of:=[$'Results - Detailed'.$G$285] -> 1.460727 | H294: of:=[$'Results - Detailed'.$H$285] -> 2017000 | I294: of:=[$'Results - Detailed'.$I$285] -> 0.006805 | J294: of:=[$'Results - Detailed'.$J$285] -> 0.700734 | K294: of:=[$'Results - Detailed'.$K$285] -> 838800 | L294: of:=[$'Results - Detailed'.$L$285] -> 0.016552 | M294: of:=[$'Results - Detailed'.$M$285] -> 1.049036
B295: of:=[$'Results - Detailed'.$B$286] -> 2327600 | C295: of:=[$'Results - Detailed'.$C$286] -> 0.005901 | D295: of:=[$'Results - Detailed'.$D$286] -> 0.631352 | E295: of:=[$'Results - Detailed'.$E$286] -> 453000 | F295: of:=[$'Results - Detailed'.$F$286] -> 0.030795 | G295: of:=[$'Results - Detailed'.$G$286] -> 1.458658 | H295: of:=[$'Results - Detailed'.$H$286] -> 2023800 | I295: of:=[$'Results - Detailed'.$I$286] -> 0.006766 | J295: of:=[$'Results - Detailed'.$J$286] -> 0.704376 | K295: of:=[$'Results - Detailed'.$K$286] -> 836727 | L295: of:=[$'Results - Detailed'.$L$286] -> 0.01656 | M295: of:=[$'Results - Detailed'.$M$286] -> 1.057148
B296: of:=[$'Results - Detailed'.$B$287] -> 2325400 | C296: of:=[$'Results - Detailed'.$C$287] -> 0.005891 | D296: of:=[$'Results - Detailed'.$D$287] -> 0.636297 | E296: of:=[$'Results - Detailed'.$E$287] -> 444800 | F296: of:=[$'Results - Detailed'.$F$287] -> 0.031376 | G296: of:=[$'Results - Detailed'.$G$287] -> 1.482958 | H296: of:=[$'Results - Detailed'.$H$287] -> 2023200 | I296: of:=[$'Results - Detailed'.$I$287] -> 0.006788 | J296: of:=[$'Results - Detailed'.$J$287] -> 0.709282 | K296: of:=[$'Results - Detailed'.$K$287] -> 836400 | L296: of:=[$'Results - Detailed'.$L$287] -> 0.016602 | M296: of:=[$'Results - Detailed'.$M$287] -> 1.066225
B297: of:=[$'Results - Detailed'.$B$288] -> 2334200 | C297: of:=[$'Results - Detailed'.$C$288] -> 0.005867 | D297: of:=[$'Results - Detailed'.$D$288] -> 0.639698 | E297: of:=[$'Results - Detailed'.$E$288] -> 444511 | F297: of:=[$'Results - Detailed'.$F$288] -> 0.031325 | G297: of:=[$'Results - Detailed'.$G$288] -> 1.492839 | H297: of:=[$'Results - Detailed'.$H$288] -> 2010200 | I297: of:=[$'Results - Detailed'.$I$288] -> 0.006846 | J297: of:=[$'Results - Detailed'.$J$288] -> 0.716366 | K297: of:=[$'Results - Detailed'.$K$288] -> 834731 | L297: of:=[$'Results - Detailed'.$L$288] -> 0.016585 | M297: of:=[$'Results - Detailed'.$M$288] -> 1.073975
B298: of:=[$'Results - Detailed'.$B$289] -> 2325000 | C298: of:=[$'Results - Detailed'.$C$289] -> 0.005892 | D298: of:=[$'Results - Detailed'.$D$289] -> 0.645543 | E298: of:=[$'Results - Detailed'.$E$289] -> 443313 | F298: of:=[$'Results - Detailed'.$F$289] -> 0.031387 | G298: of:=[$'Results - Detailed'.$G$289] -> 1.505609 | H298: of:=[$'Results - Detailed'.$H$289] -> 2016400 | I298: of:=[$'Results - Detailed'.$I$289] -> 0.00681 | J298: of:=[$'Results - Detailed'.$J$289] -> 0.720009 | K298: of:=[$'Results - Detailed'.$K$289] -> 836400 | L298: of:=[$'Results - Detailed'.$L$289] -> 0.016609 | M298: of:=[$'Results - Detailed'.$M$289] -> 1.081679
B299: of:=[$'Results - Detailed'.$B$290] -> 2336600 | C299: of:=[$'Results - Detailed'.$C$290] -> 0.005857 | D299: of:=[$'Results - Detailed'.$D$290] -> 0.648471 | E299: of:=[$'Results - Detailed'.$E$290] -> 443114 | F299: of:=[$'Results - Detailed'.$F$290] -> 0.031428 | G299: of:=[$'Results - Detailed'.$G$290] -> 1.516598 | H299: of:=[$'Results - Detailed'.$H$290] -> 2010800 | I299: of:=[$'Results - Detailed'.$I$290] -> 0.006827 | J299: of:=[$'Results - Detailed'.$J$290] -> 0.725729 | K299: of:=[$'Results - Detailed'.$K$290] -> 836000 | L299: of:=[$'Results - Detailed'.$L$290] -> 0.016639 | M299: of:=[$'Results - Detailed'.$M$290] -> 1.0896
B300: of:=[$'Results - Detailed'.$B$291] -> 2335400 | C300: of:=[$'Results - Detailed'.$C$291] -> 0.005881 | D300: of:=[$'Results - Detailed'.$D$291] -> 0.653155 | E300: of:=[$'Results - Detailed'.$E$291] -> 442515 | F300: of:=[$'Results - Detailed'.$F$291] -> 0.031443 | G300: of:=[$'Results - Detailed'.$G$291] -> 1.528229 | H300: of:=[$'Results - Detailed'.$H$291] -> 2017800 | I300: of:=[$'Results - Detailed'.$I$291] -> 0.006822 | J300: of:=[$'Results - Detailed'.$J$291] -> 0.729163 | K300: of:=[$'Results - Detailed'.$K$291] -> 835928 | L300: of:=[$'Results - Detailed'.$L$291] -> 0.016588 | M300: of:=[$'Results - Detailed'.$M$291] -> 1.096152
B301: of:=[$'Results - Detailed'.$B$292] -> 2293000 | C301: of:=[$'Results - Detailed'.$C$292] -> 0.005987 | D301: of:=[$'Results - Detailed'.$D$292] -> 0.639157 | E301: of:=[$'Results - Detailed'.$E$292] -> 482435 | F301: of:=[$'Results - Detailed'.$F$292] -> 0.028829 | G301: of:=[$'Results - Detailed'.$G$292] -> 1.357329 | H301: of:=[$'Results - Detailed'.$H$292] -> 2001200 | I301: of:=[$'Results - Detailed'.$I$292] -> 0.006894 | J301: of:=[$'Results - Detailed'.$J$292] -> 0.668456 | K301: of:=[$'Results - Detailed'.$K$292] -> 840600 | L301: of:=[$'Results - Detailed'.$L$292] -> 0.01655 | M301: of:=[$'Results - Detailed'.$M$292] -> 1.032071
B302: of:=[$'Results - Detailed'.$B$293] -> 2289000 | C302: of:=[$'Results - Detailed'.$C$293] -> 0.006014 | D302: of:=[$'Results - Detailed'.$D$293] -> 0.644398 | E302: of:=[$'Results - Detailed'.$E$293] -> 473653 | F302: of:=[$'Results - Detailed'.$F$293] -> 0.029326 | G302: of:=[$'Results - Detailed'.$G$293] -> 1.380601 | H302: of:=[$'Results - Detailed'.$H$293] -> 2009800 | I302: of:=[$'Results - Detailed'.$I$293] -> 0.006843 | J302: of:=[$'Results - Detailed'.$J$293] -> 0.672135 | K302: of:=[$'Results - Detailed'.$K$293] -> 837725 | L302: of:=[$'Results - Detailed'.$L$293] -> 0.016581 | M302: of:=[$'Results - Detailed'.$M$293] -> 1.040804
B303: of:=[$'Results - Detailed'.$B$294] -> 2280600 | C303: of:=[$'Results - Detailed'.$C$294] -> 0.006016 | D303: of:=[$'Results - Detailed'.$D$294] -> 0.650227 | E303: of:=[$'Results - Detailed'.$E$294] -> 475250 | F303: of:=[$'Results - Detailed'.$F$294] -> 0.029273 | G303: of:=[$'Results - Detailed'.$G$294] -> 1.389028 | H303: of:=[$'Results - Detailed'.$H$294] -> 2019200 | I303: of:=[$'Results - Detailed'.$I$294] -> 0.006791 | J303: of:=[$'Results - Detailed'.$J$294] -> 0.675613 | K303: of:=[$'Results - Detailed'.$K$294] -> 842200 | L303: of:=[$'Results - Detailed'.$L$294] -> 0.016464 | M303: of:=[$'Results - Detailed'.$M$294] -> 1.046966
B304: of:=[$'Results - Detailed'.$B$295] -> 2281200 | C304: of:=[$'Results - Detailed'.$C$295] -> 0.006032 | D304: of:=[$'Results - Detailed'.$D$295] -> 0.654763 | E304: of:=[$'Results - Detailed'.$E$295] -> 484000 | F304: of:=[$'Results - Detailed'.$F$295] -> 0.028822 | G304: of:=[$'Results - Detailed'.$G$295] -> 1.388429 | H304: of:=[$'Results - Detailed'.$H$295] -> 2010200 | I304: of:=[$'Results - Detailed'.$I$295] -> 0.006847 | J304: of:=[$'Results - Detailed'.$J$295] -> 0.682161 | K304: of:=[$'Results - Detailed'.$K$295] -> 842000 | L304: of:=[$'Results - Detailed'.$L$295] -> 0.016513 | M304: of:=[$'Results - Detailed'.$M$295] -> 1.054946
B305: of:=[$'Results - Detailed'.$B$296] -> 2277800 | C305: of:=[$'Results - Detailed'.$C$296] -> 0.006041 | D305: of:=[$'Results - Detailed'.$D$296] -> 0.659845 | E305: of:=[$'Results - Detailed'.$E$296] -> 493613 | F305: of:=[$'Results - Detailed'.$F$296] -> 0.028233 | G305: of:=[$'Results - Detailed'.$G$296] -> 1.383792 | H305: of:=[$'Results - Detailed'.$H$296] -> 2005200 | I305: of:=[$'Results - Detailed'.$I$296] -> 0.00687 | J305: of:=[$'Results - Detailed'.$J$296] -> 0.688022 | K305: of:=[$'Results - Detailed'.$K$296] -> 843600 | L305: of:=[$'Results - Detailed'.$L$296] -> 0.016501 | M305: of:=[$'Results - Detailed'.$M$296] -> 1.061744
B306: of:=[$'Results - Detailed'.$B$297] -> 2287400 | C306: of:=[$'Results - Detailed'.$C$297] -> 0.005994 | D306: of:=[$'Results - Detailed'.$D$297] -> 0.662995 | E306: of:=[$'Results - Detailed'.$E$297] -> 487824 | F306: of:=[$'Results - Detailed'.$F$297] -> 0.028502 | G306: of:=[$'Results - Detailed'.$G$297] -> 1.402258 | H306: of:=[$'Results - Detailed'.$H$297] -> 2009600 | I306: of:=[$'Results - Detailed'.$I$297] -> 0.006837 | J306: of:=[$'Results - Detailed'.$J$297] -> 0.692225 | K306: of:=[$'Results - Detailed'.$K$297] -> 842400 | L306: of:=[$'Results - Detailed'.$L$297] -> 0.016531 | M306: of:=[$'Results - Detailed'.$M$297] -> 1.070251
B307: of:=[$'Results - Detailed'.$B$298] -> 2281600 | C307: of:=[$'Results - Detailed'.$C$298] -> 0.006008 | D307: of:=[$'Results - Detailed'.$D$298] -> 0.668347 | E307: of:=[$'Results - Detailed'.$E$298] -> 483200 | F307: of:=[$'Results - Detailed'.$F$298] -> 0.02887 | G307: of:=[$'Results - Detailed'.$G$298] -> 1.420682 | H307: of:=[$'Results - Detailed'.$H$298] -> 2023400 | I307: of:=[$'Results - Detailed'.$I$298] -> 0.006785 | J307: of:=[$'Results - Detailed'.$J$298] -> 0.69476 | K307: of:=[$'Results - Detailed'.$K$298] -> 841916 | L307: of:=[$'Results - Detailed'.$L$298] -> 0.016475 | M307: of:=[$'Results - Detailed'.$M$298] -> 1.077164
B308: of:=[$'Results - Detailed'.$B$299] -> 2279200 | C308: of:=[$'Results - Detailed'.$C$299] -> 0.006028 | D308: of:=[$'Results - Detailed'.$D$299] -> 0.673191 | E308: of:=[$'Results - Detailed'.$E$299] -> 479840 | F308: of:=[$'Results - Detailed'.$F$299] -> 0.028989 | G308: of:=[$'Results - Detailed'.$G$299] -> 1.434497 | H308: of:=[$'Results - Detailed'.$H$299] -> 2012400 | I308: of:=[$'Results - Detailed'.$I$299] -> 0.006822 | J308: of:=[$'Results - Detailed'.$J$299] -> 0.701535 | K308: of:=[$'Results - Detailed'.$K$299] -> 841600 | L308: of:=[$'Results - Detailed'.$L$299] -> 0.016526 | M308: of:=[$'Results - Detailed'.$M$299] -> 1.086078
B309: of:=[$'Results - Detailed'.$B$300] -> 2282400 | C309: of:=[$'Results - Detailed'.$C$300] -> 0.006003 | D309: of:=[$'Results - Detailed'.$D$300] -> 0.677166 | E309: of:=[$'Results - Detailed'.$E$300] -> 484830 | F309: of:=[$'Results - Detailed'.$F$300] -> 0.028699 | G309: of:=[$'Results - Detailed'.$G$300] -> 1.437211 | H309: of:=[$'Results - Detailed'.$H$300] -> 2009000 | I309: of:=[$'Results - Detailed'.$I$300] -> 0.006834 | J309: of:=[$'Results - Detailed'.$J$300] -> 0.706979 | K309: of:=[$'Results - Detailed'.$K$300] -> 844600 | L309: of:=[$'Results - Detailed'.$L$300] -> 0.016479 | M309: of:=[$'Results - Detailed'.$M$300] -> 1.091721
B310: of:=[$'Results - Detailed'.$B$301] -> 2284400 | C310: of:=[$'Results - Detailed'.$C$301] -> 0.006009 | D310: of:=[$'Results - Detailed'.$D$301] -> 0.681294 | E310: of:=[$'Results - Detailed'.$E$301] -> 480838 | F310: of:=[$'Results - Detailed'.$F$301] -> 0.028946 | G310: of:=[$'Results - Detailed'.$G$301] -> 1.453276 | H310: of:=[$'Results - Detailed'.$H$301] -> 2021200 | I310: of:=[$'Results - Detailed'.$I$301] -> 0.006805 | J310: of:=[$'Results - Detailed'.$J$301] -> 0.709653 | K310: of:=[$'Results - Detailed'.$K$301] -> 841118 | L310: of:=[$'Results - Detailed'.$L$301] -> 0.01649 | M310: of:=[$'Results - Detailed'.$M$301] -> 1.100405
A311: 14 | B311: of:=AVERAGE([.B281:.B310]) -> 2317966.66666667 | C311: of:=AVERAGE([.C281:.C310]) -> 0.00591846666666667 | D311: of:=AVERAGE([.D281:.D310]) -> 0.648927033333333 | E311: of:=AVERAGE([.E281:.E310]) -> 460327.4 | F311: of:=AVERAGE([.F281:.F310]) -> 0.0302925 | G311: of:=AVERAGE([.G281:.G310]) -> 1.4451535 | H311: of:=AVERAGE([.H281:.H310]) -> 1965813.33333333 | I311: of:=AVERAGE([.I281:.I310]) -> 0.0069998 | J311: of:=AVERAGE([.J281:.J310]) -> 0.713925766666667 | K311: of:=AVERAGE([.K281:.K310]) -> 854875.7 | L311: of:=AVERAGE([.L281:.L310]) -> 0.0162645333333333 | M311: of:=AVERAGE([.M281:.M310]) -> 1.05547956666667
A312: 16 / Results - Detailed | B312: of:=[$'Results - Detailed'.$B$302] -> 2562800 | C312: of:=[$'Results - Detailed'.$C$302] -> 0.006137 | D312: of:=[$'Results - Detailed'.$D$302] -> 0.646268 | E312: of:=[$'Results - Detailed'.$E$302] -> 291816 | F312: of:=[$'Results - Detailed'.$F$302] -> 0.054617 | G312: of:=[$'Results - Detailed'.$G$302] -> 1.99795 | H312: of:=[$'Results - Detailed'.$H$302] -> 1915200 | I312: of:=[$'Results - Detailed'.$I$302] -> 0.008223 | J312: of:=[$'Results - Detailed'.$J$302] -> 0.823143 | K312: of:=[$'Results - Detailed'.$K$302] -> 852295 | L312: of:=[$'Results - Detailed'.$L$302] -> 0.018611 | M312: of:=[$'Results - Detailed'.$M$302] -> 1.088169
B313: of:=[$'Results - Detailed'.$B$303] -> 2566800 | C313: of:=[$'Results - Detailed'.$C$303] -> 0.006129 | D313: of:=[$'Results - Detailed'.$D$303] -> 0.650546 | E313: of:=[$'Results - Detailed'.$E$303] -> 287226 | F313: of:=[$'Results - Detailed'.$F$303] -> 0.055566 | G313: of:=[$'Results - Detailed'.$G$303] -> 2.03061 | H313: of:=[$'Results - Detailed'.$H$303] -> 1923000 | I313: of:=[$'Results - Detailed'.$I$303] -> 0.0082 | J313: of:=[$'Results - Detailed'.$J$303] -> 0.826447 | K313: of:=[$'Results - Detailed'.$K$303] -> 853693 | L313: of:=[$'Results - Detailed'.$L$303] -> 0.018543 | M313: of:=[$'Results - Detailed'.$M$303] -> 1.095774
B314: of:=[$'Results - Detailed'.$B$304] -> 2562400 | C314: of:=[$'Results - Detailed'.$C$304] -> 0.006129 | D314: of:=[$'Results - Detailed'.$D$304] -> 0.655794 | E314: of:=[$'Results - Detailed'.$E$304] -> 299601 | F314: of:=[$'Results - Detailed'.$F$304] -> 0.053125 | G314: of:=[$'Results - Detailed'.$G$304] -> 2.003425 | H314: of:=[$'Results - Detailed'.$H$304] -> 1916600 | I314: of:=[$'Results - Detailed'.$I$304] -> 0.008232 | J314: of:=[$'Results - Detailed'.$J$304] -> 0.832783 | K314: of:=[$'Results - Detailed'.$K$304] -> 854200 | L314: of:=[$'Results - Detailed'.$L$304] -> 0.018614 | M314: of:=[$'Results - Detailed'.$M$304] -> 1.104997
B315: of:=[$'Results - Detailed'.$B$305] -> 2556800 | C315: of:=[$'Results - Detailed'.$C$305] -> 0.006127 | D315: of:=[$'Results - Detailed'.$D$305] -> 0.661162 | E315: of:=[$'Results - Detailed'.$E$305] -> 286627 | F315: of:=[$'Results - Detailed'.$F$305] -> 0.055634 | G315: of:=[$'Results - Detailed'.$G$305] -> 2.064204 | H315: of:=[$'Results - Detailed'.$H$305] -> 1920800 | I315: of:=[$'Results - Detailed'.$I$305] -> 0.008206 | J315: of:=[$'Results - Detailed'.$J$305] -> 0.83679 | K315: of:=[$'Results - Detailed'.$K$305] -> 856487 | L315: of:=[$'Results - Detailed'.$L$305] -> 0.018539 | M315: of:=[$'Results - Detailed'.$M$305] -> 1.110796
B316: of:=[$'Results - Detailed'.$B$306] -> 2562200 | C316: of:=[$'Results - Detailed'.$C$306] -> 0.006133 | D316: of:=[$'Results - Detailed'.$D$306] -> 0.665091 | E316: of:=[$'Results - Detailed'.$E$306] -> 300200 | F316: of:=[$'Results - Detailed'.$F$306] -> 0.053132 | G316: of:=[$'Results - Detailed'.$G$306] -> 2.031991 | H316: of:=[$'Results - Detailed'.$H$306] -> 1926600 | I316: of:=[$'Results - Detailed'.$I$306] -> 0.008189 | J316: of:=[$'Results - Detailed'.$J$306] -> 0.840416 | K316: of:=[$'Results - Detailed'.$K$306] -> 854890 | L316: of:=[$'Results - Detailed'.$L$306] -> 0.018566 | M316: of:=[$'Results - Detailed'.$M$306] -> 1.120151
B317: of:=[$'Results - Detailed'.$B$307] -> 2549600 | C317: of:=[$'Results - Detailed'.$C$307] -> 0.006147 | D317: of:=[$'Results - Detailed'.$D$307] -> 0.671326 | E317: of:=[$'Results - Detailed'.$E$307] -> 293849 | F317: of:=[$'Results - Detailed'.$F$307] -> 0.054247 | G317: of:=[$'Results - Detailed'.$G$307] -> 2.063643 | H317: of:=[$'Results - Detailed'.$H$307] -> 1910600 | I317: of:=[$'Results - Detailed'.$I$307] -> 0.008245 | J317: of:=[$'Results - Detailed'.$J$307] -> 0.848798 | K317: of:=[$'Results - Detailed'.$K$307] -> 855888 | L317: of:=[$'Results - Detailed'.$L$307] -> 0.018526 | M317: of:=[$'Results - Detailed'.$M$307] -> 1.127742
B318: of:=[$'Results - Detailed'.$B$308] -> 2559600 | C318: of:=[$'Results - Detailed'.$C$308] -> 0.006136 | D318: of:=[$'Results - Detailed'.$D$308] -> 0.674577 | E318: of:=[$'Results - Detailed'.$E$308] -> 284431 | F318: of:=[$'Results - Detailed'.$F$308] -> 0.055993 | G318: of:=[$'Results - Detailed'.$G$308] -> 2.119755 | H318: of:=[$'Results - Detailed'.$H$308] -> 1918800 | I318: of:=[$'Results - Detailed'.$I$308] -> 0.008201 | J318: of:=[$'Results - Detailed'.$J$308] -> 0.851828 | K318: of:=[$'Results - Detailed'.$K$308] -> 854200 | L318: of:=[$'Results - Detailed'.$L$308] -> 0.018609 | M318: of:=[$'Results - Detailed'.$M$308] -> 1.138188
B319: of:=[$'Results - Detailed'.$B$309] -> 2549400 | C319: of:=[$'Results - Detailed'.$C$309] -> 0.006156 | D319: of:=[$'Results - Detailed'.$D$309] -> 0.680464 | E319: of:=[$'Results - Detailed'.$E$309] -> 299401 | F319: of:=[$'Results - Detailed'.$F$309] -> 0.053173 | G319: of:=[$'Results - Detailed'.$G$309] -> 2.080809 | H319: of:=[$'Results - Detailed'.$H$309] -> 1922000 | I319: of:=[$'Results - Detailed'.$I$309] -> 0.00819 | J319: of:=[$'Results - Detailed'.$J$309] -> 0.855917 | K319: of:=[$'Results - Detailed'.$K$309] -> 856000 | L319: of:=[$'Results - Detailed'.$L$309] -> 0.018586 | M319: of:=[$'Results - Detailed'.$M$309] -> 1.145135
B320: of:=[$'Results - Detailed'.$B$310] -> 2557600 | C320: of:=[$'Results - Detailed'.$C$310] -> 0.006154 | D320: of:=[$'Results - Detailed'.$D$310] -> 0.683886 | E320: of:=[$'Results - Detailed'.$E$310] -> 296008 | F320: of:=[$'Results - Detailed'.$F$310] -> 0.05381 | G320: of:=[$'Results - Detailed'.$G$310] -> 2.107735 | H320: of:=[$'Results - Detailed'.$H$310] -> 1909600 | I320: of:=[$'Results - Detailed'.$I$310] -> 0.008264 | J320: of:=[$'Results - Detailed'.$J$310] -> 0.863489 | K320: of:=[$'Results - Detailed'.$K$310] -> 851697 | L320: of:=[$'Results - Detailed'.$L$310] -> 0.018617 | M320: of:=[$'Results - Detailed'.$M$310] -> 1.154966
B321: of:=[$'Results - Detailed'.$B$311] -> 2546400 | C321: of:=[$'Results - Detailed'.$C$311] -> 0.006181 | D321: of:=[$'Results - Detailed'.$D$311] -> 0.689901 | E321: of:=[$'Results - Detailed'.$E$311] -> 293014 | F321: of:=[$'Results - Detailed'.$F$311] -> 0.054387 | G321: of:=[$'Results - Detailed'.$G$311] -> 2.133681 | H321: of:=[$'Results - Detailed'.$H$311] -> 1918200 | I321: of:=[$'Results - Detailed'.$I$311] -> 0.008206 | J321: of:=[$'Results - Detailed'.$J$311] -> 0.866301 | K321: of:=[$'Results - Detailed'.$K$311] -> 854291 | L321: of:=[$'Results - Detailed'.$L$311] -> 0.0186 | M321: of:=[$'Results - Detailed'.$M$311] -> 1.161247
B322: of:=[$'Results - Detailed'.$B$312] -> 2459200 | C322: of:=[$'Results - Detailed'.$C$312] -> 0.006378 | D322: of:=[$'Results - Detailed'.$D$312] -> 0.672513 | E322: of:=[$'Results - Detailed'.$E$312] -> 317365 | F322: of:=[$'Results - Detailed'.$F$312] -> 0.050157 | G322: of:=[$'Results - Detailed'.$G$312] -> 1.813624 | H322: of:=[$'Results - Detailed'.$H$312] -> 1984800 | I322: of:=[$'Results - Detailed'.$I$312] -> 0.007942 | J322: of:=[$'Results - Detailed'.$J$312] -> 0.723066 | K322: of:=[$'Results - Detailed'.$K$312] -> 966200 | L322: of:=[$'Results - Detailed'.$L$312] -> 0.016477 | M322: of:=[$'Results - Detailed'.$M$312] -> 1.025016
B323: of:=[$'Results - Detailed'.$B$313] -> 2455800 | C323: of:=[$'Results - Detailed'.$C$313] -> 0.006389 | D323: of:=[$'Results - Detailed'.$D$313] -> 0.677708 | E323: of:=[$'Results - Detailed'.$E$313] -> 319361 | F323: of:=[$'Results - Detailed'.$F$313] -> 0.04995 | G323: of:=[$'Results - Detailed'.$G$313] -> 1.821999 | H323: of:=[$'Results - Detailed'.$H$313] -> 1970200 | I323: of:=[$'Results - Detailed'.$I$313] -> 0.008008 | J323: of:=[$'Results - Detailed'.$J$313] -> 0.731237 | K323: of:=[$'Results - Detailed'.$K$313] -> 966600 | L323: of:=[$'Results - Detailed'.$L$313] -> 0.016451 | M323: of:=[$'Results - Detailed'.$M$313] -> 1.0328
B324: of:=[$'Results - Detailed'.$B$314] -> 2452600 | C324: of:=[$'Results - Detailed'.$C$314] -> 0.006396 | D324: of:=[$'Results - Detailed'.$D$314] -> 0.682849 | E324: of:=[$'Results - Detailed'.$E$314] -> 311377 | F324: of:=[$'Results - Detailed'.$F$314] -> 0.051269 | G324: of:=[$'Results - Detailed'.$G$314] -> 1.859749 | H324: of:=[$'Results - Detailed'.$H$314] -> 1976800 | I324: of:=[$'Results - Detailed'.$I$314] -> 0.007992 | J324: of:=[$'Results - Detailed'.$J$314] -> 0.735468 | K324: of:=[$'Results - Detailed'.$K$314] -> 959281 | L324: of:=[$'Results - Detailed'.$L$314] -> 0.016579 | M324: of:=[$'Results - Detailed'.$M$314] -> 1.043669
B325: of:=[$'Results - Detailed'.$B$315] -> 2452400 | C325: of:=[$'Results - Detailed'.$C$315] -> 0.006409 | D325: of:=[$'Results - Detailed'.$D$315] -> 0.687554 | E325: of:=[$'Results - Detailed'.$E$315] -> 312351 | F325: of:=[$'Results - Detailed'.$F$315] -> 0.050957 | G325: of:=[$'Results - Detailed'.$G$315] -> 1.869111 | H325: of:=[$'Results - Detailed'.$H$315] -> 1979600 | I325: of:=[$'Results - Detailed'.$I$315] -> 0.007969 | J325: of:=[$'Results - Detailed'.$J$315] -> 0.74035 | K325: of:=[$'Results - Detailed'.$K$315] -> 965070 | L325: of:=[$'Results - Detailed'.$L$315] -> 0.016457 | M325: of:=[$'Results - Detailed'.$M$315] -> 1.048413
B326: of:=[$'Results - Detailed'.$B$316] -> 2450200 | C326: of:=[$'Results - Detailed'.$C$316] -> 0.006421 | D326: of:=[$'Results - Detailed'.$D$316] -> 0.692514 | E326: of:=[$'Results - Detailed'.$E$316] -> 313972 | F326: of:=[$'Results - Detailed'.$F$316] -> 0.050788 | G326: of:=[$'Results - Detailed'.$G$316] -> 1.880369 | H326: of:=[$'Results - Detailed'.$H$316] -> 1986400 | I326: of:=[$'Results - Detailed'.$I$316] -> 0.007939 | J326: of:=[$'Results - Detailed'.$J$316] -> 0.744433 | K326: of:=[$'Results - Detailed'.$K$316] -> 964400 | L326: of:=[$'Results - Detailed'.$L$316] -> 0.016487 | M326: of:=[$'Results - Detailed'.$M$316] -> 1.057649
B327: of:=[$'Results - Detailed'.$B$317] -> 2446000 | C327: of:=[$'Results - Detailed'.$C$317] -> 0.006432 | D327: of:=[$'Results - Detailed'.$D$317] -> 0.697732 | E327: of:=[$'Results - Detailed'.$E$317] -> 317365 | F327: of:=[$'Results - Detailed'.$F$317] -> 0.050195 | G327: of:=[$'Results - Detailed'.$G$317] -> 1.884006 | H327: of:=[$'Results - Detailed'.$H$317] -> 1983000 | I327: of:=[$'Results - Detailed'.$I$317] -> 0.007957 | J327: of:=[$'Results - Detailed'.$J$317] -> 0.750392 | K327: of:=[$'Results - Detailed'.$K$317] -> 964800 | L327: of:=[$'Results - Detailed'.$L$317] -> 0.016501 | M327: of:=[$'Results - Detailed'.$M$317] -> 1.065203
B328: of:=[$'Results - Detailed'.$B$318] -> 2449200 | C328: of:=[$'Results - Detailed'.$C$318] -> 0.006428 | D328: of:=[$'Results - Detailed'.$D$318] -> 0.701871 | E328: of:=[$'Results - Detailed'.$E$318] -> 314371 | F328: of:=[$'Results - Detailed'.$F$318] -> 0.050711 | G328: of:=[$'Results - Detailed'.$G$318] -> 1.90699 | H328: of:=[$'Results - Detailed'.$H$318] -> 1992400 | I328: of:=[$'Results - Detailed'.$I$318] -> 0.007923 | J328: of:=[$'Results - Detailed'.$J$318] -> 0.754092 | K328: of:=[$'Results - Detailed'.$K$318] -> 964400 | L328: of:=[$'Results - Detailed'.$L$318] -> 0.016499 | M328: of:=[$'Results - Detailed'.$M$318] -> 1.073139
B329: of:=[$'Results - Detailed'.$B$319] -> 2457600 | C329: of:=[$'Results - Detailed'.$C$319] -> 0.006393 | D329: of:=[$'Results - Detailed'.$D$319] -> 0.705218 | E329: of:=[$'Results - Detailed'.$E$319] -> 312575 | F329: of:=[$'Results - Detailed'.$F$319] -> 0.050964 | G329: of:=[$'Results - Detailed'.$G$319] -> 1.926118 | H329: of:=[$'Results - Detailed'.$H$319] -> 1992200 | I329: of:=[$'Results - Detailed'.$I$319] -> 0.00793 | J329: of:=[$'Results - Detailed'.$J$319] -> 0.75937 | K329: of:=[$'Results - Detailed'.$K$319] -> 965269 | L329: of:=[$'Results - Detailed'.$L$319] -> 0.016474 | M329: of:=[$'Results - Detailed'.$M$319] -> 1.079244
B330: of:=[$'Results - Detailed'.$B$320] -> 2457200 | C330: of:=[$'Results - Detailed'.$C$320] -> 0.006387 | D330: of:=[$'Results - Detailed'.$D$320] -> 0.709789 | E330: of:=[$'Results - Detailed'.$E$320] -> 316966 | F330: of:=[$'Results - Detailed'.$F$320] -> 0.050384 | G330: of:=[$'Results - Detailed'.$G$320] -> 1.926185 | H330: of:=[$'Results - Detailed'.$H$320] -> 1980400 | I330: of:=[$'Results - Detailed'.$I$320] -> 0.007963 | J330: of:=[$'Results - Detailed'.$J$320] -> 0.766841 | K330: of:=[$'Results - Detailed'.$K$320] -> 964800 | L330: of:=[$'Results - Detailed'.$L$320] -> 0.01648 | M330: of:=[$'Results - Detailed'.$M$320] -> 1.088185
B331: of:=[$'Results - Detailed'.$B$321] -> 2457200 | C331: of:=[$'Results - Detailed'.$C$321] -> 0.006368 | D331: of:=[$'Results - Detailed'.$D$321] -> 0.714278 | E331: of:=[$'Results - Detailed'.$E$321] -> 320160 | F331: of:=[$'Results - Detailed'.$F$321] -> 0.049688 | G331: of:=[$'Results - Detailed'.$G$321] -> 1.929769 | H331: of:=[$'Results - Detailed'.$H$321] -> 1991400 | I331: of:=[$'Results - Detailed'.$I$321] -> 0.00792 | J331: of:=[$'Results - Detailed'.$J$321] -> 0.769881 | K331: of:=[$'Results - Detailed'.$K$321] -> 964072 | L331: of:=[$'Results - Detailed'.$L$321] -> 0.016468 | M331: of:=[$'Results - Detailed'.$M$321] -> 1.095054
B332: of:=[$'Results - Detailed'.$B$322] -> 2439400 | C332: of:=[$'Results - Detailed'.$C$322] -> 0.006461 | D332: of:=[$'Results - Detailed'.$D$322] -> 0.642926 | E332: of:=[$'Results - Detailed'.$E$322] -> 299002 | F332: of:=[$'Results - Detailed'.$F$322] -> 0.053364 | G332: of:=[$'Results - Detailed'.$G$322] -> 1.921897 | H332: of:=[$'Results - Detailed'.$H$322] -> 1906800 | I332: of:=[$'Results - Detailed'.$I$322] -> 0.008267 | J332: of:=[$'Results - Detailed'.$J$322] -> 0.735166 | K332: of:=[$'Results - Detailed'.$K$322] -> 883000 | L332: of:=[$'Results - Detailed'.$L$322] -> 0.018039 | M332: of:=[$'Results - Detailed'.$M$322] -> 1.066956
B333: of:=[$'Results - Detailed'.$B$323] -> 2437400 | C333: of:=[$'Results - Detailed'.$C$323] -> 0.006464 | D333: of:=[$'Results - Detailed'.$D$323] -> 0.648195 | E333: of:=[$'Results - Detailed'.$E$323] -> 296806 | F333: of:=[$'Results - Detailed'.$F$323] -> 0.053712 | G333: of:=[$'Results - Detailed'.$G$323] -> 1.943982 | H333: of:=[$'Results - Detailed'.$H$323] -> 1873800 | I333: of:=[$'Results - Detailed'.$I$323] -> 0.008411 | J333: of:=[$'Results - Detailed'.$J$323] -> 0.74726 | K333: of:=[$'Results - Detailed'.$K$323] -> 878842 | L333: of:=[$'Results - Detailed'.$L$323] -> 0.018083 | M333: of:=[$'Results - Detailed'.$M$323] -> 1.076838
B334: of:=[$'Results - Detailed'.$B$324] -> 2432800 | C334: of:=[$'Results - Detailed'.$C$324] -> 0.006472 | D334: of:=[$'Results - Detailed'.$D$324] -> 0.653776 | E334: of:=[$'Results - Detailed'.$E$324] -> 299004 | F334: of:=[$'Results - Detailed'.$F$324] -> 0.053298 | G334: of:=[$'Results - Detailed'.$G$324] -> 1.949447 | H334: of:=[$'Results - Detailed'.$H$324] -> 1892000 | I334: of:=[$'Results - Detailed'.$I$324] -> 0.008351 | J334: of:=[$'Results - Detailed'.$J$324] -> 0.749251 | K334: of:=[$'Results - Detailed'.$K$324] -> 878244 | L334: of:=[$'Results - Detailed'.$L$324] -> 0.018095 | M334: of:=[$'Results - Detailed'.$M$324] -> 1.085572
B335: of:=[$'Results - Detailed'.$B$325] -> 2437000 | C335: of:=[$'Results - Detailed'.$C$325] -> 0.006462 | D335: of:=[$'Results - Detailed'.$D$325] -> 0.65814 | E335: of:=[$'Results - Detailed'.$E$325] -> 291617 | F335: of:=[$'Results - Detailed'.$F$325] -> 0.0546 | G335: of:=[$'Results - Detailed'.$G$325] -> 1.991191 | H335: of:=[$'Results - Detailed'.$H$325] -> 1899800 | I335: of:=[$'Results - Detailed'.$I$325] -> 0.008287 | J335: of:=[$'Results - Detailed'.$J$325] -> 0.753233 | K335: of:=[$'Results - Detailed'.$K$325] -> 878842 | L335: of:=[$'Results - Detailed'.$L$325] -> 0.018079 | M335: of:=[$'Results - Detailed'.$M$325] -> 1.0935
B336: of:=[$'Results - Detailed'.$B$326] -> 2433800 | C336: of:=[$'Results - Detailed'.$C$326] -> 0.006465 | D336: of:=[$'Results - Detailed'.$D$326] -> 0.663463 | E336: of:=[$'Results - Detailed'.$E$326] -> 299002 | F336: of:=[$'Results - Detailed'.$F$326] -> 0.053251 | G336: of:=[$'Results - Detailed'.$G$326] -> 1.981044 | H336: of:=[$'Results - Detailed'.$H$326] -> 1867200 | I336: of:=[$'Results - Detailed'.$I$326] -> 0.008433 | J336: of:=[$'Results - Detailed'.$J$326] -> 0.765309 | K336: of:=[$'Results - Detailed'.$K$326] -> 881437 | L336: of:=[$'Results - Detailed'.$L$326] -> 0.018016 | M336: of:=[$'Results - Detailed'.$M$326] -> 1.100109
B337: of:=[$'Results - Detailed'.$B$327] -> 2438000 | C337: of:=[$'Results - Detailed'.$C$327] -> 0.006465 | D337: of:=[$'Results - Detailed'.$D$327] -> 0.667749 | E337: of:=[$'Results - Detailed'.$E$327] -> 293613 | F337: of:=[$'Results - Detailed'.$F$327] -> 0.05429 | G337: of:=[$'Results - Detailed'.$G$327] -> 2.01377 | H337: of:=[$'Results - Detailed'.$H$327] -> 1883800 | I337: of:=[$'Results - Detailed'.$I$327] -> 0.008364 | J337: of:=[$'Results - Detailed'.$J$327] -> 0.767399 | K337: of:=[$'Results - Detailed'.$K$327] -> 881800 | L337: of:=[$'Results - Detailed'.$L$327] -> 0.018031 | M337: of:=[$'Results - Detailed'.$M$327] -> 1.10914
B338: of:=[$'Results - Detailed'.$B$328] -> 2433800 | C338: of:=[$'Results - Detailed'.$C$328] -> 0.006468 | D338: of:=[$'Results - Detailed'.$D$328] -> 0.673147 | E338: of:=[$'Results - Detailed'.$E$328] -> 304591 | F338: of:=[$'Results - Detailed'.$F$328] -> 0.052307 | G338: of:=[$'Results - Detailed'.$G$328] -> 1.991681 | H338: of:=[$'Results - Detailed'.$H$328] -> 1891600 | I338: of:=[$'Results - Detailed'.$I$328] -> 0.008325 | J338: of:=[$'Results - Detailed'.$J$328] -> 0.771232 | K338: of:=[$'Results - Detailed'.$K$328] -> 883000 | L338: of:=[$'Results - Detailed'.$L$328] -> 0.018032 | M338: of:=[$'Results - Detailed'.$M$328] -> 1.116491
B339: of:=[$'Results - Detailed'.$B$329] -> 2433800 | C339: of:=[$'Results - Detailed'.$C$329] -> 0.006469 | D339: of:=[$'Results - Detailed'.$D$329] -> 0.677935 | E339: of:=[$'Results - Detailed'.$E$329] -> 291816 | F339: of:=[$'Results - Detailed'.$F$329] -> 0.05446 | G339: of:=[$'Results - Detailed'.$G$329] -> 2.049347 | H339: of:=[$'Results - Detailed'.$H$329] -> 1875800 | I339: of:=[$'Results - Detailed'.$I$329] -> 0.008402 | J339: of:=[$'Results - Detailed'.$J$329] -> 0.779878 | K339: of:=[$'Results - Detailed'.$K$329] -> 880800 | L339: of:=[$'Results - Detailed'.$L$329] -> 0.018074 | M339: of:=[$'Results - Detailed'.$M$329] -> 1.125939
B340: of:=[$'Results - Detailed'.$B$330] -> 2430000 | C340: of:=[$'Results - Detailed'.$C$330] -> 0.006456 | D340: of:=[$'Results - Detailed'.$D$330] -> 0.683206 | E340: of:=[$'Results - Detailed'.$E$330] -> 294212 | F340: of:=[$'Results - Detailed'.$F$330] -> 0.054193 | G340: of:=[$'Results - Detailed'.$G$330] -> 2.05557 | H340: of:=[$'Results - Detailed'.$H$330] -> 1891000 | I340: of:=[$'Results - Detailed'.$I$330] -> 0.008331 | J340: of:=[$'Results - Detailed'.$J$330] -> 0.782082 | K340: of:=[$'Results - Detailed'.$K$330] -> 881400 | L340: of:=[$'Results - Detailed'.$L$330] -> 0.01806 | M340: of:=[$'Results - Detailed'.$M$330] -> 1.13355
B341: of:=[$'Results - Detailed'.$B$331] -> 2436400 | C341: of:=[$'Results - Detailed'.$C$331] -> 0.006461 | D341: of:=[$'Results - Detailed'.$D$331] -> 0.687027 | E341: of:=[$'Results - Detailed'.$E$331] -> 296414 | F341: of:=[$'Results - Detailed'.$F$331] -> 0.053737 | G341: of:=[$'Results - Detailed'.$G$331] -> 2.060282 | H341: of:=[$'Results - Detailed'.$H$331] -> 1899200 | I341: of:=[$'Results - Detailed'.$I$331] -> 0.008302 | J341: of:=[$'Results - Detailed'.$J$331] -> 0.785693 | K341: of:=[$'Results - Detailed'.$K$331] -> 880240 | L341: of:=[$'Results - Detailed'.$L$331] -> 0.017989 | M341: of:=[$'Results - Detailed'.$M$331] -> 1.141075
A342: 16 | B342: of:=AVERAGE([.B312:.B341]) -> 2482113.33333333 | C342: of:=AVERAGE([.C312:.C341]) -> 0.00633576666666667 | D342: of:=AVERAGE([.D312:.D341]) -> 0.675886833333333 | E342: of:=AVERAGE([.E312:.E341]) -> 301803.766666667 | F342: of:=AVERAGE([.F312:.F341]) -> 0.0528653 | G342: of:=AVERAGE([.G312:.G341]) -> 1.98033113333333 | H342: of:=AVERAGE([.H312:.H341]) -> 1929986.66666667 | I342: of:=AVERAGE([.I312:.I341]) -> 0.0081724 | J342: of:=AVERAGE([.J312:.J341]) -> 0.7852515 | K342: of:=AVERAGE([.K312:.K341]) -> 899871.266666667 | L342: of:=AVERAGE([.L312:.L341]) -> 0.0177060666666667 | M342: of:=AVERAGE([.M312:.M341]) -> 1.09682356666667

Sheet: Results - Detailed
A1: Threads | B1: Furious opssec | C1: Furious mean | D1: Furious stddev | E1: Generic opssec | F1: Generic mean | G1: Generic stddev | H1: Queue opssec | I1: Queue mean | J1: Queue stddev | K1: Stack opssec | L1: Stack mean | M1: Stack stddev
A2: of:=[furious.B2] -> 1 | B2: of:=[furious.E2] -> 4662800 | C2: of:=[furious.G2] -> 0.000136 | D2: of:=[furious.I2] -> 0.097057 | E2: of:=[generic.E2] -> 2020400 | F2: of:=[generic.G2] -> 0.000435 | G2: of:=[generic.I2] -> 0.164793 | H2: of:=[queue.E2] -> 2792400 | I2: of:=[queue.G2] -> 0.000292 | J2: of:=[queue.I2] -> 0.135488 | K2: of:=[stack.E2] -> 2510800 | L2: of:=[stack.G2] -> 0.000335 | M2: of:=[stack.I2] -> 0.145019
A3: of:=[furious.B3] -> 1 | B3: of:=[furious.E3] -> 4647400 | C3: of:=[furious.G3] -> 0.000147 | D3: of:=[furious.I3] -> 0.097972 | E3: of:=[generic.E3] -> 2021400 | F3: of:=[generic.G3] -> 0.000439 | G3: of:=[generic.I3] -> 0.16608 | H3: of:=[queue.E3] -> 2761800 | I3: of:=[queue.G3] -> 0.000287 | J3: of:=[queue.I3] -> 0.137285 | K3: of:=[stack.E3] -> 2512400 | L3: of:=[stack.G3] -> 0.000326 | M3: of:=[stack.I3] -> 0.146092
A4: of:=[furious.B4] -> 1 | B4: of:=[furious.E4] -> 4673000 | C4: of:=[furious.G4] -> 0.000144 | D4: of:=[furious.I4] -> 0.098438 | E4: of:=[generic.E4] -> 2019200 | F4: of:=[generic.G4] -> 0.000432 | G4: of:=[generic.I4] -> 0.167465 | H4: of:=[queue.E4] -> 2783400 | I4: of:=[queue.G4] -> 0.000303 | J4: of:=[queue.I4] -> 0.137852 | K4: of:=[stack.E4] -> 2518200 | L4: of:=[stack.G4] -> 0.000337 | M4: of:=[stack.I4] -> 0.147073
A5: of:=[furious.B5] -> 1 | B5: of:=[furious.E5] -> 4680400 | C5: of:=[furious.G5] -> 0.000144 | D5: of:=[furious.I5] -> 0.099088 | E5: of:=[generic.E5] -> 2020600 | F5: of:=[generic.G5] -> 0.000427 | G5: of:=[generic.I5] -> 0.168677 | H5: of:=[queue.E5] -> 2780200 | I5: of:=[queue.G5] -> 0.000296 | J5: of:=[queue.I5] -> 0.139002 | K5: of:=[stack.E5] -> 2522400 | L5: of:=[stack.G5] -> 0.00033 | M5: of:=[stack.I5] -> 0.148068
A6: of:=[furious.B6] -> 1 | B6: of:=[furious.E6] -> 4659800 | C6: of:=[furious.G6] -> 0.000145 | D6: of:=[furious.I6] -> 0.100036 | E6: of:=[generic.E6] -> 2016400 | F6: of:=[generic.G6] -> 0.000427 | G6: of:=[generic.I6] -> 0.17011 | H6: of:=[queue.E6] -> 2794600 | I6: of:=[queue.G6] -> 0.000283 | J6: of:=[queue.I6] -> 0.139662 | K6: of:=[stack.E6] -> 2517000 | L6: of:=[stack.G6] -> 0.000339 | M6: of:=[stack.I6] -> 0.149367
A7: of:=[furious.B7] -> 1 | B7: of:=[furious.E7] -> 4689800 | C7: of:=[furious.G7] -> 0.000146 | D7: of:=[furious.I7] -> 0.100445 | E7: of:=[generic.E7] -> 2023600 | F7: of:=[generic.G7] -> 0.000427 | G7: of:=[generic.I7] -> 0.17106 | H7: of:=[queue.E7] -> 2798600 | I7: of:=[queue.G7] -> 0.000282 | J7: of:=[queue.I7] -> 0.14057 | K7: of:=[stack.E7] -> 2523200 | L7: of:=[stack.G7] -> 0.000327 | M7: of:=[stack.I7] -> 0.150274
A8: of:=[furious.B8] -> 1 | B8: of:=[furious.E8] -> 4655000 | C8: of:=[furious.G8] -> 0.000143 | D8: of:=[furious.I8] -> 0.101524 | E8: of:=[generic.E8] -> 2026200 | F8: of:=[generic.G8] -> 0.000434 | G8: of:=[generic.I8] -> 0.172216 | H8: of:=[queue.E8] -> 2778200 | I8: of:=[queue.G8] -> 0.00029 | J8: of:=[queue.I8] -> 0.142109 | K8: of:=[stack.E8] -> 2519400 | L8: of:=[stack.G8] -> 0.000323 | M8: of:=[stack.I8] -> 0.151458
A9: of:=[furious.B9] -> 1 | B9: of:=[furious.E9] -> 4666000 | C9: of:=[furious.G9] -> 0.000145 | D9: of:=[furious.I9] -> 0.102116 | E9: of:=[generic.E9] -> 2021200 | F9: of:=[generic.G9] -> 0.000425 | G9: of:=[generic.I9] -> 0.173658 | H9: of:=[queue.E9] -> 2804600 | I9: of:=[queue.G9] -> 0.000285 | J9: of:=[queue.I9] -> 0.142444 | K9: of:=[stack.E9] -> 2517000 | L9: of:=[stack.G9] -> 0.000334 | M9: of:=[stack.I9] -> 0.152627
A10: of:=[furious.B10] -> 1 | B10: of:=[furious.E10] -> 4676000 | C10: of:=[furious.G10] -> 0.000144 | D10: of:=[furious.I10] -> 0.102711 | E10: of:=[generic.E10] -> 2021400 | F10: of:=[generic.G10] -> 0.000426 | G10: of:=[generic.I10] -> 0.174873 | H10: of:=[queue.E10] -> 2773800 | I10: of:=[queue.G10] -> 0.0003 | J10: of:=[queue.I10] -> 0.144275 | K10: of:=[stack.E10] -> 2517800 | L10: of:=[stack.G10] -> 0.000329 | M10: of:=[stack.I10] -> 0.153677
A11: of:=[furious.B11] -> 1 | B11: of:=[furious.E11] -> 4684000 | C11: of:=[furious.G11] -> 0.00014 | D11: of:=[furious.I11] -> 0.103304 | E11: of:=[generic.E11] -> 2022400 | F11: of:=[generic.G11] -> 0.000434 | G11: of:=[generic.I11] -> 0.176067 | H11: of:=[queue.E11] -> 2800800 | I11: of:=[queue.G11] -> 0.000283 | J11: of:=[queue.I11] -> 0.144562 | K11: of:=[stack.E11] -> 2521200 | L11: of:=[stack.G11] -> 0.000326 | M11: of:=[stack.I11] -> 0.154631
A12: of:=[furious.B12] -> 1 | B12: of:=[furious.E12] -> 4533200 | C12: of:=[furious.G12] -> 0.000154 | D12: of:=[furious.I12] -> 0.098497 | E12: of:=[generic.E12] -> 2008200 | F12: of:=[generic.G12] -> 0.000423 | G12: of:=[generic.I12] -> 0.164952 | H12: of:=[queue.E12] -> 2753400 | I12: of:=[queue.G12] -> 0.000307 | J12: of:=[queue.I12] -> 0.136422 | K12: of:=[stack.E12] -> 2514800 | L12: of:=[stack.G12] -> 0.000343 | M12: of:=[stack.I12] -> 0.144797
A13: of:=[furious.B13] -> 1 | B13: of:=[furious.E13] -> 4541000 | C13: of:=[furious.G13] -> 0.000151 | D13: of:=[furious.I13] -> 0.099177 | E13: of:=[generic.E13] -> 2010400 | F13: of:=[generic.G13] -> 0.000424 | G13: of:=[generic.I13] -> 0.166142 | H13: of:=[queue.E13] -> 2755600 | I13: of:=[queue.G13] -> 0.000299 | J13: of:=[queue.I13] -> 0.13746 | K13: of:=[stack.E13] -> 2518400 | L13: of:=[stack.G13] -> 0.000326 | M13: of:=[stack.I13] -> 0.145817
A14: of:=[furious.B14] -> 1 | B14: of:=[furious.E14] -> 4552400 | C14: of:=[furious.G14] -> 0.000144 | D14: of:=[furious.I14] -> 0.099778 | E14: of:=[generic.E14] -> 2012200 | F14: of:=[generic.G14] -> 0.00044 | G14: of:=[generic.I14] -> 0.167388 | H14: of:=[queue.E14] -> 2744600 | I14: of:=[queue.G14] -> 0.000308 | J14: of:=[queue.I14] -> 0.138847 | K14: of:=[stack.E14] -> 2518000 | L14: of:=[stack.G14] -> 0.000326 | M14: of:=[stack.I14] -> 0.146944
A15: of:=[furious.B15] -> 1 | B15: of:=[furious.E15] -> 4550200 | C15: of:=[furious.G15] -> 0.000144 | D15: of:=[furious.I15] -> 0.100522 | E15: of:=[generic.E15] -> 2012200 | F15: of:=[generic.G15] -> 0.000433 | G15: of:=[generic.I15] -> 0.168678 | H15: of:=[queue.E15] -> 2760400 | I15: of:=[queue.G15] -> 0.000298 | J15: of:=[queue.I15] -> 0.13952 | K15: of:=[stack.E15] -> 2520200 | L15: of:=[stack.G15] -> 0.00034 | M15: of:=[stack.I15] -> 0.148031
A16: of:=[furious.B16] -> 1 | B16: of:=[furious.E16] -> 4553400 | C16: of:=[furious.G16] -> 0.000146 | D16: of:=[furious.I16] -> 0.101209 | E16: of:=[generic.E16] -> 2010600 | F16: of:=[generic.G16] -> 0.00044 | G16: of:=[generic.I16] -> 0.170043 | H16: of:=[queue.E16] -> 2753200 | I16: of:=[queue.G16] -> 0.000293 | J16: of:=[queue.I16] -> 0.140747 | K16: of:=[stack.E16] -> 2508000 | L16: of:=[stack.G16] -> 0.000331 | M16: of:=[stack.I16] -> 0.149502
A17: of:=[furious.B17] -> 1 | B17: of:=[furious.E17] -> 4545800 | C17: of:=[furious.G17] -> 0.00015 | D17: of:=[furious.I17] -> 0.10203 | E17: of:=[generic.E17] -> 2013200 | F17: of:=[generic.G17] -> 0.000419 | G17: of:=[generic.I17] -> 0.171162 | H17: of:=[queue.E17] -> 2765200 | I17: of:=[queue.G17] -> 0.000306 | J17: of:=[queue.I17] -> 0.141526 | K17: of:=[stack.E17] -> 2517800 | L17: of:=[stack.G17] -> 0.000346 | M17: of:=[stack.I17] -> 0.150364
A18: of:=[furious.B18] -> 1 | B18: of:=[furious.E18] -> 4558400 | C18: of:=[furious.G18] -> 0.000155 | D18: of:=[furious.I18] -> 0.102648 | E18: of:=[generic.E18] -> 2012000 | F18: of:=[generic.G18] -> 0.000419 | G18: of:=[generic.I18] -> 0.172434 | H18: of:=[queue.E18] -> 2755800 | I18: of:=[queue.G18] -> 0.000294 | J18: of:=[queue.I18] -> 0.1428 | K18: of:=[stack.E18] -> 2508600 | L18: of:=[stack.G18] -> 0.000334 | M18: of:=[stack.I18] -> 0.151744
A19: of:=[furious.B19] -> 1 | B19: of:=[furious.E19] -> 4532800 | C19: of:=[furious.G19] -> 0.000148 | D19: of:=[furious.I19] -> 0.103653 | E19: of:=[generic.E19] -> 2009400 | F19: of:=[generic.G19] -> 0.00044 | G19: of:=[generic.I19] -> 0.173815 | H19: of:=[queue.E19] -> 2763200 | I19: of:=[queue.G19] -> 0.000283 | J19: of:=[queue.I19] -> 0.143597 | K19: of:=[stack.E19] -> 2509800 | L19: of:=[stack.G19] -> 0.000331 | M19: of:=[stack.I19] -> 0.152794
A20: of:=[furious.B20] -> 1 | B20: of:=[furious.E20] -> 4555800 | C20: of:=[furious.G20] -> 0.00015 | D20: of:=[furious.I20] -> 0.104114 | E20: of:=[generic.E20] -> 2011400 | F20: of:=[generic.G20] -> 0.00043 | G20: of:=[generic.I20] -> 0.174961 | H20: of:=[queue.E20] -> 2742800 | I20: of:=[queue.G20] -> 0.000311 | J20: of:=[queue.I20] -> 0.145212 | K20: of:=[stack.E20] -> 2513200 | L20: of:=[stack.G20] -> 0.000328 | M20: of:=[stack.I20] -> 0.15376
A21: of:=[furious.B21] -> 1 | B21: of:=[furious.E21] -> 4539600 | C21: of:=[furious.G21] -> 0.000151 | D21: of:=[furious.I21] -> 0.105022 | E21: of:=[generic.E21] -> 2008200 | F21: of:=[generic.G21] -> 0.000443 | G21: of:=[generic.I21] -> 0.176361 | H21: of:=[queue.E21] -> 2760400 | I21: of:=[queue.G21] -> 0.000287 | J21: of:=[queue.I21] -> 0.145736 | K21: of:=[stack.E21] -> 2516600 | L21: of:=[stack.G21] -> 0.000325 | M21: of:=[stack.I21] -> 0.154711
A22: of:=[furious.B22] -> 1 | B22: of:=[furious.E22] -> 4594400 | C22: of:=[furious.G22] -> 0.000152 | D22: of:=[furious.I22] -> 0.098826 | E22: of:=[generic.E22] -> 2019400 | F22: of:=[generic.G22] -> 0.000433 | G22: of:=[generic.I22] -> 0.164368 | H22: of:=[queue.E22] -> 2757000 | I22: of:=[queue.G22] -> 0.0003 | J22: of:=[queue.I22] -> 0.136102 | K22: of:=[stack.E22] -> 2516000 | L22: of:=[stack.G22] -> 0.000335 | M22: of:=[stack.I22] -> 0.144845
A23: of:=[furious.B23] -> 1 | B23: of:=[furious.E23] -> 4618200 | C23: of:=[furious.G23] -> 0.000148 | D23: of:=[furious.I23] -> 0.09932 | E23: of:=[generic.E23] -> 2017600 | F23: of:=[generic.G23] -> 0.000421 | G23: of:=[generic.I23] -> 0.165717 | H23: of:=[queue.E23] -> 2757800 | I23: of:=[queue.G23] -> 0.000289 | J23: of:=[queue.I23] -> 0.137138 | K23: of:=[stack.E23] -> 2510600 | L23: of:=[stack.G23] -> 0.000331 | M23: of:=[stack.I23] -> 0.146136
A24: of:=[furious.B24] -> 1 | B24: of:=[furious.E24] -> 4622400 | C24: of:=[furious.G24] -> 0.000151 | D24: of:=[furious.I24] -> 0.100032 | E24: of:=[generic.E24] -> 2020800 | F24: of:=[generic.G24] -> 0.000434 | G24: of:=[generic.I24] -> 0.166893 | H24: of:=[queue.E24] -> 2757600 | I24: of:=[queue.G24] -> 0.000297 | J24: of:=[queue.I24] -> 0.138221 | K24: of:=[stack.E24] -> 2507400 | L24: of:=[stack.G24] -> 0.000333 | M24: of:=[stack.I24] -> 0.147365
A25: of:=[furious.B25] -> 1 | B25: of:=[furious.E25] -> 4624200 | C25: of:=[furious.G25] -> 0.000145 | D25: of:=[furious.I25] -> 0.100735 | E25: of:=[generic.E25] -> 2014400 | F25: of:=[generic.G25] -> 0.000432 | G25: of:=[generic.I25] -> 0.168444 | H25: of:=[queue.E25] -> 2756200 | I25: of:=[queue.G25] -> 0.000291 | J25: of:=[queue.I25] -> 0.139304 | K25: of:=[stack.E25] -> 2524400 | L25: of:=[stack.G25] -> 0.000338 | M25: of:=[stack.I25] -> 0.148012
A26: of:=[furious.B26] -> 1 | B26: of:=[furious.E26] -> 4610800 | C26: of:=[furious.G26] -> 0.000154 | D26: of:=[furious.I26] -> 0.101643 | E26: of:=[generic.E26] -> 2016800 | F26: of:=[generic.G26] -> 0.000424 | G26: of:=[generic.I26] -> 0.1696 | H26: of:=[queue.E26] -> 2760600 | I26: of:=[queue.G26] -> 0.000288 | J26: of:=[queue.I26] -> 0.140225 | K26: of:=[stack.E26] -> 2525600 | L26: of:=[stack.G26] -> 0.000331 | M26: of:=[stack.I26] -> 0.149091
A27: of:=[furious.B27] -> 1 | B27: of:=[furious.E27] -> 4602400 | C27: of:=[furious.G27] -> 0.000145 | D27: of:=[furious.I27] -> 0.102445 | E27: of:=[generic.E27] -> 2021200 | F27: of:=[generic.G27] -> 0.000419 | G27: of:=[generic.I27] -> 0.170646 | H27: of:=[queue.E27] -> 2760400 | I27: of:=[queue.G27] -> 0.00029 | J27: of:=[queue.I27] -> 0.14126 | K27: of:=[stack.E27] -> 2526800 | L27: of:=[stack.G27] -> 0.000328 | M27: of:=[stack.I27] -> 0.150151
A28: of:=[furious.B28] -> 1 | B28: of:=[furious.E28] -> 4621000 | C28: of:=[furious.G28] -> 0.000143 | D28: of:=[furious.I28] -> 0.102935 | E28: of:=[generic.E28] -> 2018600 | F28: of:=[generic.G28] -> 0.00044 | G28: of:=[generic.I28] -> 0.172039 | H28: of:=[queue.E28] -> 2762600 | I28: of:=[queue.G28] -> 0.000302 | J28: of:=[queue.I28] -> 0.142268 | K28: of:=[stack.E28] -> 2522200 | L28: of:=[stack.G28] -> 0.000336 | M28: of:=[stack.I28] -> 0.151403
A29: of:=[furious.B29] -> 1 | B29: of:=[furious.E29] -> 4623800 | C29: of:=[furious.G29] -> 0.00016 | D29: of:=[furious.I29] -> 0.103678 | E29: of:=[generic.E29] -> 2012600 | F29: of:=[generic.G29] -> 0.000436 | G29: of:=[generic.I29] -> 0.173557 | H29: of:=[queue.E29] -> 2750000 | I29: of:=[queue.G29] -> 0.000297 | J29: of:=[queue.I29] -> 0.143631 | K29: of:=[stack.E29] -> 2524800 | L29: of:=[stack.G29] -> 0.000322 | M29: of:=[stack.I29] -> 0.152384
A30: of:=[furious.B30] -> 1 | B30: of:=[furious.E30] -> 4595800 | C30: of:=[furious.G30] -> 0.00015 | D30: of:=[furious.I30] -> 0.104713 | E30: of:=[generic.E30] -> 2020200 | F30: of:=[generic.G30] -> 0.000433 | G30: of:=[generic.I30] -> 0.174475 | H30: of:=[queue.E30] -> 2760400 | I30: of:=[queue.G30] -> 0.000294 | J30: of:=[queue.I30] -> 0.144382 | K30: of:=[stack.E30] -> 2524600 | L30: of:=[stack.G30] -> 0.000332 | M30: of:=[stack.I30] -> 0.153475
A31: of:=[furious.B31] -> 1 | B31: of:=[furious.E31] -> 4619000 | C31: of:=[furious.G31] -> 0.00015 | D31: of:=[furious.I31] -> 0.105166 | E31: of:=[generic.E31] -> 2019400 | F31: of:=[generic.G31] -> 0.00043 | G31: of:=[generic.I31] -> 0.175736 | H31: of:=[queue.E31] -> 2754400 | I31: of:=[queue.G31] -> 0.000302 | J31: of:=[queue.I31] -> 0.14558 | K31: of:=[stack.E31] -> 2520600 | L31: of:=[stack.G31] -> 0.000332 | M31: of:=[stack.I31] -> 0.154672
A32: of:=[furious.B32] -> 2 | B32: of:=[furious.E32] -> 2868000 | C32: of:=[furious.G32] -> 0.000553 | D32: of:=[furious.I32] -> 0.196969 | E32: of:=[generic.E32] -> 843400 | F32: of:=[generic.G32] -> 0.002269 | G32: of:=[generic.I32] -> 0.378463 | H32: of:=[queue.E32] -> 2655400 | I32: of:=[queue.G32] -> 0.000645 | J32: of:=[queue.I32] -> 0.204168 | K32: of:=[stack.E32] -> 987400 | L32: of:=[stack.G32] -> 0.00194 | M32: of:=[stack.I32] -> 0.348532
A33: of:=[furious.B33] -> 2 | B33: of:=[furious.E33] -> 2948800 | C33: of:=[furious.G33] -> 0.000552 | D33: of:=[furious.I33] -> 0.195668 | E33: of:=[generic.E33] -> 844800 | F33: of:=[generic.G33] -> 0.002273 | G33: of:=[generic.I33] -> 0.381142 | H33: of:=[queue.E33] -> 2648000 | I33: of:=[queue.G33] -> 0.000631 | J33: of:=[queue.I33] -> 0.205991 | K33: of:=[stack.E33] -> 999800 | L33: of:=[stack.G33] -> 0.001894 | M33: of:=[stack.I33] -> 0.349089
A34: of:=[furious.B34] -> 2 | B34: of:=[furious.E34] -> 2914000 | C34: of:=[furious.G34] -> 0.000572 | D34: of:=[furious.I34] -> 0.198279 | E34: of:=[generic.E34] -> 842800 | F34: of:=[generic.G34] -> 0.002288 | G34: of:=[generic.I34] -> 0.38458 | H34: of:=[queue.E34] -> 2657800 | I34: of:=[queue.G34] -> 0.000628 | J34: of:=[queue.I34] -> 0.207132 | K34: of:=[stack.E34] -> 992200 | L34: of:=[stack.G34] -> 0.001899 | M34: of:=[stack.I34] -> 0.353122
A35: of:=[furious.B35] -> 2 | B35: of:=[furious.E35] -> 2951000 | C35: of:=[furious.G35] -> 0.000556 | D35: of:=[furious.I35] -> 0.198438 | E35: of:=[generic.E35] -> 843800 | F35: of:=[generic.G35] -> 0.002301 | G35: of:=[generic.I35] -> 0.387334 | H35: of:=[queue.E35] -> 2645000 | I35: of:=[queue.G35] -> 0.000654 | J35: of:=[queue.I35] -> 0.209201 | K35: of:=[stack.E35] -> 1004600 | L35: of:=[stack.G35] -> 0.001899 | M35: of:=[stack.I35] -> 0.353631
A36: of:=[furious.B36] -> 2 | B36: of:=[furious.E36] -> 2947200 | C36: of:=[furious.G36] -> 0.00054 | D36: of:=[furious.I36] -> 0.199921 | E36: of:=[generic.E36] -> 841600 | F36: of:=[generic.G36] -> 0.00225 | G36: of:=[generic.I36] -> 0.390731 | H36: of:=[queue.E36] -> 2655200 | I36: of:=[queue.G36] -> 0.000626 | J36: of:=[queue.I36] -> 0.210293 | K36: of:=[stack.E36] -> 998600 | L36: of:=[stack.G36] -> 0.001883 | M36: of:=[stack.I36] -> 0.357336
A37: of:=[furious.B37] -> 2 | B37: of:=[furious.E37] -> 2975200 | C37: of:=[furious.G37] -> 0.000542 | D37: of:=[furious.I37] -> 0.200337 | E37: of:=[generic.E37] -> 846000 | F37: of:=[generic.G37] -> 0.002255 | G37: of:=[generic.I37] -> 0.392597 | H37: of:=[queue.E37] -> 2648000 | I37: of:=[queue.G37] -> 0.000635 | J37: of:=[queue.I37] -> 0.212081 | K37: of:=[stack.E37] -> 1001200 | L37: of:=[stack.G37] -> 0.0019 | M37: of:=[stack.I37] -> 0.359524
A38: of:=[furious.B38] -> 2 | B38: of:=[furious.E38] -> 2843600 | C38: of:=[furious.G38] -> 0.000535 | D38: of:=[furious.I38] -> 0.20622 | E38: of:=[generic.E38] -> 841800 | F38: of:=[generic.G38] -> 0.002271 | G38: of:=[generic.I38] -> 0.39645 | H38: of:=[queue.E38] -> 2649000 | I38: of:=[queue.G38] -> 0.000643 | J38: of:=[queue.I38] -> 0.213551 | K38: of:=[stack.E38] -> 1001800 | L38: of:=[stack.G38] -> 0.001897 | M38: of:=[stack.I38] -> 0.362045
A39: of:=[furious.B39] -> 2 | B39: of:=[furious.E39] -> 2956200 | C39: of:=[furious.G39] -> 0.000546 | D39: of:=[furious.I39] -> 0.2036 | E39: of:=[generic.E39] -> 848400 | F39: of:=[generic.G39] -> 0.002263 | G39: of:=[generic.I39] -> 0.39776 | H39: of:=[queue.E39] -> 2642400 | I39: of:=[queue.G39] -> 0.00064 | J39: of:=[queue.I39] -> 0.21531 | K39: of:=[stack.E39] -> 1001000 | L39: of:=[stack.G39] -> 0.00191 | M39: of:=[stack.I39] -> 0.364817
A40: of:=[furious.B40] -> 2 | B40: of:=[furious.E40] -> 2859600 | C40: of:=[furious.G40] -> 0.000535 | D40: of:=[furious.I40] -> 0.208299 | E40: of:=[generic.E40] -> 841400 | F40: of:=[generic.G40] -> 0.002268 | G40: of:=[generic.I40] -> 0.40224 | H40: of:=[queue.E40] -> 2639800 | I40: of:=[queue.G40] -> 0.000648 | J40: of:=[queue.I40] -> 0.216914 | K40: of:=[stack.E40] -> 993000 | L40: of:=[stack.G40] -> 0.001934 | M40: of:=[stack.I40] -> 0.368913
A41: of:=[furious.B41] -> 2 | B41: of:=[furious.E41] -> 2844600 | C41: of:=[furious.G41] -> 0.00054 | D41: of:=[furious.I41] -> 0.210136 | E41: of:=[generic.E41] -> 839200 | F41: of:=[generic.G41] -> 0.002288 | G41: of:=[generic.I41] -> 0.405597 | H41: of:=[queue.E41] -> 2647400 | I41: of:=[queue.G41] -> 0.000649 | J41: of:=[queue.I41] -> 0.218095 | K41: of:=[stack.E41] -> 990200 | L41: of:=[stack.G41] -> 0.001899 | M41: of:=[stack.I41] -> 0.371995
A42: of:=[furious.B42] -> 2 | B42: of:=[furious.E42] -> 2661800 | C42: of:=[furious.G42] -> 0.000643 | D42: of:=[furious.I42] -> 0.201518 | E42: of:=[generic.E42] -> 830600 | F42: of:=[generic.G42] -> 0.002309 | G42: of:=[generic.I42] -> 0.381604 | H42: of:=[queue.E42] -> 2666400 | I42: of:=[queue.G42] -> 0.000641 | J42: of:=[queue.I42] -> 0.203071 | K42: of:=[stack.E42] -> 974400 | L42: of:=[stack.G42] -> 0.001954 | M42: of:=[stack.I42] -> 0.35787
A43: of:=[furious.B43] -> 2 | B43: of:=[furious.E43] -> 2686200 | C43: of:=[furious.G43] -> 0.000641 | D43: of:=[furious.I43] -> 0.202193 | E43: of:=[generic.E43] -> 838600 | F43: of:=[generic.G43] -> 0.00227 | G43: of:=[generic.I43] -> 0.382758 | H43: of:=[queue.E43] -> 2660600 | I43: of:=[queue.G43] -> 0.000646 | J43: of:=[queue.I43] -> 0.204875 | K43: of:=[stack.E43] -> 968600 | L43: of:=[stack.G43] -> 0.001986 | M43: of:=[stack.I43] -> 0.361696
A44: of:=[furious.B44] -> 2 | B44: of:=[furious.E44] -> 2659000 | C44: of:=[furious.G44] -> 0.000642 | D44: of:=[furious.I44] -> 0.204797 | E44: of:=[generic.E44] -> 831400 | F44: of:=[generic.G44] -> 0.002305 | G44: of:=[generic.I44] -> 0.387397 | H44: of:=[queue.E44] -> 2664600 | I44: of:=[queue.G44] -> 0.000646 | J44: of:=[queue.I44] -> 0.206291 | K44: of:=[stack.E44] -> 974600 | L44: of:=[stack.G44] -> 0.001966 | M44: of:=[stack.I44] -> 0.363297
A45: of:=[furious.B45] -> 2 | B45: of:=[furious.E45] -> 2602400 | C45: of:=[furious.G45] -> 0.000624 | D45: of:=[furious.I45] -> 0.208514 | E45: of:=[generic.E45] -> 835000 | F45: of:=[generic.G45] -> 0.002297 | G45: of:=[generic.I45] -> 0.389521 | H45: of:=[queue.E45] -> 2659200 | I45: of:=[queue.G45] -> 0.000641 | J45: of:=[queue.I45] -> 0.208046 | K45: of:=[stack.E45] -> 979000 | L45: of:=[stack.G45] -> 0.001949 | M45: of:=[stack.I45] -> 0.365158
A46: of:=[furious.B46] -> 2 | B46: of:=[furious.E46] -> 2672200 | C46: of:=[furious.G46] -> 0.000647 | D46: of:=[furious.I46] -> 0.207338 | E46: of:=[generic.E46] -> 833800 | F46: of:=[generic.G46] -> 0.002281 | G46: of:=[generic.I46] -> 0.392716 | H46: of:=[queue.E46] -> 2650400 | I46: of:=[queue.G46] -> 0.000638 | J46: of:=[queue.I46] -> 0.209918 | K46: of:=[stack.E46] -> 972200 | L46: of:=[stack.G46] -> 0.001963 | M46: of:=[stack.I46] -> 0.369101
A47: of:=[furious.B47] -> 2 | B47: of:=[furious.E47] -> 2680800 | C47: of:=[furious.G47] -> 0.000625 | D47: of:=[furious.I47] -> 0.208509 | E47: of:=[generic.E47] -> 835800 | F47: of:=[generic.G47] -> 0.002283 | G47: of:=[generic.I47] -> 0.395145 | H47: of:=[queue.E47] -> 2659800 | I47: of:=[queue.G47] -> 0.000638 | J47: of:=[queue.I47] -> 0.211062 | K47: of:=[stack.E47] -> 975400 | L47: of:=[stack.G47] -> 0.001946 | M47: of:=[stack.I47] -> 0.371126
A48: of:=[furious.B48] -> 2 | B48: of:=[furious.E48] -> 2681400 | C48: of:=[furious.G48] -> 0.000631 | D48: of:=[furious.I48] -> 0.209994 | E48: of:=[generic.E48] -> 830200 | F48: of:=[generic.G48] -> 0.002332 | G48: of:=[generic.I48] -> 0.399406 | H48: of:=[queue.E48] -> 2663000 | I48: of:=[queue.G48] -> 0.000641 | J48: of:=[queue.I48] -> 0.212449 | K48: of:=[stack.E48] -> 970400 | L48: of:=[stack.G48] -> 0.001977 | M48: of:=[stack.I48] -> 0.374727
A49: of:=[furious.B49] -> 2 | B49: of:=[furious.E49] -> 2685200 | C49: of:=[furious.G49] -> 0.000639 | D49: of:=[furious.I49] -> 0.211362 | E49: of:=[generic.E49] -> 828200 | F49: of:=[generic.G49] -> 0.002345 | G49: of:=[generic.I49] -> 0.402809 | H49: of:=[queue.E49] -> 2653600 | I49: of:=[queue.G49] -> 0.000654 | J49: of:=[queue.I49] -> 0.214356 | K49: of:=[stack.E49] -> 971000 | L49: of:=[stack.G49] -> 0.001988 | M49: of:=[stack.I49] -> 0.377255
A50: of:=[furious.B50] -> 2 | B50: of:=[furious.E50] -> 2558200 | C50: of:=[furious.G50] -> 0.000652 | D50: of:=[furious.I50] -> 0.218046 | E50: of:=[generic.E50] -> 838600 | F50: of:=[generic.G50] -> 0.002285 | G50: of:=[generic.I50] -> 0.403147 | H50: of:=[queue.E50] -> 2656000 | I50: of:=[queue.G50] -> 0.000646 | J50: of:=[queue.I50] -> 0.215762 | K50: of:=[stack.E50] -> 969200 | L50: of:=[stack.G50] -> 0.001971 | M50: of:=[stack.I50] -> 0.380206
A51: of:=[furious.B51] -> 2 | B51: of:=[furious.E51] -> 2681600 | C51: of:=[furious.G51] -> 0.000625 | D51: of:=[furious.I51] -> 0.214432 | E51: of:=[generic.E51] -> 827400 | F51: of:=[generic.G51] -> 0.002308 | G51: of:=[generic.I51] -> 0.4087 | H51: of:=[queue.E51] -> 2658200 | I51: of:=[queue.G51] -> 0.000636 | J51: of:=[queue.I51] -> 0.217141 | K51: of:=[stack.E51] -> 977800 | L51: of:=[stack.G51] -> 0.00197 | M51: of:=[stack.I51] -> 0.381123
A52: of:=[furious.B52] -> 2 | B52: of:=[furious.E52] -> 3247800 | C52: of:=[furious.G52] -> 0.000526 | D52: of:=[furious.I52] -> 0.180346 | E52: of:=[generic.E52] -> 805400 | F52: of:=[generic.G52] -> 0.002374 | G52: of:=[generic.I52] -> 0.387442 | H52: of:=[queue.E52] -> 2588000 | I52: of:=[queue.G52] -> 0.000666 | J52: of:=[queue.I52] -> 0.205582 | K52: of:=[stack.E52] -> 1017400 | L52: of:=[stack.G52] -> 0.001871 | M52: of:=[stack.I52] -> 0.344872
A53: of:=[furious.B53] -> 2 | B53: of:=[furious.E53] -> 3244400 | C53: of:=[furious.G53] -> 0.000531 | D53: of:=[furious.I53] -> 0.181905 | E53: of:=[generic.E53] -> 803400 | F53: of:=[generic.G53] -> 0.00242 | G53: of:=[generic.I53] -> 0.39103 | H53: of:=[queue.E53] -> 2598800 | I53: of:=[queue.G53] -> 0.000663 | J53: of:=[queue.I53] -> 0.206765 | K53: of:=[stack.E53] -> 979000 | L53: of:=[stack.G53] -> 0.001955 | M53: of:=[stack.I53] -> 0.35434
A54: of:=[furious.B54] -> 2 | B54: of:=[furious.E54] -> 3248400 | C54: of:=[furious.G54] -> 0.000524 | D54: of:=[furious.I54] -> 0.183228 | E54: of:=[generic.E54] -> 808600 | F54: of:=[generic.G54] -> 0.002372 | G54: of:=[generic.I54] -> 0.392802 | H54: of:=[queue.E54] -> 2592400 | I54: of:=[queue.G54] -> 0.000665 | J54: of:=[queue.I54] -> 0.20862 | K54: of:=[stack.E54] -> 1006800 | L54: of:=[stack.G54] -> 0.001893 | M54: of:=[stack.I54] -> 0.352113
A55: of:=[furious.B55] -> 2 | B55: of:=[furious.E55] -> 3256400 | C55: of:=[furious.G55] -> 0.000524 | D55: of:=[furious.I55] -> 0.184429 | E55: of:=[generic.E55] -> 801800 | F55: of:=[generic.G55] -> 0.002365 | G55: of:=[generic.I55] -> 0.39745 | H55: of:=[queue.E55] -> 2574800 | I55: of:=[queue.G55] -> 0.000661 | J55: of:=[queue.I55] -> 0.210904 | K55: of:=[stack.E55] -> 980600 | L55: of:=[stack.G55] -> 0.001966 | M55: of:=[stack.I55] -> 0.35953
A56: of:=[furious.B56] -> 2 | B56: of:=[furious.E56] -> 3023600 | C56: of:=[furious.G56] -> 0.00054 | D56: of:=[furious.I56] -> 0.192804 | E56: of:=[generic.E56] -> 809400 | F56: of:=[generic.G56] -> 0.00236 | G56: of:=[generic.I56] -> 0.398551 | H56: of:=[queue.E56] -> 2594400 | I56: of:=[queue.G56] -> 0.000668 | J56: of:=[queue.I56] -> 0.211689 | K56: of:=[stack.E56] -> 1007800 | L56: of:=[stack.G56] -> 0.001911 | M56: of:=[stack.I56] -> 0.35733
A57: of:=[furious.B57] -> 2 | B57: of:=[furious.E57] -> 3216000 | C57: of:=[furious.G57] -> 0.00054 | D57: of:=[furious.I57] -> 0.188386 | E57: of:=[generic.E57] -> 831400 | F57: of:=[generic.G57] -> 0.002285 | G57: of:=[generic.I57] -> 0.396138 | H57: of:=[queue.E57] -> 2575400 | I57: of:=[queue.G57] -> 0.000662 | J57: of:=[queue.I57] -> 0.21402 | K57: of:=[stack.E57] -> 976600 | L57: of:=[stack.G57] -> 0.001954 | M57: of:=[stack.I57] -> 0.365674
A58: of:=[furious.B58] -> 2 | B58: of:=[furious.E58] -> 3033200 | C58: of:=[furious.G58] -> 0.000544 | D58: of:=[furious.I58] -> 0.195376 | E58: of:=[generic.E58] -> 836800 | F58: of:=[generic.G58] -> 0.002263 | G58: of:=[generic.I58] -> 0.397714 | H58: of:=[queue.E58] -> 2583800 | I58: of:=[queue.G58] -> 0.00067 | J58: of:=[queue.I58] -> 0.215235 | K58: of:=[stack.E58] -> 1025600 | L58: of:=[stack.G58] -> 0.001882 | M58: of:=[stack.I58] -> 0.359459
A59: of:=[furious.B59] -> 2 | B59: of:=[furious.E59] -> 3017000 | C59: of:=[furious.G59] -> 0.000519 | D59: of:=[furious.I59] -> 0.197221 | E59: of:=[generic.E59] -> 834000 | F59: of:=[generic.G59] -> 0.002269 | G59: of:=[generic.I59] -> 0.401218 | H59: of:=[queue.E59] -> 2610400 | I59: of:=[queue.G59] -> 0.000664 | J59: of:=[queue.I59] -> 0.215681 | K59: of:=[stack.E59] -> 973600 | L59: of:=[stack.G59] -> 0.001993 | M59: of:=[stack.I59] -> 0.371624
A60: of:=[furious.B60] -> 2 | B60: of:=[furious.E60] -> 3253000 | C60: of:=[furious.G60] -> 0.000531 | D60: of:=[furious.I60] -> 0.191324 | E60: of:=[generic.E60] -> 836200 | F60: of:=[generic.G60] -> 0.002301 | G60: of:=[generic.I60] -> 0.40355 | H60: of:=[queue.E60] -> 2525800 | I60: of:=[queue.G60] -> 0.000684 | J60: of:=[queue.I60] -> 0.220817 | K60: of:=[stack.E60] -> 1028800 | L60: of:=[stack.G60] -> 0.00188 | M60: of:=[stack.I60] -> 0.364107
A61: of:=[furious.B61] -> 2 | B61: of:=[furious.E61] -> 3022000 | C61: of:=[furious.G61] -> 0.000545 | D61: of:=[furious.I61] -> 0.199869 | E61: of:=[generic.E61] -> 841000 | F61: of:=[generic.G61] -> 0.002276 | G61: of:=[generic.I61] -> 0.405215 | H61: of:=[queue.E61] -> 2600200 | I61: of:=[queue.G61] -> 0.000656 | J61: of:=[queue.I61] -> 0.219138 | K61: of:=[stack.E61] -> 979400 | L61: of:=[stack.G61] -> 0.001962 | M61: of:=[stack.I61] -> 0.375797
A62: of:=[furious.B62] -> 3 | B62: of:=[furious.E62] -> 2194600 | C62: of:=[furious.G62] -> 0.001238 | D62: of:=[furious.I62] -> 0.281626 | E62: of:=[generic.E62] -> 774800 | F62: of:=[generic.G62] -> 0.00374 | G62: of:=[generic.I62] -> 0.4865 | H62: of:=[queue.E62] -> 2255800 | I62: of:=[queue.G62] -> 0.001174 | J62: of:=[queue.I62] -> 0.277888 | K62: of:=[stack.E62] -> 922400 | L62: of:=[stack.G62] -> 0.003163 | M62: of:=[stack.I62] -> 0.448045
A63: of:=[furious.B63] -> 3 | B63: of:=[furious.E63] -> 2196200 | C63: of:=[furious.G63] -> 0.001218 | D63: of:=[furious.I63] -> 0.283678 | E63: of:=[generic.E63] -> 777400 | F63: of:=[generic.G63] -> 0.003759 | G63: of:=[generic.I63] -> 0.489539 | H63: of:=[queue.E63] -> 2228400 | I63: of:=[queue.G63] -> 0.001191 | J63: of:=[queue.I63] -> 0.281742 | K63: of:=[stack.E63] -> 931800 | L63: of:=[stack.G63] -> 0.003127 | M63: of:=[stack.I63] -> 0.449274
A64: of:=[furious.B64] -> 3 | B64: of:=[furious.E64] -> 2198200 | C64: of:=[furious.G64] -> 0.001221 | D64: of:=[furious.I64] -> 0.285693 | E64: of:=[generic.E64] -> 772800 | F64: of:=[generic.G64] -> 0.00376 | G64: of:=[generic.I64] -> 0.494809 | H64: of:=[queue.E64] -> 2235000 | I64: of:=[queue.G64] -> 0.001209 | J64: of:=[queue.I64] -> 0.283466 | K64: of:=[stack.E64] -> 928200 | L64: of:=[stack.G64] -> 0.003137 | M64: of:=[stack.I64] -> 0.453615
A65: of:=[furious.B65] -> 3 | B65: of:=[furious.E65] -> 2196200 | C65: of:=[furious.G65] -> 0.001242 | D65: of:=[furious.I65] -> 0.287988 | E65: of:=[generic.E65] -> 776400 | F65: of:=[generic.G65] -> 0.003753 | G65: of:=[generic.I65] -> 0.497447 | H65: of:=[queue.E65] -> 2251600 | I65: of:=[queue.G65] -> 0.00119 | J65: of:=[queue.I65] -> 0.284519 | K65: of:=[stack.E65] -> 930800 | L65: of:=[stack.G65] -> 0.003133 | M65: of:=[stack.I65] -> 0.456426
A66: of:=[furious.B66] -> 3 | B66: of:=[furious.E66] -> 2199000 | C66: of:=[furious.G66] -> 0.001239 | D66: of:=[furious.I66] -> 0.289949 | E66: of:=[generic.E66] -> 773000 | F66: of:=[generic.G66] -> 0.003772 | G66: of:=[generic.I66] -> 0.502309 | H66: of:=[queue.E66] -> 2242800 | I66: of:=[queue.G66] -> 0.001201 | J66: of:=[queue.I66] -> 0.287175 | K66: of:=[stack.E66] -> 931200 | L66: of:=[stack.G66] -> 0.003112 | M66: of:=[stack.I66] -> 0.459726
A67: of:=[furious.B67] -> 3 | B67: of:=[furious.E67] -> 2196800 | C67: of:=[furious.G67] -> 0.001245 | D67: of:=[furious.I67] -> 0.292231 | E67: of:=[generic.E67] -> 775800 | F67: of:=[generic.G67] -> 0.003759 | G67: of:=[generic.I67] -> 0.505136 | H67: of:=[queue.E67] -> 2256200 | I67: of:=[queue.G67] -> 0.001176 | J67: of:=[queue.I67] -> 0.288368 | K67: of:=[stack.E67] -> 935600 | L67: of:=[stack.G67] -> 0.003104 | M67: of:=[stack.I67] -> 0.462015
A68: of:=[furious.B68] -> 3 | B68: of:=[furious.E68] -> 2195800 | C68: of:=[furious.G68] -> 0.001235 | D68: of:=[furious.I68] -> 0.294403 | E68: of:=[generic.E68] -> 774800 | F68: of:=[generic.G68] -> 0.003766 | G68: of:=[generic.I68] -> 0.509174 | H68: of:=[queue.E68] -> 2242600 | I68: of:=[queue.G68] -> 0.001197 | J68: of:=[queue.I68] -> 0.291303 | K68: of:=[stack.E68] -> 929800 | L68: of:=[stack.G68] -> 0.003115 | M68: of:=[stack.I68] -> 0.466802
A69: of:=[furious.B69] -> 3 | B69: of:=[furious.E69] -> 2198400 | C69: of:=[furious.G69] -> 0.001237 | D69: of:=[furious.I69] -> 0.296324 | E69: of:=[generic.E69] -> 775200 | F69: of:=[generic.G69] -> 0.003733 | G69: of:=[generic.I69] -> 0.512696 | H69: of:=[queue.E69] -> 2239200 | I69: of:=[queue.G69] -> 0.001183 | J69: of:=[queue.I69] -> 0.293547 | K69: of:=[stack.E69] -> 928400 | L69: of:=[stack.G69] -> 0.003119 | M69: of:=[stack.I69] -> 0.47048
A70: of:=[furious.B70] -> 3 | B70: of:=[furious.E70] -> 2196800 | C70: of:=[furious.G70] -> 0.00124 | D70: of:=[furious.I70] -> 0.298516 | E70: of:=[generic.E70] -> 778200 | F70: of:=[generic.G70] -> 0.003724 | G70: of:=[generic.I70] -> 0.515333 | H70: of:=[queue.E70] -> 2253800 | I70: of:=[queue.G70] -> 0.001186 | J70: of:=[queue.I70] -> 0.294613 | K70: of:=[stack.E70] -> 928400 | L70: of:=[stack.G70] -> 0.00313 | M70: of:=[stack.I70] -> 0.473795
A71: of:=[furious.B71] -> 3 | B71: of:=[furious.E71] -> 2198000 | C71: of:=[furious.G71] -> 0.001214 | D71: of:=[furious.I71] -> 0.300461 | E71: of:=[generic.E71] -> 775800 | F71: of:=[generic.G71] -> 0.003769 | G71: of:=[generic.I71] -> 0.519768 | H71: of:=[queue.E71] -> 2243600 | I71: of:=[queue.G71] -> 0.001187 | J71: of:=[queue.I71] -> 0.297286 | K71: of:=[stack.E71] -> 928800 | L71: of:=[stack.G71] -> 0.003131 | M71: of:=[stack.I71] -> 0.476986
A72: of:=[furious.B72] -> 3 | B72: of:=[furious.E72] -> 2575600 | C72: of:=[furious.G72] -> 0.000956 | D72: of:=[furious.I72] -> 0.248875 | E72: of:=[generic.E72] -> 787000 | F72: of:=[generic.G72] -> 0.003715 | G72: of:=[generic.I72] -> 0.482698 | H72: of:=[queue.E72] -> 2927400 | I72: of:=[queue.G72] -> 0.00087 | J72: of:=[queue.I72] -> 0.233586 | K72: of:=[stack.E72] -> 931200 | L72: of:=[stack.G72] -> 0.003104 | M72: of:=[stack.I72] -> 0.443119
A73: of:=[furious.B73] -> 3 | B73: of:=[furious.E73] -> 2562800 | C73: of:=[furious.G73] -> 0.000975 | D73: of:=[furious.I73] -> 0.251442 | E73: of:=[generic.E73] -> 781000 | F73: of:=[generic.G73] -> 0.003759 | G73: of:=[generic.I73] -> 0.488412 | H73: of:=[queue.E73] -> 2887000 | I73: of:=[queue.G73] -> 0.00089 | J73: of:=[queue.I73] -> 0.237099 | K73: of:=[stack.E73] -> 928600 | L73: of:=[stack.G73] -> 0.003104 | M73: of:=[stack.I73] -> 0.447222
A74: of:=[furious.B74] -> 3 | B74: of:=[furious.E74] -> 2561200 | C74: of:=[furious.G74] -> 0.001001 | D74: of:=[furious.I74] -> 0.253502 | E74: of:=[generic.E74] -> 789800 | F74: of:=[generic.G74] -> 0.00369 | G74: of:=[generic.I74] -> 0.489468 | H74: of:=[queue.E74] -> 2924600 | I74: of:=[queue.G74] -> 0.000851 | J74: of:=[queue.I74] -> 0.237371 | K74: of:=[stack.E74] -> 923000 | L74: of:=[stack.G74] -> 0.003142 | M74: of:=[stack.I74] -> 0.452065
A75: of:=[furious.B75] -> 3 | B75: of:=[furious.E75] -> 2568200 | C75: of:=[furious.G75] -> 0.000977 | D75: of:=[furious.I75] -> 0.25508 | E75: of:=[generic.E75] -> 784800 | F75: of:=[generic.G75] -> 0.003667 | G75: of:=[generic.I75] -> 0.494745 | H75: of:=[queue.E75] -> 2898000 | I75: of:=[queue.G75] -> 0.000885 | J75: of:=[queue.I75] -> 0.240307 | K75: of:=[stack.E75] -> 921200 | L75: of:=[stack.G75] -> 0.003124 | M75: of:=[stack.I75] -> 0.455946
A76: of:=[furious.B76] -> 3 | B76: of:=[furious.E76] -> 2567800 | C76: of:=[furious.G76] -> 0.000988 | D76: of:=[furious.I76] -> 0.257028 | E76: of:=[generic.E76] -> 787400 | F76: of:=[generic.G76] -> 0.003706 | G76: of:=[generic.I76] -> 0.497664 | H76: of:=[queue.E76] -> 2904400 | I76: of:=[queue.G76] -> 0.000889 | J76: of:=[queue.I76] -> 0.241886 | K76: of:=[stack.E76] -> 924600 | L76: of:=[stack.G76] -> 0.003119 | M76: of:=[stack.I76] -> 0.458521
A77: of:=[furious.B77] -> 3 | B77: of:=[furious.E77] -> 2563600 | C77: of:=[furious.G77] -> 0.000993 | D77: of:=[furious.I77] -> 0.259162 | E77: of:=[generic.E77] -> 784400 | F77: of:=[generic.G77] -> 0.003753 | G77: of:=[generic.I77] -> 0.502364 | H77: of:=[queue.E77] -> 2903800 | I77: of:=[queue.G77] -> 0.000886 | J77: of:=[queue.I77] -> 0.243735 | K77: of:=[stack.E77] -> 931400 | L77: of:=[stack.G77] -> 0.003122 | M77: of:=[stack.I77] -> 0.460248
A78: of:=[furious.B78] -> 3 | B78: of:=[furious.E78] -> 2567800 | C78: of:=[furious.G78] -> 0.000961 | D78: of:=[furious.I78] -> 0.260799 | E78: of:=[generic.E78] -> 784800 | F78: of:=[generic.G78] -> 0.003726 | G78: of:=[generic.I78] -> 0.505932 | H78: of:=[queue.E78] -> 2906600 | I78: of:=[queue.G78] -> 0.00087 | J78: of:=[queue.I78] -> 0.245396 | K78: of:=[stack.E78] -> 917600 | L78: of:=[stack.G78] -> 0.003173 | M78: of:=[stack.I78] -> 0.467105
A79: of:=[furious.B79] -> 3 | B79: of:=[furious.E79] -> 2566000 | C79: of:=[furious.G79] -> 0.000969 | D79: of:=[furious.I79] -> 0.262741 | E79: of:=[generic.E79] -> 783600 | F79: of:=[generic.G79] -> 0.003757 | G79: of:=[generic.I79] -> 0.510016 | H79: of:=[queue.E79] -> 2926800 | I79: of:=[queue.G79] -> 0.000866 | J79: of:=[queue.I79] -> 0.246312 | K79: of:=[stack.E79] -> 920000 | L79: of:=[stack.G79] -> 0.003161 | M79: of:=[stack.I79] -> 0.469871
A80: of:=[furious.B80] -> 3 | B80: of:=[furious.E80] -> 2555000 | C80: of:=[furious.G80] -> 0.00099 | D80: of:=[furious.I80] -> 0.265179 | E80: of:=[generic.E80] -> 785200 | F80: of:=[generic.G80] -> 0.003719 | G80: of:=[generic.I80] -> 0.513133 | H80: of:=[queue.E80] -> 2903200 | I80: of:=[queue.G80] -> 0.000867 | J80: of:=[queue.I80] -> 0.249057 | K80: of:=[stack.E80] -> 923200 | L80: of:=[stack.G80] -> 0.00313 | M80: of:=[stack.I80] -> 0.472382
A81: of:=[furious.B81] -> 3 | B81: of:=[furious.E81] -> 2561400 | C81: of:=[furious.G81] -> 0.00097 | D81: of:=[furious.I81] -> 0.266672 | E81: of:=[generic.E81] -> 783600 | F81: of:=[generic.G81] -> 0.003744 | G81: of:=[generic.I81] -> 0.517288 | H81: of:=[queue.E81] -> 2915800 | I81: of:=[queue.G81] -> 0.000859 | J81: of:=[queue.I81] -> 0.250242 | K81: of:=[stack.E81] -> 927000 | L81: of:=[stack.G81] -> 0.003135 | M81: of:=[stack.I81] -> 0.474726
A82: of:=[furious.B82] -> 3 | B82: of:=[furious.E82] -> 2563000 | C82: of:=[furious.G82] -> 0.001061 | D82: of:=[furious.I82] -> 0.25999 | E82: of:=[generic.E82] -> 757400 | F82: of:=[generic.G82] -> 0.003821 | G82: of:=[generic.I82] -> 0.492571 | H82: of:=[queue.E82] -> 2259800 | I82: of:=[queue.G82] -> 0.001197 | J82: of:=[queue.I82] -> 0.274181 | K82: of:=[stack.E82] -> 848000 | L82: of:=[stack.G82] -> 0.003425 | M82: of:=[stack.I82] -> 0.466789
A83: of:=[furious.B83] -> 3 | B83: of:=[furious.E83] -> 2568400 | C83: of:=[furious.G83] -> 0.001057 | D83: of:=[furious.I83] -> 0.261744 | E83: of:=[generic.E83] -> 759600 | F83: of:=[generic.G83] -> 0.003852 | G83: of:=[generic.I83] -> 0.495757 | H83: of:=[queue.E83] -> 2266000 | I83: of:=[queue.G83] -> 0.001176 | J83: of:=[queue.I83] -> 0.275944 | K83: of:=[stack.E83] -> 861200 | L83: of:=[stack.G83] -> 0.00337 | M83: of:=[stack.I83] -> 0.466821
A84: of:=[furious.B84] -> 3 | B84: of:=[furious.E84] -> 2565200 | C84: of:=[furious.G84] -> 0.001053 | D84: of:=[furious.I84] -> 0.263909 | E84: of:=[generic.E84] -> 760200 | F84: of:=[generic.G84] -> 0.003833 | G84: of:=[generic.I84] -> 0.499414 | H84: of:=[queue.E84] -> 2262400 | I84: of:=[queue.G84] -> 0.001186 | J84: of:=[queue.I84] -> 0.278303 | K84: of:=[stack.E84] -> 857000 | L84: of:=[stack.G84] -> 0.003368 | M84: of:=[stack.I84] -> 0.471548
A85: of:=[furious.B85] -> 3 | B85: of:=[furious.E85] -> 2557800 | C85: of:=[furious.G85] -> 0.001055 | D85: of:=[furious.I85] -> 0.266279 | E85: of:=[generic.E85] -> 755800 | F85: of:=[generic.G85] -> 0.003874 | G85: of:=[generic.I85] -> 0.504718 | H85: of:=[queue.E85] -> 2272600 | I85: of:=[queue.G85] -> 0.001175 | J85: of:=[queue.I85] -> 0.279785 | K85: of:=[stack.E85] -> 850600 | L85: of:=[stack.G85] -> 0.003412 | M85: of:=[stack.I85] -> 0.476909
A86: of:=[furious.B86] -> 3 | B86: of:=[furious.E86] -> 2574200 | C86: of:=[furious.G86] -> 0.001054 | D86: of:=[furious.I86] -> 0.267408 | E86: of:=[generic.E86] -> 756800 | F86: of:=[generic.G86] -> 0.003835 | G86: of:=[generic.I86] -> 0.508172 | H86: of:=[queue.E86] -> 2273600 | I86: of:=[queue.G86] -> 0.001177 | J86: of:=[queue.I86] -> 0.28182 | K86: of:=[stack.E86] -> 858200 | L86: of:=[stack.G86] -> 0.003384 | M86: of:=[stack.I86] -> 0.478343
A87: of:=[furious.B87] -> 3 | B87: of:=[furious.E87] -> 2554200 | C87: of:=[furious.G87] -> 0.001062 | D87: of:=[furious.I87] -> 0.270423 | E87: of:=[generic.E87] -> 761000 | F87: of:=[generic.G87] -> 0.003832 | G87: of:=[generic.I87] -> 0.510534 | H87: of:=[queue.E87] -> 2270400 | I87: of:=[queue.G87] -> 0.001179 | J87: of:=[queue.I87] -> 0.2841 | K87: of:=[stack.E87] -> 857000 | L87: of:=[stack.G87] -> 0.003419 | M87: of:=[stack.I87] -> 0.482235
A88: of:=[furious.B88] -> 3 | B88: of:=[furious.E88] -> 2554000 | C88: of:=[furious.G88] -> 0.001067 | D88: of:=[furious.I88] -> 0.272398 | E88: of:=[generic.E88] -> 759400 | F88: of:=[generic.G88] -> 0.003861 | G88: of:=[generic.I88] -> 0.514835 | H88: of:=[queue.E88] -> 2275800 | I88: of:=[queue.G88] -> 0.001164 | J88: of:=[queue.I88] -> 0.285808 | K88: of:=[stack.E88] -> 859000 | L88: of:=[stack.G88] -> 0.003376 | M88: of:=[stack.I88] -> 0.485166
A89: of:=[furious.B89] -> 3 | B89: of:=[furious.E89] -> 2558000 | C89: of:=[furious.G89] -> 0.001077 | D89: of:=[furious.I89] -> 0.274156 | E89: of:=[generic.E89] -> 758400 | F89: of:=[generic.G89] -> 0.003837 | G89: of:=[generic.I89] -> 0.518885 | H89: of:=[queue.E89] -> 2276400 | I89: of:=[queue.G89] -> 0.00118 | J89: of:=[queue.I89] -> 0.287827 | K89: of:=[stack.E89] -> 858600 | L89: of:=[stack.G89] -> 0.003392 | M89: of:=[stack.I89] -> 0.48876
A90: of:=[furious.B90] -> 3 | B90: of:=[furious.E90] -> 2557200 | C90: of:=[furious.G90] -> 0.001069 | D90: of:=[furious.I90] -> 0.276142 | E90: of:=[generic.E90] -> 752200 | F90: of:=[generic.G90] -> 0.003858 | G90: of:=[generic.I90] -> 0.524708 | H90: of:=[queue.E90] -> 2273000 | I90: of:=[queue.G90] -> 0.001169 | J90: of:=[queue.I90] -> 0.290065 | K90: of:=[stack.E90] -> 851800 | L90: of:=[stack.G90] -> 0.003372 | M90: of:=[stack.I90] -> 0.494131
A91: of:=[furious.B91] -> 3 | B91: of:=[furious.E91] -> 2574800 | C91: of:=[furious.G91] -> 0.001041 | D91: of:=[furious.I91] -> 0.277081 | E91: of:=[generic.E91] -> 761200 | F91: of:=[generic.G91] -> 0.003818 | G91: of:=[generic.I91] -> 0.525244 | H91: of:=[queue.E91] -> 2257000 | I91: of:=[queue.G91] -> 0.001198 | J91: of:=[queue.I91] -> 0.293142 | K91: of:=[stack.E91] -> 854800 | L91: of:=[stack.G91] -> 0.003369 | M91: of:=[stack.I91] -> 0.496667
A92: of:=[furious.B92] -> 4 | B92: of:=[furious.E92] -> 2515800 | C92: of:=[furious.G92] -> 0.001468 | D92: of:=[furious.I92] -> 0.305993 | E92: of:=[generic.E92] -> 770000 | F92: of:=[generic.G92] -> 0.005078 | G92: of:=[generic.I92] -> 0.593769 | H92: of:=[queue.E92] -> 1869400 | I92: of:=[queue.G92] -> 0.002001 | J92: of:=[queue.I92] -> 0.353639 | K92: of:=[stack.E92] -> 930400 | L92: of:=[stack.G92] -> 0.004187 | M92: of:=[stack.I92] -> 0.517434
A93: of:=[furious.B93] -> 4 | B93: of:=[furious.E93] -> 2518800 | C93: of:=[furious.G93] -> 0.001485 | D93: of:=[furious.I93] -> 0.308229 | E93: of:=[generic.E93] -> 771200 | F93: of:=[generic.G93] -> 0.005073 | G93: of:=[generic.I93] -> 0.597566 | H93: of:=[queue.E93] -> 1874400 | I93: of:=[queue.G93] -> 0.001975 | J93: of:=[queue.I93] -> 0.355953 | K93: of:=[stack.E93] -> 930000 | L93: of:=[stack.G93] -> 0.004185 | M93: of:=[stack.I93] -> 0.521573
A94: of:=[furious.B94] -> 4 | B94: of:=[furious.E94] -> 2517600 | C94: of:=[furious.G94] -> 0.001472 | D94: of:=[furious.I94] -> 0.31068 | E94: of:=[generic.E94] -> 771600 | F94: of:=[generic.G94] -> 0.005086 | G94: of:=[generic.I94] -> 0.601652 | H94: of:=[queue.E94] -> 1877000 | I94: of:=[queue.G94] -> 0.001982 | J94: of:=[queue.I94] -> 0.358481 | K94: of:=[stack.E94] -> 925800 | L94: of:=[stack.G94] -> 0.004234 | M94: of:=[stack.I94] -> 0.526789
A95: of:=[furious.B95] -> 4 | B95: of:=[furious.E95] -> 2517800 | C95: of:=[furious.G95] -> 0.001485 | D95: of:=[furious.I95] -> 0.313048 | E95: of:=[generic.E95] -> 771800 | F95: of:=[generic.G95] -> 0.005069 | G95: of:=[generic.I95] -> 0.605773 | H95: of:=[queue.E95] -> 1879200 | I95: of:=[queue.G95] -> 0.001986 | J95: of:=[queue.I95] -> 0.361032 | K95: of:=[stack.E95] -> 927000 | L95: of:=[stack.G95] -> 0.004203 | M95: of:=[stack.I95] -> 0.530425
A96: of:=[furious.B96] -> 4 | B96: of:=[furious.E96] -> 2523800 | C96: of:=[furious.G96] -> 0.001474 | D96: of:=[furious.I96] -> 0.315024 | E96: of:=[generic.E96] -> 774200 | F96: of:=[generic.G96] -> 0.005035 | G96: of:=[generic.I96] -> 0.608981 | H96: of:=[queue.E96] -> 1864200 | I96: of:=[queue.G96] -> 0.001987 | J96: of:=[queue.I96] -> 0.365212 | K96: of:=[stack.E96] -> 933000 | L96: of:=[stack.G96] -> 0.004174 | M96: of:=[stack.I96] -> 0.532649
A97: of:=[furious.B97] -> 4 | B97: of:=[furious.E97] -> 2513200 | C97: of:=[furious.G97] -> 0.001482 | D97: of:=[furious.I97] -> 0.318026 | E97: of:=[generic.E97] -> 769000 | F97: of:=[generic.G97] -> 0.0051 | G97: of:=[generic.I97] -> 0.615196 | H97: of:=[queue.E97] -> 1883000 | I97: of:=[queue.G97] -> 0.001938 | J97: of:=[queue.I97] -> 0.366042 | K97: of:=[stack.E97] -> 929400 | L97: of:=[stack.G97] -> 0.004192 | M97: of:=[stack.I97] -> 0.537592
A98: of:=[furious.B98] -> 4 | B98: of:=[furious.E98] -> 2516800 | C98: of:=[furious.G98] -> 0.001482 | D98: of:=[furious.I98] -> 0.320144 | E98: of:=[generic.E98] -> 772400 | F98: of:=[generic.G98] -> 0.005091 | G98: of:=[generic.I98] -> 0.617973 | H98: of:=[queue.E98] -> 1871800 | I98: of:=[queue.G98] -> 0.001993 | J98: of:=[queue.I98] -> 0.369839 | K98: of:=[stack.E98] -> 926800 | L98: of:=[stack.G98] -> 0.00418 | M98: of:=[stack.I98] -> 0.542214
A99: of:=[furious.B99] -> 4 | B99: of:=[furious.E99] -> 2514600 | C99: of:=[furious.G99] -> 0.001471 | D99: of:=[furious.I99] -> 0.322573 | E99: of:=[generic.E99] -> 773800 | F99: of:=[generic.G99] -> 0.005074 | G99: of:=[generic.I99] -> 0.621509 | H99: of:=[queue.E99] -> 1871800 | I99: of:=[queue.G99] -> 0.001955 | J99: of:=[queue.I99] -> 0.372473 | K99: of:=[stack.E99] -> 930000 | L99: of:=[stack.G99] -> 0.004172 | M99: of:=[stack.I99] -> 0.545121
A100: of:=[furious.B100] -> 4 | B100: of:=[furious.E100] -> 2510400 | C100: of:=[furious.G100] -> 0.001498 | D100: of:=[furious.I100] -> 0.325154 | E100: of:=[generic.E100] -> 774200 | F100: of:=[generic.G100] -> 0.00505 | G100: of:=[generic.I100] -> 0.625399 | H100: of:=[queue.E100] -> 1869400 | I100: of:=[queue.G100] -> 0.001977 | J100: of:=[queue.I100] -> 0.375355 | K100: of:=[stack.E100] -> 929600 | L100: of:=[stack.G100] -> 0.004189 | M100: of:=[stack.I100] -> 0.549066
A101: of:=[furious.B101] -> 4 | B101: of:=[furious.E101] -> 2521400 | C101: of:=[furious.G101] -> 0.00148 | D101: of:=[furious.I101] -> 0.326717 | E101: of:=[generic.E101] -> 773000 | F101: of:=[generic.G101] -> 0.005071 | G101: of:=[generic.I101] -> 0.629922 | H101: of:=[queue.E101] -> 1874800 | I101: of:=[queue.G101] -> 0.001966 | J101: of:=[queue.I101] -> 0.377428 | K101: of:=[stack.E101] -> 929800 | L101: of:=[stack.G101] -> 0.004166 | M101: of:=[stack.I101] -> 0.552789
A102: of:=[furious.B102] -> 4 | B102: of:=[furious.E102] -> 2479800 | C102: of:=[furious.G102] -> 0.001501 | D102: of:=[furious.I102] -> 0.308551 | E102: of:=[generic.E102] -> 790400 | F102: of:=[generic.G102] -> 0.004942 | G102: of:=[generic.I102] -> 0.569365 | H102: of:=[queue.E102] -> 1853200 | I102: of:=[queue.G102] -> 0.002016 | J102: of:=[queue.I102] -> 0.359584 | K102: of:=[stack.E102] -> 948200 | L102: of:=[stack.G102] -> 0.004115 | M102: of:=[stack.I102] -> 0.513511
A103: of:=[furious.B103] -> 4 | B103: of:=[furious.E103] -> 2442200 | C103: of:=[furious.G103] -> 0.001537 | D103: of:=[furious.I103] -> 0.313379 | E103: of:=[generic.E103] -> 786400 | F103: of:=[generic.G103] -> 0.004952 | G103: of:=[generic.I103] -> 0.575132 | H103: of:=[queue.E103] -> 1837200 | I103: of:=[queue.G103] -> 0.002066 | J103: of:=[queue.I103] -> 0.363996 | K103: of:=[stack.E103] -> 948000 | L103: of:=[stack.G103] -> 0.004124 | M103: of:=[stack.I103] -> 0.517565
A104: of:=[furious.B104] -> 4 | B104: of:=[furious.E104] -> 2431800 | C104: of:=[furious.G104] -> 0.001527 | D104: of:=[furious.I104] -> 0.316471 | E104: of:=[generic.E104] -> 784800 | F104: of:=[generic.G104] -> 0.004995 | G104: of:=[generic.I104] -> 0.580039 | H104: of:=[queue.E104] -> 1844400 | I104: of:=[queue.G104] -> 0.002054 | J104: of:=[queue.I104] -> 0.366101 | K104: of:=[stack.E104] -> 950200 | L104: of:=[stack.G104] -> 0.00413 | M104: of:=[stack.I104] -> 0.520944
A105: of:=[furious.B105] -> 4 | B105: of:=[furious.E105] -> 2426800 | C105: of:=[furious.G105] -> 0.001521 | D105: of:=[furious.I105] -> 0.319189 | E105: of:=[generic.E105] -> 787800 | F105: of:=[generic.G105] -> 0.004961 | G105: of:=[generic.I105] -> 0.583203 | H105: of:=[queue.E105] -> 1845400 | I105: of:=[queue.G105] -> 0.002042 | J105: of:=[queue.I105] -> 0.368807 | K105: of:=[stack.E105] -> 946000 | L105: of:=[stack.G105] -> 0.004123 | M105: of:=[stack.I105] -> 0.526033
A106: of:=[furious.B106] -> 4 | B106: of:=[furious.E106] -> 2432000 | C106: of:=[furious.G106] -> 0.001528 | D106: of:=[furious.I106] -> 0.321235 | E106: of:=[generic.E106] -> 775400 | F106: of:=[generic.G106] -> 0.00504 | G106: of:=[generic.I106] -> 0.592118 | H106: of:=[queue.E106] -> 1830800 | I106: of:=[queue.G106] -> 0.00208 | J106: of:=[queue.I106] -> 0.373072 | K106: of:=[stack.E106] -> 949200 | L106: of:=[stack.G106] -> 0.004111 | M106: of:=[stack.I106] -> 0.529045
A107: of:=[furious.B107] -> 4 | B107: of:=[furious.E107] -> 2426600 | C107: of:=[furious.G107] -> 0.001543 | D107: of:=[furious.I107] -> 0.323982 | E107: of:=[generic.E107] -> 787400 | F107: of:=[generic.G107] -> 0.004958 | G107: of:=[generic.I107] -> 0.591793 | H107: of:=[queue.E107] -> 1853400 | I107: of:=[queue.G107] -> 0.002031 | J107: of:=[queue.I107] -> 0.37384 | K107: of:=[stack.E107] -> 946200 | L107: of:=[stack.G107] -> 0.00412 | M107: of:=[stack.I107] -> 0.533756
A108: of:=[furious.B108] -> 4 | B108: of:=[furious.E108] -> 2442600 | C108: of:=[furious.G108] -> 0.001534 | D108: of:=[furious.I108] -> 0.325293 | E108: of:=[generic.E108] -> 783800 | F108: of:=[generic.G108] -> 0.004983 | G108: of:=[generic.I108] -> 0.597337 | H108: of:=[queue.E108] -> 1855400 | I108: of:=[queue.G108] -> 0.002024 | J108: of:=[queue.I108] -> 0.376358 | K108: of:=[stack.E108] -> 954400 | L108: of:=[stack.G108] -> 0.004101 | M108: of:=[stack.I108] -> 0.535302
A109: of:=[furious.B109] -> 4 | B109: of:=[furious.E109] -> 2438000 | C109: of:=[furious.G109] -> 0.001525 | D109: of:=[furious.I109] -> 0.327933 | E109: of:=[generic.E109] -> 789000 | F109: of:=[generic.G109] -> 0.00494 | G109: of:=[generic.I109] -> 0.5995 | H109: of:=[queue.E109] -> 1838000 | I109: of:=[queue.G109] -> 0.00205 | J109: of:=[queue.I109] -> 0.380836 | K109: of:=[stack.E109] -> 952400 | L109: of:=[stack.G109] -> 0.004078 | M109: of:=[stack.I109] -> 0.539656
A110: of:=[furious.B110] -> 4 | B110: of:=[furious.E110] -> 2427800 | C110: of:=[furious.G110] -> 0.001526 | D110: of:=[furious.I110] -> 0.330935 | E110: of:=[generic.E110] -> 789000 | F110: of:=[generic.G110] -> 0.004953 | G110: of:=[generic.I110] -> 0.603617 | H110: of:=[queue.E110] -> 1844600 | I110: of:=[queue.G110] -> 0.002023 | J110: of:=[queue.I110] -> 0.382806 | K110: of:=[stack.E110] -> 953200 | L110: of:=[stack.G110] -> 0.004087 | M110: of:=[stack.I110] -> 0.543205
A111: of:=[furious.B111] -> 4 | B111: of:=[furious.E111] -> 2436800 | C111: of:=[furious.G111] -> 0.001514 | D111: of:=[furious.I111] -> 0.332608 | E111: of:=[generic.E111] -> 787400 | F111: of:=[generic.G111] -> 0.00495 | G111: of:=[generic.I111] -> 0.608312 | H111: of:=[queue.E111] -> 1842000 | I111: of:=[queue.G111] -> 0.00203 | J111: of:=[queue.I111] -> 0.385717 | K111: of:=[stack.E111] -> 953200 | L111: of:=[stack.G111] -> 0.004081 | M111: of:=[stack.I111] -> 0.546948
A112: of:=[furious.B112] -> 4 | B112: of:=[furious.E112] -> 2448000 | C112: of:=[furious.G112] -> 0.001482 | D112: of:=[furious.I112] -> 0.309159 | E112: of:=[generic.E112] -> 782800 | F112: of:=[generic.G112] -> 0.005015 | G112: of:=[generic.I112] -> 0.576532 | H112: of:=[queue.E112] -> 1834600 | I112: of:=[queue.G112] -> 0.002069 | J112: of:=[queue.I112] -> 0.360283 | K112: of:=[stack.E112] -> 930000 | L112: of:=[stack.G112] -> 0.004209 | M112: of:=[stack.I112] -> 0.515025
A113: of:=[furious.B113] -> 4 | B113: of:=[furious.E113] -> 2440400 | C113: of:=[furious.G113] -> 0.001517 | D113: of:=[furious.I113] -> 0.312088 | E113: of:=[generic.E113] -> 783600 | F113: of:=[generic.G113] -> 0.005003 | G113: of:=[generic.I113] -> 0.580562 | H113: of:=[queue.E113] -> 1831400 | I113: of:=[queue.G113] -> 0.002054 | J113: of:=[queue.I113] -> 0.363462 | K113: of:=[stack.E113] -> 931200 | L113: of:=[stack.G113] -> 0.004197 | M113: of:=[stack.I113] -> 0.518754
A114: of:=[furious.B114] -> 4 | B114: of:=[furious.E114] -> 2454400 | C114: of:=[furious.G114] -> 0.001483 | D114: of:=[furious.I114] -> 0.313571 | E114: of:=[generic.E114] -> 785200 | F114: of:=[generic.G114] -> 0.005 | G114: of:=[generic.I114] -> 0.584265 | H114: of:=[queue.E114] -> 1845000 | I114: of:=[queue.G114] -> 0.002042 | J114: of:=[queue.I114] -> 0.364929 | K114: of:=[stack.E114] -> 925600 | L114: of:=[stack.G114] -> 0.004246 | M114: of:=[stack.I114] -> 0.524385
A115: of:=[furious.B115] -> 4 | B115: of:=[furious.E115] -> 2443000 | C115: of:=[furious.G115] -> 0.0015 | D115: of:=[furious.I115] -> 0.316678 | E115: of:=[generic.E115] -> 785200 | F115: of:=[generic.G115] -> 0.004977 | G115: of:=[generic.I115] -> 0.588509 | H115: of:=[queue.E115] -> 1840000 | I115: of:=[queue.G115] -> 0.002047 | J115: of:=[queue.I115] -> 0.368214 | K115: of:=[stack.E115] -> 933200 | L115: of:=[stack.G115] -> 0.004203 | M115: of:=[stack.I115] -> 0.526254
A116: of:=[furious.B116] -> 4 | B116: of:=[furious.E116] -> 2456000 | C116: of:=[furious.G116] -> 0.0015 | D116: of:=[furious.I116] -> 0.318205 | E116: of:=[generic.E116] -> 787600 | F116: of:=[generic.G116] -> 0.004937 | G116: of:=[generic.I116] -> 0.591798 | H116: of:=[queue.E116] -> 1831200 | I116: of:=[queue.G116] -> 0.00205 | J116: of:=[queue.I116] -> 0.371865 | K116: of:=[stack.E116] -> 927400 | L116: of:=[stack.G116] -> 0.004216 | M116: of:=[stack.I116] -> 0.531875
A117: of:=[furious.B117] -> 4 | B117: of:=[furious.E117] -> 2450800 | C117: of:=[furious.G117] -> 0.00151 | D117: of:=[furious.I117] -> 0.320903 | E117: of:=[generic.E117] -> 781600 | F117: of:=[generic.G117] -> 0.005003 | G117: of:=[generic.I117] -> 0.59826 | H117: of:=[queue.E117] -> 1825000 | I117: of:=[queue.G117] -> 0.002044 | J117: of:=[queue.I117] -> 0.375229 | K117: of:=[stack.E117] -> 928600 | L117: of:=[stack.G117] -> 0.004204 | M117: of:=[stack.I117] -> 0.535472
A118: of:=[furious.B118] -> 4 | B118: of:=[furious.E118] -> 2450800 | C118: of:=[furious.G118] -> 0.001502 | D118: of:=[furious.I118] -> 0.323234 | E118: of:=[generic.E118] -> 785600 | F118: of:=[generic.G118] -> 0.004924 | G118: of:=[generic.I118] -> 0.600847 | H118: of:=[queue.E118] -> 1827600 | I118: of:=[queue.G118] -> 0.002054 | J118: of:=[queue.I118] -> 0.377691 | K118: of:=[stack.E118] -> 929400 | L118: of:=[stack.G118] -> 0.004226 | M118: of:=[stack.I118] -> 0.539175
A119: of:=[furious.B119] -> 4 | B119: of:=[furious.E119] -> 2442400 | C119: of:=[furious.G119] -> 0.001509 | D119: of:=[furious.I119] -> 0.326112 | E119: of:=[generic.E119] -> 778000 | F119: of:=[generic.G119] -> 0.005054 | G119: of:=[generic.I119] -> 0.607945 | H119: of:=[queue.E119] -> 1820200 | I119: of:=[queue.G119] -> 0.002064 | J119: of:=[queue.I119] -> 0.381175 | K119: of:=[stack.E119] -> 935800 | L119: of:=[stack.G119] -> 0.004176 | M119: of:=[stack.I119] -> 0.5412
A120: of:=[furious.B120] -> 4 | B120: of:=[furious.E120] -> 2459000 | C120: of:=[furious.G120] -> 0.001508 | D120: of:=[furious.I120] -> 0.327328 | E120: of:=[generic.E120] -> 785400 | F120: of:=[generic.G120] -> 0.004981 | G120: of:=[generic.I120] -> 0.609176 | H120: of:=[queue.E120] -> 1826400 | I120: of:=[queue.G120] -> 0.002042 | J120: of:=[queue.I120] -> 0.383201 | K120: of:=[stack.E120] -> 932600 | L120: of:=[stack.G120] -> 0.004175 | M120: of:=[stack.I120] -> 0.545965
A121: of:=[furious.B121] -> 4 | B121: of:=[furious.E121] -> 2452000 | C121: of:=[furious.G121] -> 0.001498 | D121: of:=[furious.I121] -> 0.330073 | E121: of:=[generic.E121] -> 781200 | F121: of:=[generic.G121] -> 0.005036 | G121: of:=[generic.I121] -> 0.61492 | H121: of:=[queue.E121] -> 1830800 | I121: of:=[queue.G121] -> 0.002067 | J121: of:=[queue.I121] -> 0.385431 | K121: of:=[stack.E121] -> 930800 | L121: of:=[stack.G121] -> 0.004209 | M121: of:=[stack.I121] -> 0.550331
A122: of:=[furious.B122] -> 5 | B122: of:=[furious.E122] -> 2507000 | C122: of:=[furious.G122] -> 0.001863 | D122: of:=[furious.I122] -> 0.352629 | E122: of:=[generic.E122] -> 740800 | F122: of:=[generic.G122] -> 0.00665 | G122: of:=[generic.I122] -> 0.647089 | H122: of:=[queue.E122] -> 1879800 | I122: of:=[queue.G122] -> 0.002524 | J122: of:=[queue.I122] -> 0.409861 | K122: of:=[stack.E122] -> 886800 | L122: of:=[stack.G122] -> 0.005519 | M122: of:=[stack.I122] -> 0.593596
A123: of:=[furious.B123] -> 5 | B123: of:=[furious.E123] -> 2504400 | C123: of:=[furious.G123] -> 0.001854 | D123: of:=[furious.I123] -> 0.355431 | E123: of:=[generic.E123] -> 740600 | F123: of:=[generic.G123] -> 0.006595 | G123: of:=[generic.I123] -> 0.652252 | H123: of:=[queue.E123] -> 1861000 | I123: of:=[queue.G123] -> 0.002556 | J123: of:=[queue.I123] -> 0.415016 | K123: of:=[stack.E123] -> 901800 | L123: of:=[stack.G123] -> 0.005434 | M123: of:=[stack.I123] -> 0.593236
A124: of:=[furious.B124] -> 5 | B124: of:=[furious.E124] -> 2514200 | C124: of:=[furious.G124] -> 0.001852 | D124: of:=[furious.I124] -> 0.357365 | E124: of:=[generic.E124] -> 738200 | F124: of:=[generic.G124] -> 0.006646 | G124: of:=[generic.I124] -> 0.658378 | H124: of:=[queue.E124] -> 1874000 | I124: of:=[queue.G124] -> 0.002511 | J124: of:=[queue.I124] -> 0.416599 | K124: of:=[stack.E124] -> 900600 | L124: of:=[stack.G124] -> 0.005445 | M124: of:=[stack.I124] -> 0.5982
A125: of:=[furious.B125] -> 5 | B125: of:=[furious.E125] -> 2507400 | C125: of:=[furious.G125] -> 0.001851 | D125: of:=[furious.I125] -> 0.360426 | E125: of:=[generic.E125] -> 741200 | F125: of:=[generic.G125] -> 0.006624 | G125: of:=[generic.I125] -> 0.662066 | H125: of:=[queue.E125] -> 1864800 | I125: of:=[queue.G125] -> 0.002509 | J125: of:=[queue.I125] -> 0.420618 | K125: of:=[stack.E125] -> 897400 | L125: of:=[stack.G125] -> 0.005447 | M125: of:=[stack.I125] -> 0.603793
A126: of:=[furious.B126] -> 5 | B126: of:=[furious.E126] -> 2496400 | C126: of:=[furious.G126] -> 0.001872 | D126: of:=[furious.I126] -> 0.363802 | E126: of:=[generic.E126] -> 739200 | F126: of:=[generic.G126] -> 0.006656 | G126: of:=[generic.I126] -> 0.667962 | H126: of:=[queue.E126] -> 1869600 | I126: of:=[queue.G126] -> 0.002505 | J126: of:=[queue.I126] -> 0.42305 | K126: of:=[stack.E126] -> 900800 | L126: of:=[stack.G126] -> 0.005406 | M126: of:=[stack.I126] -> 0.607121
A127: of:=[furious.B127] -> 5 | B127: of:=[furious.E127] -> 2477200 | C127: of:=[furious.G127] -> 0.00188 | D127: of:=[furious.I127] -> 0.367774 | E127: of:=[generic.E127] -> 740800 | F127: of:=[generic.G127] -> 0.006639 | G127: of:=[generic.I127] -> 0.672197 | H127: of:=[queue.E127] -> 1859200 | I127: of:=[queue.G127] -> 0.002515 | J127: of:=[queue.I127] -> 0.427185 | K127: of:=[stack.E127] -> 901400 | L127: of:=[stack.G127] -> 0.005445 | M127: of:=[stack.I127] -> 0.611388
A128: of:=[furious.B128] -> 5 | B128: of:=[furious.E128] -> 2487400 | C128: of:=[furious.G128] -> 0.00189 | D128: of:=[furious.I128] -> 0.369586 | E128: of:=[generic.E128] -> 741600 | F128: of:=[generic.G128] -> 0.006632 | G128: of:=[generic.I128] -> 0.676752 | H128: of:=[queue.E128] -> 1880800 | I128: of:=[queue.G128] -> 0.002503 | J128: of:=[queue.I128] -> 0.427662 | K128: of:=[stack.E128] -> 897600 | L128: of:=[stack.G128] -> 0.005457 | M128: of:=[stack.I128] -> 0.617118
A129: of:=[furious.B129] -> 5 | B129: of:=[furious.E129] -> 2497400 | C129: of:=[furious.G129] -> 0.001882 | D129: of:=[furious.I129] -> 0.371388 | E129: of:=[generic.E129] -> 742600 | F129: of:=[generic.G129] -> 0.006636 | G129: of:=[generic.I129] -> 0.681184 | H129: of:=[queue.E129] -> 1862000 | I129: of:=[queue.G129] -> 0.002527 | J129: of:=[queue.I129] -> 0.432745 | K129: of:=[stack.E129] -> 901000 | L129: of:=[stack.G129] -> 0.005443 | M129: of:=[stack.I129] -> 0.620355
A130: of:=[furious.B130] -> 5 | B130: of:=[furious.E130] -> 2496200 | C130: of:=[furious.G130] -> 0.001871 | D130: of:=[furious.I130] -> 0.373986 | E130: of:=[generic.E130] -> 741000 | F130: of:=[generic.G130] -> 0.006634 | G130: of:=[generic.I130] -> 0.686767 | H130: of:=[queue.E130] -> 1870400 | I130: of:=[queue.G130] -> 0.002512 | J130: of:=[queue.I130] -> 0.434672 | K130: of:=[stack.E130] -> 896800 | L130: of:=[stack.G130] -> 0.005486 | M130: of:=[stack.I130] -> 0.626202
A131: of:=[furious.B131] -> 5 | B131: of:=[furious.E131] -> 2498400 | C131: of:=[furious.G131] -> 0.001862 | D131: of:=[furious.I131] -> 0.376304 | E131: of:=[generic.E131] -> 739200 | F131: of:=[generic.G131] -> 0.006631 | G131: of:=[generic.I131] -> 0.692408 | H131: of:=[queue.E131] -> 1859600 | I131: of:=[queue.G131] -> 0.002532 | J131: of:=[queue.I131] -> 0.438826 | K131: of:=[stack.E131] -> 899000 | L131: of:=[stack.G131] -> 0.005453 | M131: of:=[stack.I131] -> 0.629779
A132: of:=[furious.B132] -> 5 | B132: of:=[furious.E132] -> 2452000 | C132: of:=[furious.G132] -> 0.001918 | D132: of:=[furious.I132] -> 0.355492 | E132: of:=[generic.E132] -> 812200 | F132: of:=[generic.G132] -> 0.00605 | G132: of:=[generic.I132] -> 0.618085 | H132: of:=[queue.E132] -> 2086400 | I132: of:=[queue.G132] -> 0.002263 | J132: of:=[queue.I132] -> 0.379833 | K132: of:=[stack.E132] -> 928400 | L132: of:=[stack.G132] -> 0.005274 | M132: of:=[stack.I132] -> 0.577603
A133: of:=[furious.B133] -> 5 | B133: of:=[furious.E133] -> 2458800 | C133: of:=[furious.G133] -> 0.001904 | D133: of:=[furious.I133] -> 0.357672 | E133: of:=[generic.E133] -> 811600 | F133: of:=[generic.G133] -> 0.006033 | G133: of:=[generic.I133] -> 0.623173 | H133: of:=[queue.E133] -> 2090000 | I133: of:=[queue.G133] -> 0.002257 | J133: of:=[queue.I133] -> 0.382468 | K133: of:=[stack.E133] -> 921400 | L133: of:=[stack.G133] -> 0.005338 | M133: of:=[stack.I133] -> 0.584378
A134: of:=[furious.B134] -> 5 | B134: of:=[furious.E134] -> 2466000 | C134: of:=[furious.G134] -> 0.001921 | D134: of:=[furious.I134] -> 0.359829 | E134: of:=[generic.E134] -> 810200 | F134: of:=[generic.G134] -> 0.006065 | G134: of:=[generic.I134] -> 0.628554 | H134: of:=[queue.E134] -> 2093800 | I134: of:=[queue.G134] -> 0.002262 | J134: of:=[queue.I134] -> 0.385069 | K134: of:=[stack.E134] -> 926200 | L134: of:=[stack.G134] -> 0.005293 | M134: of:=[stack.I134] -> 0.587385
A135: of:=[furious.B135] -> 5 | B135: of:=[furious.E135] -> 2443000 | C135: of:=[furious.G135] -> 0.001945 | D135: of:=[furious.I135] -> 0.364206 | E135: of:=[generic.E135] -> 812000 | F135: of:=[generic.G135] -> 0.006067 | G135: of:=[generic.I135] -> 0.63267 | H135: of:=[queue.E135] -> 2084600 | I135: of:=[queue.G135] -> 0.002241 | J135: of:=[queue.I135] -> 0.388811 | K135: of:=[stack.E135] -> 923000 | L135: of:=[stack.G135] -> 0.005298 | M135: of:=[stack.I135] -> 0.592887
A136: of:=[furious.B136] -> 5 | B136: of:=[furious.E136] -> 2462800 | C136: of:=[furious.G136] -> 0.001932 | D136: of:=[furious.I136] -> 0.365393 | E136: of:=[generic.E136] -> 811800 | F136: of:=[generic.G136] -> 0.00607 | G136: of:=[generic.I136] -> 0.637527 | H136: of:=[queue.E136] -> 2098000 | I136: of:=[queue.G136] -> 0.002274 | J136: of:=[queue.I136] -> 0.390489 | K136: of:=[stack.E136] -> 926200 | L136: of:=[stack.G136] -> 0.005258 | M136: of:=[stack.I136] -> 0.596287
A137: of:=[furious.B137] -> 5 | B137: of:=[furious.E137] -> 2478400 | C137: of:=[furious.G137] -> 0.001895 | D137: of:=[furious.I137] -> 0.366886 | E137: of:=[generic.E137] -> 810600 | F137: of:=[generic.G137] -> 0.006079 | G137: of:=[generic.I137] -> 0.642745 | H137: of:=[queue.E137] -> 2093600 | I137: of:=[queue.G137] -> 0.002268 | J137: of:=[queue.I137] -> 0.39379 | K137: of:=[stack.E137] -> 924800 | L137: of:=[stack.G137] -> 0.005307 | M137: of:=[stack.I137] -> 0.601168
A138: of:=[furious.B138] -> 5 | B138: of:=[furious.E138] -> 2462400 | C138: of:=[furious.G138] -> 0.00191 | D138: of:=[furious.I138] -> 0.370662 | E138: of:=[generic.E138] -> 810600 | F138: of:=[generic.G138] -> 0.00606 | G138: of:=[generic.I138] -> 0.647442 | H138: of:=[queue.E138] -> 2089400 | I138: of:=[queue.G138] -> 0.002269 | J138: of:=[queue.I138] -> 0.397052 | K138: of:=[stack.E138] -> 929200 | L138: of:=[stack.G138] -> 0.005252 | M138: of:=[stack.I138] -> 0.604106
A139: of:=[furious.B139] -> 5 | B139: of:=[furious.E139] -> 2463600 | C139: of:=[furious.G139] -> 0.001921 | D139: of:=[furious.I139] -> 0.373154 | E139: of:=[generic.E139] -> 825200 | F139: of:=[generic.G139] -> 0.005991 | G139: of:=[generic.I139] -> 0.646655 | H139: of:=[queue.E139] -> 2091000 | I139: of:=[queue.G139] -> 0.002264 | J139: of:=[queue.I139] -> 0.399742 | K139: of:=[stack.E139] -> 925400 | L139: of:=[stack.G139] -> 0.005282 | M139: of:=[stack.I139] -> 0.609692
A140: of:=[furious.B140] -> 5 | B140: of:=[furious.E140] -> 2470400 | C140: of:=[furious.G140] -> 0.001913 | D140: of:=[furious.I140] -> 0.375198 | E140: of:=[generic.E140] -> 814800 | F140: of:=[generic.G140] -> 0.006033 | G140: of:=[generic.I140] -> 0.655388 | H140: of:=[queue.E140] -> 2093400 | I140: of:=[queue.G140] -> 0.002255 | J140: of:=[queue.I140] -> 0.402325 | K140: of:=[stack.E140] -> 926200 | L140: of:=[stack.G140] -> 0.005247 | M140: of:=[stack.I140] -> 0.613719
A141: of:=[furious.B141] -> 5 | B141: of:=[furious.E141] -> 2468200 | C141: of:=[furious.G141] -> 0.001904 | D141: of:=[furious.I141] -> 0.377893 | E141: of:=[generic.E141] -> 811000 | F141: of:=[generic.G141] -> 0.006079 | G141: of:=[generic.I141] -> 0.661532 | H141: of:=[queue.E141] -> 2089600 | I141: of:=[queue.G141] -> 0.00228 | J141: of:=[queue.I141] -> 0.405512 | K141: of:=[stack.E141] -> 927000 | L141: of:=[stack.G141] -> 0.005271 | M141: of:=[stack.I141] -> 0.617735
A142: of:=[furious.B142] -> 5 | B142: of:=[furious.E142] -> 2347600 | C142: of:=[furious.G142] -> 0.002016 | D142: of:=[furious.I142] -> 0.359144 | E142: of:=[generic.E142] -> 785400 | F142: of:=[generic.G142] -> 0.006257 | G142: of:=[generic.I142] -> 0.628379 | H142: of:=[queue.E142] -> 2175000 | I142: of:=[queue.G142] -> 0.002172 | J142: of:=[queue.I142] -> 0.37169 | K142: of:=[stack.E142] -> 947000 | L142: of:=[stack.G142] -> 0.005145 | M142: of:=[stack.I142] -> 0.571085
A143: of:=[furious.B143] -> 5 | B143: of:=[furious.E143] -> 2347000 | C143: of:=[furious.G143] -> 0.002016 | D143: of:=[furious.I143] -> 0.361986 | E143: of:=[generic.E143] -> 781000 | F143: of:=[generic.G143] -> 0.006287 | G143: of:=[generic.I143] -> 0.635115 | H143: of:=[queue.E143] -> 2177200 | I143: of:=[queue.G143] -> 0.002153 | J143: of:=[queue.I143] -> 0.374389 | K143: of:=[stack.E143] -> 952400 | L143: of:=[stack.G143] -> 0.005113 | M143: of:=[stack.I143] -> 0.573936
A144: of:=[furious.B144] -> 5 | B144: of:=[furious.E144] -> 2355000 | C144: of:=[furious.G144] -> 0.002004 | D144: of:=[furious.I144] -> 0.364133 | E144: of:=[generic.E144] -> 782400 | F144: of:=[generic.G144] -> 0.006276 | G144: of:=[generic.I144] -> 0.639473 | H144: of:=[queue.E144] -> 2171000 | I144: of:=[queue.G144] -> 0.002179 | J144: of:=[queue.I144] -> 0.377817 | K144: of:=[stack.E144] -> 947600 | L144: of:=[stack.G144] -> 0.005156 | M144: of:=[stack.I144] -> 0.579851
A145: of:=[furious.B145] -> 5 | B145: of:=[furious.E145] -> 2355400 | C145: of:=[furious.G145] -> 0.001995 | D145: of:=[furious.I145] -> 0.366831 | E145: of:=[generic.E145] -> 780000 | F145: of:=[generic.G145] -> 0.006274 | G145: of:=[generic.I145] -> 0.645336 | H145: of:=[queue.E145] -> 2174200 | I145: of:=[queue.G145] -> 0.002177 | J145: of:=[queue.I145] -> 0.380422 | K145: of:=[stack.E145] -> 948800 | L145: of:=[stack.G145] -> 0.005169 | M145: of:=[stack.I145] -> 0.583927
A146: of:=[furious.B146] -> 5 | B146: of:=[furious.E146] -> 2351400 | C146: of:=[furious.G146] -> 0.002015 | D146: of:=[furious.I146] -> 0.369877 | E146: of:=[generic.E146] -> 780400 | F146: of:=[generic.G146] -> 0.006287 | G146: of:=[generic.I146] -> 0.650024 | H146: of:=[queue.E146] -> 2162200 | I146: of:=[queue.G146] -> 0.002166 | J146: of:=[queue.I146] -> 0.384305 | K146: of:=[stack.E146] -> 947000 | L146: of:=[stack.G146] -> 0.005172 | M146: of:=[stack.I146] -> 0.588889
A147: of:=[furious.B147] -> 5 | B147: of:=[furious.E147] -> 2354000 | C147: of:=[furious.G147] -> 0.00201 | D147: of:=[furious.I147] -> 0.372382 | E147: of:=[generic.E147] -> 783600 | F147: of:=[generic.G147] -> 0.006276 | G147: of:=[generic.I147] -> 0.653515 | H147: of:=[queue.E147] -> 2174200 | I147: of:=[queue.G147] -> 0.002161 | J147: of:=[queue.I147] -> 0.386052 | K147: of:=[stack.E147] -> 949800 | L147: of:=[stack.G147] -> 0.005161 | M147: of:=[stack.I147] -> 0.592393
A148: of:=[furious.B148] -> 5 | B148: of:=[furious.E148] -> 2351800 | C148: of:=[furious.G148] -> 0.002007 | D148: of:=[furious.I148] -> 0.37524 | E148: of:=[generic.E148] -> 782000 | F148: of:=[generic.G148] -> 0.006281 | G148: of:=[generic.I148] -> 0.658966 | H148: of:=[queue.E148] -> 2180000 | I148: of:=[queue.G148] -> 0.00216 | J148: of:=[queue.I148] -> 0.388328 | K148: of:=[stack.E148] -> 951000 | L148: of:=[stack.G148] -> 0.005148 | M148: of:=[stack.I148] -> 0.596351
A149: of:=[furious.B149] -> 5 | B149: of:=[furious.E149] -> 2348800 | C149: of:=[furious.G149] -> 0.002026 | D149: of:=[furious.I149] -> 0.378167 | E149: of:=[generic.E149] -> 782200 | F149: of:=[generic.G149] -> 0.00629 | G149: of:=[generic.I149] -> 0.663638 | H149: of:=[queue.E149] -> 2181000 | I149: of:=[queue.G149] -> 0.002159 | J149: of:=[queue.I149] -> 0.39101 | K149: of:=[stack.E149] -> 952400 | L149: of:=[stack.G149] -> 0.005128 | M149: of:=[stack.I149] -> 0.6002
A150: of:=[furious.B150] -> 5 | B150: of:=[furious.E150] -> 2343200 | C150: of:=[furious.G150] -> 0.002003 | D150: of:=[furious.I150] -> 0.381255 | E150: of:=[generic.E150] -> 783800 | F150: of:=[generic.G150] -> 0.006277 | G150: of:=[generic.I150] -> 0.667678 | H150: of:=[queue.E150] -> 2164800 | I150: of:=[queue.G150] -> 0.002173 | J150: of:=[queue.I150] -> 0.395228 | K150: of:=[stack.E150] -> 951800 | L150: of:=[stack.G150] -> 0.005144 | M150: of:=[stack.I150] -> 0.604658
A151: of:=[furious.B151] -> 5 | B151: of:=[furious.E151] -> 2352200 | C151: of:=[furious.G151] -> 0.002021 | D151: of:=[furious.I151] -> 0.383171 | E151: of:=[generic.E151] -> 781400 | F151: of:=[generic.G151] -> 0.006299 | G151: of:=[generic.I151] -> 0.673396 | H151: of:=[queue.E151] -> 2165800 | I151: of:=[queue.G151] -> 0.002171 | J151: of:=[queue.I151] -> 0.397875 | K151: of:=[stack.E151] -> 951000 | L151: of:=[stack.G151] -> 0.005129 | M151: of:=[stack.I151] -> 0.609137
A152: of:=[furious.B152] -> 6 | B152: of:=[furious.E152] -> 2487000 | C152: of:=[furious.G152] -> 0.0023 | D152: of:=[furious.I152] -> 0.38085 | E152: of:=[generic.E152] -> 801400 | F152: of:=[generic.G152] -> 0.007362 | G152: of:=[generic.I152] -> 0.681202 | H152: of:=[queue.E152] -> 2010200 | I152: of:=[queue.G152] -> 0.002834 | J152: of:=[queue.I152] -> 0.426678 | K152: of:=[stack.E152] -> 863600 | L152: of:=[stack.G152] -> 0.006839 | M152: of:=[stack.I152] -> 0.662039
A153: of:=[furious.B153] -> 6 | B153: of:=[furious.E153] -> 2490400 | C153: of:=[furious.G153] -> 0.002314 | D153: of:=[furious.I153] -> 0.38364 | E153: of:=[generic.E153] -> 800800 | F153: of:=[generic.G153] -> 0.007363 | G153: of:=[generic.I153] -> 0.686838 | H153: of:=[queue.E153] -> 2018000 | I153: of:=[queue.G153] -> 0.002853 | J153: of:=[queue.I153] -> 0.42919 | K153: of:=[stack.E153] -> 866400 | L153: of:=[stack.G153] -> 0.006801 | M153: of:=[stack.I153] -> 0.666093
A154: of:=[furious.B154] -> 6 | B154: of:=[furious.E154] -> 2477800 | C154: of:=[furious.G154] -> 0.00231 | D154: of:=[furious.I154] -> 0.387606 | E154: of:=[generic.E154] -> 808600 | F154: of:=[generic.G154] -> 0.007297 | G154: of:=[generic.I154] -> 0.688834 | H154: of:=[queue.E154] -> 2021800 | I154: of:=[queue.G154] -> 0.002834 | J154: of:=[queue.I154] -> 0.432079 | K154: of:=[stack.E154] -> 864600 | L154: of:=[stack.G154] -> 0.006822 | M154: of:=[stack.I154] -> 0.671881
A155: of:=[furious.B155] -> 6 | B155: of:=[furious.E155] -> 2482200 | C155: of:=[furious.G155] -> 0.002313 | D155: of:=[furious.I155] -> 0.390238 | E155: of:=[generic.E155] -> 803600 | F155: of:=[generic.G155] -> 0.007344 | G155: of:=[generic.I155] -> 0.696268 | H155: of:=[queue.E155] -> 2005400 | I155: of:=[queue.G155] -> 0.002871 | J155: of:=[queue.I155] -> 0.437138 | K155: of:=[stack.E155] -> 868200 | L155: of:=[stack.G155] -> 0.006796 | M155: of:=[stack.I155] -> 0.675536
A156: of:=[furious.B156] -> 6 | B156: of:=[furious.E156] -> 2484600 | C156: of:=[furious.G156] -> 0.002295 | D156: of:=[furious.I156] -> 0.39298 | E156: of:=[generic.E156] -> 796600 | F156: of:=[generic.G156] -> 0.007424 | G156: of:=[generic.I156] -> 0.704608 | H156: of:=[queue.E156] -> 2015800 | I156: of:=[queue.G156] -> 0.002843 | J156: of:=[queue.I156] -> 0.439257 | K156: of:=[stack.E156] -> 864400 | L156: of:=[stack.G156] -> 0.006819 | M156: of:=[stack.I156] -> 0.682036
A157: of:=[furious.B157] -> 6 | B157: of:=[furious.E157] -> 2474800 | C157: of:=[furious.G157] -> 0.002319 | D157: of:=[furious.I157] -> 0.396703 | E157: of:=[generic.E157] -> 797200 | F157: of:=[generic.G157] -> 0.007383 | G157: of:=[generic.I157] -> 0.709565 | H157: of:=[queue.E157] -> 2022200 | I157: of:=[queue.G157] -> 0.00284 | J157: of:=[queue.I157] -> 0.441788 | K157: of:=[stack.E157] -> 869000 | L157: of:=[stack.G157] -> 0.006799 | M157: of:=[stack.I157] -> 0.685208
A158: of:=[furious.B158] -> 6 | B158: of:=[furious.E158] -> 2477800 | C158: of:=[furious.G158] -> 0.002321 | D158: of:=[furious.I158] -> 0.399378 | E158: of:=[generic.E158] -> 803600 | F158: of:=[generic.G158] -> 0.007374 | G158: of:=[generic.I158] -> 0.711932 | H158: of:=[queue.E158] -> 2010200 | I158: of:=[queue.G158] -> 0.002861 | J158: of:=[queue.I158] -> 0.446321 | K158: of:=[stack.E158] -> 866400 | L158: of:=[stack.G158] -> 0.006777 | M158: of:=[stack.I158] -> 0.691156
A159: of:=[furious.B159] -> 6 | B159: of:=[furious.E159] -> 2475200 | C159: of:=[furious.G159] -> 0.002313 | D159: of:=[furious.I159] -> 0.402472 | E159: of:=[generic.E159] -> 805200 | F159: of:=[generic.G159] -> 0.007327 | G159: of:=[generic.I159] -> 0.716375 | H159: of:=[queue.E159] -> 2010600 | I159: of:=[queue.G159] -> 0.002859 | J159: of:=[queue.I159] -> 0.449469 | K159: of:=[stack.E159] -> 868200 | L159: of:=[stack.G159] -> 0.006775 | M159: of:=[stack.I159] -> 0.695328
A160: of:=[furious.B160] -> 6 | B160: of:=[furious.E160] -> 2469200 | C160: of:=[furious.G160] -> 0.00232 | D160: of:=[furious.I160] -> 0.405829 | E160: of:=[generic.E160] -> 803000 | F160: of:=[generic.G160] -> 0.00737 | G160: of:=[generic.I160] -> 0.722474 | H160: of:=[queue.E160] -> 2014800 | I160: of:=[queue.G160] -> 0.002854 | J160: of:=[queue.I160] -> 0.452167 | K160: of:=[stack.E160] -> 864800 | L160: of:=[stack.G160] -> 0.006829 | M160: of:=[stack.I160] -> 0.701577
A161: of:=[furious.B161] -> 6 | B161: of:=[furious.E161] -> 2482400 | C161: of:=[furious.G161] -> 0.002307 | D161: of:=[furious.I161] -> 0.407589 | E161: of:=[generic.E161] -> 802200 | F161: of:=[generic.G161] -> 0.007357 | G161: of:=[generic.I161] -> 0.727905 | H161: of:=[queue.E161] -> 2016400 | I161: of:=[queue.G161] -> 0.00285 | J161: of:=[queue.I161] -> 0.455129 | K161: of:=[stack.E161] -> 870000 | L161: of:=[stack.G161] -> 0.006784 | M161: of:=[stack.I161] -> 0.70431
A162: of:=[furious.B162] -> 6 | B162: of:=[furious.E162] -> 2388600 | C162: of:=[furious.G162] -> 0.002388 | D162: of:=[furious.I162] -> 0.412458 | E162: of:=[generic.E162] -> 774600 | F162: of:=[generic.G162] -> 0.007622 | G162: of:=[generic.I162] -> 0.694147 | H162: of:=[queue.E162] -> 2053000 | I162: of:=[queue.G162] -> 0.002812 | J162: of:=[queue.I162] -> 0.424114 | K162: of:=[stack.E162] -> 907200 | L162: of:=[stack.G162] -> 0.006479 | M162: of:=[stack.I162] -> 0.641882
A163: of:=[furious.B163] -> 6 | B163: of:=[furious.E163] -> 2380600 | C163: of:=[furious.G163] -> 0.002412 | D163: of:=[furious.I163] -> 0.416059 | E163: of:=[generic.E163] -> 772000 | F163: of:=[generic.G163] -> 0.007637 | G163: of:=[generic.I163] -> 0.700785 | H163: of:=[queue.E163] -> 2051200 | I163: of:=[queue.G163] -> 0.002821 | J163: of:=[queue.I163] -> 0.427611 | K163: of:=[stack.E163] -> 902800 | L163: of:=[stack.G163] -> 0.006535 | M163: of:=[stack.I163] -> 0.648502
A164: of:=[furious.B164] -> 6 | B164: of:=[furious.E164] -> 2383400 | C164: of:=[furious.G164] -> 0.002403 | D164: of:=[furious.I164] -> 0.418695 | E164: of:=[generic.E164] -> 774400 | F164: of:=[generic.G164] -> 0.007624 | G164: of:=[generic.I164] -> 0.705125 | H164: of:=[queue.E164] -> 2045600 | I164: of:=[queue.G164] -> 0.002819 | J164: of:=[queue.I164] -> 0.431474 | K164: of:=[stack.E164] -> 906800 | L164: of:=[stack.G164] -> 0.00652 | M164: of:=[stack.I164] -> 0.652089
A165: of:=[furious.B165] -> 6 | B165: of:=[furious.E165] -> 2379000 | C165: of:=[furious.G165] -> 0.002426 | D165: of:=[furious.I165] -> 0.421966 | E165: of:=[generic.E165] -> 773200 | F165: of:=[generic.G165] -> 0.007625 | G165: of:=[generic.I165] -> 0.711055 | H165: of:=[queue.E165] -> 2059400 | I165: of:=[queue.G165] -> 0.00281 | J165: of:=[queue.I165] -> 0.433281 | K165: of:=[stack.E165] -> 903000 | L165: of:=[stack.G165] -> 0.006543 | M165: of:=[stack.I165] -> 0.658447
A166: of:=[furious.B166] -> 6 | B166: of:=[furious.E166] -> 2387200 | C166: of:=[furious.G166] -> 0.002411 | D166: of:=[furious.I166] -> 0.424093 | E166: of:=[generic.E166] -> 771000 | F166: of:=[generic.G166] -> 0.007652 | G166: of:=[generic.I166] -> 0.717422 | H166: of:=[queue.E166] -> 2049400 | I166: of:=[queue.G166] -> 0.002798 | J166: of:=[queue.I166] -> 0.437546 | K166: of:=[stack.E166] -> 904000 | L166: of:=[stack.G166] -> 0.006504 | M166: of:=[stack.I166] -> 0.663006
A167: of:=[furious.B167] -> 6 | B167: of:=[furious.E167] -> 2379200 | C167: of:=[furious.G167] -> 0.002412 | D167: of:=[furious.I167] -> 0.427635 | E167: of:=[generic.E167] -> 769800 | F167: of:=[generic.G167] -> 0.007683 | G167: of:=[generic.I167] -> 0.723311 | H167: of:=[queue.E167] -> 2042800 | I167: of:=[queue.G167] -> 0.002817 | J167: of:=[queue.I167] -> 0.441454 | K167: of:=[stack.E167] -> 900800 | L167: of:=[stack.G167] -> 0.006528 | M167: of:=[stack.I167] -> 0.669079
A168: of:=[furious.B168] -> 6 | B168: of:=[furious.E168] -> 2387200 | C168: of:=[furious.G168] -> 0.002381 | D168: of:=[furious.I168] -> 0.429697 | E168: of:=[generic.E168] -> 774200 | F168: of:=[generic.G168] -> 0.007649 | G168: of:=[generic.I168] -> 0.726536 | H168: of:=[queue.E168] -> 2055400 | I168: of:=[queue.G168] -> 0.002796 | J168: of:=[queue.I168] -> 0.443263 | K168: of:=[stack.E168] -> 902000 | L168: of:=[stack.G168] -> 0.006523 | M168: of:=[stack.I168] -> 0.673494
A169: of:=[furious.B169] -> 6 | B169: of:=[furious.E169] -> 2379000 | C169: of:=[furious.G169] -> 0.002405 | D169: of:=[furious.I169] -> 0.433222 | E169: of:=[generic.E169] -> 776400 | F169: of:=[generic.G169] -> 0.007586 | G169: of:=[generic.I169] -> 0.730716 | H169: of:=[queue.E169] -> 2055000 | I169: of:=[queue.G169] -> 0.002802 | J169: of:=[queue.I169] -> 0.446456 | K169: of:=[stack.E169] -> 905800 | L169: of:=[stack.G169] -> 0.00652 | M169: of:=[stack.I169] -> 0.676913
A170: of:=[furious.B170] -> 6 | B170: of:=[furious.E170] -> 2385400 | C170: of:=[furious.G170] -> 0.00241 | D170: of:=[furious.I170] -> 0.435417 | E170: of:=[generic.E170] -> 775200 | F170: of:=[generic.G170] -> 0.007647 | G170: of:=[generic.I170] -> 0.736491 | H170: of:=[queue.E170] -> 2052200 | I170: of:=[queue.G170] -> 0.002824 | J170: of:=[queue.I170] -> 0.44991 | K170: of:=[stack.E170] -> 906000 | L170: of:=[stack.G170] -> 0.006503 | M170: of:=[stack.I170] -> 0.681626
A171: of:=[furious.B171] -> 6 | B171: of:=[furious.E171] -> 2389000 | C171: of:=[furious.G171] -> 0.002402 | D171: of:=[furious.I171] -> 0.437841 | E171: of:=[generic.E171] -> 771800 | F171: of:=[generic.G171] -> 0.007657 | G171: of:=[generic.I171] -> 0.74328 | H171: of:=[queue.E171] -> 2051000 | I171: of:=[queue.G171] -> 0.002818 | J171: of:=[queue.I171] -> 0.453161 | K171: of:=[stack.E171] -> 903400 | L171: of:=[stack.G171] -> 0.006555 | M171: of:=[stack.I171] -> 0.68739
A172: of:=[furious.B172] -> 6 | B172: of:=[furious.E172] -> 2337400 | C172: of:=[furious.G172] -> 0.002464 | D172: of:=[furious.I172] -> 0.393942 | E172: of:=[generic.E172] -> 790800 | F172: of:=[generic.G172] -> 0.007446 | G172: of:=[generic.I172] -> 0.687398 | H172: of:=[queue.E172] -> 1852600 | I172: of:=[queue.G172] -> 0.003108 | J172: of:=[queue.I172] -> 0.455054 | K172: of:=[stack.E172] -> 919000 | L172: of:=[stack.G172] -> 0.006448 | M172: of:=[stack.I172] -> 0.640756
A173: of:=[furious.B173] -> 6 | B173: of:=[furious.E173] -> 2359000 | C173: of:=[furious.G173] -> 0.002427 | D173: of:=[furious.I173] -> 0.395217 | E173: of:=[generic.E173] -> 790800 | F173: of:=[generic.G173] -> 0.007476 | G173: of:=[generic.I173] -> 0.692815 | H173: of:=[queue.E173] -> 1852000 | I173: of:=[queue.G173] -> 0.003109 | J173: of:=[queue.I173] -> 0.458531 | K173: of:=[stack.E173] -> 915400 | L173: of:=[stack.G173] -> 0.006412 | M173: of:=[stack.I173] -> 0.64699
A174: of:=[furious.B174] -> 6 | B174: of:=[furious.E174] -> 2333800 | C174: of:=[furious.G174] -> 0.002451 | D174: of:=[furious.I174] -> 0.400418 | E174: of:=[generic.E174] -> 788600 | F174: of:=[generic.G174] -> 0.007512 | G174: of:=[generic.I174] -> 0.699173 | H174: of:=[queue.E174] -> 1847200 | I174: of:=[queue.G174] -> 0.003128 | J174: of:=[queue.I174] -> 0.46252 | K174: of:=[stack.E174] -> 915800 | L174: of:=[stack.G174] -> 0.006412 | M174: of:=[stack.I174] -> 0.651786
A175: of:=[furious.B175] -> 6 | B175: of:=[furious.E175] -> 2355600 | C175: of:=[furious.G175] -> 0.002424 | D175: of:=[furious.I175] -> 0.40159 | E175: of:=[generic.E175] -> 792400 | F175: of:=[generic.G175] -> 0.007494 | G175: of:=[generic.I175] -> 0.702846 | H175: of:=[queue.E175] -> 1842800 | I175: of:=[queue.G175] -> 0.003133 | J175: of:=[queue.I175] -> 0.466443 | K175: of:=[stack.E175] -> 917200 | L175: of:=[stack.G175] -> 0.006413 | M175: of:=[stack.I175] -> 0.656193
A176: of:=[furious.B176] -> 6 | B176: of:=[furious.E176] -> 2333600 | C176: of:=[furious.G176] -> 0.002468 | D176: of:=[furious.I176] -> 0.406526 | E176: of:=[generic.E176] -> 759000 | F176: of:=[generic.G176] -> 0.00781 | G176: of:=[generic.I176] -> 0.72356 | H176: of:=[queue.E176] -> 1851600 | I176: of:=[queue.G176] -> 0.003124 | J176: of:=[queue.I176] -> 0.468678 | K176: of:=[stack.E176] -> 916400 | L176: of:=[stack.G176] -> 0.00643 | M176: of:=[stack.I176] -> 0.661358
A177: of:=[furious.B177] -> 6 | B177: of:=[furious.E177] -> 2347600 | C177: of:=[furious.G177] -> 0.002442 | D177: of:=[furious.I177] -> 0.408314 | E177: of:=[generic.E177] -> 758600 | F177: of:=[generic.G177] -> 0.007772 | G177: of:=[generic.I177] -> 0.7291 | H177: of:=[queue.E177] -> 1847600 | I177: of:=[queue.G177] -> 0.003126 | J177: of:=[queue.I177] -> 0.472504 | K177: of:=[stack.E177] -> 915200 | L177: of:=[stack.G177] -> 0.006429 | M177: of:=[stack.I177] -> 0.666631
A178: of:=[furious.B178] -> 6 | B178: of:=[furious.E178] -> 2332000 | C178: of:=[furious.G178] -> 0.002459 | D178: of:=[furious.I178] -> 0.412667 | E178: of:=[generic.E178] -> 757200 | F178: of:=[generic.G178] -> 0.007824 | G178: of:=[generic.I178] -> 0.735114 | H178: of:=[queue.E178] -> 1848800 | I178: of:=[queue.G178] -> 0.003117 | J178: of:=[queue.I178] -> 0.475639 | K178: of:=[stack.E178] -> 916800 | L178: of:=[stack.G178] -> 0.006414 | M178: of:=[stack.I178] -> 0.670847
A179: of:=[furious.B179] -> 6 | B179: of:=[furious.E179] -> 2348000 | C179: of:=[furious.G179] -> 0.002439 | D179: of:=[furious.I179] -> 0.414213 | E179: of:=[generic.E179] -> 756000 | F179: of:=[generic.G179] -> 0.007817 | G179: of:=[generic.I179] -> 0.740992 | H179: of:=[queue.E179] -> 1848400 | I179: of:=[queue.G179] -> 0.003136 | J179: of:=[queue.I179] -> 0.478975 | K179: of:=[stack.E179] -> 915600 | L179: of:=[stack.G179] -> 0.006459 | M179: of:=[stack.I179] -> 0.67608
A180: of:=[furious.B180] -> 6 | B180: of:=[furious.E180] -> 2335000 | C180: of:=[furious.G180] -> 0.002461 | D180: of:=[furious.I180] -> 0.418316 | E180: of:=[generic.E180] -> 753400 | F180: of:=[generic.G180] -> 0.007863 | G180: of:=[generic.I180] -> 0.747547 | H180: of:=[queue.E180] -> 1856800 | I180: of:=[queue.G180] -> 0.003113 | J180: of:=[queue.I180] -> 0.481449 | K180: of:=[stack.E180] -> 915800 | L180: of:=[stack.G180] -> 0.006414 | M180: of:=[stack.I180] -> 0.680734
A181: of:=[furious.B181] -> 6 | B181: of:=[furious.E181] -> 2353000 | C181: of:=[furious.G181] -> 0.002433 | D181: of:=[furious.I181] -> 0.419623 | E181: of:=[generic.E181] -> 758200 | F181: of:=[generic.G181] -> 0.007813 | G181: of:=[generic.I181] -> 0.750401 | H181: of:=[queue.E181] -> 1849200 | I181: of:=[queue.G181] -> 0.003128 | J181: of:=[queue.I181] -> 0.485668 | K181: of:=[stack.E181] -> 913800 | L181: of:=[stack.G181] -> 0.006422 | M181: of:=[stack.I181] -> 0.686174
A182: of:=[furious.B182] -> 8 | B182: of:=[furious.E182] -> 2414600 | C182: of:=[furious.G182] -> 0.0032 | D182: of:=[furious.I182] -> 0.464683 | E182: of:=[generic.E182] -> 763200 | F182: of:=[generic.G182] -> 0.010356 | G182: of:=[generic.I182] -> 0.809203 | H182: of:=[queue.E182] -> 1945000 | I182: of:=[queue.G182] -> 0.004003 | J182: of:=[queue.I182] -> 0.531543 | K182: of:=[stack.E182] -> 883800 | L182: of:=[stack.G182] -> 0.008952 | M182: of:=[stack.I182] -> 0.750318
A183: of:=[furious.B183] -> 8 | B183: of:=[furious.E183] -> 2414000 | C183: of:=[furious.G183] -> 0.003191 | D183: of:=[furious.I183] -> 0.468162 | E183: of:=[generic.E183] -> 768000 | F183: of:=[generic.G183] -> 0.010315 | G183: of:=[generic.I183] -> 0.813039 | H183: of:=[queue.E183] -> 1928200 | I183: of:=[queue.G183] -> 0.00403 | J183: of:=[queue.I183] -> 0.537615 | K183: of:=[stack.E183] -> 886200 | L183: of:=[stack.G183] -> 0.008912 | M183: of:=[stack.I183] -> 0.755225
A184: of:=[furious.B184] -> 8 | B184: of:=[furious.E184] -> 2413000 | C184: of:=[furious.G184] -> 0.003206 | D184: of:=[furious.I184] -> 0.471669 | E184: of:=[generic.E184] -> 763600 | F184: of:=[generic.G184] -> 0.010354 | G184: of:=[generic.I184] -> 0.821702 | H184: of:=[queue.E184] -> 1935600 | I184: of:=[queue.G184] -> 0.004014 | J184: of:=[queue.I184] -> 0.540314 | K184: of:=[stack.E184] -> 879600 | L184: of:=[stack.G184] -> 0.008993 | M184: of:=[stack.I184] -> 0.763961
A185: of:=[furious.B185] -> 8 | B185: of:=[furious.E185] -> 2420400 | C185: of:=[furious.G185] -> 0.003177 | D185: of:=[furious.I185] -> 0.474309 | E185: of:=[generic.E185] -> 767800 | F185: of:=[generic.G185] -> 0.010323 | G185: of:=[generic.I185] -> 0.825726 | H185: of:=[queue.E185] -> 1942200 | I185: of:=[queue.G185] -> 0.003993 | J185: of:=[queue.I185] -> 0.543084 | K185: of:=[stack.E185] -> 884800 | L185: of:=[stack.G185] -> 0.008938 | M185: of:=[stack.I185] -> 0.767558
A186: of:=[furious.B186] -> 8 | B186: of:=[furious.E186] -> 2422800 | C186: of:=[furious.G186] -> 0.003181 | D186: of:=[furious.I186] -> 0.47743 | E186: of:=[generic.E186] -> 764800 | F186: of:=[generic.G186] -> 0.010335 | G186: of:=[generic.I186] -> 0.833566 | H186: of:=[queue.E186] -> 1930600 | I186: of:=[queue.G186] -> 0.004005 | J186: of:=[queue.I186] -> 0.548377 | K186: of:=[stack.E186] -> 885000 | L186: of:=[stack.G186] -> 0.008949 | M186: of:=[stack.I186] -> 0.773279
A187: of:=[furious.B187] -> 8 | B187: of:=[furious.E187] -> 2406800 | C187: of:=[furious.G187] -> 0.003219 | D187: of:=[furious.I187] -> 0.482363 | E187: of:=[generic.E187] -> 766400 | F187: of:=[generic.G187] -> 0.010287 | G187: of:=[generic.I187] -> 0.838851 | H187: of:=[queue.E187] -> 1944600 | I187: of:=[queue.G187] -> 0.003997 | J187: of:=[queue.I187] -> 0.550045 | K187: of:=[stack.E187] -> 884200 | L187: of:=[stack.G187] -> 0.008944 | M187: of:=[stack.I187] -> 0.779388
A188: of:=[furious.B188] -> 8 | B188: of:=[furious.E188] -> 2409400 | C188: of:=[furious.G188] -> 0.00321 | D188: of:=[furious.I188] -> 0.48542 | E188: of:=[generic.E188] -> 766600 | F188: of:=[generic.G188] -> 0.010277 | G188: of:=[generic.I188] -> 0.844845 | H188: of:=[queue.E188] -> 1926000 | I188: of:=[queue.G188] -> 0.004023 | J188: of:=[queue.I188] -> 0.556322 | K188: of:=[stack.E188] -> 884400 | L188: of:=[stack.G188] -> 0.008917 | M188: of:=[stack.I188] -> 0.785
A189: of:=[furious.B189] -> 8 | B189: of:=[furious.E189] -> 2409400 | C189: of:=[furious.G189] -> 0.003211 | D189: of:=[furious.I189] -> 0.488716 | E189: of:=[generic.E189] -> 769000 | F189: of:=[generic.G189] -> 0.010255 | G189: of:=[generic.I189] -> 0.849616 | H189: of:=[queue.E189] -> 1936200 | I189: of:=[queue.G189] -> 0.004034 | J189: of:=[queue.I189] -> 0.558477 | K189: of:=[stack.E189] -> 887600 | L189: of:=[stack.G189] -> 0.008898 | M189: of:=[stack.I189] -> 0.789241
A190: of:=[furious.B190] -> 8 | B190: of:=[furious.E190] -> 2410600 | C190: of:=[furious.G190] -> 0.003208 | D190: of:=[furious.I190] -> 0.491867 | E190: of:=[generic.E190] -> 765200 | F190: of:=[generic.G190] -> 0.010319 | G190: of:=[generic.I190] -> 0.857759 | H190: of:=[queue.E190] -> 1935800 | I190: of:=[queue.G190] -> 0.004008 | J190: of:=[queue.I190] -> 0.562111 | K190: of:=[stack.E190] -> 885000 | L190: of:=[stack.G190] -> 0.008908 | M190: of:=[stack.I190] -> 0.796015
A191: of:=[furious.B191] -> 8 | B191: of:=[furious.E191] -> 2407400 | C191: of:=[furious.G191] -> 0.003222 | D191: of:=[furious.I191] -> 0.495455 | E191: of:=[generic.E191] -> 765200 | F191: of:=[generic.G191] -> 0.010355 | G191: of:=[generic.I191] -> 0.863774 | H191: of:=[queue.E191] -> 1934400 | I191: of:=[queue.G191] -> 0.004025 | J191: of:=[queue.I191] -> 0.565882 | K191: of:=[stack.E191] -> 881200 | L191: of:=[stack.G191] -> 0.008956 | M191: of:=[stack.I191] -> 0.803323
A192: of:=[furious.B192] -> 8 | B192: of:=[furious.E192] -> 2362200 | C192: of:=[furious.G192] -> 0.003248 | D192: of:=[furious.I192] -> 0.480634 | E192: of:=[generic.E192] -> 819000 | F192: of:=[generic.G192] -> 0.009658 | G192: of:=[generic.I192] -> 0.82758 | H192: of:=[queue.E192] -> 1668600 | I192: of:=[queue.G192] -> 0.004675 | J192: of:=[queue.I192] -> 0.545611 | K192: of:=[stack.E192] -> 878200 | L192: of:=[stack.G192] -> 0.009009 | M192: of:=[stack.I192] -> 0.764665
A193: of:=[furious.B193] -> 8 | B193: of:=[furious.E193] -> 2351800 | C193: of:=[furious.G193] -> 0.003275 | D193: of:=[furious.I193] -> 0.485083 | E193: of:=[generic.E193] -> 819200 | F193: of:=[generic.G193] -> 0.00968 | G193: of:=[generic.I193] -> 0.833307 | H193: of:=[queue.E193] -> 1667000 | I193: of:=[queue.G193] -> 0.004673 | J193: of:=[queue.I193] -> 0.550136 | K193: of:=[stack.E193] -> 880400 | L193: of:=[stack.G193] -> 0.00895 | M193: of:=[stack.I193] -> 0.769547
A194: of:=[furious.B194] -> 8 | B194: of:=[furious.E194] -> 2358800 | C194: of:=[furious.G194] -> 0.003259 | D194: of:=[furious.I194] -> 0.487715 | E194: of:=[generic.E194] -> 820600 | F194: of:=[generic.G194] -> 0.009625 | G194: of:=[generic.I194] -> 0.838357 | H194: of:=[queue.E194] -> 1662600 | I194: of:=[queue.G194] -> 0.004688 | J194: of:=[queue.I194] -> 0.555113 | K194: of:=[stack.E194] -> 882000 | L194: of:=[stack.G194] -> 0.008971 | M194: of:=[stack.I194] -> 0.77466
A195: of:=[furious.B195] -> 8 | B195: of:=[furious.E195] -> 2364400 | C195: of:=[furious.G195] -> 0.003268 | D195: of:=[furious.I195] -> 0.490481 | E195: of:=[generic.E195] -> 820200 | F195: of:=[generic.G195] -> 0.009632 | G195: of:=[generic.I195] -> 0.844284 | H195: of:=[queue.E195] -> 1662800 | I195: of:=[queue.G195] -> 0.004694 | J195: of:=[queue.I195] -> 0.559293 | K195: of:=[stack.E195] -> 880400 | L195: of:=[stack.G195] -> 0.008971 | M195: of:=[stack.I195] -> 0.781128
A196: of:=[furious.B196] -> 8 | B196: of:=[furious.E196] -> 2368400 | C196: of:=[furious.G196] -> 0.003269 | D196: of:=[furious.I196] -> 0.49339 | E196: of:=[generic.E196] -> 821400 | F196: of:=[generic.G196] -> 0.009627 | G196: of:=[generic.I196] -> 0.849354 | H196: of:=[queue.E196] -> 1669800 | I196: of:=[queue.G196] -> 0.004674 | J196: of:=[queue.I196] -> 0.562301 | K196: of:=[stack.E196] -> 878200 | L196: of:=[stack.G196] -> 0.008998 | M196: of:=[stack.I196] -> 0.787837
A197: of:=[furious.B197] -> 8 | B197: of:=[furious.E197] -> 2354000 | C197: of:=[furious.G197] -> 0.003284 | D197: of:=[furious.I197] -> 0.498203 | E197: of:=[generic.E197] -> 823600 | F197: of:=[generic.G197] -> 0.009599 | G197: of:=[generic.I197] -> 0.853859 | H197: of:=[queue.E197] -> 1669200 | I197: of:=[queue.G197] -> 0.004675 | J197: of:=[queue.I197] -> 0.566588 | K197: of:=[stack.E197] -> 879400 | L197: of:=[stack.G197] -> 0.009008 | M197: of:=[stack.I197] -> 0.792999
A198: of:=[furious.B198] -> 8 | B198: of:=[furious.E198] -> 2358400 | C198: of:=[furious.G198] -> 0.003262 | D198: of:=[furious.I198] -> 0.501004 | E198: of:=[generic.E198] -> 820400 | F198: of:=[generic.G198] -> 0.009617 | G198: of:=[generic.I198] -> 0.861125 | H198: of:=[queue.E198] -> 1659600 | I198: of:=[queue.G198] -> 0.004683 | J198: of:=[queue.I198] -> 0.57233 | K198: of:=[stack.E198] -> 880200 | L198: of:=[stack.G198] -> 0.008993 | M198: of:=[stack.I198] -> 0.798292
A199: of:=[furious.B199] -> 8 | B199: of:=[furious.E199] -> 2356800 | C199: of:=[furious.G199] -> 0.003272 | D199: of:=[furious.I199] -> 0.504428 | E199: of:=[generic.E199] -> 818600 | F199: of:=[generic.G199] -> 0.00966 | G199: of:=[generic.I199] -> 0.867656 | H199: of:=[queue.E199] -> 1672000 | I199: of:=[queue.G199] -> 0.00466 | J199: of:=[queue.I199] -> 0.574276 | K199: of:=[stack.E199] -> 881200 | L199: of:=[stack.G199] -> 0.008949 | M199: of:=[stack.I199] -> 0.803428
A200: of:=[furious.B200] -> 8 | B200: of:=[furious.E200] -> 2361200 | C200: of:=[furious.G200] -> 0.003269 | D200: of:=[furious.I200] -> 0.507191 | E200: of:=[generic.E200] -> 822400 | F200: of:=[generic.G200] -> 0.009628 | G200: of:=[generic.I200] -> 0.871192 | H200: of:=[queue.E200] -> 1662600 | I200: of:=[queue.G200] -> 0.004703 | J200: of:=[queue.I200] -> 0.579966 | K200: of:=[stack.E200] -> 882200 | L200: of:=[stack.G200] -> 0.008955 | M200: of:=[stack.I200] -> 0.808529
A201: of:=[furious.B201] -> 8 | B201: of:=[furious.E201] -> 2365200 | C201: of:=[furious.G201] -> 0.003244 | D201: of:=[furious.I201] -> 0.509952 | E201: of:=[generic.E201] -> 822000 | F201: of:=[generic.G201] -> 0.00962 | G201: of:=[generic.I201] -> 0.876907 | H201: of:=[queue.E201] -> 1667600 | I201: of:=[queue.G201] -> 0.0047 | J201: of:=[queue.I201] -> 0.58314 | K201: of:=[stack.E201] -> 877800 | L201: of:=[stack.G201] -> 0.009013 | M201: of:=[stack.I201] -> 0.816094
A202: of:=[furious.B202] -> 8 | B202: of:=[furious.E202] -> 2462800 | C202: of:=[furious.G202] -> 0.003133 | D202: of:=[furious.I202] -> 0.444482 | E202: of:=[generic.E202] -> 805400 | F202: of:=[generic.G202] -> 0.009799 | G202: of:=[generic.I202] -> 0.809816 | H202: of:=[queue.E202] -> 1748200 | I202: of:=[queue.G202] -> 0.004445 | J202: of:=[queue.I202] -> 0.53889 | K202: of:=[stack.E202] -> 862600 | L202: of:=[stack.G202] -> 0.009135 | M202: of:=[stack.I202] -> 0.763797
A203: of:=[furious.B203] -> 8 | B203: of:=[furious.E203] -> 2452800 | C203: of:=[furious.G203] -> 0.003143 | D203: of:=[furious.I203] -> 0.448901 | E203: of:=[generic.E203] -> 810600 | F203: of:=[generic.G203] -> 0.009748 | G203: of:=[generic.I203] -> 0.813251 | H203: of:=[queue.E203] -> 1739000 | I203: of:=[queue.G203] -> 0.004475 | J203: of:=[queue.I203] -> 0.544439 | K203: of:=[stack.E203] -> 857600 | L203: of:=[stack.G203] -> 0.009186 | M203: of:=[stack.I203] -> 0.771992
A204: of:=[furious.B204] -> 8 | B204: of:=[furious.E204] -> 2461800 | C204: of:=[furious.G204] -> 0.003138 | D204: of:=[furious.I204] -> 0.451568 | E204: of:=[generic.E204] -> 804000 | F204: of:=[generic.G204] -> 0.009831 | G204: of:=[generic.I204] -> 0.82258 | H204: of:=[queue.E204] -> 1742600 | I204: of:=[queue.G204] -> 0.004454 | J204: of:=[queue.I204] -> 0.547956 | K204: of:=[stack.E204] -> 867800 | L204: of:=[stack.G204] -> 0.009092 | M204: of:=[stack.I204] -> 0.773343
A205: of:=[furious.B205] -> 8 | B205: of:=[furious.E205] -> 2456200 | C205: of:=[furious.G205] -> 0.003143 | D205: of:=[furious.I205] -> 0.455546 | E205: of:=[generic.E205] -> 808800 | F205: of:=[generic.G205] -> 0.009763 | G205: of:=[generic.I205] -> 0.826066 | H205: of:=[queue.E205] -> 1743600 | I205: of:=[queue.G205] -> 0.004455 | J205: of:=[queue.I205] -> 0.55185 | K205: of:=[stack.E205] -> 853200 | L205: of:=[stack.G205] -> 0.009231 | M205: of:=[stack.I205] -> 0.785827
A206: of:=[furious.B206] -> 8 | B206: of:=[furious.E206] -> 2462400 | C206: of:=[furious.G206] -> 0.00313 | D206: of:=[furious.I206] -> 0.458399 | E206: of:=[generic.E206] -> 805200 | F206: of:=[generic.G206] -> 0.009804 | G206: of:=[generic.I206] -> 0.83381 | H206: of:=[queue.E206] -> 1741600 | I206: of:=[queue.G206] -> 0.004461 | J206: of:=[queue.I206] -> 0.556192 | K206: of:=[stack.E206] -> 866800 | L206: of:=[stack.G206] -> 0.0091 | M206: of:=[stack.I206] -> 0.785453
A207: of:=[furious.B207] -> 8 | B207: of:=[furious.E207] -> 2459000 | C207: of:=[furious.G207] -> 0.003141 | D207: of:=[furious.I207] -> 0.462127 | E207: of:=[generic.E207] -> 806400 | F207: of:=[generic.G207] -> 0.009804 | G207: of:=[generic.I207] -> 0.839052 | H207: of:=[queue.E207] -> 1741200 | I207: of:=[queue.G207] -> 0.004469 | J207: of:=[queue.I207] -> 0.560259 | K207: of:=[stack.E207] -> 861200 | L207: of:=[stack.G207] -> 0.009159 | M207: of:=[stack.I207] -> 0.793793
A208: of:=[furious.B208] -> 8 | B208: of:=[furious.E208] -> 2459800 | C208: of:=[furious.G208] -> 0.003139 | D208: of:=[furious.I208] -> 0.465437 | E208: of:=[generic.E208] -> 804000 | F208: of:=[generic.G208] -> 0.009861 | G208: of:=[generic.I208] -> 0.84615 | H208: of:=[queue.E208] -> 1740000 | I208: of:=[queue.G208] -> 0.00447 | J208: of:=[queue.I208] -> 0.564426 | K208: of:=[stack.E208] -> 869600 | L208: of:=[stack.G208] -> 0.009078 | M208: of:=[stack.I208] -> 0.795675
A209: of:=[furious.B209] -> 8 | B209: of:=[furious.E209] -> 2467800 | C209: of:=[furious.G209] -> 0.00312 | D209: of:=[furious.I209] -> 0.468027 | E209: of:=[generic.E209] -> 806000 | F209: of:=[generic.G209] -> 0.009772 | G209: of:=[generic.I209] -> 0.850862 | H209: of:=[queue.E209] -> 1740200 | I209: of:=[queue.G209] -> 0.004459 | J209: of:=[queue.I209] -> 0.56833 | K209: of:=[stack.E209] -> 856600 | L209: of:=[stack.G209] -> 0.009185 | M209: of:=[stack.I209] -> 0.807398
A210: of:=[furious.B210] -> 8 | B210: of:=[furious.E210] -> 2458800 | C210: of:=[furious.G210] -> 0.003136 | D210: of:=[furious.I210] -> 0.472215 | E210: of:=[generic.E210] -> 804800 | F210: of:=[generic.G210] -> 0.009786 | G210: of:=[generic.I210] -> 0.857224 | H210: of:=[queue.E210] -> 1737600 | I210: of:=[queue.G210] -> 0.004491 | J210: of:=[queue.I210] -> 0.57269 | K210: of:=[stack.E210] -> 864000 | L210: of:=[stack.G210] -> 0.009155 | M210: of:=[stack.I210] -> 0.809606
A211: of:=[furious.B211] -> 8 | B211: of:=[furious.E211] -> 2458200 | C211: of:=[furious.G211] -> 0.003132 | D211: of:=[furious.I211] -> 0.475576 | E211: of:=[generic.E211] -> 808000 | F211: of:=[generic.G211] -> 0.00976 | G211: of:=[generic.I211] -> 0.86121 | H211: of:=[queue.E211] -> 1748800 | I211: of:=[queue.G211] -> 0.004444 | J211: of:=[queue.I211] -> 0.574774 | K211: of:=[stack.E211] -> 876200 | L211: of:=[stack.G211] -> 0.009037 | M211: of:=[stack.I211] -> 0.809552
A212: of:=[furious.B212] -> 10 | B212: of:=[furious.E212] -> 2480600 | C212: of:=[furious.G212] -> 0.003928 | D212: of:=[furious.I212] -> 0.507024 | E212: of:=[generic.E212] -> 734000 | F212: of:=[generic.G212] -> 0.01349 | G212: of:=[generic.I212] -> 0.922529 | H212: of:=[queue.E212] -> 1721200 | I212: of:=[queue.G212] -> 0.005694 | J212: of:=[queue.I212] -> 0.615254 | K212: of:=[stack.E212] -> 841200 | L212: of:=[stack.G212] -> 0.011728 | M212: of:=[stack.I212] -> 0.867076
A213: of:=[furious.B213] -> 10 | B213: of:=[furious.E213] -> 2477800 | C213: of:=[furious.G213] -> 0.003913 | D213: of:=[furious.I213] -> 0.511153 | E213: of:=[generic.E213] -> 733200 | F213: of:=[generic.G213] -> 0.013511 | G213: of:=[generic.I213] -> 0.930322 | H213: of:=[queue.E213] -> 1717600 | I213: of:=[queue.G213] -> 0.005706 | J213: of:=[queue.I213] -> 0.620513 | K213: of:=[stack.E213] -> 843000 | L213: of:=[stack.G213] -> 0.01173 | M213: of:=[stack.I213] -> 0.872895
A214: of:=[furious.B214] -> 10 | B214: of:=[furious.E214] -> 2476200 | C214: of:=[furious.G214] -> 0.003925 | D214: of:=[furious.I214] -> 0.515142 | E214: of:=[generic.E214] -> 734800 | F214: of:=[generic.G214] -> 0.013484 | G214: of:=[generic.I214] -> 0.936536 | H214: of:=[queue.E214] -> 1725400 | I214: of:=[queue.G214] -> 0.005661 | J214: of:=[queue.I214] -> 0.623664 | K214: of:=[stack.E214] -> 844200 | L214: of:=[stack.G214] -> 0.011696 | M214: of:=[stack.I214] -> 0.878953
A215: of:=[furious.B215] -> 10 | B215: of:=[furious.E215] -> 2474600 | C215: of:=[furious.G215] -> 0.003934 | D215: of:=[furious.I215] -> 0.519111 | E215: of:=[generic.E215] -> 734000 | F215: of:=[generic.G215] -> 0.013471 | G215: of:=[generic.I215] -> 0.944207 | H215: of:=[queue.E215] -> 1720000 | I215: of:=[queue.G215] -> 0.005676 | J215: of:=[queue.I215] -> 0.629169 | K215: of:=[stack.E215] -> 843600 | L215: of:=[stack.G215] -> 0.011714 | M215: of:=[stack.I215] -> 0.885902
A216: of:=[furious.B216] -> 10 | B216: of:=[furious.E216] -> 2448600 | C216: of:=[furious.G216] -> 0.003952 | D216: of:=[furious.I216] -> 0.525633 | E216: of:=[generic.E216] -> 730400 | F216: of:=[generic.G216] -> 0.013535 | G216: of:=[generic.I216] -> 0.953654 | H216: of:=[queue.E216] -> 1723800 | I216: of:=[queue.G216] -> 0.005671 | J216: of:=[queue.I216] -> 0.632971 | K216: of:=[stack.E216] -> 842800 | L216: of:=[stack.G216] -> 0.011725 | M216: of:=[stack.I216] -> 0.892912
A217: of:=[furious.B217] -> 10 | B217: of:=[furious.E217] -> 2470200 | C217: of:=[furious.G217] -> 0.003899 | D217: of:=[furious.I217] -> 0.527042 | E217: of:=[generic.E217] -> 733200 | F217: of:=[generic.G217] -> 0.013543 | G217: of:=[generic.I217] -> 0.958919 | H217: of:=[queue.E217] -> 1721000 | I217: of:=[queue.G217] -> 0.005672 | J217: of:=[queue.I217] -> 0.637964 | K217: of:=[stack.E217] -> 842800 | L217: of:=[stack.G217] -> 0.011692 | M217: of:=[stack.I217] -> 0.899436
A218: of:=[furious.B218] -> 10 | B218: of:=[furious.E218] -> 2467400 | C218: of:=[furious.G218] -> 0.003931 | D218: of:=[furious.I218] -> 0.531055 | E218: of:=[generic.E218] -> 731400 | F218: of:=[generic.G218] -> 0.013577 | G218: of:=[generic.I218] -> 0.967142 | H218: of:=[queue.E218] -> 1723000 | I218: of:=[queue.G218] -> 0.005642 | J218: of:=[queue.I218] -> 0.642003 | K218: of:=[stack.E218] -> 838000 | L218: of:=[stack.G218] -> 0.011792 | M218: of:=[stack.I218] -> 0.908521
A219: of:=[furious.B219] -> 10 | B219: of:=[furious.E219] -> 2461200 | C219: of:=[furious.G219] -> 0.003941 | D219: of:=[furious.I219] -> 0.535417 | E219: of:=[generic.E219] -> 734600 | F219: of:=[generic.G219] -> 0.013482 | G219: of:=[generic.I219] -> 0.971995 | H219: of:=[queue.E219] -> 1721200 | I219: of:=[queue.G219] -> 0.005684 | J219: of:=[queue.I219] -> 0.646748 | K219: of:=[stack.E219] -> 846000 | L219: of:=[stack.G219] -> 0.011702 | M219: of:=[stack.I219] -> 0.910663
A220: of:=[furious.B220] -> 10 | B220: of:=[furious.E220] -> 2472200 | C220: of:=[furious.G220] -> 0.003915 | D220: of:=[furious.I220] -> 0.537876 | E220: of:=[generic.E220] -> 733400 | F220: of:=[generic.G220] -> 0.013526 | G220: of:=[generic.I220] -> 0.979716 | H220: of:=[queue.E220] -> 1726200 | I220: of:=[queue.G220] -> 0.005654 | J220: of:=[queue.I220] -> 0.650173 | K220: of:=[stack.E220] -> 846400 | L220: of:=[stack.G220] -> 0.011673 | M220: of:=[stack.I220] -> 0.916836
A221: of:=[furious.B221] -> 10 | B221: of:=[furious.E221] -> 2465400 | C221: of:=[furious.G221] -> 0.003917 | D221: of:=[furious.I221] -> 0.542241 | E221: of:=[generic.E221] -> 732600 | F221: of:=[generic.G221] -> 0.013508 | G221: of:=[generic.I221] -> 0.987118 | H221: of:=[queue.E221] -> 1722600 | I221: of:=[queue.G221] -> 0.005643 | J221: of:=[queue.I221] -> 0.655173 | K221: of:=[stack.E221] -> 849000 | L221: of:=[stack.G221] -> 0.011661 | M221: of:=[stack.I221] -> 0.921778
A222: of:=[furious.B222] -> 10 | B222: of:=[furious.E222] -> 2417200 | C222: of:=[furious.G222] -> 0.003987 | D222: of:=[furious.I222] -> 0.507784 | E222: of:=[generic.E222] -> 777600 | F222: of:=[generic.G222] -> 0.012737 | G222: of:=[generic.I222] -> 0.898176 | H222: of:=[queue.E222] -> 1759600 | I222: of:=[queue.G222] -> 0.005534 | J222: of:=[queue.I222] -> 0.625602 | K222: of:=[stack.E222] -> 907000 | L222: of:=[stack.G222] -> 0.010911 | M222: of:=[stack.I222] -> 0.830502
A223: of:=[furious.B223] -> 10 | B223: of:=[furious.E223] -> 2404800 | C223: of:=[furious.G223] -> 0.004032 | D223: of:=[furious.I223] -> 0.513036 | E223: of:=[generic.E223] -> 774000 | F223: of:=[generic.G223] -> 0.012809 | G223: of:=[generic.I223] -> 0.907348 | H223: of:=[queue.E223] -> 1748000 | I223: of:=[queue.G223] -> 0.005572 | J223: of:=[queue.I223] -> 0.632113 | K223: of:=[stack.E223] -> 915400 | L223: of:=[stack.G223] -> 0.010826 | M223: of:=[stack.I223] -> 0.833205
A224: of:=[furious.B224] -> 10 | B224: of:=[furious.E224] -> 2420000 | C224: of:=[furious.G224] -> 0.003999 | D224: of:=[furious.I224] -> 0.515317 | E224: of:=[generic.E224] -> 774800 | F224: of:=[generic.G224] -> 0.012785 | G224: of:=[generic.I224] -> 0.913902 | H224: of:=[queue.E224] -> 1756400 | I224: of:=[queue.G224] -> 0.005553 | J224: of:=[queue.I224] -> 0.634988 | K224: of:=[stack.E224] -> 911600 | L224: of:=[stack.G224] -> 0.010878 | M224: of:=[stack.I224] -> 0.841428
A225: of:=[furious.B225] -> 10 | B225: of:=[furious.E225] -> 2415000 | C225: of:=[furious.G225] -> 0.004035 | D225: of:=[furious.I225] -> 0.519746 | E225: of:=[generic.E225] -> 779600 | F225: of:=[generic.G225] -> 0.012719 | G225: of:=[generic.I225] -> 0.918038 | H225: of:=[queue.E225] -> 1750800 | I225: of:=[queue.G225] -> 0.005569 | J225: of:=[queue.I225] -> 0.640366 | K225: of:=[stack.E225] -> 910200 | L225: of:=[stack.G225] -> 0.010894 | M225: of:=[stack.I225] -> 0.848519
A226: of:=[furious.B226] -> 10 | B226: of:=[furious.E226] -> 2409200 | C226: of:=[furious.G226] -> 0.004022 | D226: of:=[furious.I226] -> 0.524222 | E226: of:=[generic.E226] -> 774600 | F226: of:=[generic.G226] -> 0.012791 | G226: of:=[generic.I226] -> 0.927914 | H226: of:=[queue.E226] -> 1758600 | I226: of:=[queue.G226] -> 0.005564 | J226: of:=[queue.I226] -> 0.643283 | K226: of:=[stack.E226] -> 908200 | L226: of:=[stack.G226] -> 0.010918 | M226: of:=[stack.I226] -> 0.855855
A227: of:=[furious.B227] -> 10 | B227: of:=[furious.E227] -> 2405800 | C227: of:=[furious.G227] -> 0.004022 | D227: of:=[furious.I227] -> 0.528412 | E227: of:=[generic.E227] -> 776600 | F227: of:=[generic.G227] -> 0.01273 | G227: of:=[generic.I227] -> 0.933562 | H227: of:=[queue.E227] -> 1746000 | I227: of:=[queue.G227] -> 0.005584 | J227: of:=[queue.I227] -> 0.64991 | K227: of:=[stack.E227] -> 914000 | L227: of:=[stack.G227] -> 0.01084 | M227: of:=[stack.I227] -> 0.859466
A228: of:=[furious.B228] -> 10 | B228: of:=[furious.E228] -> 2411800 | C228: of:=[furious.G228] -> 0.004015 | D228: of:=[furious.I228] -> 0.531545 | E228: of:=[generic.E228] -> 771400 | F228: of:=[generic.G228] -> 0.012836 | G228: of:=[generic.I228] -> 0.943529 | H228: of:=[queue.E228] -> 1758400 | I228: of:=[queue.G228] -> 0.005556 | J228: of:=[queue.I228] -> 0.65189 | K228: of:=[stack.E228] -> 905600 | L228: of:=[stack.G228] -> 0.010892 | M228: of:=[stack.I228] -> 0.869727
A229: of:=[furious.B229] -> 10 | B229: of:=[furious.E229] -> 2416800 | C229: of:=[furious.G229] -> 0.004011 | D229: of:=[furious.I229] -> 0.534758 | E229: of:=[generic.E229] -> 778200 | F229: of:=[generic.G229] -> 0.012709 | G229: of:=[generic.I229] -> 0.946163 | H229: of:=[queue.E229] -> 1758200 | I229: of:=[queue.G229] -> 0.005532 | J229: of:=[queue.I229] -> 0.656157 | K229: of:=[stack.E229] -> 910400 | L229: of:=[stack.G229] -> 0.010877 | M229: of:=[stack.I229] -> 0.873678
A230: of:=[furious.B230] -> 10 | B230: of:=[furious.E230] -> 2414200 | C230: of:=[furious.G230] -> 0.004028 | D230: of:=[furious.I230] -> 0.538797 | E230: of:=[generic.E230] -> 774200 | F230: of:=[generic.G230] -> 0.012787 | G230: of:=[generic.I230] -> 0.95532 | H230: of:=[queue.E230] -> 1754200 | I230: of:=[queue.G230] -> 0.005563 | J230: of:=[queue.I230] -> 0.661125 | K230: of:=[stack.E230] -> 906600 | L230: of:=[stack.G230] -> 0.010942 | M230: of:=[stack.I230] -> 0.881733
A231: of:=[furious.B231] -> 10 | B231: of:=[furious.E231] -> 2416600 | C231: of:=[furious.G231] -> 0.003997 | D231: of:=[furious.I231] -> 0.542241 | E231: of:=[generic.E231] -> 776400 | F231: of:=[generic.G231] -> 0.012764 | G231: of:=[generic.I231] -> 0.960633 | H231: of:=[queue.E231] -> 1750600 | I231: of:=[queue.G231] -> 0.005576 | J231: of:=[queue.I231] -> 0.666004 | K231: of:=[stack.E231] -> 915000 | L231: of:=[stack.G231] -> 0.010855 | M231: of:=[stack.I231] -> 0.883839
A232: of:=[furious.B232] -> 10 | B232: of:=[furious.E232] -> 2546200 | C232: of:=[furious.G232] -> 0.003836 | D232: of:=[furious.I232] -> 0.501752 | E232: of:=[generic.E232] -> 767600 | F232: of:=[generic.G232] -> 0.012903 | G232: of:=[generic.I232] -> 0.981983 | H232: of:=[queue.E232] -> 2144200 | I232: of:=[queue.G232] -> 0.004538 | J232: of:=[queue.I232] -> 0.539375 | K232: of:=[stack.E232] -> 908000 | L232: of:=[stack.G232] -> 0.010919 | M232: of:=[stack.I232] -> 0.83244
A233: of:=[furious.B233] -> 10 | B233: of:=[furious.E233] -> 2535800 | C233: of:=[furious.G233] -> 0.003854 | D233: of:=[furious.I233] -> 0.506598 | E233: of:=[generic.E233] -> 768000 | F233: of:=[generic.G233] -> 0.012891 | G233: of:=[generic.I233] -> 0.988271 | H233: of:=[queue.E233] -> 2149200 | I233: of:=[queue.G233] -> 0.004506 | J233: of:=[queue.I233] -> 0.542913 | K233: of:=[stack.E233] -> 909200 | L233: of:=[stack.G233] -> 0.010867 | M233: of:=[stack.I233] -> 0.838397
A234: of:=[furious.B234] -> 10 | B234: of:=[furious.E234] -> 2531000 | C234: of:=[furious.G234] -> 0.003853 | D234: of:=[furious.I234] -> 0.510863 | E234: of:=[generic.E234] -> 765400 | F234: of:=[generic.G234] -> 0.012934 | G234: of:=[generic.I234] -> 0.99646 | H234: of:=[queue.E234] -> 2153800 | I234: of:=[queue.G234] -> 0.004515 | J234: of:=[queue.I234] -> 0.546479 | K234: of:=[stack.E234] -> 906200 | L234: of:=[stack.G234] -> 0.010925 | M234: of:=[stack.I234] -> 0.846262
A235: of:=[furious.B235] -> 10 | B235: of:=[furious.E235] -> 2551800 | C235: of:=[furious.G235] -> 0.003825 | D235: of:=[furious.I235] -> 0.512535 | E235: of:=[generic.E235] -> 761400 | F235: of:=[generic.G235] -> 0.012987 | G235: of:=[generic.I235] -> 1.005708 | H235: of:=[queue.E235] -> 2160000 | I235: of:=[queue.G235] -> 0.004503 | J235: of:=[queue.I235] -> 0.549805 | K235: of:=[stack.E235] -> 905800 | L235: of:=[stack.G235] -> 0.010921 | M235: of:=[stack.I235] -> 0.852876
A236: of:=[furious.B236] -> 10 | B236: of:=[furious.E236] -> 2539000 | C236: of:=[furious.G236] -> 0.003842 | D236: of:=[furious.I236] -> 0.51756 | E236: of:=[generic.E236] -> 764800 | F236: of:=[generic.G236] -> 0.012958 | G236: of:=[generic.I236] -> 1.009906 | H236: of:=[queue.E236] -> 2157800 | I236: of:=[queue.G236] -> 0.004482 | J236: of:=[queue.I236] -> 0.55419 | K236: of:=[stack.E236] -> 907800 | L236: of:=[stack.G236] -> 0.010912 | M236: of:=[stack.I236] -> 0.858316
A237: of:=[furious.B237] -> 10 | B237: of:=[furious.E237] -> 2530400 | C237: of:=[furious.G237] -> 0.003865 | D237: of:=[furious.I237] -> 0.522152 | E237: of:=[generic.E237] -> 768800 | F237: of:=[generic.G237] -> 0.012888 | G237: of:=[generic.I237] -> 1.013653 | H237: of:=[queue.E237] -> 2139800 | I237: of:=[queue.G237] -> 0.004531 | J237: of:=[queue.I237] -> 0.560572 | K237: of:=[stack.E237] -> 907800 | L237: of:=[stack.G237] -> 0.010901 | M237: of:=[stack.I237] -> 0.864643
A238: of:=[furious.B238] -> 10 | B238: of:=[furious.E238] -> 2536000 | C238: of:=[furious.G238] -> 0.003861 | D238: of:=[furious.I238] -> 0.525264 | E238: of:=[generic.E238] -> 769800 | F238: of:=[generic.G238] -> 0.012915 | G238: of:=[generic.I238] -> 1.019349 | H238: of:=[queue.E238] -> 2164600 | I238: of:=[queue.G238] -> 0.004496 | J238: of:=[queue.I238] -> 0.56137 | K238: of:=[stack.E238] -> 909000 | L238: of:=[stack.G238] -> 0.010871 | M238: of:=[stack.I238] -> 0.87034
A239: of:=[furious.B239] -> 10 | B239: of:=[furious.E239] -> 2540200 | C239: of:=[furious.G239] -> 0.003846 | D239: of:=[furious.I239] -> 0.528481 | E239: of:=[generic.E239] -> 768600 | F239: of:=[generic.G239] -> 0.012868 | G239: of:=[generic.I239] -> 1.026432 | H239: of:=[queue.E239] -> 2139000 | I239: of:=[queue.G239] -> 0.004545 | J239: of:=[queue.I239] -> 0.568729 | K239: of:=[stack.E239] -> 905600 | L239: of:=[stack.G239] -> 0.010928 | M239: of:=[stack.I239] -> 0.878216
A240: of:=[furious.B240] -> 10 | B240: of:=[furious.E240] -> 2541200 | C240: of:=[furious.G240] -> 0.003849 | D240: of:=[furious.I240] -> 0.532007 | E240: of:=[generic.E240] -> 768800 | F240: of:=[generic.G240] -> 0.012849 | G240: of:=[generic.I240] -> 1.03254 | H240: of:=[queue.E240] -> 2155800 | I240: of:=[queue.G240] -> 0.004513 | J240: of:=[queue.I240] -> 0.570479 | K240: of:=[stack.E240] -> 906400 | L240: of:=[stack.G240] -> 0.01094 | M240: of:=[stack.I240] -> 0.884037
A241: of:=[furious.B241] -> 10 | B241: of:=[furious.E241] -> 2529800 | C241: of:=[furious.G241] -> 0.003859 | D241: of:=[furious.I241] -> 0.53681 | E241: of:=[generic.E241] -> 770000 | F241: of:=[generic.G241] -> 0.012881 | G241: of:=[generic.I241] -> 1.037958 | H241: of:=[queue.E241] -> 2137400 | I241: of:=[queue.G241] -> 0.004549 | J241: of:=[queue.I241] -> 0.576943 | K241: of:=[stack.E241] -> 906000 | L241: of:=[stack.G241] -> 0.010912 | M241: of:=[stack.I241] -> 0.890382
A242: of:=[furious.B242] -> 12 | B242: of:=[furious.E242] -> 2407000 | C242: of:=[furious.G242] -> 0.004875 | D242: of:=[furious.I242] -> 0.568124 | E242: of:=[generic.E242] -> 674400 | F242: of:=[generic.G242] -> 0.017654 | G242: of:=[generic.I242] -> 1.069857 | H242: of:=[queue.E242] -> 2022800 | I242: of:=[queue.G242] -> 0.005829 | J242: of:=[queue.I242] -> 0.608271 | K242: of:=[stack.E242] -> 846800 | L242: of:=[stack.G242] -> 0.014015 | M242: of:=[stack.I242] -> 0.943178
A243: of:=[furious.B243] -> 12 | B243: of:=[furious.E243] -> 2411200 | C243: of:=[furious.G243] -> 0.00487 | D243: of:=[furious.I243] -> 0.571902 | E243: of:=[generic.E243] -> 670000 | F243: of:=[generic.G243] -> 0.017767 | G243: of:=[generic.I243] -> 1.081608 | H243: of:=[queue.E243] -> 2020800 | I243: of:=[queue.G243] -> 0.005813 | J243: of:=[queue.I243] -> 0.613329 | K243: of:=[stack.E243] -> 846200 | L243: of:=[stack.G243] -> 0.014025 | M243: of:=[stack.I243] -> 0.950915
A244: of:=[furious.B244] -> 12 | B244: of:=[furious.E244] -> 2407600 | C244: of:=[furious.G244] -> 0.004862 | D244: of:=[furious.I244] -> 0.576562 | E244: of:=[generic.E244] -> 672255 | F244: of:=[generic.G244] -> 0.01772 | G244: of:=[generic.I244] -> 1.086896 | H244: of:=[queue.E244] -> 2016000 | I244: of:=[queue.G244] -> 0.005815 | J244: of:=[queue.I244] -> 0.618776 | K244: of:=[stack.E244] -> 850000 | L244: of:=[stack.G244] -> 0.013974 | M244: of:=[stack.I244] -> 0.956123
A245: of:=[furious.B245] -> 12 | B245: of:=[furious.E245] -> 2416800 | C245: of:=[furious.G245] -> 0.004857 | D245: of:=[furious.I245] -> 0.579668 | E245: of:=[generic.E245] -> 672000 | F245: of:=[generic.G245] -> 0.017729 | G245: of:=[generic.I245] -> 1.096305 | H245: of:=[queue.E245] -> 2017800 | I245: of:=[queue.G245] -> 0.005824 | J245: of:=[queue.I245] -> 0.62319 | K245: of:=[stack.E245] -> 846400 | L245: of:=[stack.G245] -> 0.014062 | M245: of:=[stack.I245] -> 0.965464
A246: of:=[furious.B246] -> 12 | B246: of:=[furious.E246] -> 2411200 | C246: of:=[furious.G246] -> 0.004866 | D246: of:=[furious.I246] -> 0.584518 | E246: of:=[generic.E246] -> 667600 | F246: of:=[generic.G246] -> 0.017852 | G246: of:=[generic.I246] -> 1.107996 | H246: of:=[queue.E246] -> 2019000 | I246: of:=[queue.G246] -> 0.005817 | J246: of:=[queue.I246] -> 0.627656 | K246: of:=[stack.E246] -> 844112 | L246: of:=[stack.G246] -> 0.014055 | M246: of:=[stack.I246] -> 0.973075
A247: of:=[furious.B247] -> 12 | B247: of:=[furious.E247] -> 2410200 | C247: of:=[furious.G247] -> 0.004872 | D247: of:=[furious.I247] -> 0.588791 | E247: of:=[generic.E247] -> 667800 | F247: of:=[generic.G247] -> 0.017781 | G247: of:=[generic.I247] -> 1.115828 | H247: of:=[queue.E247] -> 2015400 | I247: of:=[queue.G247] -> 0.005835 | J247: of:=[queue.I247] -> 0.632844 | K247: of:=[stack.E247] -> 841200 | L247: of:=[stack.G247] -> 0.014118 | M247: of:=[stack.I247] -> 0.98294
A248: of:=[furious.B248] -> 12 | B248: of:=[furious.E248] -> 2415600 | C248: of:=[furious.G248] -> 0.004856 | D248: of:=[furious.I248] -> 0.592246 | E248: of:=[generic.E248] -> 672455 | F248: of:=[generic.G248] -> 0.017679 | G248: of:=[generic.I248] -> 1.118778 | H248: of:=[queue.E248] -> 2018600 | I248: of:=[queue.G248] -> 0.005822 | J248: of:=[queue.I248] -> 0.63698 | K248: of:=[stack.E248] -> 844800 | L248: of:=[stack.G248] -> 0.014044 | M248: of:=[stack.I248] -> 0.987977
A249: of:=[furious.B249] -> 12 | B249: of:=[furious.E249] -> 2412600 | C249: of:=[furious.G249] -> 0.004854 | D249: of:=[furious.I249] -> 0.596695 | E249: of:=[generic.E249] -> 672200 | F249: of:=[generic.G249] -> 0.017751 | G249: of:=[generic.I249] -> 1.128004 | H249: of:=[queue.E249] -> 2023200 | I249: of:=[queue.G249] -> 0.005813 | J249: of:=[queue.I249] -> 0.640807 | K249: of:=[stack.E249] -> 843000 | L249: of:=[stack.G249] -> 0.014076 | M249: of:=[stack.I249] -> 0.996121
A250: of:=[furious.B250] -> 12 | B250: of:=[furious.E250] -> 2413400 | C250: of:=[furious.G250] -> 0.004852 | D250: of:=[furious.I250] -> 0.600649 | E250: of:=[generic.E250] -> 672600 | F250: of:=[generic.G250] -> 0.017696 | G250: of:=[generic.I250] -> 1.135488 | H250: of:=[queue.E250] -> 2021000 | I250: of:=[queue.G250] -> 0.005832 | J250: of:=[queue.I250] -> 0.645687 | K250: of:=[stack.E250] -> 844000 | L250: of:=[stack.G250] -> 0.014057 | M250: of:=[stack.I250] -> 1.002566
A251: of:=[furious.B251] -> 12 | B251: of:=[furious.E251] -> 2400800 | C251: of:=[furious.G251] -> 0.004873 | D251: of:=[furious.I251] -> 0.606256 | E251: of:=[generic.E251] -> 669600 | F251: of:=[generic.G251] -> 0.017808 | G251: of:=[generic.I251] -> 1.145827 | H251: of:=[queue.E251] -> 2016600 | I251: of:=[queue.G251] -> 0.005823 | J251: of:=[queue.I251] -> 0.65088 | K251: of:=[stack.E251] -> 844311 | L251: of:=[stack.G251] -> 0.014038 | M251: of:=[stack.I251] -> 1.008365
A252: of:=[furious.B252] -> 12 | B252: of:=[furious.E252] -> 2502800 | C252: of:=[furious.G252] -> 0.004702 | D252: of:=[furious.I252] -> 0.548819 | E252: of:=[generic.E252] -> 660600 | F252: of:=[generic.G252] -> 0.018065 | G252: of:=[generic.I252] -> 1.06855 | H252: of:=[queue.E252] -> 1959200 | I252: of:=[queue.G252] -> 0.00601 | J252: of:=[queue.I252] -> 0.617477 | K252: of:=[stack.E252] -> 883200 | L252: of:=[stack.G252] -> 0.013431 | M252: of:=[stack.I252] -> 0.922506
A253: of:=[furious.B253] -> 12 | B253: of:=[furious.E253] -> 2498800 | C253: of:=[furious.G253] -> 0.004701 | D253: of:=[furious.I253] -> 0.553521 | E253: of:=[generic.E253] -> 653600 | F253: of:=[generic.G253] -> 0.018188 | G253: of:=[generic.I253] -> 1.0827 | H253: of:=[queue.E253] -> 1958000 | I253: of:=[queue.G253] -> 0.005996 | J253: of:=[queue.I253] -> 0.622501 | K253: of:=[stack.E253] -> 879000 | L253: of:=[stack.G253] -> 0.01352 | M253: of:=[stack.I253] -> 0.931988
A254: of:=[furious.B254] -> 12 | B254: of:=[furious.E254] -> 2499200 | C254: of:=[furious.G254] -> 0.004676 | D254: of:=[furious.I254] -> 0.557685 | E254: of:=[generic.E254] -> 649900 | F254: of:=[generic.G254] -> 0.018277 | G254: of:=[generic.I254] -> 1.093088 | H254: of:=[queue.E254] -> 1947800 | I254: of:=[queue.G254] -> 0.006033 | J254: of:=[queue.I254] -> 0.628943 | K254: of:=[stack.E254] -> 882200 | L254: of:=[stack.G254] -> 0.013484 | M254: of:=[stack.I254] -> 0.937516
A255: of:=[furious.B255] -> 12 | B255: of:=[furious.E255] -> 2493400 | C255: of:=[furious.G255] -> 0.004686 | D255: of:=[furious.I255] -> 0.562514 | E255: of:=[generic.E255] -> 652600 | F255: of:=[generic.G255] -> 0.018244 | G255: of:=[generic.I255] -> 1.100237 | H255: of:=[queue.E255] -> 1950600 | I255: of:=[queue.G255] -> 0.006042 | J255: of:=[queue.I255] -> 0.63328 | K255: of:=[stack.E255] -> 881000 | L255: of:=[stack.G255] -> 0.013496 | M255: of:=[stack.I255] -> 0.94532
A256: of:=[furious.B256] -> 12 | B256: of:=[furious.E256] -> 2489200 | C256: of:=[furious.G256] -> 0.0047 | D256: of:=[furious.I256] -> 0.567148 | E256: of:=[generic.E256] -> 653493 | F256: of:=[generic.G256] -> 0.018253 | G256: of:=[generic.I256] -> 1.106689 | H256: of:=[queue.E256] -> 1955400 | I256: of:=[queue.G256] -> 0.005993 | J256: of:=[queue.I256] -> 0.637223 | K256: of:=[stack.E256] -> 883600 | L256: of:=[stack.G256] -> 0.013436 | M256: of:=[stack.I256] -> 0.951019
A257: of:=[furious.B257] -> 12 | B257: of:=[furious.E257] -> 2496200 | C257: of:=[furious.G257] -> 0.004688 | D257: of:=[furious.I257] -> 0.570476 | E257: of:=[generic.E257] -> 660400 | F257: of:=[generic.G257] -> 0.018022 | G257: of:=[generic.I257] -> 1.110137 | H257: of:=[queue.E257] -> 1942600 | I257: of:=[queue.G257] -> 0.00606 | J257: of:=[queue.I257] -> 0.64404 | K257: of:=[stack.E257] -> 877600 | L257: of:=[stack.G257] -> 0.013551 | M257: of:=[stack.I257] -> 0.961337
A258: of:=[furious.B258] -> 12 | B258: of:=[furious.E258] -> 2495200 | C258: of:=[furious.G258] -> 0.004701 | D258: of:=[furious.I258] -> 0.574694 | E258: of:=[generic.E258] -> 649600 | F258: of:=[generic.G258] -> 0.018347 | G258: of:=[generic.I258] -> 1.127493 | H258: of:=[queue.E258] -> 1952200 | I258: of:=[queue.G258] -> 0.006023 | J258: of:=[queue.I258] -> 0.647125 | K258: of:=[stack.E258] -> 881600 | L258: of:=[stack.G258] -> 0.013457 | M258: of:=[stack.I258] -> 0.966144
A259: of:=[furious.B259] -> 12 | B259: of:=[furious.E259] -> 2490400 | C259: of:=[furious.G259] -> 0.004707 | D259: of:=[furious.I259] -> 0.579325 | E259: of:=[generic.E259] -> 661200 | F259: of:=[generic.G259] -> 0.018007 | G259: of:=[generic.I259] -> 1.125594 | H259: of:=[queue.E259] -> 1959200 | I259: of:=[queue.G259] -> 0.005975 | J259: of:=[queue.I259] -> 0.650577 | K259: of:=[stack.E259] -> 879200 | L259: of:=[stack.G259] -> 0.013526 | M259: of:=[stack.I259] -> 0.974427
A260: of:=[furious.B260] -> 12 | B260: of:=[furious.E260] -> 2497200 | C260: of:=[furious.G260] -> 0.004696 | D260: of:=[furious.I260] -> 0.58258 | E260: of:=[generic.E260] -> 654600 | F260: of:=[generic.G260] -> 0.018213 | G260: of:=[generic.I260] -> 1.139274 | H260: of:=[queue.E260] -> 1942400 | I260: of:=[queue.G260] -> 0.006045 | J260: of:=[queue.I260] -> 0.657994 | K260: of:=[stack.E260] -> 882600 | L260: of:=[stack.G260] -> 0.013438 | M260: of:=[stack.I260] -> 0.979433
A261: of:=[furious.B261] -> 12 | B261: of:=[furious.E261] -> 2504600 | C261: of:=[furious.G261] -> 0.004679 | D261: of:=[furious.I261] -> 0.585726 | E261: of:=[generic.E261] -> 656800 | F261: of:=[generic.G261] -> 0.018136 | G261: of:=[generic.I261] -> 1.14531 | H261: of:=[queue.E261] -> 1944400 | I261: of:=[queue.G261] -> 0.006044 | J261: of:=[queue.I261] -> 0.662234 | K261: of:=[stack.E261] -> 879400 | L261: of:=[stack.G261] -> 0.01353 | M261: of:=[stack.I261] -> 0.988083
A262: of:=[furious.B262] -> 12 | B262: of:=[furious.E262] -> 2280000 | C262: of:=[furious.G262] -> 0.005149 | D262: of:=[furious.I262] -> 0.572356 | E262: of:=[generic.E262] -> 684200 | F262: of:=[generic.G262] -> 0.017404 | G262: of:=[generic.I262] -> 1.054798 | H262: of:=[queue.E262] -> 1920400 | I262: of:=[queue.G262] -> 0.006123 | J262: of:=[queue.I262] -> 0.634369 | K262: of:=[stack.E262] -> 865200 | L262: of:=[stack.G262] -> 0.013747 | M262: of:=[stack.I262] -> 0.939486
A263: of:=[furious.B263] -> 12 | B263: of:=[furious.E263] -> 2279800 | C263: of:=[furious.G263] -> 0.005157 | D263: of:=[furious.I263] -> 0.576868 | E263: of:=[generic.E263] -> 683034 | F263: of:=[generic.G263] -> 0.01744 | G263: of:=[generic.I263] -> 1.062883 | H263: of:=[queue.E263] -> 1927200 | I263: of:=[queue.G263] -> 0.006114 | J263: of:=[queue.I263] -> 0.638057 | K263: of:=[stack.E263] -> 863400 | L263: of:=[stack.G263] -> 0.013725 | M263: of:=[stack.I263] -> 0.947734
A264: of:=[furious.B264] -> 12 | B264: of:=[furious.E264] -> 2289800 | C264: of:=[furious.G264] -> 0.005119 | D264: of:=[furious.I264] -> 0.580037 | E264: of:=[generic.E264] -> 681600 | F264: of:=[generic.G264] -> 0.017468 | G264: of:=[generic.I264] -> 1.073233 | H264: of:=[queue.E264] -> 1909600 | I264: of:=[queue.G264] -> 0.006151 | J264: of:=[queue.I264] -> 0.645771 | K264: of:=[stack.E264] -> 863400 | L264: of:=[stack.G264] -> 0.01378 | M264: of:=[stack.I264] -> 0.954976
A265: of:=[furious.B265] -> 12 | B265: of:=[furious.E265] -> 2289600 | C265: of:=[furious.G265] -> 0.005121 | D265: of:=[furious.I265] -> 0.584459 | E265: of:=[generic.E265] -> 683832 | F265: of:=[generic.G265] -> 0.017391 | G265: of:=[generic.I265] -> 1.078511 | H265: of:=[queue.E265] -> 1920400 | I265: of:=[queue.G265] -> 0.006135 | J265: of:=[queue.I265] -> 0.648699 | K265: of:=[stack.E265] -> 860600 | L265: of:=[stack.G265] -> 0.013811 | M265: of:=[stack.I265] -> 0.96372
A266: of:=[furious.B266] -> 12 | B266: of:=[furious.E266] -> 2295000 | C266: of:=[furious.G266] -> 0.00513 | D266: of:=[furious.I266] -> 0.588149 | E266: of:=[generic.E266] -> 679000 | F266: of:=[generic.G266] -> 0.017541 | G266: of:=[generic.I266] -> 1.091493 | H266: of:=[queue.E266] -> 1930200 | I266: of:=[queue.G266] -> 0.006102 | J266: of:=[queue.I266] -> 0.651748 | K266: of:=[stack.E266] -> 862400 | L266: of:=[stack.G266] -> 0.013799 | M266: of:=[stack.I266] -> 0.969854
A267: of:=[furious.B267] -> 12 | B267: of:=[furious.E267] -> 2288600 | C267: of:=[furious.G267] -> 0.005125 | D267: of:=[furious.I267] -> 0.593305 | E267: of:=[generic.E267] -> 680600 | F267: of:=[generic.G267] -> 0.017505 | G267: of:=[generic.I267] -> 1.098208 | H267: of:=[queue.E267] -> 1910200 | I267: of:=[queue.G267] -> 0.006149 | J267: of:=[queue.I267] -> 0.659827 | K267: of:=[stack.E267] -> 864600 | L267: of:=[stack.G267] -> 0.013736 | M267: of:=[stack.I267] -> 0.975685
A268: of:=[furious.B268] -> 12 | B268: of:=[furious.E268] -> 2271600 | C268: of:=[furious.G268] -> 0.005166 | D268: of:=[furious.I268] -> 0.599842 | E268: of:=[generic.E268] -> 652495 | F268: of:=[generic.G268] -> 0.018238 | G268: of:=[generic.I268] -> 1.128607 | H268: of:=[queue.E268] -> 1911400 | I268: of:=[queue.G268] -> 0.006141 | J268: of:=[queue.I268] -> 0.664259 | K268: of:=[stack.E268] -> 863800 | L268: of:=[stack.G268] -> 0.01376 | M268: of:=[stack.I268] -> 0.983159
A269: of:=[furious.B269] -> 12 | B269: of:=[furious.E269] -> 2279000 | C269: of:=[furious.G269] -> 0.005137 | D269: of:=[furious.I269] -> 0.60319 | E269: of:=[generic.E269] -> 655600 | F269: of:=[generic.G269] -> 0.018145 | G269: of:=[generic.I269] -> 1.135079 | H269: of:=[queue.E269] -> 1924800 | I269: of:=[queue.G269] -> 0.006109 | J269: of:=[queue.I269] -> 0.666541 | K269: of:=[stack.E269] -> 861000 | L269: of:=[stack.G269] -> 0.01381 | M269: of:=[stack.I269] -> 0.991743
A270: of:=[furious.B270] -> 12 | B270: of:=[furious.E270] -> 2277800 | C270: of:=[furious.G270] -> 0.005157 | D270: of:=[furious.I270] -> 0.607607 | E270: of:=[generic.E270] -> 654800 | F270: of:=[generic.G270] -> 0.018152 | G270: of:=[generic.I270] -> 1.143736 | H270: of:=[queue.E270] -> 1902800 | I270: of:=[queue.G270] -> 0.006186 | J270: of:=[queue.I270] -> 0.674981 | K270: of:=[stack.E270] -> 861600 | L270: of:=[stack.G270] -> 0.013784 | M270: of:=[stack.I270] -> 0.998325
A271: of:=[furious.B271] -> 12 | B271: of:=[furious.E271] -> 2280800 | C271: of:=[furious.G271] -> 0.005149 | D271: of:=[furious.I271] -> 0.611432 | E271: of:=[generic.E271] -> 650299 | F271: of:=[generic.G271] -> 0.018238 | G271: of:=[generic.I271] -> 1.154469 | H271: of:=[queue.E271] -> 1918800 | I271: of:=[queue.G271] -> 0.006155 | J271: of:=[queue.I271] -> 0.676723 | K271: of:=[stack.E271] -> 863600 | L271: of:=[stack.G271] -> 0.013777 | M271: of:=[stack.I271] -> 1.004053
A272: of:=[furious.B272] -> 14 | B272: of:=[furious.E272] -> 2343400 | C272: of:=[furious.G272] -> 0.005862 | D272: of:=[furious.I272] -> 0.631636 | E272: of:=[generic.E272] -> 458483 | F272: of:=[generic.G272] -> 0.030392 | G272: of:=[generic.I272] -> 1.39808 | H272: of:=[queue.E272] -> 1875600 | I272: of:=[queue.G272] -> 0.007327 | J272: of:=[queue.I272] -> 0.720961 | K272: of:=[stack.E272] -> 887400 | L272: of:=[stack.G272] -> 0.015693 | M272: of:=[stack.I272] -> 1.003673
A273: of:=[furious.B273] -> 14 | B273: of:=[furious.E273] -> 2339000 | C273: of:=[furious.G273] -> 0.005865 | D273: of:=[furious.I273] -> 0.636851 | E273: of:=[generic.E273] -> 447505 | F273: of:=[generic.G273] -> 0.031169 | G273: of:=[generic.I273] -> 1.426261 | H273: of:=[queue.E273] -> 1878400 | I273: of:=[queue.G273] -> 0.007328 | J273: of:=[queue.I273] -> 0.725492 | K273: of:=[stack.E273] -> 887600 | L273: of:=[stack.G273] -> 0.015667 | M273: of:=[stack.I273] -> 1.011336
A274: of:=[furious.B274] -> 14 | B274: of:=[furious.E274] -> 2339200 | C274: of:=[furious.G274] -> 0.005848 | D274: of:=[furious.I274] -> 0.641399 | E274: of:=[generic.E274] -> 452988 | F274: of:=[generic.G274] -> 0.030761 | G274: of:=[generic.I274] -> 1.427244 | H274: of:=[queue.E274] -> 1869200 | I274: of:=[queue.G274] -> 0.007353 | J274: of:=[queue.I274] -> 0.732312 | K274: of:=[stack.E274] -> 887600 | L274: of:=[stack.G274] -> 0.015671 | M274: of:=[stack.I274] -> 1.019055
A275: of:=[furious.B275] -> 14 | B275: of:=[furious.E275] -> 2352000 | C275: of:=[furious.G275] -> 0.005817 | D275: of:=[furious.I275] -> 0.644183 | E275: of:=[generic.E275] -> 458084 | F275: of:=[generic.G275] -> 0.030318 | G275: of:=[generic.I275] -> 1.431546 | H275: of:=[queue.E275] -> 1871800 | I275: of:=[queue.G275] -> 0.007354 | J275: of:=[queue.I275] -> 0.736811 | K275: of:=[stack.E275] -> 886000 | L275: of:=[stack.G275] -> 0.015688 | M275: of:=[stack.I275] -> 1.027636
A276: of:=[furious.B276] -> 14 | B276: of:=[furious.E276] -> 2343200 | C276: of:=[furious.G276] -> 0.005856 | D276: of:=[furious.I276] -> 0.649912 | E276: of:=[generic.E276] -> 453293 | F276: of:=[generic.G276] -> 0.030749 | G276: of:=[generic.I276] -> 1.449929 | H276: of:=[queue.E276] -> 1879800 | I276: of:=[queue.G276] -> 0.007314 | J276: of:=[queue.I276] -> 0.740199 | K276: of:=[stack.E276] -> 887600 | L276: of:=[stack.G276] -> 0.015678 | M276: of:=[stack.I276] -> 1.034316
A277: of:=[furious.B277] -> 14 | B277: of:=[furious.E277] -> 2345400 | C277: of:=[furious.G277] -> 0.005845 | D277: of:=[furious.I277] -> 0.65409 | E277: of:=[generic.E277] -> 453493 | F277: of:=[generic.G277] -> 0.030682 | G277: of:=[generic.I277] -> 1.460403 | H277: of:=[queue.E277] -> 1863600 | I277: of:=[queue.G277] -> 0.007386 | J277: of:=[queue.I277] -> 0.74836 | K277: of:=[stack.E277] -> 886600 | L277: of:=[stack.G277] -> 0.015685 | M277: of:=[stack.I277] -> 1.04245
A278: of:=[furious.B278] -> 14 | B278: of:=[furious.E278] -> 2342200 | C278: of:=[furious.G278] -> 0.005862 | D278: of:=[furious.I278] -> 0.659 | E278: of:=[generic.E278] -> 454291 | F278: of:=[generic.G278] -> 0.03062 | G278: of:=[generic.I278] -> 1.469811 | H278: of:=[queue.E278] -> 1864200 | I278: of:=[queue.G278] -> 0.00738 | J278: of:=[queue.I278] -> 0.753155 | K278: of:=[stack.E278] -> 887000 | L278: of:=[stack.G278] -> 0.015651 | M278: of:=[stack.I278] -> 1.049697
A279: of:=[furious.B279] -> 14 | B279: of:=[furious.E279] -> 2338800 | C279: of:=[furious.G279] -> 0.005862 | D279: of:=[furious.I279] -> 0.663908 | E279: of:=[generic.E279] -> 461800 | F279: of:=[generic.G279] -> 0.030169 | G279: of:=[generic.I279] -> 1.469741 | H279: of:=[queue.E279] -> 1862800 | I279: of:=[queue.G279] -> 0.00738 | J279: of:=[queue.I279] -> 0.75832 | K279: of:=[stack.E279] -> 882000 | L279: of:=[stack.G279] -> 0.015773 | M279: of:=[stack.I279] -> 1.060132
A280: of:=[furious.B280] -> 14 | B280: of:=[furious.E280] -> 2338200 | C280: of:=[furious.G280] -> 0.005869 | D280: of:=[furious.I280] -> 0.668398 | E280: of:=[generic.E280] -> 446906 | F280: of:=[generic.G280] -> 0.031197 | G280: of:=[generic.I280] -> 1.503233 | H280: of:=[queue.E280] -> 1867400 | I280: of:=[queue.G280] -> 0.007359 | J280: of:=[queue.I280] -> 0.762247 | K280: of:=[stack.E280] -> 882200 | L280: of:=[stack.G280] -> 0.015781 | M280: of:=[stack.I280] -> 1.067513
A281: of:=[furious.B281] -> 14 | B281: of:=[furious.E281] -> 2342800 | C281: of:=[furious.G281] -> 0.00585 | D281: of:=[furious.I281] -> 0.672108 | E281: of:=[generic.E281] -> 450299 | F281: of:=[generic.G281] -> 0.030918 | G281: of:=[generic.I281] -> 1.507985 | H281: of:=[queue.E281] -> 1871000 | I281: of:=[queue.G281] -> 0.007323 | J281: of:=[queue.I281] -> 0.766307 | K281: of:=[stack.E281] -> 885400 | L281: of:=[stack.G281] -> 0.015695 | M281: of:=[stack.I281] -> 1.072922
A282: of:=[furious.B282] -> 14 | B282: of:=[furious.E282] -> 2325800 | C282: of:=[furious.G282] -> 0.005911 | D282: of:=[furious.I282] -> 0.612654 | E282: of:=[generic.E282] -> 441717 | F282: of:=[generic.G282] -> 0.031586 | G282: of:=[generic.I282] -> 1.431107 | H282: of:=[queue.E282] -> 2004000 | I282: of:=[queue.G282] -> 0.006856 | J282: of:=[queue.I282] -> 0.68823 | K282: of:=[stack.E282] -> 838000 | L282: of:=[stack.G282] -> 0.016597 | M282: of:=[stack.I282] -> 1.025578
A283: of:=[furious.B283] -> 14 | B283: of:=[furious.E283] -> 2323400 | C283: of:=[furious.G283] -> 0.005901 | D283: of:=[furious.I283] -> 0.617765 | E283: of:=[generic.E283] -> 447800 | F283: of:=[generic.G283] -> 0.031179 | G283: of:=[generic.I283] -> 1.433958 | H283: of:=[queue.E283] -> 2021000 | I283: of:=[queue.G283] -> 0.006803 | J283: of:=[queue.I283] -> 0.690275 | K283: of:=[stack.E283] -> 839000 | L283: of:=[stack.G283] -> 0.016524 | M283: of:=[stack.I283] -> 1.032997
A284: of:=[furious.B284] -> 14 | B284: of:=[furious.E284] -> 2324400 | C284: of:=[furious.G284] -> 0.005882 | D284: of:=[furious.I284] -> 0.622376 | E284: of:=[generic.E284] -> 442315 | F284: of:=[generic.G284] -> 0.031471 | G284: of:=[generic.I284] -> 1.452586 | H284: of:=[queue.E284] -> 2005200 | I284: of:=[queue.G284] -> 0.006839 | J284: of:=[queue.I284] -> 0.697906 | K284: of:=[stack.E284] -> 837126 | L284: of:=[stack.G284] -> 0.016588 | M284: of:=[stack.I284] -> 1.041117
A285: of:=[furious.B285] -> 14 | B285: of:=[furious.E285] -> 2320400 | C285: of:=[furious.G285] -> 0.005903 | D285: of:=[furious.I285] -> 0.627632 | E285: of:=[generic.E285] -> 444112 | F285: of:=[generic.G285] -> 0.031321 | G285: of:=[generic.I285] -> 1.460727 | H285: of:=[queue.E285] -> 2017000 | I285: of:=[queue.G285] -> 0.006805 | J285: of:=[queue.I285] -> 0.700734 | K285: of:=[stack.E285] -> 838800 | L285: of:=[stack.G285] -> 0.016552 | M285: of:=[stack.I285] -> 1.049036
A286: of:=[furious.B286] -> 14 | B286: of:=[furious.E286] -> 2327600 | C286: of:=[furious.G286] -> 0.005901 | D286: of:=[furious.I286] -> 0.631352 | E286: of:=[generic.E286] -> 453000 | F286: of:=[generic.G286] -> 0.030795 | G286: of:=[generic.I286] -> 1.458658 | H286: of:=[queue.E286] -> 2023800 | I286: of:=[queue.G286] -> 0.006766 | J286: of:=[queue.I286] -> 0.704376 | K286: of:=[stack.E286] -> 836727 | L286: of:=[stack.G286] -> 0.01656 | M286: of:=[stack.I286] -> 1.057148
A287: of:=[furious.B287] -> 14 | B287: of:=[furious.E287] -> 2325400 | C287: of:=[furious.G287] -> 0.005891 | D287: of:=[furious.I287] -> 0.636297 | E287: of:=[generic.E287] -> 444800 | F287: of:=[generic.G287] -> 0.031376 | G287: of:=[generic.I287] -> 1.482958 | H287: of:=[queue.E287] -> 2023200 | I287: of:=[queue.G287] -> 0.006788 | J287: of:=[queue.I287] -> 0.709282 | K287: of:=[stack.E287] -> 836400 | L287: of:=[stack.G287] -> 0.016602 | M287: of:=[stack.I287] -> 1.066225
A288: of:=[furious.B288] -> 14 | B288: of:=[furious.E288] -> 2334200 | C288: of:=[furious.G288] -> 0.005867 | D288: of:=[furious.I288] -> 0.639698 | E288: of:=[generic.E288] -> 444511 | F288: of:=[generic.G288] -> 0.031325 | G288: of:=[generic.I288] -> 1.492839 | H288: of:=[queue.E288] -> 2010200 | I288: of:=[queue.G288] -> 0.006846 | J288: of:=[queue.I288] -> 0.716366 | K288: of:=[stack.E288] -> 834731 | L288: of:=[stack.G288] -> 0.016585 | M288: of:=[stack.I288] -> 1.073975
A289: of:=[furious.B289] -> 14 | B289: of:=[furious.E289] -> 2325000 | C289: of:=[furious.G289] -> 0.005892 | D289: of:=[furious.I289] -> 0.645543 | E289: of:=[generic.E289] -> 443313 | F289: of:=[generic.G289] -> 0.031387 | G289: of:=[generic.I289] -> 1.505609 | H289: of:=[queue.E289] -> 2016400 | I289: of:=[queue.G289] -> 0.00681 | J289: of:=[queue.I289] -> 0.720009 | K289: of:=[stack.E289] -> 836400 | L289: of:=[stack.G289] -> 0.016609 | M289: of:=[stack.I289] -> 1.081679
A290: of:=[furious.B290] -> 14 | B290: of:=[furious.E290] -> 2336600 | C290: of:=[furious.G290] -> 0.005857 | D290: of:=[furious.I290] -> 0.648471 | E290: of:=[generic.E290] -> 443114 | F290: of:=[generic.G290] -> 0.031428 | G290: of:=[generic.I290] -> 1.516598 | H290: of:=[queue.E290] -> 2010800 | I290: of:=[queue.G290] -> 0.006827 | J290: of:=[queue.I290] -> 0.725729 | K290: of:=[stack.E290] -> 836000 | L290: of:=[stack.G290] -> 0.016639 | M290: of:=[stack.I290] -> 1.0896
A291: of:=[furious.B291] -> 14 | B291: of:=[furious.E291] -> 2335400 | C291: of:=[furious.G291] -> 0.005881 | D291: of:=[furious.I291] -> 0.653155 | E291: of:=[generic.E291] -> 442515 | F291: of:=[generic.G291] -> 0.031443 | G291: of:=[generic.I291] -> 1.528229 | H291: of:=[queue.E291] -> 2017800 | I291: of:=[queue.G291] -> 0.006822 | J291: of:=[queue.I291] -> 0.729163 | K291: of:=[stack.E291] -> 835928 | L291: of:=[stack.G291] -> 0.016588 | M291: of:=[stack.I291] -> 1.096152
A292: of:=[furious.B292] -> 14 | B292: of:=[furious.E292] -> 2293000 | C292: of:=[furious.G292] -> 0.005987 | D292: of:=[furious.I292] -> 0.639157 | E292: of:=[generic.E292] -> 482435 | F292: of:=[generic.G292] -> 0.028829 | G292: of:=[generic.I292] -> 1.357329 | H292: of:=[queue.E292] -> 2001200 | I292: of:=[queue.G292] -> 0.006894 | J292: of:=[queue.I292] -> 0.668456 | K292: of:=[stack.E292] -> 840600 | L292: of:=[stack.G292] -> 0.01655 | M292: of:=[stack.I292] -> 1.032071
A293: of:=[furious.B293] -> 14 | B293: of:=[furious.E293] -> 2289000 | C293: of:=[furious.G293] -> 0.006014 | D293: of:=[furious.I293] -> 0.644398 | E293: of:=[generic.E293] -> 473653 | F293: of:=[generic.G293] -> 0.029326 | G293: of:=[generic.I293] -> 1.380601 | H293: of:=[queue.E293] -> 2009800 | I293: of:=[queue.G293] -> 0.006843 | J293: of:=[queue.I293] -> 0.672135 | K293: of:=[stack.E293] -> 837725 | L293: of:=[stack.G293] -> 0.016581 | M293: of:=[stack.I293] -> 1.040804
A294: of:=[furious.B294] -> 14 | B294: of:=[furious.E294] -> 2280600 | C294: of:=[furious.G294] -> 0.006016 | D294: of:=[furious.I294] -> 0.650227 | E294: of:=[generic.E294] -> 475250 | F294: of:=[generic.G294] -> 0.029273 | G294: of:=[generic.I294] -> 1.389028 | H294: of:=[queue.E294] -> 2019200 | I294: of:=[queue.G294] -> 0.006791 | J294: of:=[queue.I294] -> 0.675613 | K294: of:=[stack.E294] -> 842200 | L294: of:=[stack.G294] -> 0.016464 | M294: of:=[stack.I294] -> 1.046966
A295: of:=[furious.B295] -> 14 | B295: of:=[furious.E295] -> 2281200 | C295: of:=[furious.G295] -> 0.006032 | D295: of:=[furious.I295] -> 0.654763 | E295: of:=[generic.E295] -> 484000 | F295: of:=[generic.G295] -> 0.028822 | G295: of:=[generic.I295] -> 1.388429 | H295: of:=[queue.E295] -> 2010200 | I295: of:=[queue.G295] -> 0.006847 | J295: of:=[queue.I295] -> 0.682161 | K295: of:=[stack.E295] -> 842000 | L295: of:=[stack.G295] -> 0.016513 | M295: of:=[stack.I295] -> 1.054946
A296: of:=[furious.B296] -> 14 | B296: of:=[furious.E296] -> 2277800 | C296: of:=[furious.G296] -> 0.006041 | D296: of:=[furious.I296] -> 0.659845 | E296: of:=[generic.E296] -> 493613 | F296: of:=[generic.G296] -> 0.028233 | G296: of:=[generic.I296] -> 1.383792 | H296: of:=[queue.E296] -> 2005200 | I296: of:=[queue.G296] -> 0.00687 | J296: of:=[queue.I296] -> 0.688022 | K296: of:=[stack.E296] -> 843600 | L296: of:=[stack.G296] -> 0.016501 | M296: of:=[stack.I296] -> 1.061744
A297: of:=[furious.B297] -> 14 | B297: of:=[furious.E297] -> 2287400 | C297: of:=[furious.G297] -> 0.005994 | D297: of:=[furious.I297] -> 0.662995 | E297: of:=[generic.E297] -> 487824 | F297: of:=[generic.G297] -> 0.028502 | G297: of:=[generic.I297] -> 1.402258 | H297: of:=[queue.E297] -> 2009600 | I297: of:=[queue.G297] -> 0.006837 | J297: of:=[queue.I297] -> 0.692225 | K297: of:=[stack.E297] -> 842400 | L297: of:=[stack.G297] -> 0.016531 | M297: of:=[stack.I297] -> 1.070251
A298: of:=[furious.B298] -> 14 | B298: of:=[furious.E298] -> 2281600 | C298: of:=[furious.G298] -> 0.006008 | D298: of:=[furious.I298] -> 0.668347 | E298: of:=[generic.E298] -> 483200 | F298: of:=[generic.G298] -> 0.02887 | G298: of:=[generic.I298] -> 1.420682 | H298: of:=[queue.E298] -> 2023400 | I298: of:=[queue.G298] -> 0.006785 | J298: of:=[queue.I298] -> 0.69476 | K298: of:=[stack.E298] -> 841916 | L298: of:=[stack.G298] -> 0.016475 | M298: of:=[stack.I298] -> 1.077164
A299: of:=[furious.B299] -> 14 | B299: of:=[furious.E299] -> 2279200 | C299: of:=[furious.G299] -> 0.006028 | D299: of:=[furious.I299] -> 0.673191 | E299: of:=[generic.E299] -> 479840 | F299: of:=[generic.G299] -> 0.028989 | G299: of:=[generic.I299] -> 1.434497 | H299: of:=[queue.E299] -> 2012400 | I299: of:=[queue.G299] -> 0.006822 | J299: of:=[queue.I299] -> 0.701535 | K299: of:=[stack.E299] -> 841600 | L299: of:=[stack.G299] -> 0.016526 | M299: of:=[stack.I299] -> 1.086078
A300: of:=[furious.B300] -> 14 | B300: of:=[furious.E300] -> 2282400 | C300: of:=[furious.G300] -> 0.006003 | D300: of:=[furious.I300] -> 0.677166 | E300: of:=[generic.E300] -> 484830 | F300: of:=[generic.G300] -> 0.028699 | G300: of:=[generic.I300] -> 1.437211 | H300: of:=[queue.E300] -> 2009000 | I300: of:=[queue.G300] -> 0.006834 | J300: of:=[queue.I300] -> 0.706979 | K300: of:=[stack.E300] -> 844600 | L300: of:=[stack.G300] -> 0.016479 | M300: of:=[stack.I300] -> 1.091721
A301: of:=[furious.B301] -> 14 | B301: of:=[furious.E301] -> 2284400 | C301: of:=[furious.G301] -> 0.006009 | D301: of:=[furious.I301] -> 0.681294 | E301: of:=[generic.E301] -> 480838 | F301: of:=[generic.G301] -> 0.028946 | G301: of:=[generic.I301] -> 1.453276 | H301: of:=[queue.E301] -> 2021200 | I301: of:=[queue.G301] -> 0.006805 | J301: of:=[queue.I301] -> 0.709653 | K301: of:=[stack.E301] -> 841118 | L301: of:=[stack.G301] -> 0.01649 | M301: of:=[stack.I301] -> 1.100405
A302: of:=[furious.B302] -> 16 | B302: of:=[furious.E302] -> 2562800 | C302: of:=[furious.G302] -> 0.006137 | D302: of:=[furious.I302] -> 0.646268 | E302: of:=[generic.E302] -> 291816 | F302: of:=[generic.G302] -> 0.054617 | G302: of:=[generic.I302] -> 1.99795 | H302: of:=[queue.E302] -> 1915200 | I302: of:=[queue.G302] -> 0.008223 | J302: of:=[queue.I302] -> 0.823143 | K302: of:=[stack.E302] -> 852295 | L302: of:=[stack.G302] -> 0.018611 | M302: of:=[stack.I302] -> 1.088169
A303: of:=[furious.B303] -> 16 | B303: of:=[furious.E303] -> 2566800 | C303: of:=[furious.G303] -> 0.006129 | D303: of:=[furious.I303] -> 0.650546 | E303: of:=[generic.E303] -> 287226 | F303: of:=[generic.G303] -> 0.055566 | G303: of:=[generic.I303] -> 2.03061 | H303: of:=[queue.E303] -> 1923000 | I303: of:=[queue.G303] -> 0.0082 | J303: of:=[queue.I303] -> 0.826447 | K303: of:=[stack.E303] -> 853693 | L303: of:=[stack.G303] -> 0.018543 | M303: of:=[stack.I303] -> 1.095774
A304: of:=[furious.B304] -> 16 | B304: of:=[furious.E304] -> 2562400 | C304: of:=[furious.G304] -> 0.006129 | D304: of:=[furious.I304] -> 0.655794 | E304: of:=[generic.E304] -> 299601 | F304: of:=[generic.G304] -> 0.053125 | G304: of:=[generic.I304] -> 2.003425 | H304: of:=[queue.E304] -> 1916600 | I304: of:=[queue.G304] -> 0.008232 | J304: of:=[queue.I304] -> 0.832783 | K304: of:=[stack.E304] -> 854200 | L304: of:=[stack.G304] -> 0.018614 | M304: of:=[stack.I304] -> 1.104997
A305: of:=[furious.B305] -> 16 | B305: of:=[furious.E305] -> 2556800 | C305: of:=[furious.G305] -> 0.006127 | D305: of:=[furious.I305] -> 0.661162 | E305: of:=[generic.E305] -> 286627 | F305: of:=[generic.G305] -> 0.055634 | G305: of:=[generic.I305] -> 2.064204 | H305: of:=[queue.E305] -> 1920800 | I305: of:=[queue.G305] -> 0.008206 | J305: of:=[queue.I305] -> 0.83679 | K305: of:=[stack.E305] -> 856487 | L305: of:=[stack.G305] -> 0.018539 | M305: of:=[stack.I305] -> 1.110796
A306: of:=[furious.B306] -> 16 | B306: of:=[furious.E306] -> 2562200 | C306: of:=[furious.G306] -> 0.006133 | D306: of:=[furious.I306] -> 0.665091 | E306: of:=[generic.E306] -> 300200 | F306: of:=[generic.G306] -> 0.053132 | G306: of:=[generic.I306] -> 2.031991 | H306: of:=[queue.E306] -> 1926600 | I306: of:=[queue.G306] -> 0.008189 | J306: of:=[queue.I306] -> 0.840416 | K306: of:=[stack.E306] -> 854890 | L306: of:=[stack.G306] -> 0.018566 | M306: of:=[stack.I306] -> 1.120151
A307: of:=[furious.B307] -> 16 | B307: of:=[furious.E307] -> 2549600 | C307: of:=[furious.G307] -> 0.006147 | D307: of:=[furious.I307] -> 0.671326 | E307: of:=[generic.E307] -> 293849 | F307: of:=[generic.G307] -> 0.054247 | G307: of:=[generic.I307] -> 2.063643 | H307: of:=[queue.E307] -> 1910600 | I307: of:=[queue.G307] -> 0.008245 | J307: of:=[queue.I307] -> 0.848798 | K307: of:=[stack.E307] -> 855888 | L307: of:=[stack.G307] -> 0.018526 | M307: of:=[stack.I307] -> 1.127742
A308: of:=[furious.B308] -> 16 | B308: of:=[furious.E308] -> 2559600 | C308: of:=[furious.G308] -> 0.006136 | D308: of:=[furious.I308] -> 0.674577 | E308: of:=[generic.E308] -> 284431 | F308: of:=[generic.G308] -> 0.055993 | G308: of:=[generic.I308] -> 2.119755 | H308: of:=[queue.E308] -> 1918800 | I308: of:=[queue.G308] -> 0.008201 | J308: of:=[queue.I308] -> 0.851828 | K308: of:=[stack.E308] -> 854200 | L308: of:=[stack.G308] -> 0.018609 | M308: of:=[stack.I308] -> 1.138188
A309: of:=[furious.B309] -> 16 | B309: of:=[furious.E309] -> 2549400 | C309: of:=[furious.G309] -> 0.006156 | D309: of:=[furious.I309] -> 0.680464 | E309: of:=[generic.E309] -> 299401 | F309: of:=[generic.G309] -> 0.053173 | G309: of:=[generic.I309] -> 2.080809 | H309: of:=[queue.E309] -> 1922000 | I309: of:=[queue.G309] -> 0.00819 | J309: of:=[queue.I309] -> 0.855917 | K309: of:=[stack.E309] -> 856000 | L309: of:=[stack.G309] -> 0.018586 | M309: of:=[stack.I309] -> 1.145135
A310: of:=[furious.B310] -> 16 | B310: of:=[furious.E310] -> 2557600 | C310: of:=[furious.G310] -> 0.006154 | D310: of:=[furious.I310] -> 0.683886 | E310: of:=[generic.E310] -> 296008 | F310: of:=[generic.G310] -> 0.05381 | G310: of:=[generic.I310] -> 2.107735 | H310: of:=[queue.E310] -> 1909600 | I310: of:=[queue.G310] -> 0.008264 | J310: of:=[queue.I310] -> 0.863489 | K310: of:=[stack.E310] -> 851697 | L310: of:=[stack.G310] -> 0.018617 | M310: of:=[stack.I310] -> 1.154966
A311: of:=[furious.B311] -> 16 | B311: of:=[furious.E311] -> 2546400 | C311: of:=[furious.G311] -> 0.006181 | D311: of:=[furious.I311] -> 0.689901 | E311: of:=[generic.E311] -> 293014 | F311: of:=[generic.G311] -> 0.054387 | G311: of:=[generic.I311] -> 2.133681 | H311: of:=[queue.E311] -> 1918200 | I311: of:=[queue.G311] -> 0.008206 | J311: of:=[queue.I311] -> 0.866301 | K311: of:=[stack.E311] -> 854291 | L311: of:=[stack.G311] -> 0.0186 | M311: of:=[stack.I311] -> 1.161247
A312: of:=[furious.B312] -> 16 | B312: of:=[furious.E312] -> 2459200 | C312: of:=[furious.G312] -> 0.006378 | D312: of:=[furious.I312] -> 0.672513 | E312: of:=[generic.E312] -> 317365 | F312: of:=[generic.G312] -> 0.050157 | G312: of:=[generic.I312] -> 1.813624 | H312: of:=[queue.E312] -> 1984800 | I312: of:=[queue.G312] -> 0.007942 | J312: of:=[queue.I312] -> 0.723066 | K312: of:=[stack.E312] -> 966200 | L312: of:=[stack.G312] -> 0.016477 | M312: of:=[stack.I312] -> 1.025016
A313: of:=[furious.B313] -> 16 | B313: of:=[furious.E313] -> 2455800 | C313: of:=[furious.G313] -> 0.006389 | D313: of:=[furious.I313] -> 0.677708 | E313: of:=[generic.E313] -> 319361 | F313: of:=[generic.G313] -> 0.04995 | G313: of:=[generic.I313] -> 1.821999 | H313: of:=[queue.E313] -> 1970200 | I313: of:=[queue.G313] -> 0.008008 | J313: of:=[queue.I313] -> 0.731237 | K313: of:=[stack.E313] -> 966600 | L313: of:=[stack.G313] -> 0.016451 | M313: of:=[stack.I313] -> 1.0328
A314: of:=[furious.B314] -> 16 | B314: of:=[furious.E314] -> 2452600 | C314: of:=[furious.G314] -> 0.006396 | D314: of:=[furious.I314] -> 0.682849 | E314: of:=[generic.E314] -> 311377 | F314: of:=[generic.G314] -> 0.051269 | G314: of:=[generic.I314] -> 1.859749 | H314: of:=[queue.E314] -> 1976800 | I314: of:=[queue.G314] -> 0.007992 | J314: of:=[queue.I314] -> 0.735468 | K314: of:=[stack.E314] -> 959281 | L314: of:=[stack.G314] -> 0.016579 | M314: of:=[stack.I314] -> 1.043669
A315: of:=[furious.B315] -> 16 | B315: of:=[furious.E315] -> 2452400 | C315: of:=[furious.G315] -> 0.006409 | D315: of:=[furious.I315] -> 0.687554 | E315: of:=[generic.E315] -> 312351 | F315: of:=[generic.G315] -> 0.050957 | G315: of:=[generic.I315] -> 1.869111 | H315: of:=[queue.E315] -> 1979600 | I315: of:=[queue.G315] -> 0.007969 | J315: of:=[queue.I315] -> 0.74035 | K315: of:=[stack.E315] -> 965070 | L315: of:=[stack.G315] -> 0.016457 | M315: of:=[stack.I315] -> 1.048413
A316: of:=[furious.B316] -> 16 | B316: of:=[furious.E316] -> 2450200 | C316: of:=[furious.G316] -> 0.006421 | D316: of:=[furious.I316] -> 0.692514 | E316: of:=[generic.E316] -> 313972 | F316: of:=[generic.G316] -> 0.050788 | G316: of:=[generic.I316] -> 1.880369 | H316: of:=[queue.E316] -> 1986400 | I316: of:=[queue.G316] -> 0.007939 | J316: of:=[queue.I316] -> 0.744433 | K316: of:=[stack.E316] -> 964400 | L316: of:=[stack.G316] -> 0.016487 | M316: of:=[stack.I316] -> 1.057649
A317: of:=[furious.B317] -> 16 | B317: of:=[furious.E317] -> 2446000 | C317: of:=[furious.G317] -> 0.006432 | D317: of:=[furious.I317] -> 0.697732 | E317: of:=[generic.E317] -> 317365 | F317: of:=[generic.G317] -> 0.050195 | G317: of:=[generic.I317] -> 1.884006 | H317: of:=[queue.E317] -> 1983000 | I317: of:=[queue.G317] -> 0.007957 | J317: of:=[queue.I317] -> 0.750392 | K317: of:=[stack.E317] -> 964800 | L317: of:=[stack.G317] -> 0.016501 | M317: of:=[stack.I317] -> 1.065203
A318: of:=[furious.B318] -> 16 | B318: of:=[furious.E318] -> 2449200 | C318: of:=[furious.G318] -> 0.006428 | D318: of:=[furious.I318] -> 0.701871 | E318: of:=[generic.E318] -> 314371 | F318: of:=[generic.G318] -> 0.050711 | G318: of:=[generic.I318] -> 1.90699 | H318: of:=[queue.E318] -> 1992400 | I318: of:=[queue.G318] -> 0.007923 | J318: of:=[queue.I318] -> 0.754092 | K318: of:=[stack.E318] -> 964400 | L318: of:=[stack.G318] -> 0.016499 | M318: of:=[stack.I318] -> 1.073139
A319: of:=[furious.B319] -> 16 | B319: of:=[furious.E319] -> 2457600 | C319: of:=[furious.G319] -> 0.006393 | D319: of:=[furious.I319] -> 0.705218 | E319: of:=[generic.E319] -> 312575 | F319: of:=[generic.G319] -> 0.050964 | G319: of:=[generic.I319] -> 1.926118 | H319: of:=[queue.E319] -> 1992200 | I319: of:=[queue.G319] -> 0.00793 | J319: of:=[queue.I319] -> 0.75937 | K319: of:=[stack.E319] -> 965269 | L319: of:=[stack.G319] -> 0.016474 | M319: of:=[stack.I319] -> 1.079244
A320: of:=[furious.B320] -> 16 | B320: of:=[furious.E320] -> 2457200 | C320: of:=[furious.G320] -> 0.006387 | D320: of:=[furious.I320] -> 0.709789 | E320: of:=[generic.E320] -> 316966 | F320: of:=[generic.G320] -> 0.050384 | G320: of:=[generic.I320] -> 1.926185 | H320: of:=[queue.E320] -> 1980400 | I320: of:=[queue.G320] -> 0.007963 | J320: of:=[queue.I320] -> 0.766841 | K320: of:=[stack.E320] -> 964800 | L320: of:=[stack.G320] -> 0.01648 | M320: of:=[stack.I320] -> 1.088185
A321: of:=[furious.B321] -> 16 | B321: of:=[furious.E321] -> 2457200 | C321: of:=[furious.G321] -> 0.006368 | D321: of:=[furious.I321] -> 0.714278 | E321: of:=[generic.E321] -> 320160 | F321: of:=[generic.G321] -> 0.049688 | G321: of:=[generic.I321] -> 1.929769 | H321: of:=[queue.E321] -> 1991400 | I321: of:=[queue.G321] -> 0.00792 | J321: of:=[queue.I321] -> 0.769881 | K321: of:=[stack.E321] -> 964072 | L321: of:=[stack.G321] -> 0.016468 | M321: of:=[stack.I321] -> 1.095054
A322: of:=[furious.B322] -> 16 | B322: of:=[furious.E322] -> 2439400 | C322: of:=[furious.G322] -> 0.006461 | D322: of:=[furious.I322] -> 0.642926 | E322: of:=[generic.E322] -> 299002 | F322: of:=[generic.G322] -> 0.053364 | G322: of:=[generic.I322] -> 1.921897 | H322: of:=[queue.E322] -> 1906800 | I322: of:=[queue.G322] -> 0.008267 | J322: of:=[queue.I322] -> 0.735166 | K322: of:=[stack.E322] -> 883000 | L322: of:=[stack.G322] -> 0.018039 | M322: of:=[stack.I322] -> 1.066956
A323: of:=[furious.B323] -> 16 | B323: of:=[furious.E323] -> 2437400 | C323: of:=[furious.G323] -> 0.006464 | D323: of:=[furious.I323] -> 0.648195 | E323: of:=[generic.E323] -> 296806 | F323: of:=[generic.G323] -> 0.053712 | G323: of:=[generic.I323] -> 1.943982 | H323: of:=[queue.E323] -> 1873800 | I323: of:=[queue.G323] -> 0.008411 | J323: of:=[queue.I323] -> 0.74726 | K323: of:=[stack.E323] -> 878842 | L323: of:=[stack.G323] -> 0.018083 | M323: of:=[stack.I323] -> 1.076838
A324: of:=[furious.B324] -> 16 | B324: of:=[furious.E324] -> 2432800 | C324: of:=[furious.G324] -> 0.006472 | D324: of:=[furious.I324] -> 0.653776 | E324: of:=[generic.E324] -> 299004 | F324: of:=[generic.G324] -> 0.053298 | G324: of:=[generic.I324] -> 1.949447 | H324: of:=[queue.E324] -> 1892000 | I324: of:=[queue.G324] -> 0.008351 | J324: of:=[queue.I324] -> 0.749251 | K324: of:=[stack.E324] -> 878244 | L324: of:=[stack.G324] -> 0.018095 | M324: of:=[stack.I324] -> 1.085572
A325: of:=[furious.B325] -> 16 | B325: of:=[furious.E325] -> 2437000 | C325: of:=[furious.G325] -> 0.006462 | D325: of:=[furious.I325] -> 0.65814 | E325: of:=[generic.E325] -> 291617 | F325: of:=[generic.G325] -> 0.0546 | G325: of:=[generic.I325] -> 1.991191 | H325: of:=[queue.E325] -> 1899800 | I325: of:=[queue.G325] -> 0.008287 | J325: of:=[queue.I325] -> 0.753233 | K325: of:=[stack.E325] -> 878842 | L325: of:=[stack.G325] -> 0.018079 | M325: of:=[stack.I325] -> 1.0935
A326: of:=[furious.B326] -> 16 | B326: of:=[furious.E326] -> 2433800 | C326: of:=[furious.G326] -> 0.006465 | D326: of:=[furious.I326] -> 0.663463 | E326: of:=[generic.E326] -> 299002 | F326: of:=[generic.G326] -> 0.053251 | G326: of:=[generic.I326] -> 1.981044 | H326: of:=[queue.E326] -> 1867200 | I326: of:=[queue.G326] -> 0.008433 | J326: of:=[queue.I326] -> 0.765309 | K326: of:=[stack.E326] -> 881437 | L326: of:=[stack.G326] -> 0.018016 | M326: of:=[stack.I326] -> 1.100109
A327: of:=[furious.B327] -> 16 | B327: of:=[furious.E327] -> 2438000 | C327: of:=[furious.G327] -> 0.006465 | D327: of:=[furious.I327] -> 0.667749 | E327: of:=[generic.E327] -> 293613 | F327: of:=[generic.G327] -> 0.05429 | G327: of:=[generic.I327] -> 2.01377 | H327: of:=[queue.E327] -> 1883800 | I327: of:=[queue.G327] -> 0.008364 | J327: of:=[queue.I327] -> 0.767399 | K327: of:=[stack.E327] -> 881800 | L327: of:=[stack.G327] -> 0.018031 | M327: of:=[stack.I327] -> 1.10914
A328: of:=[furious.B328] -> 16 | B328: of:=[furious.E328] -> 2433800 | C328: of:=[furious.G328] -> 0.006468 | D328: of:=[furious.I328] -> 0.673147 | E328: of:=[generic.E328] -> 304591 | F328: of:=[generic.G328] -> 0.052307 | G328: of:=[generic.I328] -> 1.991681 | H328: of:=[queue.E328] -> 1891600 | I328: of:=[queue.G328] -> 0.008325 | J328: of:=[queue.I328] -> 0.771232 | K328: of:=[stack.E328] -> 883000 | L328: of:=[stack.G328] -> 0.018032 | M328: of:=[stack.I328] -> 1.116491
A329: of:=[furious.B329] -> 16 | B329: of:=[furious.E329] -> 2433800 | C329: of:=[furious.G329] -> 0.006469 | D329: of:=[furious.I329] -> 0.677935 | E329: of:=[generic.E329] -> 291816 | F329: of:=[generic.G329] -> 0.05446 | G329: of:=[generic.I329] -> 2.049347 | H329: of:=[queue.E329] -> 1875800 | I329: of:=[queue.G329] -> 0.008402 | J329: of:=[queue.I329] -> 0.779878 | K329: of:=[stack.E329] -> 880800 | L329: of:=[stack.G329] -> 0.018074 | M329: of:=[stack.I329] -> 1.125939
A330: of:=[furious.B330] -> 16 | B330: of:=[furious.E330] -> 2430000 | C330: of:=[furious.G330] -> 0.006456 | D330: of:=[furious.I330] -> 0.683206 | E330: of:=[generic.E330] -> 294212 | F330: of:=[generic.G330] -> 0.054193 | G330: of:=[generic.I330] -> 2.05557 | H330: of:=[queue.E330] -> 1891000 | I330: of:=[queue.G330] -> 0.008331 | J330: of:=[queue.I330] -> 0.782082 | K330: of:=[stack.E330] -> 881400 | L330: of:=[stack.G330] -> 0.01806 | M330: of:=[stack.I330] -> 1.13355
A331: of:=[furious.B331] -> 16 | B331: of:=[furious.E331] -> 2436400 | C331: of:=[furious.G331] -> 0.006461 | D331: of:=[furious.I331] -> 0.687027 | E331: of:=[generic.E331] -> 296414 | F331: of:=[generic.G331] -> 0.053737 | G331: of:=[generic.I331] -> 2.060282 | H331: of:=[queue.E331] -> 1899200 | I331: of:=[queue.G331] -> 0.008302 | J331: of:=[queue.I331] -> 0.785693 | K331: of:=[stack.E331] -> 880240 | L331: of:=[stack.G331] -> 0.017989 | M331: of:=[stack.I331] -> 1.141075

Sheet: furious
A2: ## FuriousBench | B2: 1 | C2: 2331400 | D2: 500 | E2: 4662800 | F2: 1 | G2: 0.000136 | H2: 0 | I2: 0.097057
A3: ## FuriousBench | B3: 1 | C3: 2323700 | D3: 500 | E3: 4647400 | F3: 1 | G3: 0.000147 | H3: 0 | I3: 0.097972
A4: ## FuriousBench | B4: 1 | C4: 2336500 | D4: 500 | E4: 4673000 | F4: 1 | G4: 0.000144 | H4: 0 | I4: 0.098438
A5: ## FuriousBench | B5: 1 | C5: 2340200 | D5: 500 | E5: 4680400 | F5: 1 | G5: 0.000144 | H5: 0 | I5: 0.099088
A6: ## FuriousBench | B6: 1 | C6: 2329900 | D6: 500 | E6: 4659800 | F6: 1 | G6: 0.000145 | H6: 0 | I6: 0.100036
A7: ## FuriousBench | B7: 1 | C7: 2344900 | D7: 500 | E7: 4689800 | F7: 1 | G7: 0.000146 | H7: 0 | I7: 0.100445
A8: ## FuriousBench | B8: 1 | C8: 2327500 | D8: 500 | E8: 4655000 | F8: 1 | G8: 0.000143 | H8: 0 | I8: 0.101524
A9: ## FuriousBench | B9: 1 | C9: 2333000 | D9: 500 | E9: 4666000 | F9: 1 | G9: 0.000145 | H9: 0 | I9: 0.102116
A10: ## FuriousBench | B10: 1 | C10: 2338000 | D10: 500 | E10: 4676000 | F10: 1 | G10: 0.000144 | H10: 0 | I10: 0.102711
A11: ## FuriousBench | B11: 1 | C11: 2342000 | D11: 500 | E11: 4684000 | F11: 1 | G11: 0.00014 | H11: 0 | I11: 0.103304
A12: ## FuriousBench | B12: 1 | C12: 2266600 | D12: 500 | E12: 4533200 | F12: 1 | G12: 0.000154 | H12: 0 | I12: 0.098497
A13: ## FuriousBench | B13: 1 | C13: 2270500 | D13: 500 | E13: 4541000 | F13: 1 | G13: 0.000151 | H13: 0 | I13: 0.099177
A14: ## FuriousBench | B14: 1 | C14: 2276200 | D14: 500 | E14: 4552400 | F14: 1 | G14: 0.000144 | H14: 0 | I14: 0.099778
A15: ## FuriousBench | B15: 1 | C15: 2275100 | D15: 500 | E15: 4550200 | F15: 1 | G15: 0.000144 | H15: 0 | I15: 0.100522
A16: ## FuriousBench | B16: 1 | C16: 2276700 | D16: 500 | E16: 4553400 | F16: 1 | G16: 0.000146 | H16: 0 | I16: 0.101209
A17: ## FuriousBench | B17: 1 | C17: 2272900 | D17: 500 | E17: 4545800 | F17: 1 | G17: 0.00015 | H17: 0 | I17: 0.10203
A18: ## FuriousBench | B18: 1 | C18: 2279200 | D18: 500 | E18: 4558400 | F18: 1 | G18: 0.000155 | H18: 0 | I18: 0.102648
A19: ## FuriousBench | B19: 1 | C19: 2266400 | D19: 500 | E19: 4532800 | F19: 1 | G19: 0.000148 | H19: 0 | I19: 0.103653
A20: ## FuriousBench | B20: 1 | C20: 2277900 | D20: 500 | E20: 4555800 | F20: 1 | G20: 0.00015 | H20: 0 | I20: 0.104114
A21: ## FuriousBench | B21: 1 | C21: 2269800 | D21: 500 | E21: 4539600 | F21: 1 | G21: 0.000151 | H21: 0 | I21: 0.105022
A22: ## FuriousBench | B22: 1 | C22: 2297200 | D22: 500 | E22: 4594400 | F22: 1 | G22: 0.000152 | H22: 0 | I22: 0.098826
A23: ## FuriousBench | B23: 1 | C23: 2309100 | D23: 500 | E23: 4618200 | F23: 1 | G23: 0.000148 | H23: 0 | I23: 0.09932
A24: ## FuriousBench | B24: 1 | C24: 2311200 | D24: 500 | E24: 4622400 | F24: 1 | G24: 0.000151 | H24: 0 | I24: 0.100032
A25: ## FuriousBench | B25: 1 | C25: 2312100 | D25: 500 | E25: 4624200 | F25: 1 | G25: 0.000145 | H25: 0 | I25: 0.100735
A26: ## FuriousBench | B26: 1 | C26: 2305400 | D26: 500 | E26: 4610800 | F26: 1 | G26: 0.000154 | H26: 0 | I26: 0.101643
A27: ## FuriousBench | B27: 1 | C27: 2301200 | D27: 500 | E27: 4602400 | F27: 1 | G27: 0.000145 | H27: 0 | I27: 0.102445
A28: ## FuriousBench | B28: 1 | C28: 2310500 | D28: 500 | E28: 4621000 | F28: 1 | G28: 0.000143 | H28: 0 | I28: 0.102935
A29: ## FuriousBench | B29: 1 | C29: 2311900 | D29: 500 | E29: 4623800 | F29: 1 | G29: 0.00016 | H29: 0 | I29: 0.103678
A30: ## FuriousBench | B30: 1 | C30: 2297900 | D30: 500 | E30: 4595800 | F30: 1 | G30: 0.00015 | H30: 0 | I30: 0.104713
A31: ## FuriousBench | B31: 1 | C31: 2309500 | D31: 500 | E31: 4619000 | F31: 1 | G31: 0.00015 | H31: 0 | I31: 0.105166
A32: ## FuriousBench | B32: 2 | C32: 1434000 | D32: 500 | E32: 2868000 | F32: 1 | G32: 0.000553 | H32: 0 | I32: 0.196969
A33: ## FuriousBench | B33: 2 | C33: 1474400 | D33: 500 | E33: 2948800 | F33: 1 | G33: 0.000552 | H33: 0 | I33: 0.195668
A34: ## FuriousBench | B34: 2 | C34: 1457000 | D34: 500 | E34: 2914000 | F34: 1 | G34: 0.000572 | H34: 0 | I34: 0.198279
A35: ## FuriousBench | B35: 2 | C35: 1475500 | D35: 500 | E35: 2951000 | F35: 1 | G35: 0.000556 | H35: 0 | I35: 0.198438
A36: ## FuriousBench | B36: 2 | C36: 1473600 | D36: 500 | E36: 2947200 | F36: 1 | G36: 0.00054 | H36: 0 | I36: 0.199921
A37: ## FuriousBench | B37: 2 | C37: 1487600 | D37: 500 | E37: 2975200 | F37: 1 | G37: 0.000542 | H37: 0 | I37: 0.200337
A38: ## FuriousBench | B38: 2 | C38: 1421800 | D38: 500 | E38: 2843600 | F38: 1 | G38: 0.000535 | H38: 0 | I38: 0.20622
A39: ## FuriousBench | B39: 2 | C39: 1478100 | D39: 500 | E39: 2956200 | F39: 1 | G39: 0.000546 | H39: 0 | I39: 0.2036
A40: ## FuriousBench | B40: 2 | C40: 1429800 | D40: 500 | E40: 2859600 | F40: 1 | G40: 0.000535 | H40: 0 | I40: 0.208299
A41: ## FuriousBench | B41: 2 | C41: 1422300 | D41: 500 | E41: 2844600 | F41: 1 | G41: 0.00054 | H41: 0 | I41: 0.210136
A42: ## FuriousBench | B42: 2 | C42: 1330900 | D42: 500 | E42: 2661800 | F42: 1 | G42: 0.000643 | H42: 0 | I42: 0.201518
A43: ## FuriousBench | B43: 2 | C43: 1343100 | D43: 500 | E43: 2686200 | F43: 1 | G43: 0.000641 | H43: 0 | I43: 0.202193
A44: ## FuriousBench | B44: 2 | C44: 1329500 | D44: 500 | E44: 2659000 | F44: 1 | G44: 0.000642 | H44: 0 | I44: 0.204797
A45: ## FuriousBench | B45: 2 | C45: 1301200 | D45: 500 | E45: 2602400 | F45: 1 | G45: 0.000624 | H45: 0 | I45: 0.208514
A46: ## FuriousBench | B46: 2 | C46: 1336100 | D46: 500 | E46: 2672200 | F46: 1 | G46: 0.000647 | H46: 0 | I46: 0.207338
A47: ## FuriousBench | B47: 2 | C47: 1340400 | D47: 500 | E47: 2680800 | F47: 1 | G47: 0.000625 | H47: 0 | I47: 0.208509
A48: ## FuriousBench | B48: 2 | C48: 1340700 | D48: 500 | E48: 2681400 | F48: 1 | G48: 0.000631 | H48: 0 | I48: 0.209994
A49: ## FuriousBench | B49: 2 | C49: 1342600 | D49: 500 | E49: 2685200 | F49: 1 | G49: 0.000639 | H49: 0 | I49: 0.211362
A50: ## FuriousBench | B50: 2 | C50: 1279100 | D50: 500 | E50: 2558200 | F50: 1 | G50: 0.000652 | H50: 0 | I50: 0.218046
A51: ## FuriousBench | B51: 2 | C51: 1340800 | D51: 500 | E51: 2681600 | F51: 1 | G51: 0.000625 | H51: 0 | I51: 0.214432
A52: ## FuriousBench | B52: 2 | C52: 1623900 | D52: 500 | E52: 3247800 | F52: 1 | G52: 0.000526 | H52: 0 | I52: 0.180346
A53: ## FuriousBench | B53: 2 | C53: 1622200 | D53: 500 | E53: 3244400 | F53: 1 | G53: 0.000531 | H53: 0 | I53: 0.181905
A54: ## FuriousBench | B54: 2 | C54: 1624200 | D54: 500 | E54: 3248400 | F54: 1 | G54: 0.000524 | H54: 0 | I54: 0.183228
A55: ## FuriousBench | B55: 2 | C55: 1628200 | D55: 500 | E55: 3256400 | F55: 1 | G55: 0.000524 | H55: 0 | I55: 0.184429
A56: ## FuriousBench | B56: 2 | C56: 1511800 | D56: 500 | E56: 3023600 | F56: 1 | G56: 0.00054 | H56: 0 | I56: 0.192804
A57: ## FuriousBench | B57: 2 | C57: 1608000 | D57: 500 | E57: 3216000 | F57: 1 | G57: 0.00054 | H57: 0 | I57: 0.188386
A58: ## FuriousBench | B58: 2 | C58: 1516600 | D58: 500 | E58: 3033200 | F58: 1 | G58: 0.000544 | H58: 0 | I58: 0.195376
A59: ## FuriousBench | B59: 2 | C59: 1508500 | D59: 500 | E59: 3017000 | F59: 1 | G59: 0.000519 | H59: 0 | I59: 0.197221
A60: ## FuriousBench | B60: 2 | C60: 1626500 | D60: 500 | E60: 3253000 | F60: 1 | G60: 0.000531 | H60: 0 | I60: 0.191324
A61: ## FuriousBench | B61: 2 | C61: 1511000 | D61: 500 | E61: 3022000 | F61: 1 | G61: 0.000545 | H61: 0 | I61: 0.199869
A62: ## FuriousBench | B62: 3 | C62: 1097300 | D62: 500 | E62: 2194600 | F62: 1 | G62: 0.001238 | H62: 0 | I62: 0.281626
A63: ## FuriousBench | B63: 3 | C63: 1098100 | D63: 500 | E63: 2196200 | F63: 1 | G63: 0.001218 | H63: 0 | I63: 0.283678
A64: ## FuriousBench | B64: 3 | C64: 1099100 | D64: 500 | E64: 2198200 | F64: 1 | G64: 0.001221 | H64: 0 | I64: 0.285693
A65: ## FuriousBench | B65: 3 | C65: 1098100 | D65: 500 | E65: 2196200 | F65: 1 | G65: 0.001242 | H65: 0 | I65: 0.287988
A66: ## FuriousBench | B66: 3 | C66: 1099500 | D66: 500 | E66: 2199000 | F66: 1 | G66: 0.001239 | H66: 0 | I66: 0.289949
A67: ## FuriousBench | B67: 3 | C67: 1098400 | D67: 500 | E67: 2196800 | F67: 1 | G67: 0.001245 | H67: 0 | I67: 0.292231
A68: ## FuriousBench | B68: 3 | C68: 1097900 | D68: 500 | E68: 2195800 | F68: 1 | G68: 0.001235 | H68: 0 | I68: 0.294403
A69: ## FuriousBench | B69: 3 | C69: 1099200 | D69: 500 | E69: 2198400 | F69: 1 | G69: 0.001237 | H69: 0 | I69: 0.296324
A70: ## FuriousBench | B70: 3 | C70: 1098400 | D70: 500 | E70: 2196800 | F70: 1 | G70: 0.00124 | H70: 0 | I70: 0.298516
A71: ## FuriousBench | B71: 3 | C71: 1099000 | D71: 500 | E71: 2198000 | F71: 1 | G71: 0.001214 | H71: 0 | I71: 0.300461
A72: ## FuriousBench | B72: 3 | C72: 1287800 | D72: 500 | E72: 2575600 | F72: 1 | G72: 0.000956 | H72: 0 | I72: 0.248875
A73: ## FuriousBench | B73: 3 | C73: 1281400 | D73: 500 | E73: 2562800 | F73: 1 | G73: 0.000975 | H73: 0 | I73: 0.251442
A74: ## FuriousBench | B74: 3 | C74: 1280600 | D74: 500 | E74: 2561200 | F74: 1 | G74: 0.001001 | H74: 0 | I74: 0.253502
A75: ## FuriousBench | B75: 3 | C75: 1284100 | D75: 500 | E75: 2568200 | F75: 1 | G75: 0.000977 | H75: 0 | I75: 0.25508
A76: ## FuriousBench | B76: 3 | C76: 1283900 | D76: 500 | E76: 2567800 | F76: 1 | G76: 0.000988 | H76: 0 | I76: 0.257028
A77: ## FuriousBench | B77: 3 | C77: 1281800 | D77: 500 | E77: 2563600 | F77: 1 | G77: 0.000993 | H77: 0 | I77: 0.259162
A78: ## FuriousBench | B78: 3 | C78: 1283900 | D78: 500 | E78: 2567800 | F78: 1 | G78: 0.000961 | H78: 0 | I78: 0.260799
A79: ## FuriousBench | B79: 3 | C79: 1283000 | D79: 500 | E79: 2566000 | F79: 1 | G79: 0.000969 | H79: 0 | I79: 0.262741
A80: ## FuriousBench | B80: 3 | C80: 1277500 | D80: 500 | E80: 2555000 | F80: 1 | G80: 0.00099 | H80: 0 | I80: 0.265179
A81: ## FuriousBench | B81: 3 | C81: 1280700 | D81: 500 | E81: 2561400 | F81: 1 | G81: 0.00097 | H81: 0 | I81: 0.266672
A82: ## FuriousBench | B82: 3 | C82: 1281500 | D82: 500 | E82: 2563000 | F82: 1 | G82: 0.001061 | H82: 0 | I82: 0.25999
A83: ## FuriousBench | B83: 3 | C83: 1284200 | D83: 500 | E83: 2568400 | F83: 1 | G83: 0.001057 | H83: 0 | I83: 0.261744
A84: ## FuriousBench | B84: 3 | C84: 1282600 | D84: 500 | E84: 2565200 | F84: 1 | G84: 0.001053 | H84: 0 | I84: 0.263909
A85: ## FuriousBench | B85: 3 | C85: 1278900 | D85: 500 | E85: 2557800 | F85: 1 | G85: 0.001055 | H85: 0 | I85: 0.266279
A86: ## FuriousBench | B86: 3 | C86: 1287100 | D86: 500 | E86: 2574200 | F86: 1 | G86: 0.001054 | H86: 0 | I86: 0.267408
A87: ## FuriousBench | B87: 3 | C87: 1277100 | D87: 500 | E87: 2554200 | F87: 1 | G87: 0.001062 | H87: 0 | I87: 0.270423
A88: ## FuriousBench | B88: 3 | C88: 1277000 | D88: 500 | E88: 2554000 | F88: 1 | G88: 0.001067 | H88: 0 | I88: 0.272398
A89: ## FuriousBench | B89: 3 | C89: 1279000 | D89: 500 | E89: 2558000 | F89: 1 | G89: 0.001077 | H89: 0 | I89: 0.274156
A90: ## FuriousBench | B90: 3 | C90: 1278600 | D90: 500 | E90: 2557200 | F90: 1 | G90: 0.001069 | H90: 0 | I90: 0.276142
A91: ## FuriousBench | B91: 3 | C91: 1287400 | D91: 500 | E91: 2574800 | F91: 1 | G91: 0.001041 | H91: 0 | I91: 0.277081
A92: ## FuriousBench | B92: 4 | C92: 1257900 | D92: 500 | E92: 2515800 | F92: 1 | G92: 0.001468 | H92: 0 | I92: 0.305993
A93: ## FuriousBench | B93: 4 | C93: 1259400 | D93: 500 | E93: 2518800 | F93: 1 | G93: 0.001485 | H93: 0 | I93: 0.308229
A94: ## FuriousBench | B94: 4 | C94: 1258800 | D94: 500 | E94: 2517600 | F94: 1 | G94: 0.001472 | H94: 0 | I94: 0.31068
A95: ## FuriousBench | B95: 4 | C95: 1258900 | D95: 500 | E95: 2517800 | F95: 1 | G95: 0.001485 | H95: 0 | I95: 0.313048
A96: ## FuriousBench | B96: 4 | C96: 1261900 | D96: 500 | E96: 2523800 | F96: 1 | G96: 0.001474 | H96: 0 | I96: 0.315024
A97: ## FuriousBench | B97: 4 | C97: 1256600 | D97: 500 | E97: 2513200 | F97: 1 | G97: 0.001482 | H97: 0 | I97: 0.318026
A98: ## FuriousBench | B98: 4 | C98: 1258400 | D98: 500 | E98: 2516800 | F98: 3 | G98: 0.001482 | H98: 0 | I98: 0.320144
A99: ## FuriousBench | B99: 4 | C99: 1257300 | D99: 500 | E99: 2514600 | F99: 1 | G99: 0.001471 | H99: 0 | I99: 0.322573
A100: ## FuriousBench | B100: 4 | C100: 1255200 | D100: 500 | E100: 2510400 | F100: 1 | G100: 0.001498 | H100: 0 | I100: 0.325154
A101: ## FuriousBench | B101: 4 | C101: 1260700 | D101: 500 | E101: 2521400 | F101: 1 | G101: 0.00148 | H101: 0 | I101: 0.326717
A102: ## FuriousBench | B102: 4 | C102: 1239900 | D102: 500 | E102: 2479800 | F102: 3 | G102: 0.001501 | H102: 0 | I102: 0.308551
A103: ## FuriousBench | B103: 4 | C103: 1221100 | D103: 500 | E103: 2442200 | F103: 1 | G103: 0.001537 | H103: 0 | I103: 0.313379
A104: ## FuriousBench | B104: 4 | C104: 1215900 | D104: 500 | E104: 2431800 | F104: 1 | G104: 0.001527 | H104: 0 | I104: 0.316471
A105: ## FuriousBench | B105: 4 | C105: 1213400 | D105: 500 | E105: 2426800 | F105: 1 | G105: 0.001521 | H105: 0 | I105: 0.319189
A106: ## FuriousBench | B106: 4 | C106: 1216000 | D106: 500 | E106: 2432000 | F106: 1 | G106: 0.001528 | H106: 0 | I106: 0.321235
A107: ## FuriousBench | B107: 4 | C107: 1213300 | D107: 500 | E107: 2426600 | F107: 1 | G107: 0.001543 | H107: 0 | I107: 0.323982
A108: ## FuriousBench | B108: 4 | C108: 1221300 | D108: 500 | E108: 2442600 | F108: 2 | G108: 0.001534 | H108: 0 | I108: 0.325293
A109: ## FuriousBench | B109: 4 | C109: 1219000 | D109: 500 | E109: 2438000 | F109: 1 | G109: 0.001525 | H109: 0 | I109: 0.327933
A110: ## FuriousBench | B110: 4 | C110: 1213900 | D110: 500 | E110: 2427800 | F110: 1 | G110: 0.001526 | H110: 0 | I110: 0.330935
A111: ## FuriousBench | B111: 4 | C111: 1218400 | D111: 500 | E111: 2436800 | F111: 1 | G111: 0.001514 | H111: 0 | I111: 0.332608
A112: ## FuriousBench | B112: 4 | C112: 1224000 | D112: 500 | E112: 2448000 | F112: 1 | G112: 0.001482 | H112: 0 | I112: 0.309159
A113: ## FuriousBench | B113: 4 | C113: 1220200 | D113: 500 | E113: 2440400 | F113: 2 | G113: 0.001517 | H113: 0 | I113: 0.312088
A114: ## FuriousBench | B114: 4 | C114: 1227200 | D114: 500 | E114: 2454400 | F114: 1 | G114: 0.001483 | H114: 0 | I114: 0.313571
A115: ## FuriousBench | B115: 4 | C115: 1221500 | D115: 500 | E115: 2443000 | F115: 1 | G115: 0.0015 | H115: 0 | I115: 0.316678
A116: ## FuriousBench | B116: 4 | C116: 1228000 | D116: 500 | E116: 2456000 | F116: 1 | G116: 0.0015 | H116: 0 | I116: 0.318205
A117: ## FuriousBench | B117: 4 | C117: 1225400 | D117: 500 | E117: 2450800 | F117: 1 | G117: 0.00151 | H117: 0 | I117: 0.320903
A118: ## FuriousBench | B118: 4 | C118: 1225400 | D118: 500 | E118: 2450800 | F118: 1 | G118: 0.001502 | H118: 0 | I118: 0.323234
A119: ## FuriousBench | B119: 4 | C119: 1221200 | D119: 500 | E119: 2442400 | F119: 1 | G119: 0.001509 | H119: 0 | I119: 0.326112
A120: ## FuriousBench | B120: 4 | C120: 1229500 | D120: 500 | E120: 2459000 | F120: 2 | G120: 0.001508 | H120: 0 | I120: 0.327328
A121: ## FuriousBench | B121: 4 | C121: 1226000 | D121: 500 | E121: 2452000 | F121: 1 | G121: 0.001498 | H121: 0 | I121: 0.330073
A122: ## FuriousBench | B122: 5 | C122: 1253500 | D122: 500 | E122: 2507000 | F122: 1 | G122: 0.001863 | H122: 0 | I122: 0.352629
A123: ## FuriousBench | B123: 5 | C123: 1252200 | D123: 500 | E123: 2504400 | F123: 1 | G123: 0.001854 | H123: 0 | I123: 0.355431
A124: ## FuriousBench | B124: 5 | C124: 1257100 | D124: 500 | E124: 2514200 | F124: 3 | G124: 0.001852 | H124: 0 | I124: 0.357365
A125: ## FuriousBench | B125: 5 | C125: 1253700 | D125: 500 | E125: 2507400 | F125: 1 | G125: 0.001851 | H125: 0 | I125: 0.360426
A126: ## FuriousBench | B126: 5 | C126: 1248200 | D126: 500 | E126: 2496400 | F126: 1 | G126: 0.001872 | H126: 0 | I126: 0.363802
A127: ## FuriousBench | B127: 5 | C127: 1238600 | D127: 500 | E127: 2477200 | F127: 1 | G127: 0.00188 | H127: 0 | I127: 0.367774
A128: ## FuriousBench | B128: 5 | C128: 1243700 | D128: 500 | E128: 2487400 | F128: 1 | G128: 0.00189 | H128: 0 | I128: 0.369586
A129: ## FuriousBench | B129: 5 | C129: 1248700 | D129: 500 | E129: 2497400 | F129: 1 | G129: 0.001882 | H129: 0 | I129: 0.371388
A130: ## FuriousBench | B130: 5 | C130: 1248100 | D130: 500 | E130: 2496200 | F130: 1 | G130: 0.001871 | H130: 0 | I130: 0.373986
A131: ## FuriousBench | B131: 5 | C131: 1249200 | D131: 500 | E131: 2498400 | F131: 1 | G131: 0.001862 | H131: 0 | I131: 0.376304
A132: ## FuriousBench | B132: 5 | C132: 1226000 | D132: 500 | E132: 2452000 | F132: 1 | G132: 0.001918 | H132: 0 | I132: 0.355492
A133: ## FuriousBench | B133: 5 | C133: 1229400 | D133: 500 | E133: 2458800 | F133: 1 | G133: 0.001904 | H133: 0 | I133: 0.357672
A134: ## FuriousBench | B134: 5 | C134: 1233000 | D134: 500 | E134: 2466000 | F134: 1 | G134: 0.001921 | H134: 0 | I134: 0.359829
A135: ## FuriousBench | B135: 5 | C135: 1221500 | D135: 500 | E135: 2443000 | F135: 2 | G135: 0.001945 | H135: 0 | I135: 0.364206
A136: ## FuriousBench | B136: 5 | C136: 1231400 | D136: 500 | E136: 2462800 | F136: 1 | G136: 0.001932 | H136: 0 | I136: 0.365393
A137: ## FuriousBench | B137: 5 | C137: 1239200 | D137: 500 | E137: 2478400 | F137: 4 | G137: 0.001895 | H137: 0 | I137: 0.366886
A138: ## FuriousBench | B138: 5 | C138: 1231200 | D138: 500 | E138: 2462400 | F138: 1 | G138: 0.00191 | H138: 0 | I138: 0.370662
A139: ## FuriousBench | B139: 5 | C139: 1231800 | D139: 500 | E139: 2463600 | F139: 1 | G139: 0.001921 | H139: 0 | I139: 0.373154
A140: ## FuriousBench | B140: 5 | C140: 1235200 | D140: 500 | E140: 2470400 | F140: 1 | G140: 0.001913 | H140: 0 | I140: 0.375198
A141: ## FuriousBench | B141: 5 | C141: 1234100 | D141: 500 | E141: 2468200 | F141: 1 | G141: 0.001904 | H141: 0 | I141: 0.377893
A142: ## FuriousBench | B142: 5 | C142: 1173800 | D142: 500 | E142: 2347600 | F142: 1 | G142: 0.002016 | H142: 0 | I142: 0.359144
A143: ## FuriousBench | B143: 5 | C143: 1173500 | D143: 500 | E143: 2347000 | F143: 1 | G143: 0.002016 | H143: 0 | I143: 0.361986
A144: ## FuriousBench | B144: 5 | C144: 1177500 | D144: 500 | E144: 2355000 | F144: 1 | G144: 0.002004 | H144: 0 | I144: 0.364133
A145: ## FuriousBench | B145: 5 | C145: 1177700 | D145: 500 | E145: 2355400 | F145: 1 | G145: 0.001995 | H145: 0 | I145: 0.366831
A146: ## FuriousBench | B146: 5 | C146: 1175700 | D146: 500 | E146: 2351400 | F146: 1 | G146: 0.002015 | H146: 0 | I146: 0.369877
A147: ## FuriousBench | B147: 5 | C147: 1177000 | D147: 500 | E147: 2354000 | F147: 1 | G147: 0.00201 | H147: 0 | I147: 0.372382
A148: ## FuriousBench | B148: 5 | C148: 1175900 | D148: 500 | E148: 2351800 | F148: 1 | G148: 0.002007 | H148: 0 | I148: 0.37524
A149: ## FuriousBench | B149: 5 | C149: 1174400 | D149: 500 | E149: 2348800 | F149: 1 | G149: 0.002026 | H149: 0 | I149: 0.378167
A150: ## FuriousBench | B150: 5 | C150: 1171600 | D150: 500 | E150: 2343200 | F150: 1 | G150: 0.002003 | H150: 0 | I150: 0.381255
A151: ## FuriousBench | B151: 5 | C151: 1176100 | D151: 500 | E151: 2352200 | F151: 1 | G151: 0.002021 | H151: 0 | I151: 0.383171
A152: ## FuriousBench | B152: 6 | C152: 1243500 | D152: 500 | E152: 2487000 | F152: 1 | G152: 0.0023 | H152: 0 | I152: 0.38085
A153: ## FuriousBench | B153: 6 | C153: 1245200 | D153: 500 | E153: 2490400 | F153: 3 | G153: 0.002314 | H153: 0 | I153: 0.38364
A154: ## FuriousBench | B154: 6 | C154: 1238900 | D154: 500 | E154: 2477800 | F154: 1 | G154: 0.00231 | H154: 0 | I154: 0.387606
A155: ## FuriousBench | B155: 6 | C155: 1241100 | D155: 500 | E155: 2482200 | F155: 1 | G155: 0.002313 | H155: 0 | I155: 0.390238
A156: ## FuriousBench | B156: 6 | C156: 1242300 | D156: 500 | E156: 2484600 | F156: 1 | G156: 0.002295 | H156: 0 | I156: 0.39298
A157: ## FuriousBench | B157: 6 | C157: 1237400 | D157: 500 | E157: 2474800 | F157: 2 | G157: 0.002319 | H157: 0 | I157: 0.396703
A158: ## FuriousBench | B158: 6 | C158: 1238900 | D158: 500 | E158: 2477800 | F158: 1 | G158: 0.002321 | H158: 0 | I158: 0.399378
A159: ## FuriousBench | B159: 6 | C159: 1237600 | D159: 500 | E159: 2475200 | F159: 1 | G159: 0.002313 | H159: 0 | I159: 0.402472
A160: ## FuriousBench | B160: 6 | C160: 1234600 | D160: 500 | E160: 2469200 | F160: 1 | G160: 0.00232 | H160: 0 | I160: 0.405829
A161: ## FuriousBench | B161: 6 | C161: 1241200 | D161: 500 | E161: 2482400 | F161: 1 | G161: 0.002307 | H161: 0 | I161: 0.407589
A162: ## FuriousBench | B162: 6 | C162: 1194300 | D162: 500 | E162: 2388600 | F162: 1 | G162: 0.002388 | H162: 0 | I162: 0.412458
A163: ## FuriousBench | B163: 6 | C163: 1190300 | D163: 500 | E163: 2380600 | F163: 1 | G163: 0.002412 | H163: 0 | I163: 0.416059
A164: ## FuriousBench | B164: 6 | C164: 1191700 | D164: 500 | E164: 2383400 | F164: 1 | G164: 0.002403 | H164: 0 | I164: 0.418695
A165: ## FuriousBench | B165: 6 | C165: 1189500 | D165: 500 | E165: 2379000 | F165: 1 | G165: 0.002426 | H165: 0 | I165: 0.421966
A166: ## FuriousBench | B166: 6 | C166: 1193600 | D166: 500 | E166: 2387200 | F166: 1 | G166: 0.002411 | H166: 0 | I166: 0.424093
A167: ## FuriousBench | B167: 6 | C167: 1189600 | D167: 500 | E167: 2379200 | F167: 1 | G167: 0.002412 | H167: 0 | I167: 0.427635
A168: ## FuriousBench | B168: 6 | C168: 1193600 | D168: 500 | E168: 2387200 | F168: 1 | G168: 0.002381 | H168: 0 | I168: 0.429697
A169: ## FuriousBench | B169: 6 | C169: 1189500 | D169: 500 | E169: 2379000 | F169: 1 | G169: 0.002405 | H169: 0 | I169: 0.433222
A170: ## FuriousBench | B170: 6 | C170: 1192700 | D170: 500 | E170: 2385400 | F170: 1 | G170: 0.00241 | H170: 0 | I170: 0.435417
A171: ## FuriousBench | B171: 6 | C171: 1194500 | D171: 500 | E171: 2389000 | F171: 1 | G171: 0.002402 | H171: 0 | I171: 0.437841
A172: ## FuriousBench | B172: 6 | C172: 1168700 | D172: 500 | E172: 2337400 | F172: 1 | G172: 0.002464 | H172: 0 | I172: 0.393942
A173: ## FuriousBench | B173: 6 | C173: 1179500 | D173: 500 | E173: 2359000 | F173: 1 | G173: 0.002427 | H173: 0 | I173: 0.395217
A174: ## FuriousBench | B174: 6 | C174: 1166900 | D174: 500 | E174: 2333800 | F174: 1 | G174: 0.002451 | H174: 0 | I174: 0.400418
A175: ## FuriousBench | B175: 6 | C175: 1177800 | D175: 500 | E175: 2355600 | F175: 1 | G175: 0.002424 | H175: 0 | I175: 0.40159
A176: ## FuriousBench | B176: 6 | C176: 1166800 | D176: 500 | E176: 2333600 | F176: 1 | G176: 0.002468 | H176: 0 | I176: 0.406526
A177: ## FuriousBench | B177: 6 | C177: 1173800 | D177: 500 | E177: 2347600 | F177: 1 | G177: 0.002442 | H177: 0 | I177: 0.408314
A178: ## FuriousBench | B178: 6 | C178: 1166000 | D178: 500 | E178: 2332000 | F178: 1 | G178: 0.002459 | H178: 0 | I178: 0.412667
A179: ## FuriousBench | B179: 6 | C179: 1174000 | D179: 500 | E179: 2348000 | F179: 1 | G179: 0.002439 | H179: 0 | I179: 0.414213
A180: ## FuriousBench | B180: 6 | C180: 1167500 | D180: 500 | E180: 2335000 | F180: 1 | G180: 0.002461 | H180: 0 | I180: 0.418316
A181: ## FuriousBench | B181: 6 | C181: 1176500 | D181: 500 | E181: 2353000 | F181: 1 | G181: 0.002433 | H181: 0 | I181: 0.419623
A182: ## FuriousBench | B182: 8 | C182: 1207300 | D182: 500 | E182: 2414600 | F182: 1 | G182: 0.0032 | H182: 0 | I182: 0.464683
A183: ## FuriousBench | B183: 8 | C183: 1207000 | D183: 500 | E183: 2414000 | F183: 1 | G183: 0.003191 | H183: 0 | I183: 0.468162
A184: ## FuriousBench | B184: 8 | C184: 1206500 | D184: 500 | E184: 2413000 | F184: 1 | G184: 0.003206 | H184: 0 | I184: 0.471669
A185: ## FuriousBench | B185: 8 | C185: 1210200 | D185: 500 | E185: 2420400 | F185: 1 | G185: 0.003177 | H185: 0 | I185: 0.474309
A186: ## FuriousBench | B186: 8 | C186: 1211400 | D186: 500 | E186: 2422800 | F186: 2 | G186: 0.003181 | H186: 0 | I186: 0.47743
A187: ## FuriousBench | B187: 8 | C187: 1203400 | D187: 500 | E187: 2406800 | F187: 1 | G187: 0.003219 | H187: 0 | I187: 0.482363
A188: ## FuriousBench | B188: 8 | C188: 1204700 | D188: 500 | E188: 2409400 | F188: 1 | G188: 0.00321 | H188: 0 | I188: 0.48542
A189: ## FuriousBench | B189: 8 | C189: 1204700 | D189: 500 | E189: 2409400 | F189: 1 | G189: 0.003211 | H189: 0 | I189: 0.488716
A190: ## FuriousBench | B190: 8 | C190: 1205300 | D190: 500 | E190: 2410600 | F190: 1 | G190: 0.003208 | H190: 0 | I190: 0.491867
A191: ## FuriousBench | B191: 8 | C191: 1203700 | D191: 500 | E191: 2407400 | F191: 1 | G191: 0.003222 | H191: 0 | I191: 0.495455
A192: ## FuriousBench | B192: 8 | C192: 1181100 | D192: 500 | E192: 2362200 | F192: 1 | G192: 0.003248 | H192: 0 | I192: 0.480634
A193: ## FuriousBench | B193: 8 | C193: 1175900 | D193: 500 | E193: 2351800 | F193: 1 | G193: 0.003275 | H193: 0 | I193: 0.485083
A194: ## FuriousBench | B194: 8 | C194: 1179400 | D194: 500 | E194: 2358800 | F194: 1 | G194: 0.003259 | H194: 0 | I194: 0.487715
A195: ## FuriousBench | B195: 8 | C195: 1182200 | D195: 500 | E195: 2364400 | F195: 1 | G195: 0.003268 | H195: 0 | I195: 0.490481
A196: ## FuriousBench | B196: 8 | C196: 1184200 | D196: 500 | E196: 2368400 | F196: 1 | G196: 0.003269 | H196: 0 | I196: 0.49339
A197: ## FuriousBench | B197: 8 | C197: 1177000 | D197: 500 | E197: 2354000 | F197: 1 | G197: 0.003284 | H197: 0 | I197: 0.498203
A198: ## FuriousBench | B198: 8 | C198: 1179200 | D198: 500 | E198: 2358400 | F198: 1 | G198: 0.003262 | H198: 0 | I198: 0.501004
A199: ## FuriousBench | B199: 8 | C199: 1178400 | D199: 500 | E199: 2356800 | F199: 1 | G199: 0.003272 | H199: 0 | I199: 0.504428
A200: ## FuriousBench | B200: 8 | C200: 1180600 | D200: 500 | E200: 2361200 | F200: 1 | G200: 0.003269 | H200: 0 | I200: 0.507191
A201: ## FuriousBench | B201: 8 | C201: 1182600 | D201: 500 | E201: 2365200 | F201: 1 | G201: 0.003244 | H201: 0 | I201: 0.509952
A202: ## FuriousBench | B202: 8 | C202: 1231400 | D202: 500 | E202: 2462800 | F202: 1 | G202: 0.003133 | H202: 0 | I202: 0.444482
A203: ## FuriousBench | B203: 8 | C203: 1226400 | D203: 500 | E203: 2452800 | F203: 1 | G203: 0.003143 | H203: 0 | I203: 0.448901
A204: ## FuriousBench | B204: 8 | C204: 1230900 | D204: 500 | E204: 2461800 | F204: 1 | G204: 0.003138 | H204: 0 | I204: 0.451568
A205: ## FuriousBench | B205: 8 | C205: 1228100 | D205: 500 | E205: 2456200 | F205: 1 | G205: 0.003143 | H205: 0 | I205: 0.455546
A206: ## FuriousBench | B206: 8 | C206: 1231200 | D206: 500 | E206: 2462400 | F206: 1 | G206: 0.00313 | H206: 0 | I206: 0.458399
A207: ## FuriousBench | B207: 8 | C207: 1229500 | D207: 500 | E207: 2459000 | F207: 1 | G207: 0.003141 | H207: 0 | I207: 0.462127
A208: ## FuriousBench | B208: 8 | C208: 1229900 | D208: 500 | E208: 2459800 | F208: 1 | G208: 0.003139 | H208: 0 | I208: 0.465437
A209: ## FuriousBench | B209: 8 | C209: 1233900 | D209: 500 | E209: 2467800 | F209: 1 | G209: 0.00312 | H209: 0 | I209: 0.468027
A210: ## FuriousBench | B210: 8 | C210: 1229400 | D210: 500 | E210: 2458800 | F210: 1 | G210: 0.003136 | H210: 0 | I210: 0.472215
A211: ## FuriousBench | B211: 8 | C211: 1229100 | D211: 500 | E211: 2458200 | F211: 1 | G211: 0.003132 | H211: 0 | I211: 0.475576
A212: ## FuriousBench | B212: 10 | C212: 1240300 | D212: 500 | E212: 2480600 | F212: 1 | G212: 0.003928 | H212: 0 | I212: 0.507024
A213: ## FuriousBench | B213: 10 | C213: 1238900 | D213: 500 | E213: 2477800 | F213: 1 | G213: 0.003913 | H213: 0 | I213: 0.511153
A214: ## FuriousBench | B214: 10 | C214: 1238100 | D214: 500 | E214: 2476200 | F214: 1 | G214: 0.003925 | H214: 0 | I214: 0.515142
A215: ## FuriousBench | B215: 10 | C215: 1237300 | D215: 500 | E215: 2474600 | F215: 1 | G215: 0.003934 | H215: 0 | I215: 0.519111
A216: ## FuriousBench | B216: 10 | C216: 1224300 | D216: 500 | E216: 2448600 | F216: 1 | G216: 0.003952 | H216: 0 | I216: 0.525633
A217: ## FuriousBench | B217: 10 | C217: 1235100 | D217: 500 | E217: 2470200 | F217: 1 | G217: 0.003899 | H217: 0 | I217: 0.527042
A218: ## FuriousBench | B218: 10 | C218: 1233700 | D218: 500 | E218: 2467400 | F218: 1 | G218: 0.003931 | H218: 0 | I218: 0.531055
A219: ## FuriousBench | B219: 10 | C219: 1230600 | D219: 500 | E219: 2461200 | F219: 1 | G219: 0.003941 | H219: 0 | I219: 0.535417
A220: ## FuriousBench | B220: 10 | C220: 1236100 | D220: 500 | E220: 2472200 | F220: 1 | G220: 0.003915 | H220: 0 | I220: 0.537876
A221: ## FuriousBench | B221: 10 | C221: 1232700 | D221: 500 | E221: 2465400 | F221: 1 | G221: 0.003917 | H221: 0 | I221: 0.542241
A222: ## FuriousBench | B222: 10 | C222: 1208600 | D222: 500 | E222: 2417200 | F222: 1 | G222: 0.003987 | H222: 0 | I222: 0.507784
A223: ## FuriousBench | B223: 10 | C223: 1202400 | D223: 500 | E223: 2404800 | F223: 1 | G223: 0.004032 | H223: 0 | I223: 0.513036
A224: ## FuriousBench | B224: 10 | C224: 1210000 | D224: 500 | E224: 2420000 | F224: 1 | G224: 0.003999 | H224: 0 | I224: 0.515317
A225: ## FuriousBench | B225: 10 | C225: 1207500 | D225: 500 | E225: 2415000 | F225: 1 | G225: 0.004035 | H225: 0 | I225: 0.519746
A226: ## FuriousBench | B226: 10 | C226: 1204600 | D226: 500 | E226: 2409200 | F226: 1 | G226: 0.004022 | H226: 0 | I226: 0.524222
A227: ## FuriousBench | B227: 10 | C227: 1202900 | D227: 500 | E227: 2405800 | F227: 1 | G227: 0.004022 | H227: 0 | I227: 0.528412
A228: ## FuriousBench | B228: 10 | C228: 1205900 | D228: 500 | E228: 2411800 | F228: 1 | G228: 0.004015 | H228: 0 | I228: 0.531545
A229: ## FuriousBench | B229: 10 | C229: 1208400 | D229: 500 | E229: 2416800 | F229: 1 | G229: 0.004011 | H229: 0 | I229: 0.534758
A230: ## FuriousBench | B230: 10 | C230: 1207100 | D230: 500 | E230: 2414200 | F230: 1 | G230: 0.004028 | H230: 0 | I230: 0.538797
A231: ## FuriousBench | B231: 10 | C231: 1208300 | D231: 500 | E231: 2416600 | F231: 2 | G231: 0.003997 | H231: 0 | I231: 0.542241
A232: ## FuriousBench | B232: 10 | C232: 1273100 | D232: 500 | E232: 2546200 | F232: 1 | G232: 0.003836 | H232: 0 | I232: 0.501752
A233: ## FuriousBench | B233: 10 | C233: 1267900 | D233: 500 | E233: 2535800 | F233: 1 | G233: 0.003854 | H233: 0 | I233: 0.506598
A234: ## FuriousBench | B234: 10 | C234: 1265500 | D234: 500 | E234: 2531000 | F234: 1 | G234: 0.003853 | H234: 0 | I234: 0.510863
A235: ## FuriousBench | B235: 10 | C235: 1275900 | D235: 500 | E235: 2551800 | F235: 2 | G235: 0.003825 | H235: 0 | I235: 0.512535
A236: ## FuriousBench | B236: 10 | C236: 1269500 | D236: 500 | E236: 2539000 | F236: 2 | G236: 0.003842 | H236: 0 | I236: 0.51756
A237: ## FuriousBench | B237: 10 | C237: 1265200 | D237: 500 | E237: 2530400 | F237: 1 | G237: 0.003865 | H237: 0 | I237: 0.522152
A238: ## FuriousBench | B238: 10 | C238: 1268000 | D238: 500 | E238: 2536000 | F238: 1 | G238: 0.003861 | H238: 0 | I238: 0.525264
A239: ## FuriousBench | B239: 10 | C239: 1270100 | D239: 500 | E239: 2540200 | F239: 1 | G239: 0.003846 | H239: 0 | I239: 0.528481
A240: ## FuriousBench | B240: 10 | C240: 1270600 | D240: 500 | E240: 2541200 | F240: 1 | G240: 0.003849 | H240: 0 | I240: 0.532007
A241: ## FuriousBench | B241: 10 | C241: 1264900 | D241: 500 | E241: 2529800 | F241: 1 | G241: 0.003859 | H241: 0 | I241: 0.53681
A242: ## FuriousBench | B242: 12 | C242: 1203500 | D242: 500 | E242: 2407000 | F242: 1 | G242: 0.004875 | H242: 0 | I242: 0.568124
A243: ## FuriousBench | B243: 12 | C243: 1205600 | D243: 500 | E243: 2411200 | F243: 1 | G243: 0.00487 | H243: 0 | I243: 0.571902
A244: ## FuriousBench | B244: 12 | C244: 1203800 | D244: 500 | E244: 2407600 | F244: 1 | G244: 0.004862 | H244: 0 | I244: 0.576562
A245: ## FuriousBench | B245: 12 | C245: 1208400 | D245: 500 | E245: 2416800 | F245: 1 | G245: 0.004857 | H245: 0 | I245: 0.579668
A246: ## FuriousBench | B246: 12 | C246: 1205600 | D246: 500 | E246: 2411200 | F246: 1 | G246: 0.004866 | H246: 0 | I246: 0.584518
A247: ## FuriousBench | B247: 12 | C247: 1205100 | D247: 500 | E247: 2410200 | F247: 1 | G247: 0.004872 | H247: 0 | I247: 0.588791
A248: ## FuriousBench | B248: 12 | C248: 1207800 | D248: 500 | E248: 2415600 | F248: 1 | G248: 0.004856 | H248: 0 | I248: 0.592246
A249: ## FuriousBench | B249: 12 | C249: 1206300 | D249: 500 | E249: 2412600 | F249: 1 | G249: 0.004854 | H249: 0 | I249: 0.596695
A250: ## FuriousBench | B250: 12 | C250: 1206700 | D250: 500 | E250: 2413400 | F250: 1 | G250: 0.004852 | H250: 0 | I250: 0.600649
A251: ## FuriousBench | B251: 12 | C251: 1200400 | D251: 500 | E251: 2400800 | F251: 1 | G251: 0.004873 | H251: 0 | I251: 0.606256
A252: ## FuriousBench | B252: 12 | C252: 1251400 | D252: 500 | E252: 2502800 | F252: 1 | G252: 0.004702 | H252: 0 | I252: 0.548819
A253: ## FuriousBench | B253: 12 | C253: 1249400 | D253: 500 | E253: 2498800 | F253: 1 | G253: 0.004701 | H253: 0 | I253: 0.553521
A254: ## FuriousBench | B254: 12 | C254: 1249600 | D254: 500 | E254: 2499200 | F254: 1 | G254: 0.004676 | H254: 0 | I254: 0.557685
A255: ## FuriousBench | B255: 12 | C255: 1246700 | D255: 500 | E255: 2493400 | F255: 1 | G255: 0.004686 | H255: 0 | I255: 0.562514
A256: ## FuriousBench | B256: 12 | C256: 1244600 | D256: 500 | E256: 2489200 | F256: 1 | G256: 0.0047 | H256: 0 | I256: 0.567148
A257: ## FuriousBench | B257: 12 | C257: 1248100 | D257: 500 | E257: 2496200 | F257: 1 | G257: 0.004688 | H257: 0 | I257: 0.570476
A258: ## FuriousBench | B258: 12 | C258: 1247600 | D258: 500 | E258: 2495200 | F258: 1 | G258: 0.004701 | H258: 0 | I258: 0.574694
A259: ## FuriousBench | B259: 12 | C259: 1245200 | D259: 500 | E259: 2490400 | F259: 1 | G259: 0.004707 | H259: 0 | I259: 0.579325
A260: ## FuriousBench | B260: 12 | C260: 1248600 | D260: 500 | E260: 2497200 | F260: 1 | G260: 0.004696 | H260: 0 | I260: 0.58258
A261: ## FuriousBench | B261: 12 | C261: 1252300 | D261: 500 | E261: 2504600 | F261: 1 | G261: 0.004679 | H261: 0 | I261: 0.585726
A262: ## FuriousBench | B262: 12 | C262: 1140000 | D262: 500 | E262: 2280000 | F262: 1 | G262: 0.005149 | H262: 0 | I262: 0.572356
A263: ## FuriousBench | B263: 12 | C263: 1139900 | D263: 500 | E263: 2279800 | F263: 1 | G263: 0.005157 | H263: 0 | I263: 0.576868
A264: ## FuriousBench | B264: 12 | C264: 1144900 | D264: 500 | E264: 2289800 | F264: 1 | G264: 0.005119 | H264: 0 | I264: 0.580037
A265: ## FuriousBench | B265: 12 | C265: 1144800 | D265: 500 | E265: 2289600 | F265: 1 | G265: 0.005121 | H265: 0 | I265: 0.584459
A266: ## FuriousBench | B266: 12 | C266: 1147500 | D266: 500 | E266: 2295000 | F266: 1 | G266: 0.00513 | H266: 0 | I266: 0.588149
A267: ## FuriousBench | B267: 12 | C267: 1144300 | D267: 500 | E267: 2288600 | F267: 1 | G267: 0.005125 | H267: 0 | I267: 0.593305
A268: ## FuriousBench | B268: 12 | C268: 1135800 | D268: 500 | E268: 2271600 | F268: 1 | G268: 0.005166 | H268: 0 | I268: 0.599842
A269: ## FuriousBench | B269: 12 | C269: 1139500 | D269: 500 | E269: 2279000 | F269: 3 | G269: 0.005137 | H269: 0 | I269: 0.60319
A270: ## FuriousBench | B270: 12 | C270: 1138900 | D270: 500 | E270: 2277800 | F270: 1 | G270: 0.005157 | H270: 0 | I270: 0.607607
A271: ## FuriousBench | B271: 12 | C271: 1140400 | D271: 500 | E271: 2280800 | F271: 1 | G271: 0.005149 | H271: 0 | I271: 0.611432
A272: ## FuriousBench | B272: 14 | C272: 1171700 | D272: 500 | E272: 2343400 | F272: 1 | G272: 0.005862 | H272: 0 | I272: 0.631636
A273: ## FuriousBench | B273: 14 | C273: 1169500 | D273: 500 | E273: 2339000 | F273: 1 | G273: 0.005865 | H273: 0 | I273: 0.636851
A274: ## FuriousBench | B274: 14 | C274: 1169600 | D274: 500 | E274: 2339200 | F274: 1 | G274: 0.005848 | H274: 0 | I274: 0.641399
A275: ## FuriousBench | B275: 14 | C275: 1176000 | D275: 500 | E275: 2352000 | F275: 1 | G275: 0.005817 | H275: 0 | I275: 0.644183
A276: ## FuriousBench | B276: 14 | C276: 1171600 | D276: 500 | E276: 2343200 | F276: 1 | G276: 0.005856 | H276: 0 | I276: 0.649912
A277: ## FuriousBench | B277: 14 | C277: 1172700 | D277: 500 | E277: 2345400 | F277: 1 | G277: 0.005845 | H277: 0 | I277: 0.65409
A278: ## FuriousBench | B278: 14 | C278: 1171100 | D278: 500 | E278: 2342200 | F278: 1 | G278: 0.005862 | H278: 0 | I278: 0.659
A279: ## FuriousBench | B279: 14 | C279: 1169400 | D279: 500 | E279: 2338800 | F279: 1 | G279: 0.005862 | H279: 0 | I279: 0.663908
A280: ## FuriousBench | B280: 14 | C280: 1169100 | D280: 500 | E280: 2338200 | F280: 1 | G280: 0.005869 | H280: 0 | I280: 0.668398
A281: ## FuriousBench | B281: 14 | C281: 1171400 | D281: 500 | E281: 2342800 | F281: 1 | G281: 0.00585 | H281: 0 | I281: 0.672108
A282: ## FuriousBench | B282: 14 | C282: 1162900 | D282: 500 | E282: 2325800 | F282: 2 | G282: 0.005911 | H282: 0 | I282: 0.612654
A283: ## FuriousBench | B283: 14 | C283: 1161700 | D283: 500 | E283: 2323400 | F283: 1 | G283: 0.005901 | H283: 0 | I283: 0.617765
A284: ## FuriousBench | B284: 14 | C284: 1162200 | D284: 500 | E284: 2324400 | F284: 1 | G284: 0.005882 | H284: 0 | I284: 0.622376
A285: ## FuriousBench | B285: 14 | C285: 1160200 | D285: 500 | E285: 2320400 | F285: 1 | G285: 0.005903 | H285: 0 | I285: 0.627632
A286: ## FuriousBench | B286: 14 | C286: 1163800 | D286: 500 | E286: 2327600 | F286: 1 | G286: 0.005901 | H286: 0 | I286: 0.631352
A287: ## FuriousBench | B287: 14 | C287: 1162700 | D287: 500 | E287: 2325400 | F287: 1 | G287: 0.005891 | H287: 0 | I287: 0.636297
A288: ## FuriousBench | B288: 14 | C288: 1167100 | D288: 500 | E288: 2334200 | F288: 1 | G288: 0.005867 | H288: 0 | I288: 0.639698
A289: ## FuriousBench | B289: 14 | C289: 1162500 | D289: 500 | E289: 2325000 | F289: 1 | G289: 0.005892 | H289: 0 | I289: 0.645543
A290: ## FuriousBench | B290: 14 | C290: 1168300 | D290: 500 | E290: 2336600 | F290: 1 | G290: 0.005857 | H290: 0 | I290: 0.648471
A291: ## FuriousBench | B291: 14 | C291: 1167700 | D291: 500 | E291: 2335400 | F291: 1 | G291: 0.005881 | H291: 0 | I291: 0.653155
A292: ## FuriousBench | B292: 14 | C292: 1146500 | D292: 500 | E292: 2293000 | F292: 1 | G292: 0.005987 | H292: 0 | I292: 0.639157
A293: ## FuriousBench | B293: 14 | C293: 1144500 | D293: 500 | E293: 2289000 | F293: 1 | G293: 0.006014 | H293: 0 | I293: 0.644398
A294: ## FuriousBench | B294: 14 | C294: 1140300 | D294: 500 | E294: 2280600 | F294: 1 | G294: 0.006016 | H294: 0 | I294: 0.650227
A295: ## FuriousBench | B295: 14 | C295: 1140600 | D295: 500 | E295: 2281200 | F295: 1 | G295: 0.006032 | H295: 0 | I295: 0.654763
A296: ## FuriousBench | B296: 14 | C296: 1138900 | D296: 500 | E296: 2277800 | F296: 1 | G296: 0.006041 | H296: 0 | I296: 0.659845
A297: ## FuriousBench | B297: 14 | C297: 1143700 | D297: 500 | E297: 2287400 | F297: 1 | G297: 0.005994 | H297: 0 | I297: 0.662995
A298: ## FuriousBench | B298: 14 | C298: 1140800 | D298: 500 | E298: 2281600 | F298: 1 | G298: 0.006008 | H298: 0 | I298: 0.668347
A299: ## FuriousBench | B299: 14 | C299: 1139600 | D299: 500 | E299: 2279200 | F299: 1 | G299: 0.006028 | H299: 0 | I299: 0.673191
A300: ## FuriousBench | B300: 14 | C300: 1141200 | D300: 500 | E300: 2282400 | F300: 1 | G300: 0.006003 | H300: 0 | I300: 0.677166
A301: ## FuriousBench | B301: 14 | C301: 1142200 | D301: 500 | E301: 2284400 | F301: 1 | G301: 0.006009 | H301: 0 | I301: 0.681294
A302: ## FuriousBench | B302: 16 | C302: 1281400 | D302: 500 | E302: 2562800 | F302: 1 | G302: 0.006137 | H302: 0 | I302: 0.646268
A303: ## FuriousBench | B303: 16 | C303: 1283400 | D303: 500 | E303: 2566800 | F303: 3 | G303: 0.006129 | H303: 0 | I303: 0.650546
A304: ## FuriousBench | B304: 16 | C304: 1281200 | D304: 500 | E304: 2562400 | F304: 1 | G304: 0.006129 | H304: 0 | I304: 0.655794
A305: ## FuriousBench | B305: 16 | C305: 1278400 | D305: 500 | E305: 2556800 | F305: 1 | G305: 0.006127 | H305: 0 | I305: 0.661162
A306: ## FuriousBench | B306: 16 | C306: 1281100 | D306: 500 | E306: 2562200 | F306: 1 | G306: 0.006133 | H306: 0 | I306: 0.665091
A307: ## FuriousBench | B307: 16 | C307: 1274800 | D307: 500 | E307: 2549600 | F307: 1 | G307: 0.006147 | H307: 0 | I307: 0.671326
A308: ## FuriousBench | B308: 16 | C308: 1279800 | D308: 500 | E308: 2559600 | F308: 1 | G308: 0.006136 | H308: 0 | I308: 0.674577
A309: ## FuriousBench | B309: 16 | C309: 1274700 | D309: 500 | E309: 2549400 | F309: 1 | G309: 0.006156 | H309: 0 | I309: 0.680464
A310: ## FuriousBench | B310: 16 | C310: 1278800 | D310: 500 | E310: 2557600 | F310: 1 | G310: 0.006154 | H310: 0 | I310: 0.683886
A311: ## FuriousBench | B311: 16 | C311: 1273200 | D311: 500 | E311: 2546400 | F311: 2 | G311: 0.006181 | H311: 0 | I311: 0.689901
A312: ## FuriousBench | B312: 16 | C312: 1229600 | D312: 500 | E312: 2459200 | F312: 1 | G312: 0.006378 | H312: 0 | I312: 0.672513
A313: ## FuriousBench | B313: 16 | C313: 1227900 | D313: 500 | E313: 2455800 | F313: 1 | G313: 0.006389 | H313: 0 | I313: 0.677708
A314: ## FuriousBench | B314: 16 | C314: 1226300 | D314: 500 | E314: 2452600 | F314: 1 | G314: 0.006396 | H314: 0 | I314: 0.682849
A315: ## FuriousBench | B315: 16 | C315: 1226200 | D315: 500 | E315: 2452400 | F315: 1 | G315: 0.006409 | H315: 0 | I315: 0.687554
A316: ## FuriousBench | B316: 16 | C316: 1225100 | D316: 500 | E316: 2450200 | F316: 1 | G316: 0.006421 | H316: 0 | I316: 0.692514
A317: ## FuriousBench | B317: 16 | C317: 1223000 | D317: 500 | E317: 2446000 | F317: 1 | G317: 0.006432 | H317: 0 | I317: 0.697732
A318: ## FuriousBench | B318: 16 | C318: 1224600 | D318: 500 | E318: 2449200 | F318: 1 | G318: 0.006428 | H318: 0 | I318: 0.701871
A319: ## FuriousBench | B319: 16 | C319: 1228800 | D319: 500 | E319: 2457600 | F319: 1 | G319: 0.006393 | H319: 0 | I319: 0.705218
A320: ## FuriousBench | B320: 16 | C320: 1228600 | D320: 500 | E320: 2457200 | F320: 1 | G320: 0.006387 | H320: 0 | I320: 0.709789
A321: ## FuriousBench | B321: 16 | C321: 1228600 | D321: 500 | E321: 2457200 | F321: 2 | G321: 0.006368 | H321: 0 | I321: 0.714278
A322: ## FuriousBench | B322: 16 | C322: 1219700 | D322: 500 | E322: 2439400 | F322: 2 | G322: 0.006461 | H322: 0 | I322: 0.642926
A323: ## FuriousBench | B323: 16 | C323: 1218700 | D323: 500 | E323: 2437400 | F323: 1 | G323: 0.006464 | H323: 0 | I323: 0.648195
A324: ## FuriousBench | B324: 16 | C324: 1216400 | D324: 500 | E324: 2432800 | F324: 1 | G324: 0.006472 | H324: 0 | I324: 0.653776
A325: ## FuriousBench | B325: 16 | C325: 1218500 | D325: 500 | E325: 2437000 | F325: 1 | G325: 0.006462 | H325: 0 | I325: 0.65814
A326: ## FuriousBench | B326: 16 | C326: 1216900 | D326: 500 | E326: 2433800 | F326: 1 | G326: 0.006465 | H326: 0 | I326: 0.663463
A327: ## FuriousBench | B327: 16 | C327: 1219000 | D327: 500 | E327: 2438000 | F327: 1 | G327: 0.006465 | H327: 0 | I327: 0.667749
A328: ## FuriousBench | B328: 16 | C328: 1216900 | D328: 500 | E328: 2433800 | F328: 1 | G328: 0.006468 | H328: 0 | I328: 0.673147
A329: ## FuriousBench | B329: 16 | C329: 1216900 | D329: 500 | E329: 2433800 | F329: 1 | G329: 0.006469 | H329: 0 | I329: 0.677935
A330: ## FuriousBench | B330: 16 | C330: 1215000 | D330: 500 | E330: 2430000 | F330: 1 | G330: 0.006456 | H330: 0 | I330: 0.683206
A331: ## FuriousBench | B331: 16 | C331: 1218200 | D331: 500 | E331: 2436400 | F331: 1 | G331: 0.006461 | H331: 0 | I331: 0.687027

Sheet: generic
A2: ## GenericObjectPool | B2: 1 | C2: 1010200 | D2: 500 | E2: 2020400 | F2: 1 | G2: 0.000435 | H2: 0 | I2: 0.164793
A3: ## GenericObjectPool | B3: 1 | C3: 1010700 | D3: 500 | E3: 2021400 | F3: 1 | G3: 0.000439 | H3: 0 | I3: 0.16608
A4: ## GenericObjectPool | B4: 1 | C4: 1009600 | D4: 500 | E4: 2019200 | F4: 1 | G4: 0.000432 | H4: 0 | I4: 0.167465
A5: ## GenericObjectPool | B5: 1 | C5: 1010300 | D5: 500 | E5: 2020600 | F5: 1 | G5: 0.000427 | H5: 0 | I5: 0.168677
A6: ## GenericObjectPool | B6: 1 | C6: 1008200 | D6: 500 | E6: 2016400 | F6: 1 | G6: 0.000427 | H6: 0 | I6: 0.17011
A7: ## GenericObjectPool | B7: 1 | C7: 1011800 | D7: 500 | E7: 2023600 | F7: 1 | G7: 0.000427 | H7: 0 | I7: 0.17106
A8: ## GenericObjectPool | B8: 1 | C8: 1013100 | D8: 500 | E8: 2026200 | F8: 1 | G8: 0.000434 | H8: 0 | I8: 0.172216
A9: ## GenericObjectPool | B9: 1 | C9: 1010600 | D9: 500 | E9: 2021200 | F9: 1 | G9: 0.000425 | H9: 0 | I9: 0.173658
A10: ## GenericObjectPool | B10: 1 | C10: 1010700 | D10: 500 | E10: 2021400 | F10: 1 | G10: 0.000426 | H10: 0 | I10: 0.174873
A11: ## GenericObjectPool | B11: 1 | C11: 1011200 | D11: 500 | E11: 2022400 | F11: 1 | G11: 0.000434 | H11: 0 | I11: 0.176067
A12: ## GenericObjectPool | B12: 1 | C12: 1004100 | D12: 500 | E12: 2008200 | F12: 1 | G12: 0.000423 | H12: 0 | I12: 0.164952
A13: ## GenericObjectPool | B13: 1 | C13: 1005200 | D13: 500 | E13: 2010400 | F13: 1 | G13: 0.000424 | H13: 0 | I13: 0.166142
A14: ## GenericObjectPool | B14: 1 | C14: 1006100 | D14: 500 | E14: 2012200 | F14: 1 | G14: 0.00044 | H14: 0 | I14: 0.167388
A15: ## GenericObjectPool | B15: 1 | C15: 1006100 | D15: 500 | E15: 2012200 | F15: 1 | G15: 0.000433 | H15: 0 | I15: 0.168678
A16: ## GenericObjectPool | B16: 1 | C16: 1005300 | D16: 500 | E16: 2010600 | F16: 1 | G16: 0.00044 | H16: 0 | I16: 0.170043
A17: ## GenericObjectPool | B17: 1 | C17: 1006600 | D17: 500 | E17: 2013200 | F17: 1 | G17: 0.000419 | H17: 0 | I17: 0.171162
A18: ## GenericObjectPool | B18: 1 | C18: 1006000 | D18: 500 | E18: 2012000 | F18: 1 | G18: 0.000419 | H18: 0 | I18: 0.172434
A19: ## GenericObjectPool | B19: 1 | C19: 1004700 | D19: 500 | E19: 2009400 | F19: 1 | G19: 0.00044 | H19: 0 | I19: 0.173815
A20: ## GenericObjectPool | B20: 1 | C20: 1005700 | D20: 500 | E20: 2011400 | F20: 1 | G20: 0.00043 | H20: 0 | I20: 0.174961
A21: ## GenericObjectPool | B21: 1 | C21: 1004100 | D21: 500 | E21: 2008200 | F21: 1 | G21: 0.000443 | H21: 0 | I21: 0.176361
A22: ## GenericObjectPool | B22: 1 | C22: 1009700 | D22: 500 | E22: 2019400 | F22: 1 | G22: 0.000433 | H22: 0 | I22: 0.164368
A23: ## GenericObjectPool | B23: 1 | C23: 1008800 | D23: 500 | E23: 2017600 | F23: 1 | G23: 0.000421 | H23: 0 | I23: 0.165717
A24: ## GenericObjectPool | B24: 1 | C24: 1010400 | D24: 500 | E24: 2020800 | F24: 1 | G24: 0.000434 | H24: 0 | I24: 0.166893
A25: ## GenericObjectPool | B25: 1 | C25: 1007200 | D25: 500 | E25: 2014400 | F25: 1 | G25: 0.000432 | H25: 0 | I25: 0.168444
A26: ## GenericObjectPool | B26: 1 | C26: 1008400 | D26: 500 | E26: 2016800 | F26: 1 | G26: 0.000424 | H26: 0 | I26: 0.1696
A27: ## GenericObjectPool | B27: 1 | C27: 1010600 | D27: 500 | E27: 2021200 | F27: 1 | G27: 0.000419 | H27: 0 | I27: 0.170646
A28: ## GenericObjectPool | B28: 1 | C28: 1009300 | D28: 500 | E28: 2018600 | F28: 1 | G28: 0.00044 | H28: 0 | I28: 0.172039
A29: ## GenericObjectPool | B29: 1 | C29: 1006300 | D29: 500 | E29: 2012600 | F29: 1 | G29: 0.000436 | H29: 0 | I29: 0.173557
A30: ## GenericObjectPool | B30: 1 | C30: 1010100 | D30: 500 | E30: 2020200 | F30: 1 | G30: 0.000433 | H30: 0 | I30: 0.174475
A31: ## GenericObjectPool | B31: 1 | C31: 1009700 | D31: 500 | E31: 2019400 | F31: 1 | G31: 0.00043 | H31: 0 | I31: 0.175736
A32: ## GenericObjectPool | B32: 2 | C32: 421700 | D32: 500 | E32: 843400 | F32: 1 | G32: 0.002269 | H32: 0 | I32: 0.378463
A33: ## GenericObjectPool | B33: 2 | C33: 422400 | D33: 500 | E33: 844800 | F33: 1 | G33: 0.002273 | H33: 0 | I33: 0.381142
A34: ## GenericObjectPool | B34: 2 | C34: 421400 | D34: 500 | E34: 842800 | F34: 1 | G34: 0.002288 | H34: 0 | I34: 0.38458
A35: ## GenericObjectPool | B35: 2 | C35: 421900 | D35: 500 | E35: 843800 | F35: 1 | G35: 0.002301 | H35: 0 | I35: 0.387334
A36: ## GenericObjectPool | B36: 2 | C36: 420800 | D36: 500 | E36: 841600 | F36: 1 | G36: 0.00225 | H36: 0 | I36: 0.390731
A37: ## GenericObjectPool | B37: 2 | C37: 423000 | D37: 500 | E37: 846000 | F37: 1 | G37: 0.002255 | H37: 0 | I37: 0.392597
A38: ## GenericObjectPool | B38: 2 | C38: 420900 | D38: 500 | E38: 841800 | F38: 1 | G38: 0.002271 | H38: 0 | I38: 0.39645
A39: ## GenericObjectPool | B39: 2 | C39: 424200 | D39: 500 | E39: 848400 | F39: 1 | G39: 0.002263 | H39: 0 | I39: 0.39776
A40: ## GenericObjectPool | B40: 2 | C40: 420700 | D40: 500 | E40: 841400 | F40: 1 | G40: 0.002268 | H40: 0 | I40: 0.40224
A41: ## GenericObjectPool | B41: 2 | C41: 419600 | D41: 500 | E41: 839200 | F41: 1 | G41: 0.002288 | H41: 0 | I41: 0.405597
A42: ## GenericObjectPool | B42: 2 | C42: 415300 | D42: 500 | E42: 830600 | F42: 1 | G42: 0.002309 | H42: 0 | I42: 0.381604
A43: ## GenericObjectPool | B43: 2 | C43: 419300 | D43: 500 | E43: 838600 | F43: 1 | G43: 0.00227 | H43: 0 | I43: 0.382758
A44: ## GenericObjectPool | B44: 2 | C44: 415700 | D44: 500 | E44: 831400 | F44: 1 | G44: 0.002305 | H44: 0 | I44: 0.387397
A45: ## GenericObjectPool | B45: 2 | C45: 417500 | D45: 500 | E45: 835000 | F45: 1 | G45: 0.002297 | H45: 0 | I45: 0.389521
A46: ## GenericObjectPool | B46: 2 | C46: 416900 | D46: 500 | E46: 833800 | F46: 1 | G46: 0.002281 | H46: 0 | I46: 0.392716
A47: ## GenericObjectPool | B47: 2 | C47: 417900 | D47: 500 | E47: 835800 | F47: 1 | G47: 0.002283 | H47: 0 | I47: 0.395145
A48: ## GenericObjectPool | B48: 2 | C48: 415100 | D48: 500 | E48: 830200 | F48: 1 | G48: 0.002332 | H48: 0 | I48: 0.399406
A49: ## GenericObjectPool | B49: 2 | C49: 414100 | D49: 500 | E49: 828200 | F49: 1 | G49: 0.002345 | H49: 0 | I49: 0.402809
A50: ## GenericObjectPool | B50: 2 | C50: 419300 | D50: 500 | E50: 838600 | F50: 1 | G50: 0.002285 | H50: 0 | I50: 0.403147
A51: ## GenericObjectPool | B51: 2 | C51: 413700 | D51: 500 | E51: 827400 | F51: 1 | G51: 0.002308 | H51: 0 | I51: 0.4087
A52: ## GenericObjectPool | B52: 2 | C52: 402700 | D52: 500 | E52: 805400 | F52: 1 | G52: 0.002374 | H52: 0 | I52: 0.387442
A53: ## GenericObjectPool | B53: 2 | C53: 401700 | D53: 500 | E53: 803400 | F53: 1 | G53: 0.00242 | H53: 0 | I53: 0.39103
A54: ## GenericObjectPool | B54: 2 | C54: 404300 | D54: 500 | E54: 808600 | F54: 1 | G54: 0.002372 | H54: 0 | I54: 0.392802
A55: ## GenericObjectPool | B55: 2 | C55: 400900 | D55: 500 | E55: 801800 | F55: 1 | G55: 0.002365 | H55: 0 | I55: 0.39745
A56: ## GenericObjectPool | B56: 2 | C56: 404700 | D56: 500 | E56: 809400 | F56: 1 | G56: 0.00236 | H56: 0 | I56: 0.398551
A57: ## GenericObjectPool | B57: 2 | C57: 415700 | D57: 500 | E57: 831400 | F57: 1 | G57: 0.002285 | H57: 0 | I57: 0.396138
A58: ## GenericObjectPool | B58: 2 | C58: 418400 | D58: 500 | E58: 836800 | F58: 1 | G58: 0.002263 | H58: 0 | I58: 0.397714
A59: ## GenericObjectPool | B59: 2 | C59: 417000 | D59: 500 | E59: 834000 | F59: 1 | G59: 0.002269 | H59: 0 | I59: 0.401218
A60: ## GenericObjectPool | B60: 2 | C60: 418100 | D60: 500 | E60: 836200 | F60: 1 | G60: 0.002301 | H60: 0 | I60: 0.40355
A61: ## GenericObjectPool | B61: 2 | C61: 420500 | D61: 500 | E61: 841000 | F61: 1 | G61: 0.002276 | H61: 0 | I61: 0.405215
A62: ## GenericObjectPool | B62: 3 | C62: 387400 | D62: 500 | E62: 774800 | F62: 1 | G62: 0.00374 | H62: 0 | I62: 0.4865
A63: ## GenericObjectPool | B63: 3 | C63: 388700 | D63: 500 | E63: 777400 | F63: 1 | G63: 0.003759 | H63: 0 | I63: 0.489539
A64: ## GenericObjectPool | B64: 3 | C64: 386400 | D64: 500 | E64: 772800 | F64: 1 | G64: 0.00376 | H64: 0 | I64: 0.494809
A65: ## GenericObjectPool | B65: 3 | C65: 388200 | D65: 500 | E65: 776400 | F65: 1 | G65: 0.003753 | H65: 0 | I65: 0.497447
A66: ## GenericObjectPool | B66: 3 | C66: 386500 | D66: 500 | E66: 773000 | F66: 1 | G66: 0.003772 | H66: 0 | I66: 0.502309
A67: ## GenericObjectPool | B67: 3 | C67: 387900 | D67: 500 | E67: 775800 | F67: 1 | G67: 0.003759 | H67: 0 | I67: 0.505136
A68: ## GenericObjectPool | B68: 3 | C68: 387400 | D68: 500 | E68: 774800 | F68: 1 | G68: 0.003766 | H68: 0 | I68: 0.509174
A69: ## GenericObjectPool | B69: 3 | C69: 387600 | D69: 500 | E69: 775200 | F69: 1 | G69: 0.003733 | H69: 0 | I69: 0.512696
A70: ## GenericObjectPool | B70: 3 | C70: 389100 | D70: 500 | E70: 778200 | F70: 1 | G70: 0.003724 | H70: 0 | I70: 0.515333
A71: ## GenericObjectPool | B71: 3 | C71: 387900 | D71: 500 | E71: 775800 | F71: 1 | G71: 0.003769 | H71: 0 | I71: 0.519768
A72: ## GenericObjectPool | B72: 3 | C72: 393500 | D72: 500 | E72: 787000 | F72: 1 | G72: 0.003715 | H72: 0 | I72: 0.482698
A73: ## GenericObjectPool | B73: 3 | C73: 390500 | D73: 500 | E73: 781000 | F73: 1 | G73: 0.003759 | H73: 0 | I73: 0.488412
A74: ## GenericObjectPool | B74: 3 | C74: 394900 | D74: 500 | E74: 789800 | F74: 1 | G74: 0.00369 | H74: 0 | I74: 0.489468
A75: ## GenericObjectPool | B75: 3 | C75: 392400 | D75: 500 | E75: 784800 | F75: 1 | G75: 0.003667 | H75: 0 | I75: 0.494745
A76: ## GenericObjectPool | B76: 3 | C76: 393700 | D76: 500 | E76: 787400 | F76: 1 | G76: 0.003706 | H76: 0 | I76: 0.497664
A77: ## GenericObjectPool | B77: 3 | C77: 392200 | D77: 500 | E77: 784400 | F77: 1 | G77: 0.003753 | H77: 0 | I77: 0.502364
A78: ## GenericObjectPool | B78: 3 | C78: 392400 | D78: 500 | E78: 784800 | F78: 1 | G78: 0.003726 | H78: 0 | I78: 0.505932
A79: ## GenericObjectPool | B79: 3 | C79: 391800 | D79: 500 | E79: 783600 | F79: 1 | G79: 0.003757 | H79: 0 | I79: 0.510016
A80: ## GenericObjectPool | B80: 3 | C80: 392600 | D80: 500 | E80: 785200 | F80: 1 | G80: 0.003719 | H80: 0 | I80: 0.513133
A81: ## GenericObjectPool | B81: 3 | C81: 391800 | D81: 500 | E81: 783600 | F81: 1 | G81: 0.003744 | H81: 0 | I81: 0.517288
A82: ## GenericObjectPool | B82: 3 | C82: 378700 | D82: 500 | E82: 757400 | F82: 1 | G82: 0.003821 | H82: 0 | I82: 0.492571
A83: ## GenericObjectPool | B83: 3 | C83: 379800 | D83: 500 | E83: 759600 | F83: 1 | G83: 0.003852 | H83: 0 | I83: 0.495757
A84: ## GenericObjectPool | B84: 3 | C84: 380100 | D84: 500 | E84: 760200 | F84: 1 | G84: 0.003833 | H84: 0 | I84: 0.499414
A85: ## GenericObjectPool | B85: 3 | C85: 377900 | D85: 500 | E85: 755800 | F85: 1 | G85: 0.003874 | H85: 0 | I85: 0.504718
A86: ## GenericObjectPool | B86: 3 | C86: 378400 | D86: 500 | E86: 756800 | F86: 1 | G86: 0.003835 | H86: 0 | I86: 0.508172
A87: ## GenericObjectPool | B87: 3 | C87: 380500 | D87: 500 | E87: 761000 | F87: 1 | G87: 0.003832 | H87: 0 | I87: 0.510534
A88: ## GenericObjectPool | B88: 3 | C88: 379700 | D88: 500 | E88: 759400 | F88: 1 | G88: 0.003861 | H88: 0 | I88: 0.514835
A89: ## GenericObjectPool | B89: 3 | C89: 379200 | D89: 500 | E89: 758400 | F89: 1 | G89: 0.003837 | H89: 0 | I89: 0.518885
A90: ## GenericObjectPool | B90: 3 | C90: 376100 | D90: 500 | E90: 752200 | F90: 1 | G90: 0.003858 | H90: 0 | I90: 0.524708
A91: ## GenericObjectPool | B91: 3 | C91: 380600 | D91: 500 | E91: 761200 | F91: 1 | G91: 0.003818 | H91: 0 | I91: 0.525244
A92: ## GenericObjectPool | B92: 4 | C92: 385000 | D92: 500 | E92: 770000 | F92: 1 | G92: 0.005078 | H92: 0 | I92: 0.593769
A93: ## GenericObjectPool | B93: 4 | C93: 385600 | D93: 500 | E93: 771200 | F93: 1 | G93: 0.005073 | H93: 0 | I93: 0.597566
A94: ## GenericObjectPool | B94: 4 | C94: 385800 | D94: 500 | E94: 771600 | F94: 1 | G94: 0.005086 | H94: 0 | I94: 0.601652
A95: ## GenericObjectPool | B95: 4 | C95: 385900 | D95: 500 | E95: 771800 | F95: 1 | G95: 0.005069 | H95: 0 | I95: 0.605773
A96: ## GenericObjectPool | B96: 4 | C96: 387100 | D96: 500 | E96: 774200 | F96: 1 | G96: 0.005035 | H96: 0 | I96: 0.608981
A97: ## GenericObjectPool | B97: 4 | C97: 384500 | D97: 500 | E97: 769000 | F97: 1 | G97: 0.0051 | H97: 0 | I97: 0.615196
A98: ## GenericObjectPool | B98: 4 | C98: 386200 | D98: 500 | E98: 772400 | F98: 1 | G98: 0.005091 | H98: 0 | I98: 0.617973
A99: ## GenericObjectPool | B99: 4 | C99: 386900 | D99: 500 | E99: 773800 | F99: 1 | G99: 0.005074 | H99: 0 | I99: 0.621509
A100: ## GenericObjectPool | B100: 4 | C100: 387100 | D100: 500 | E100: 774200 | F100: 1 | G100: 0.00505 | H100: 0 | I100: 0.625399
A101: ## GenericObjectPool | B101: 4 | C101: 386500 | D101: 500 | E101: 773000 | F101: 1 | G101: 0.005071 | H101: 0 | I101: 0.629922
A102: ## GenericObjectPool | B102: 4 | C102: 395200 | D102: 500 | E102: 790400 | F102: 1 | G102: 0.004942 | H102: 0 | I102: 0.569365
A103: ## GenericObjectPool | B103: 4 | C103: 393200 | D103: 500 | E103: 786400 | F103: 1 | G103: 0.004952 | H103: 0 | I103: 0.575132
A104: ## GenericObjectPool | B104: 4 | C104: 392400 | D104: 500 | E104: 784800 | F104: 1 | G104: 0.004995 | H104: 0 | I104: 0.580039
A105: ## GenericObjectPool | B105: 4 | C105: 393900 | D105: 500 | E105: 787800 | F105: 1 | G105: 0.004961 | H105: 0 | I105: 0.583203
A106: ## GenericObjectPool | B106: 4 | C106: 387700 | D106: 500 | E106: 775400 | F106: 1 | G106: 0.00504 | H106: 0 | I106: 0.592118
A107: ## GenericObjectPool | B107: 4 | C107: 393700 | D107: 500 | E107: 787400 | F107: 1 | G107: 0.004958 | H107: 0 | I107: 0.591793
A108: ## GenericObjectPool | B108: 4 | C108: 391900 | D108: 500 | E108: 783800 | F108: 1 | G108: 0.004983 | H108: 0 | I108: 0.597337
A109: ## GenericObjectPool | B109: 4 | C109: 394500 | D109: 500 | E109: 789000 | F109: 1 | G109: 0.00494 | H109: 0 | I109: 0.5995
A110: ## GenericObjectPool | B110: 4 | C110: 394500 | D110: 500 | E110: 789000 | F110: 1 | G110: 0.004953 | H110: 0 | I110: 0.603617
A111: ## GenericObjectPool | B111: 4 | C111: 393700 | D111: 500 | E111: 787400 | F111: 1 | G111: 0.00495 | H111: 0 | I111: 0.608312
A112: ## GenericObjectPool | B112: 4 | C112: 391400 | D112: 500 | E112: 782800 | F112: 1 | G112: 0.005015 | H112: 0 | I112: 0.576532
A113: ## GenericObjectPool | B113: 4 | C113: 391800 | D113: 500 | E113: 783600 | F113: 1 | G113: 0.005003 | H113: 0 | I113: 0.580562
A114: ## GenericObjectPool | B114: 4 | C114: 392600 | D114: 500 | E114: 785200 | F114: 1 | G114: 0.005 | H114: 0 | I114: 0.584265
A115: ## GenericObjectPool | B115: 4 | C115: 392600 | D115: 500 | E115: 785200 | F115: 1 | G115: 0.004977 | H115: 0 | I115: 0.588509
A116: ## GenericObjectPool | B116: 4 | C116: 393800 | D116: 500 | E116: 787600 | F116: 1 | G116: 0.004937 | H116: 0 | I116: 0.591798
A117: ## GenericObjectPool | B117: 4 | C117: 390800 | D117: 500 | E117: 781600 | F117: 1 | G117: 0.005003 | H117: 0 | I117: 0.59826
A118: ## GenericObjectPool | B118: 4 | C118: 392800 | D118: 500 | E118: 785600 | F118: 1 | G118: 0.004924 | H118: 0 | I118: 0.600847
A119: ## GenericObjectPool | B119: 4 | C119: 389000 | D119: 500 | E119: 778000 | F119: 1 | G119: 0.005054 | H119: 0 | I119: 0.607945
A120: ## GenericObjectPool | B120: 4 | C120: 392700 | D120: 500 | E120: 785400 | F120: 1 | G120: 0.004981 | H120: 0 | I120: 0.609176
A121: ## GenericObjectPool | B121: 4 | C121: 390600 | D121: 500 | E121: 781200 | F121: 1 | G121: 0.005036 | H121: 0 | I121: 0.61492
A122: ## GenericObjectPool | B122: 5 | C122: 370400 | D122: 500 | E122: 740800 | F122: 1 | G122: 0.00665 | H122: 0 | I122: 0.647089
A123: ## GenericObjectPool | B123: 5 | C123: 370300 | D123: 500 | E123: 740600 | F123: 1 | G123: 0.006595 | H123: 0 | I123: 0.652252
A124: ## GenericObjectPool | B124: 5 | C124: 369100 | D124: 500 | E124: 738200 | F124: 1 | G124: 0.006646 | H124: 0 | I124: 0.658378
A125: ## GenericObjectPool | B125: 5 | C125: 370600 | D125: 500 | E125: 741200 | F125: 1 | G125: 0.006624 | H125: 0 | I125: 0.662066
A126: ## GenericObjectPool | B126: 5 | C126: 369600 | D126: 500 | E126: 739200 | F126: 1 | G126: 0.006656 | H126: 0 | I126: 0.667962
A127: ## GenericObjectPool | B127: 5 | C127: 370400 | D127: 500 | E127: 740800 | F127: 1 | G127: 0.006639 | H127: 0 | I127: 0.672197
A128: ## GenericObjectPool | B128: 5 | C128: 370800 | D128: 500 | E128: 741600 | F128: 1 | G128: 0.006632 | H128: 0 | I128: 0.676752
A129: ## GenericObjectPool | B129: 5 | C129: 371300 | D129: 500 | E129: 742600 | F129: 1 | G129: 0.006636 | H129: 0 | I129: 0.681184
A130: ## GenericObjectPool | B130: 5 | C130: 370500 | D130: 500 | E130: 741000 | F130: 1 | G130: 0.006634 | H130: 0 | I130: 0.686767
A131: ## GenericObjectPool | B131: 5 | C131: 369600 | D131: 500 | E131: 739200 | F131: 1 | G131: 0.006631 | H131: 0 | I131: 0.692408
A132: ## GenericObjectPool | B132: 5 | C132: 406100 | D132: 500 | E132: 812200 | F132: 1 | G132: 0.00605 | H132: 0 | I132: 0.618085
A133: ## GenericObjectPool | B133: 5 | C133: 405800 | D133: 500 | E133: 811600 | F133: 1 | G133: 0.006033 | H133: 0 | I133: 0.623173
A134: ## GenericObjectPool | B134: 5 | C134: 405100 | D134: 500 | E134: 810200 | F134: 1 | G134: 0.006065 | H134: 0 | I134: 0.628554
A135: ## GenericObjectPool | B135: 5 | C135: 406000 | D135: 500 | E135: 812000 | F135: 1 | G135: 0.006067 | H135: 0 | I135: 0.63267
A136: ## GenericObjectPool | B136: 5 | C136: 405900 | D136: 500 | E136: 811800 | F136: 1 | G136: 0.00607 | H136: 0 | I136: 0.637527
A137: ## GenericObjectPool | B137: 5 | C137: 405300 | D137: 500 | E137: 810600 | F137: 1 | G137: 0.006079 | H137: 0 | I137: 0.642745
A138: ## GenericObjectPool | B138: 5 | C138: 405300 | D138: 500 | E138: 810600 | F138: 1 | G138: 0.00606 | H138: 0 | I138: 0.647442
A139: ## GenericObjectPool | B139: 5 | C139: 412600 | D139: 500 | E139: 825200 | F139: 7 | G139: 0.005991 | H139: 0 | I139: 0.646655
A140: ## GenericObjectPool | B140: 5 | C140: 407400 | D140: 500 | E140: 814800 | F140: 1 | G140: 0.006033 | H140: 0 | I140: 0.655388
A141: ## GenericObjectPool | B141: 5 | C141: 405500 | D141: 500 | E141: 811000 | F141: 1 | G141: 0.006079 | H141: 0 | I141: 0.661532
A142: ## GenericObjectPool | B142: 5 | C142: 392700 | D142: 500 | E142: 785400 | F142: 1 | G142: 0.006257 | H142: 0 | I142: 0.628379
A143: ## GenericObjectPool | B143: 5 | C143: 390500 | D143: 500 | E143: 781000 | F143: 1 | G143: 0.006287 | H143: 0 | I143: 0.635115
A144: ## GenericObjectPool | B144: 5 | C144: 391200 | D144: 500 | E144: 782400 | F144: 1 | G144: 0.006276 | H144: 0 | I144: 0.639473
A145: ## GenericObjectPool | B145: 5 | C145: 390000 | D145: 500 | E145: 780000 | F145: 1 | G145: 0.006274 | H145: 0 | I145: 0.645336
A146: ## GenericObjectPool | B146: 5 | C146: 390200 | D146: 500 | E146: 780400 | F146: 1 | G146: 0.006287 | H146: 0 | I146: 0.650024
A147: ## GenericObjectPool | B147: 5 | C147: 391800 | D147: 500 | E147: 783600 | F147: 1 | G147: 0.006276 | H147: 0 | I147: 0.653515
A148: ## GenericObjectPool | B148: 5 | C148: 391000 | D148: 500 | E148: 782000 | F148: 1 | G148: 0.006281 | H148: 0 | I148: 0.658966
A149: ## GenericObjectPool | B149: 5 | C149: 391100 | D149: 500 | E149: 782200 | F149: 1 | G149: 0.00629 | H149: 0 | I149: 0.663638
A150: ## GenericObjectPool | B150: 5 | C150: 391900 | D150: 500 | E150: 783800 | F150: 1 | G150: 0.006277 | H150: 0 | I150: 0.667678
A151: ## GenericObjectPool | B151: 5 | C151: 390700 | D151: 500 | E151: 781400 | F151: 1 | G151: 0.006299 | H151: 0 | I151: 0.673396
A152: ## GenericObjectPool | B152: 6 | C152: 400700 | D152: 500 | E152: 801400 | F152: 1 | G152: 0.007362 | H152: 0 | I152: 0.681202
A153: ## GenericObjectPool | B153: 6 | C153: 400400 | D153: 500 | E153: 800800 | F153: 1 | G153: 0.007363 | H153: 0 | I153: 0.686838
A154: ## GenericObjectPool | B154: 6 | C154: 404300 | D154: 500 | E154: 808600 | F154: 1 | G154: 0.007297 | H154: 0 | I154: 0.688834
A155: ## GenericObjectPool | B155: 6 | C155: 401800 | D155: 500 | E155: 803600 | F155: 1 | G155: 0.007344 | H155: 0 | I155: 0.696268
A156: ## GenericObjectPool | B156: 6 | C156: 398300 | D156: 500 | E156: 796600 | F156: 1 | G156: 0.007424 | H156: 0 | I156: 0.704608
A157: ## GenericObjectPool | B157: 6 | C157: 398600 | D157: 500 | E157: 797200 | F157: 1 | G157: 0.007383 | H157: 0 | I157: 0.709565
A158: ## GenericObjectPool | B158: 6 | C158: 401800 | D158: 500 | E158: 803600 | F158: 1 | G158: 0.007374 | H158: 0 | I158: 0.711932
A159: ## GenericObjectPool | B159: 6 | C159: 402600 | D159: 500 | E159: 805200 | F159: 2 | G159: 0.007327 | H159: 0 | I159: 0.716375
A160: ## GenericObjectPool | B160: 6 | C160: 401500 | D160: 500 | E160: 803000 | F160: 1 | G160: 0.00737 | H160: 0 | I160: 0.722474
A161: ## GenericObjectPool | B161: 6 | C161: 401100 | D161: 500 | E161: 802200 | F161: 1 | G161: 0.007357 | H161: 0 | I161: 0.727905
A162: ## GenericObjectPool | B162: 6 | C162: 387300 | D162: 500 | E162: 774600 | F162: 1 | G162: 0.007622 | H162: 0 | I162: 0.694147
A163: ## GenericObjectPool | B163: 6 | C163: 386000 | D163: 500 | E163: 772000 | F163: 1 | G163: 0.007637 | H163: 0 | I163: 0.700785
A164: ## GenericObjectPool | B164: 6 | C164: 387200 | D164: 500 | E164: 774400 | F164: 1 | G164: 0.007624 | H164: 0 | I164: 0.705125
A165: ## GenericObjectPool | B165: 6 | C165: 386600 | D165: 500 | E165: 773200 | F165: 1 | G165: 0.007625 | H165: 0 | I165: 0.711055
A166: ## GenericObjectPool | B166: 6 | C166: 385500 | D166: 500 | E166: 771000 | F166: 1 | G166: 0.007652 | H166: 0 | I166: 0.717422
A167: ## GenericObjectPool | B167: 6 | C167: 384900 | D167: 500 | E167: 769800 | F167: 1 | G167: 0.007683 | H167: 0 | I167: 0.723311
A168: ## GenericObjectPool | B168: 6 | C168: 387100 | D168: 500 | E168: 774200 | F168: 1 | G168: 0.007649 | H168: 0 | I168: 0.726536
A169: ## GenericObjectPool | B169: 6 | C169: 388200 | D169: 500 | E169: 776400 | F169: 1 | G169: 0.007586 | H169: 0 | I169: 0.730716
A170: ## GenericObjectPool | B170: 6 | C170: 387600 | D170: 500 | E170: 775200 | F170: 1 | G170: 0.007647 | H170: 0 | I170: 0.736491
A171: ## GenericObjectPool | B171: 6 | C171: 385900 | D171: 500 | E171: 771800 | F171: 1 | G171: 0.007657 | H171: 0 | I171: 0.74328
A172: ## GenericObjectPool | B172: 6 | C172: 395400 | D172: 500 | E172: 790800 | F172: 1 | G172: 0.007446 | H172: 0 | I172: 0.687398
A173: ## GenericObjectPool | B173: 6 | C173: 395400 | D173: 500 | E173: 790800 | F173: 1 | G173: 0.007476 | H173: 0 | I173: 0.692815
A174: ## GenericObjectPool | B174: 6 | C174: 394300 | D174: 500 | E174: 788600 | F174: 1 | G174: 0.007512 | H174: 0 | I174: 0.699173
A175: ## GenericObjectPool | B175: 6 | C175: 396200 | D175: 500 | E175: 792400 | F175: 1 | G175: 0.007494 | H175: 0 | I175: 0.702846
A176: ## GenericObjectPool | B176: 6 | C176: 379500 | D176: 500 | E176: 759000 | F176: 1 | G176: 0.00781 | H176: 0 | I176: 0.72356
A177: ## GenericObjectPool | B177: 6 | C177: 379300 | D177: 500 | E177: 758600 | F177: 1 | G177: 0.007772 | H177: 0 | I177: 0.7291
A178: ## GenericObjectPool | B178: 6 | C178: 378600 | D178: 500 | E178: 757200 | F178: 1 | G178: 0.007824 | H178: 0 | I178: 0.735114
A179: ## GenericObjectPool | B179: 6 | C179: 378000 | D179: 500 | E179: 756000 | F179: 1 | G179: 0.007817 | H179: 0 | I179: 0.740992
A180: ## GenericObjectPool | B180: 6 | C180: 376700 | D180: 500 | E180: 753400 | F180: 1 | G180: 0.007863 | H180: 0 | I180: 0.747547
A181: ## GenericObjectPool | B181: 6 | C181: 379100 | D181: 500 | E181: 758200 | F181: 1 | G181: 0.007813 | H181: 0 | I181: 0.750401
A182: ## GenericObjectPool | B182: 8 | C182: 381600 | D182: 500 | E182: 763200 | F182: 1 | G182: 0.010356 | H182: 0 | I182: 0.809203
A183: ## GenericObjectPool | B183: 8 | C183: 384000 | D183: 500 | E183: 768000 | F183: 1 | G183: 0.010315 | H183: 0 | I183: 0.813039
A184: ## GenericObjectPool | B184: 8 | C184: 381800 | D184: 500 | E184: 763600 | F184: 1 | G184: 0.010354 | H184: 0 | I184: 0.821702
A185: ## GenericObjectPool | B185: 8 | C185: 383900 | D185: 500 | E185: 767800 | F185: 1 | G185: 0.010323 | H185: 0 | I185: 0.825726
A186: ## GenericObjectPool | B186: 8 | C186: 382400 | D186: 500 | E186: 764800 | F186: 1 | G186: 0.010335 | H186: 0 | I186: 0.833566
A187: ## GenericObjectPool | B187: 8 | C187: 383200 | D187: 500 | E187: 766400 | F187: 1 | G187: 0.010287 | H187: 0 | I187: 0.838851
A188: ## GenericObjectPool | B188: 8 | C188: 383300 | D188: 500 | E188: 766600 | F188: 1 | G188: 0.010277 | H188: 0 | I188: 0.844845
A189: ## GenericObjectPool | B189: 8 | C189: 384500 | D189: 500 | E189: 769000 | F189: 3 | G189: 0.010255 | H189: 0 | I189: 0.849616
A190: ## GenericObjectPool | B190: 8 | C190: 382600 | D190: 500 | E190: 765200 | F190: 1 | G190: 0.010319 | H190: 0 | I190: 0.857759
A191: ## GenericObjectPool | B191: 8 | C191: 382600 | D191: 500 | E191: 765200 | F191: 1 | G191: 0.010355 | H191: 0 | I191: 0.863774
A192: ## GenericObjectPool | B192: 8 | C192: 409500 | D192: 500 | E192: 819000 | F192: 1 | G192: 0.009658 | H192: 0 | I192: 0.82758
A193: ## GenericObjectPool | B193: 8 | C193: 409600 | D193: 500 | E193: 819200 | F193: 1 | G193: 0.00968 | H193: 0 | I193: 0.833307
A194: ## GenericObjectPool | B194: 8 | C194: 410300 | D194: 500 | E194: 820600 | F194: 1 | G194: 0.009625 | H194: 0 | I194: 0.838357
A195: ## GenericObjectPool | B195: 8 | C195: 410100 | D195: 500 | E195: 820200 | F195: 1 | G195: 0.009632 | H195: 0 | I195: 0.844284
A196: ## GenericObjectPool | B196: 8 | C196: 410700 | D196: 500 | E196: 821400 | F196: 1 | G196: 0.009627 | H196: 0 | I196: 0.849354
A197: ## GenericObjectPool | B197: 8 | C197: 411800 | D197: 500 | E197: 823600 | F197: 1 | G197: 0.009599 | H197: 0 | I197: 0.853859
A198: ## GenericObjectPool | B198: 8 | C198: 410200 | D198: 500 | E198: 820400 | F198: 1 | G198: 0.009617 | H198: 0 | I198: 0.861125
A199: ## GenericObjectPool | B199: 8 | C199: 409300 | D199: 500 | E199: 818600 | F199: 1 | G199: 0.00966 | H199: 0 | I199: 0.867656
A200: ## GenericObjectPool | B200: 8 | C200: 411200 | D200: 500 | E200: 822400 | F200: 1 | G200: 0.009628 | H200: 0 | I200: 0.871192
A201: ## GenericObjectPool | B201: 8 | C201: 411000 | D201: 500 | E201: 822000 | F201: 1 | G201: 0.00962 | H201: 0 | I201: 0.876907
A202: ## GenericObjectPool | B202: 8 | C202: 402700 | D202: 500 | E202: 805400 | F202: 1 | G202: 0.009799 | H202: 0 | I202: 0.809816
A203: ## GenericObjectPool | B203: 8 | C203: 405300 | D203: 500 | E203: 810600 | F203: 2 | G203: 0.009748 | H203: 0 | I203: 0.813251
A204: ## GenericObjectPool | B204: 8 | C204: 402000 | D204: 500 | E204: 804000 | F204: 1 | G204: 0.009831 | H204: 0 | I204: 0.82258
A205: ## GenericObjectPool | B205: 8 | C205: 404400 | D205: 500 | E205: 808800 | F205: 1 | G205: 0.009763 | H205: 0 | I205: 0.826066
A206: ## GenericObjectPool | B206: 8 | C206: 402600 | D206: 500 | E206: 805200 | F206: 1 | G206: 0.009804 | H206: 0 | I206: 0.83381
A207: ## GenericObjectPool | B207: 8 | C207: 403200 | D207: 500 | E207: 806400 | F207: 1 | G207: 0.009804 | H207: 0 | I207: 0.839052
A208: ## GenericObjectPool | B208: 8 | C208: 402000 | D208: 500 | E208: 804000 | F208: 1 | G208: 0.009861 | H208: 0 | I208: 0.84615
A209: ## GenericObjectPool | B209: 8 | C209: 403000 | D209: 500 | E209: 806000 | F209: 1 | G209: 0.009772 | H209: 0 | I209: 0.850862
A210: ## GenericObjectPool | B210: 8 | C210: 402400 | D210: 500 | E210: 804800 | F210: 1 | G210: 0.009786 | H210: 0 | I210: 0.857224
A211: ## GenericObjectPool | B211: 8 | C211: 404000 | D211: 500 | E211: 808000 | F211: 1 | G211: 0.00976 | H211: 0 | I211: 0.86121
A212: ## GenericObjectPool | B212: 10 | C212: 367000 | D212: 500 | E212: 734000 | F212: 1 | G212: 0.01349 | H212: 0 | I212: 0.922529
A213: ## GenericObjectPool | B213: 10 | C213: 366600 | D213: 500 | E213: 733200 | F213: 1 | G213: 0.013511 | H213: 0 | I213: 0.930322
A214: ## GenericObjectPool | B214: 10 | C214: 367400 | D214: 500 | E214: 734800 | F214: 1 | G214: 0.013484 | H214: 0 | I214: 0.936536
A215: ## GenericObjectPool | B215: 10 | C215: 367000 | D215: 500 | E215: 734000 | F215: 1 | G215: 0.013471 | H215: 0 | I215: 0.944207
A216: ## GenericObjectPool | B216: 10 | C216: 365200 | D216: 500 | E216: 730400 | F216: 1 | G216: 0.013535 | H216: 0 | I216: 0.953654
A217: ## GenericObjectPool | B217: 10 | C217: 366600 | D217: 500 | E217: 733200 | F217: 1 | G217: 0.013543 | H217: 0 | I217: 0.958919
A218: ## GenericObjectPool | B218: 10 | C218: 365700 | D218: 500 | E218: 731400 | F218: 1 | G218: 0.013577 | H218: 0 | I218: 0.967142
A219: ## GenericObjectPool | B219: 10 | C219: 367300 | D219: 500 | E219: 734600 | F219: 1 | G219: 0.013482 | H219: 0 | I219: 0.971995
A220: ## GenericObjectPool | B220: 10 | C220: 366700 | D220: 500 | E220: 733400 | F220: 1 | G220: 0.013526 | H220: 0 | I220: 0.979716
A221: ## GenericObjectPool | B221: 10 | C221: 366300 | D221: 500 | E221: 732600 | F221: 1 | G221: 0.013508 | H221: 0 | I221: 0.987118
A222: ## GenericObjectPool | B222: 10 | C222: 388800 | D222: 500 | E222: 777600 | F222: 1 | G222: 0.012737 | H222: 0 | I222: 0.898176
A223: ## GenericObjectPool | B223: 10 | C223: 387000 | D223: 500 | E223: 774000 | F223: 1 | G223: 0.012809 | H223: 0 | I223: 0.907348
A224: ## GenericObjectPool | B224: 10 | C224: 387400 | D224: 500 | E224: 774800 | F224: 1 | G224: 0.012785 | H224: 0 | I224: 0.913902
A225: ## GenericObjectPool | B225: 10 | C225: 389800 | D225: 500 | E225: 779600 | F225: 1 | G225: 0.012719 | H225: 0 | I225: 0.918038
A226: ## GenericObjectPool | B226: 10 | C226: 387300 | D226: 500 | E226: 774600 | F226: 1 | G226: 0.012791 | H226: 0 | I226: 0.927914
A227: ## GenericObjectPool | B227: 10 | C227: 388300 | D227: 500 | E227: 776600 | F227: 1 | G227: 0.01273 | H227: 0 | I227: 0.933562
A228: ## GenericObjectPool | B228: 10 | C228: 385700 | D228: 500 | E228: 771400 | F228: 1 | G228: 0.012836 | H228: 0 | I228: 0.943529
A229: ## GenericObjectPool | B229: 10 | C229: 389100 | D229: 500 | E229: 778200 | F229: 2 | G229: 0.012709 | H229: 0 | I229: 0.946163
A230: ## GenericObjectPool | B230: 10 | C230: 387100 | D230: 500 | E230: 774200 | F230: 1 | G230: 0.012787 | H230: 0 | I230: 0.95532
A231: ## GenericObjectPool | B231: 10 | C231: 388200 | D231: 500 | E231: 776400 | F231: 1 | G231: 0.012764 | H231: 0 | I231: 0.960633
A232: ## GenericObjectPool | B232: 10 | C232: 383800 | D232: 500 | E232: 767600 | F232: 1 | G232: 0.012903 | H232: 0 | I232: 0.981983
A233: ## GenericObjectPool | B233: 10 | C233: 384000 | D233: 500 | E233: 768000 | F233: 1 | G233: 0.012891 | H233: 0 | I233: 0.988271
A234: ## GenericObjectPool | B234: 10 | C234: 382700 | D234: 500 | E234: 765400 | F234: 1 | G234: 0.012934 | H234: 0 | I234: 0.99646
A235: ## GenericObjectPool | B235: 10 | C235: 380700 | D235: 500 | E235: 761400 | F235: 4 | G235: 0.012987 | H235: 0 | I235: 1.005708
A236: ## GenericObjectPool | B236: 10 | C236: 382400 | D236: 500 | E236: 764800 | F236: 1 | G236: 0.012958 | H236: 0 | I236: 1.009906
A237: ## GenericObjectPool | B237: 10 | C237: 384400 | D237: 500 | E237: 768800 | F237: 1 | G237: 0.012888 | H237: 0 | I237: 1.013653
A238: ## GenericObjectPool | B238: 10 | C238: 384900 | D238: 500 | E238: 769800 | F238: 1 | G238: 0.012915 | H238: 0 | I238: 1.019349
A239: ## GenericObjectPool | B239: 10 | C239: 384300 | D239: 500 | E239: 768600 | F239: 1 | G239: 0.012868 | H239: 0 | I239: 1.026432
A240: ## GenericObjectPool | B240: 10 | C240: 384400 | D240: 500 | E240: 768800 | F240: 1 | G240: 0.012849 | H240: 0 | I240: 1.03254
A241: ## GenericObjectPool | B241: 10 | C241: 385000 | D241: 500 | E241: 770000 | F241: 1 | G241: 0.012881 | H241: 0 | I241: 1.037958
A242: ## GenericObjectPool | B242: 12 | C242: 337200 | D242: 500 | E242: 674400 | F242: 2 | G242: 0.017654 | H242: 0 | I242: 1.069857
A243: ## GenericObjectPool | B243: 12 | C243: 335000 | D243: 500 | E243: 670000 | F243: 1 | G243: 0.017767 | H243: 0 | I243: 1.081608
A244: ## GenericObjectPool | B244: 12 | C244: 336800 | D244: 501 | E244: 672255 | F244: 1 | G244: 0.01772 | H244: 0 | I244: 1.086896
A245: ## GenericObjectPool | B245: 12 | C245: 336000 | D245: 500 | E245: 672000 | F245: 1 | G245: 0.017729 | H245: 0 | I245: 1.096305
A246: ## GenericObjectPool | B246: 12 | C246: 333800 | D246: 500 | E246: 667600 | F246: 1 | G246: 0.017852 | H246: 0 | I246: 1.107996
A247: ## GenericObjectPool | B247: 12 | C247: 333900 | D247: 500 | E247: 667800 | F247: 1 | G247: 0.017781 | H247: 0 | I247: 1.115828
A248: ## GenericObjectPool | B248: 12 | C248: 336900 | D248: 501 | E248: 672455 | F248: 1 | G248: 0.017679 | H248: 0 | I248: 1.118778
A249: ## GenericObjectPool | B249: 12 | C249: 336100 | D249: 500 | E249: 672200 | F249: 1 | G249: 0.017751 | H249: 0 | I249: 1.128004
A250: ## GenericObjectPool | B250: 12 | C250: 336300 | D250: 500 | E250: 672600 | F250: 1 | G250: 0.017696 | H250: 0 | I250: 1.135488
A251: ## GenericObjectPool | B251: 12 | C251: 334800 | D251: 500 | E251: 669600 | F251: 2 | G251: 0.017808 | H251: 0 | I251: 1.145827
A252: ## GenericObjectPool | B252: 12 | C252: 330300 | D252: 500 | E252: 660600 | F252: 2 | G252: 0.018065 | H252: 0 | I252: 1.06855
A253: ## GenericObjectPool | B253: 12 | C253: 326800 | D253: 500 | E253: 653600 | F253: 2 | G253: 0.018188 | H253: 0 | I253: 1.0827
A254: ## GenericObjectPool | B254: 12 | C254: 325600 | D254: 501 | E254: 649900 | F254: 2 | G254: 0.018277 | H254: 0 | I254: 1.093088
A255: ## GenericObjectPool | B255: 12 | C255: 326300 | D255: 500 | E255: 652600 | F255: 1 | G255: 0.018244 | H255: 0 | I255: 1.100237
A256: ## GenericObjectPool | B256: 12 | C256: 327400 | D256: 501 | E256: 653493 | F256: 2 | G256: 0.018253 | H256: 0 | I256: 1.106689
A257: ## GenericObjectPool | B257: 12 | C257: 330200 | D257: 500 | E257: 660400 | F257: 1 | G257: 0.018022 | H257: 0 | I257: 1.110137
A258: ## GenericObjectPool | B258: 12 | C258: 324800 | D258: 500 | E258: 649600 | F258: 2 | G258: 0.018347 | H258: 0 | I258: 1.127493
A259: ## GenericObjectPool | B259: 12 | C259: 330600 | D259: 500 | E259: 661200 | F259: 2 | G259: 0.018007 | H259: 0 | I259: 1.125594
A260: ## GenericObjectPool | B260: 12 | C260: 327300 | D260: 500 | E260: 654600 | F260: 1 | G260: 0.018213 | H260: 0 | I260: 1.139274
A261: ## GenericObjectPool | B261: 12 | C261: 328400 | D261: 500 | E261: 656800 | F261: 1 | G261: 0.018136 | H261: 0 | I261: 1.14531
A262: ## GenericObjectPool | B262: 12 | C262: 342100 | D262: 500 | E262: 684200 | F262: 2 | G262: 0.017404 | H262: 0 | I262: 1.054798
A263: ## GenericObjectPool | B263: 12 | C263: 342200 | D263: 501 | E263: 683034 | F263: 2 | G263: 0.01744 | H263: 0 | I263: 1.062883
A264: ## GenericObjectPool | B264: 12 | C264: 340800 | D264: 500 | E264: 681600 | F264: 1 | G264: 0.017468 | H264: 0 | I264: 1.073233
A265: ## GenericObjectPool | B265: 12 | C265: 342600 | D265: 501 | E265: 683832 | F265: 2 | G265: 0.017391 | H265: 0 | I265: 1.078511
A266: ## GenericObjectPool | B266: 12 | C266: 339500 | D266: 500 | E266: 679000 | F266: 2 | G266: 0.017541 | H266: 0 | I266: 1.091493
A267: ## GenericObjectPool | B267: 12 | C267: 340300 | D267: 500 | E267: 680600 | F267: 1 | G267: 0.017505 | H267: 0 | I267: 1.098208
A268: ## GenericObjectPool | B268: 12 | C268: 326900 | D268: 501 | E268: 652495 | F268: 2 | G268: 0.018238 | H268: 0 | I268: 1.128607
A269: ## GenericObjectPool | B269: 12 | C269: 327800 | D269: 500 | E269: 655600 | F269: 1 | G269: 0.018145 | H269: 0 | I269: 1.135079
A270: ## GenericObjectPool | B270: 12 | C270: 327400 | D270: 500 | E270: 654800 | F270: 1 | G270: 0.018152 | H270: 0 | I270: 1.143736
A271: ## GenericObjectPool | B271: 12 | C271: 325800 | D271: 501 | E271: 650299 | F271: 2 | G271: 0.018238 | H271: 0 | I271: 1.154469
A272: ## GenericObjectPool | B272: 14 | C272: 229700 | D272: 501 | E272: 458483 | F272: 3 | G272: 0.030392 | H272: 0 | I272: 1.39808
A273: ## GenericObjectPool | B273: 14 | C273: 224200 | D273: 501 | E273: 447505 | F273: 3 | G273: 0.031169 | H273: 0 | I273: 1.426261
A274: ## GenericObjectPool | B274: 14 | C274: 227400 | D274: 502 | E274: 452988 | F274: 3 | G274: 0.030761 | H274: 0 | I274: 1.427244
A275: ## GenericObjectPool | B275: 14 | C275: 229500 | D275: 501 | E275: 458084 | F275: 3 | G275: 0.030318 | H275: 0 | I275: 1.431546
A276: ## GenericObjectPool | B276: 14 | C276: 227100 | D276: 501 | E276: 453293 | F276: 3 | G276: 0.030749 | H276: 0 | I276: 1.449929
A277: ## GenericObjectPool | B277: 14 | C277: 227200 | D277: 501 | E277: 453493 | F277: 4 | G277: 0.030682 | H277: 0 | I277: 1.460403
A278: ## GenericObjectPool | B278: 14 | C278: 227600 | D278: 501 | E278: 454291 | F278: 3 | G278: 0.03062 | H278: 0 | I278: 1.469811
A279: ## GenericObjectPool | B279: 14 | C279: 230900 | D279: 500 | E279: 461800 | F279: 3 | G279: 0.030169 | H279: 0 | I279: 1.469741
A280: ## GenericObjectPool | B280: 14 | C280: 223900 | D280: 501 | E280: 446906 | F280: 3 | G280: 0.031197 | H280: 0 | I280: 1.503233
A281: ## GenericObjectPool | B281: 14 | C281: 225600 | D281: 501 | E281: 450299 | F281: 3 | G281: 0.030918 | H281: 0 | I281: 1.507985
A282: ## GenericObjectPool | B282: 14 | C282: 221300 | D282: 501 | E282: 441717 | F282: 4 | G282: 0.031586 | H282: 0 | I282: 1.431107
A283: ## GenericObjectPool | B283: 14 | C283: 223900 | D283: 500 | E283: 447800 | F283: 4 | G283: 0.031179 | H283: 0 | I283: 1.433958
A284: ## GenericObjectPool | B284: 14 | C284: 221600 | D284: 501 | E284: 442315 | F284: 4 | G284: 0.031471 | H284: 0 | I284: 1.452586
A285: ## GenericObjectPool | B285: 14 | C285: 222500 | D285: 501 | E285: 444112 | F285: 4 | G285: 0.031321 | H285: 0 | I285: 1.460727
A286: ## GenericObjectPool | B286: 14 | C286: 226500 | D286: 500 | E286: 453000 | F286: 4 | G286: 0.030795 | H286: 0 | I286: 1.458658
A287: ## GenericObjectPool | B287: 14 | C287: 222400 | D287: 500 | E287: 444800 | F287: 3 | G287: 0.031376 | H287: 0 | I287: 1.482958
A288: ## GenericObjectPool | B288: 14 | C288: 222700 | D288: 501 | E288: 444511 | F288: 3 | G288: 0.031325 | H288: 0 | I288: 1.492839
A289: ## GenericObjectPool | B289: 14 | C289: 222100 | D289: 501 | E289: 443313 | F289: 4 | G289: 0.031387 | H289: 0 | I289: 1.505609
A290: ## GenericObjectPool | B290: 14 | C290: 222000 | D290: 501 | E290: 443114 | F290: 3 | G290: 0.031428 | H290: 0 | I290: 1.516598
A291: ## GenericObjectPool | B291: 14 | C291: 221700 | D291: 501 | E291: 442515 | F291: 3 | G291: 0.031443 | H291: 0 | I291: 1.528229
A292: ## GenericObjectPool | B292: 14 | C292: 241700 | D292: 501 | E292: 482435 | F292: 2 | G292: 0.028829 | H292: 0 | I292: 1.357329
A293: ## GenericObjectPool | B293: 14 | C293: 237300 | D293: 501 | E293: 473653 | F293: 2 | G293: 0.029326 | H293: 0 | I293: 1.380601
A294: ## GenericObjectPool | B294: 14 | C294: 238100 | D294: 501 | E294: 475250 | F294: 3 | G294: 0.029273 | H294: 0 | I294: 1.389028
A295: ## GenericObjectPool | B295: 14 | C295: 242000 | D295: 500 | E295: 484000 | F295: 3 | G295: 0.028822 | H295: 0 | I295: 1.388429
A296: ## GenericObjectPool | B296: 14 | C296: 247300 | D296: 501 | E296: 493613 | F296: 2 | G296: 0.028233 | H296: 0 | I296: 1.383792
A297: ## GenericObjectPool | B297: 14 | C297: 244400 | D297: 501 | E297: 487824 | F297: 2 | G297: 0.028502 | H297: 0 | I297: 1.402258
A298: ## GenericObjectPool | B298: 14 | C298: 241600 | D298: 500 | E298: 483200 | F298: 3 | G298: 0.02887 | H298: 0 | I298: 1.420682
A299: ## GenericObjectPool | B299: 14 | C299: 240400 | D299: 501 | E299: 479840 | F299: 3 | G299: 0.028989 | H299: 0 | I299: 1.434497
A300: ## GenericObjectPool | B300: 14 | C300: 242900 | D300: 501 | E300: 484830 | F300: 3 | G300: 0.028699 | H300: 0 | I300: 1.437211
A301: ## GenericObjectPool | B301: 14 | C301: 240900 | D301: 501 | E301: 480838 | F301: 2 | G301: 0.028946 | H301: 0 | I301: 1.453276
A302: ## GenericObjectPool | B302: 16 | C302: 146200 | D302: 501 | E302: 291816 | F302: 7 | G302: 0.054617 | H302: 0 | I302: 1.99795
A303: ## GenericObjectPool | B303: 16 | C303: 143900 | D303: 501 | E303: 287226 | F303: 6 | G303: 0.055566 | H303: 0 | I303: 2.03061
A304: ## GenericObjectPool | B304: 16 | C304: 150100 | D304: 501 | E304: 299601 | F304: 6 | G304: 0.053125 | H304: 0 | I304: 2.003425
A305: ## GenericObjectPool | B305: 16 | C305: 143600 | D305: 501 | E305: 286627 | F305: 6 | G305: 0.055634 | H305: 0 | I305: 2.064204
A306: ## GenericObjectPool | B306: 16 | C306: 150400 | D306: 501 | E306: 300200 | F306: 6 | G306: 0.053132 | H306: 0 | I306: 2.031991
A307: ## GenericObjectPool | B307: 16 | C307: 148100 | D307: 504 | E307: 293849 | F307: 7 | G307: 0.054247 | H307: 0 | I307: 2.063643
A308: ## GenericObjectPool | B308: 16 | C308: 142500 | D308: 501 | E308: 284431 | F308: 6 | G308: 0.055993 | H308: 0 | I308: 2.119755
A309: ## GenericObjectPool | B309: 16 | C309: 150000 | D309: 501 | E309: 299401 | F309: 6 | G309: 0.053173 | H309: 0 | I309: 2.080809
A310: ## GenericObjectPool | B310: 16 | C310: 148300 | D310: 501 | E310: 296008 | F310: 6 | G310: 0.05381 | H310: 0 | I310: 2.107735
A311: ## GenericObjectPool | B311: 16 | C311: 146800 | D311: 501 | E311: 293014 | F311: 6 | G311: 0.054387 | H311: 0 | I311: 2.133681
A312: ## GenericObjectPool | B312: 16 | C312: 159000 | D312: 501 | E312: 317365 | F312: 4 | G312: 0.050157 | H312: 0 | I312: 1.813624
A313: ## GenericObjectPool | B313: 16 | C313: 160000 | D313: 501 | E313: 319361 | F313: 4 | G313: 0.04995 | H313: 0 | I313: 1.821999
A314: ## GenericObjectPool | B314: 16 | C314: 156000 | D314: 501 | E314: 311377 | F314: 5 | G314: 0.051269 | H314: 0 | I314: 1.859749
A315: ## GenericObjectPool | B315: 16 | C315: 156800 | D315: 502 | E315: 312351 | F315: 5 | G315: 0.050957 | H315: 0 | I315: 1.869111
A316: ## GenericObjectPool | B316: 16 | C316: 157300 | D316: 501 | E316: 313972 | F316: 5 | G316: 0.050788 | H316: 0 | I316: 1.880369
A317: ## GenericObjectPool | B317: 16 | C317: 159000 | D317: 501 | E317: 317365 | F317: 4 | G317: 0.050195 | H317: 0 | I317: 1.884006
A318: ## GenericObjectPool | B318: 16 | C318: 157500 | D318: 501 | E318: 314371 | F318: 5 | G318: 0.050711 | H318: 0 | I318: 1.90699
A319: ## GenericObjectPool | B319: 16 | C319: 156600 | D319: 501 | E319: 312575 | F319: 4 | G319: 0.050964 | H319: 0 | I319: 1.926118
A320: ## GenericObjectPool | B320: 16 | C320: 158800 | D320: 501 | E320: 316966 | F320: 4 | G320: 0.050384 | H320: 0 | I320: 1.926185
A321: ## GenericObjectPool | B321: 16 | C321: 160400 | D321: 501 | E321: 320160 | F321: 4 | G321: 0.049688 | H321: 0 | I321: 1.929769
A322: ## GenericObjectPool | B322: 16 | C322: 149800 | D322: 501 | E322: 299002 | F322: 6 | G322: 0.053364 | H322: 0 | I322: 1.921897
A323: ## GenericObjectPool | B323: 16 | C323: 148700 | D323: 501 | E323: 296806 | F323: 6 | G323: 0.053712 | H323: 0 | I323: 1.943982
A324: ## GenericObjectPool | B324: 16 | C324: 150100 | D324: 502 | E324: 299004 | F324: 6 | G324: 0.053298 | H324: 0 | I324: 1.949447
A325: ## GenericObjectPool | B325: 16 | C325: 146100 | D325: 501 | E325: 291617 | F325: 5 | G325: 0.0546 | H325: 0 | I325: 1.991191
A326: ## GenericObjectPool | B326: 16 | C326: 149800 | D326: 501 | E326: 299002 | F326: 6 | G326: 0.053251 | H326: 0 | I326: 1.981044
A327: ## GenericObjectPool | B327: 16 | C327: 147100 | D327: 501 | E327: 293613 | F327: 6 | G327: 0.05429 | H327: 0 | I327: 2.01377
A328: ## GenericObjectPool | B328: 16 | C328: 152600 | D328: 501 | E328: 304591 | F328: 5 | G328: 0.052307 | H328: 0 | I328: 1.991681
A329: ## GenericObjectPool | B329: 16 | C329: 146200 | D329: 501 | E329: 291816 | F329: 7 | G329: 0.05446 | H329: 0 | I329: 2.049347
A330: ## GenericObjectPool | B330: 16 | C330: 147400 | D330: 501 | E330: 294212 | F330: 6 | G330: 0.054193 | H330: 0 | I330: 2.05557
A331: ## GenericObjectPool | B331: 16 | C331: 148800 | D331: 502 | E331: 296414 | F331: 6 | G331: 0.053737 | H331: 0 | I331: 2.060282

Sheet: queue
A2: ## QueuePool | B2: 1 | C2: 1396200 | D2: 500 | E2: 2792400 | F2: 1 | G2: 0.000292 | H2: 0 | I2: 0.135488
A3: ## QueuePool | B3: 1 | C3: 1380900 | D3: 500 | E3: 2761800 | F3: 1 | G3: 0.000287 | H3: 0 | I3: 0.137285
A4: ## QueuePool | B4: 1 | C4: 1391700 | D4: 500 | E4: 2783400 | F4: 1 | G4: 0.000303 | H4: 0 | I4: 0.137852
A5: ## QueuePool | B5: 1 | C5: 1390100 | D5: 500 | E5: 2780200 | F5: 1 | G5: 0.000296 | H5: 0 | I5: 0.139002
A6: ## QueuePool | B6: 1 | C6: 1397300 | D6: 500 | E6: 2794600 | F6: 1 | G6: 0.000283 | H6: 0 | I6: 0.139662
A7: ## QueuePool | B7: 1 | C7: 1399300 | D7: 500 | E7: 2798600 | F7: 1 | G7: 0.000282 | H7: 0 | I7: 0.14057
A8: ## QueuePool | B8: 1 | C8: 1389100 | D8: 500 | E8: 2778200 | F8: 1 | G8: 0.00029 | H8: 0 | I8: 0.142109
A9: ## QueuePool | B9: 1 | C9: 1402300 | D9: 500 | E9: 2804600 | F9: 1 | G9: 0.000285 | H9: 0 | I9: 0.142444
A10: ## QueuePool | B10: 1 | C10: 1386900 | D10: 500 | E10: 2773800 | F10: 1 | G10: 0.0003 | H10: 0 | I10: 0.144275
A11: ## QueuePool | B11: 1 | C11: 1400400 | D11: 500 | E11: 2800800 | F11: 1 | G11: 0.000283 | H11: 0 | I11: 0.144562
A12: ## QueuePool | B12: 1 | C12: 1376700 | D12: 500 | E12: 2753400 | F12: 1 | G12: 0.000307 | H12: 0 | I12: 0.136422
A13: ## QueuePool | B13: 1 | C13: 1377800 | D13: 500 | E13: 2755600 | F13: 1 | G13: 0.000299 | H13: 0 | I13: 0.13746
A14: ## QueuePool | B14: 1 | C14: 1372300 | D14: 500 | E14: 2744600 | F14: 1 | G14: 0.000308 | H14: 0 | I14: 0.138847
A15: ## QueuePool | B15: 1 | C15: 1380200 | D15: 500 | E15: 2760400 | F15: 1 | G15: 0.000298 | H15: 0 | I15: 0.13952
A16: ## QueuePool | B16: 1 | C16: 1376600 | D16: 500 | E16: 2753200 | F16: 1 | G16: 0.000293 | H16: 0 | I16: 0.140747
A17: ## QueuePool | B17: 1 | C17: 1382600 | D17: 500 | E17: 2765200 | F17: 1 | G17: 0.000306 | H17: 0 | I17: 0.141526
A18: ## QueuePool | B18: 1 | C18: 1377900 | D18: 500 | E18: 2755800 | F18: 1 | G18: 0.000294 | H18: 0 | I18: 0.1428
A19: ## QueuePool | B19: 1 | C19: 1381600 | D19: 500 | E19: 2763200 | F19: 1 | G19: 0.000283 | H19: 0 | I19: 0.143597
A20: ## QueuePool | B20: 1 | C20: 1371400 | D20: 500 | E20: 2742800 | F20: 2 | G20: 0.000311 | H20: 0 | I20: 0.145212
A21: ## QueuePool | B21: 1 | C21: 1380200 | D21: 500 | E21: 2760400 | F21: 1 | G21: 0.000287 | H21: 0 | I21: 0.145736
A22: ## QueuePool | B22: 1 | C22: 1378500 | D22: 500 | E22: 2757000 | F22: 1 | G22: 0.0003 | H22: 0 | I22: 0.136102
A23: ## QueuePool | B23: 1 | C23: 1378900 | D23: 500 | E23: 2757800 | F23: 1 | G23: 0.000289 | H23: 0 | I23: 0.137138
A24: ## QueuePool | B24: 1 | C24: 1378800 | D24: 500 | E24: 2757600 | F24: 1 | G24: 0.000297 | H24: 0 | I24: 0.138221
A25: ## QueuePool | B25: 1 | C25: 1378100 | D25: 500 | E25: 2756200 | F25: 1 | G25: 0.000291 | H25: 0 | I25: 0.139304
A26: ## QueuePool | B26: 1 | C26: 1380300 | D26: 500 | E26: 2760600 | F26: 1 | G26: 0.000288 | H26: 0 | I26: 0.140225
A27: ## QueuePool | B27: 1 | C27: 1380200 | D27: 500 | E27: 2760400 | F27: 1 | G27: 0.00029 | H27: 0 | I27: 0.14126
A28: ## QueuePool | B28: 1 | C28: 1381300 | D28: 500 | E28: 2762600 | F28: 1 | G28: 0.000302 | H28: 0 | I28: 0.142268
A29: ## QueuePool | B29: 1 | C29: 1375000 | D29: 500 | E29: 2750000 | F29: 1 | G29: 0.000297 | H29: 0 | I29: 0.143631
A30: ## QueuePool | B30: 1 | C30: 1380200 | D30: 500 | E30: 2760400 | F30: 1 | G30: 0.000294 | H30: 0 | I30: 0.144382
A31: ## QueuePool | B31: 1 | C31: 1377200 | D31: 500 | E31: 2754400 | F31: 1 | G31: 0.000302 | H31: 0 | I31: 0.14558
A32: ## QueuePool | B32: 2 | C32: 1327700 | D32: 500 | E32: 2655400 | F32: 1 | G32: 0.000645 | H32: 0 | I32: 0.204168
A33: ## QueuePool | B33: 2 | C33: 1324000 | D33: 500 | E33: 2648000 | F33: 1 | G33: 0.000631 | H33: 0 | I33: 0.205991
A34: ## QueuePool | B34: 2 | C34: 1328900 | D34: 500 | E34: 2657800 | F34: 1 | G34: 0.000628 | H34: 0 | I34: 0.207132
A35: ## QueuePool | B35: 2 | C35: 1322500 | D35: 500 | E35: 2645000 | F35: 1 | G35: 0.000654 | H35: 0 | I35: 0.209201
A36: ## QueuePool | B36: 2 | C36: 1327600 | D36: 500 | E36: 2655200 | F36: 1 | G36: 0.000626 | H36: 0 | I36: 0.210293
A37: ## QueuePool | B37: 2 | C37: 1324000 | D37: 500 | E37: 2648000 | F37: 1 | G37: 0.000635 | H37: 0 | I37: 0.212081
A38: ## QueuePool | B38: 2 | C38: 1324500 | D38: 500 | E38: 2649000 | F38: 1 | G38: 0.000643 | H38: 0 | I38: 0.213551
A39: ## QueuePool | B39: 2 | C39: 1321200 | D39: 500 | E39: 2642400 | F39: 1 | G39: 0.00064 | H39: 0 | I39: 0.21531
A40: ## QueuePool | B40: 2 | C40: 1319900 | D40: 500 | E40: 2639800 | F40: 1 | G40: 0.000648 | H40: 0 | I40: 0.216914
A41: ## QueuePool | B41: 2 | C41: 1323700 | D41: 500 | E41: 2647400 | F41: 1 | G41: 0.000649 | H41: 0 | I41: 0.218095
A42: ## QueuePool | B42: 2 | C42: 1333200 | D42: 500 | E42: 2666400 | F42: 1 | G42: 0.000641 | H42: 0 | I42: 0.203071
A43: ## QueuePool | B43: 2 | C43: 1330300 | D43: 500 | E43: 2660600 | F43: 1 | G43: 0.000646 | H43: 0 | I43: 0.204875
A44: ## QueuePool | B44: 2 | C44: 1332300 | D44: 500 | E44: 2664600 | F44: 1 | G44: 0.000646 | H44: 0 | I44: 0.206291
A45: ## QueuePool | B45: 2 | C45: 1329600 | D45: 500 | E45: 2659200 | F45: 1 | G45: 0.000641 | H45: 0 | I45: 0.208046
A46: ## QueuePool | B46: 2 | C46: 1325200 | D46: 500 | E46: 2650400 | F46: 1 | G46: 0.000638 | H46: 0 | I46: 0.209918
A47: ## QueuePool | B47: 2 | C47: 1329900 | D47: 500 | E47: 2659800 | F47: 1 | G47: 0.000638 | H47: 0 | I47: 0.211062
A48: ## QueuePool | B48: 2 | C48: 1331500 | D48: 500 | E48: 2663000 | F48: 1 | G48: 0.000641 | H48: 0 | I48: 0.212449
A49: ## QueuePool | B49: 2 | C49: 1326800 | D49: 500 | E49: 2653600 | F49: 1 | G49: 0.000654 | H49: 0 | I49: 0.214356
A50: ## QueuePool | B50: 2 | C50: 1328000 | D50: 500 | E50: 2656000 | F50: 1 | G50: 0.000646 | H50: 0 | I50: 0.215762
A51: ## QueuePool | B51: 2 | C51: 1329100 | D51: 500 | E51: 2658200 | F51: 1 | G51: 0.000636 | H51: 0 | I51: 0.217141
A52: ## QueuePool | B52: 2 | C52: 1294000 | D52: 500 | E52: 2588000 | F52: 1 | G52: 0.000666 | H52: 0 | I52: 0.205582
A53: ## QueuePool | B53: 2 | C53: 1299400 | D53: 500 | E53: 2598800 | F53: 1 | G53: 0.000663 | H53: 0 | I53: 0.206765
A54: ## QueuePool | B54: 2 | C54: 1296200 | D54: 500 | E54: 2592400 | F54: 1 | G54: 0.000665 | H54: 0 | I54: 0.20862
A55: ## QueuePool | B55: 2 | C55: 1287400 | D55: 500 | E55: 2574800 | F55: 1 | G55: 0.000661 | H55: 0 | I55: 0.210904
A56: ## QueuePool | B56: 2 | C56: 1297200 | D56: 500 | E56: 2594400 | F56: 1 | G56: 0.000668 | H56: 0 | I56: 0.211689
A57: ## QueuePool | B57: 2 | C57: 1287700 | D57: 500 | E57: 2575400 | F57: 1 | G57: 0.000662 | H57: 0 | I57: 0.21402
A58: ## QueuePool | B58: 2 | C58: 1291900 | D58: 500 | E58: 2583800 | F58: 1 | G58: 0.00067 | H58: 0 | I58: 0.215235
A59: ## QueuePool | B59: 2 | C59: 1305200 | D59: 500 | E59: 2610400 | F59: 1 | G59: 0.000664 | H59: 0 | I59: 0.215681
A60: ## QueuePool | B60: 2 | C60: 1262900 | D60: 500 | E60: 2525800 | F60: 1 | G60: 0.000684 | H60: 0 | I60: 0.220817
A61: ## QueuePool | B61: 2 | C61: 1300100 | D61: 500 | E61: 2600200 | F61: 1 | G61: 0.000656 | H61: 0 | I61: 0.219138
A62: ## QueuePool | B62: 3 | C62: 1127900 | D62: 500 | E62: 2255800 | F62: 1 | G62: 0.001174 | H62: 0 | I62: 0.277888
A63: ## QueuePool | B63: 3 | C63: 1114200 | D63: 500 | E63: 2228400 | F63: 3 | G63: 0.001191 | H63: 0 | I63: 0.281742
A64: ## QueuePool | B64: 3 | C64: 1117500 | D64: 500 | E64: 2235000 | F64: 1 | G64: 0.001209 | H64: 0 | I64: 0.283466
A65: ## QueuePool | B65: 3 | C65: 1125800 | D65: 500 | E65: 2251600 | F65: 1 | G65: 0.00119 | H65: 0 | I65: 0.284519
A66: ## QueuePool | B66: 3 | C66: 1121400 | D66: 500 | E66: 2242800 | F66: 1 | G66: 0.001201 | H66: 0 | I66: 0.287175
A67: ## QueuePool | B67: 3 | C67: 1128100 | D67: 500 | E67: 2256200 | F67: 1 | G67: 0.001176 | H67: 0 | I67: 0.288368
A68: ## QueuePool | B68: 3 | C68: 1121300 | D68: 500 | E68: 2242600 | F68: 1 | G68: 0.001197 | H68: 0 | I68: 0.291303
A69: ## QueuePool | B69: 3 | C69: 1119600 | D69: 500 | E69: 2239200 | F69: 1 | G69: 0.001183 | H69: 0 | I69: 0.293547
A70: ## QueuePool | B70: 3 | C70: 1126900 | D70: 500 | E70: 2253800 | F70: 1 | G70: 0.001186 | H70: 0 | I70: 0.294613
A71: ## QueuePool | B71: 3 | C71: 1121800 | D71: 500 | E71: 2243600 | F71: 1 | G71: 0.001187 | H71: 0 | I71: 0.297286
A72: ## QueuePool | B72: 3 | C72: 1463700 | D72: 500 | E72: 2927400 | F72: 1 | G72: 0.00087 | H72: 0 | I72: 0.233586
A73: ## QueuePool | B73: 3 | C73: 1443500 | D73: 500 | E73: 2887000 | F73: 1 | G73: 0.00089 | H73: 0 | I73: 0.237099
A74: ## QueuePool | B74: 3 | C74: 1462300 | D74: 500 | E74: 2924600 | F74: 1 | G74: 0.000851 | H74: 0 | I74: 0.237371
A75: ## QueuePool | B75: 3 | C75: 1449000 | D75: 500 | E75: 2898000 | F75: 1 | G75: 0.000885 | H75: 0 | I75: 0.240307
A76: ## QueuePool | B76: 3 | C76: 1452200 | D76: 500 | E76: 2904400 | F76: 1 | G76: 0.000889 | H76: 0 | I76: 0.241886
A77: ## QueuePool | B77: 3 | C77: 1451900 | D77: 500 | E77: 2903800 | F77: 1 | G77: 0.000886 | H77: 0 | I77: 0.243735
A78: ## QueuePool | B78: 3 | C78: 1453300 | D78: 500 | E78: 2906600 | F78: 1 | G78: 0.00087 | H78: 0 | I78: 0.245396
A79: ## QueuePool | B79: 3 | C79: 1463400 | D79: 500 | E79: 2926800 | F79: 1 | G79: 0.000866 | H79: 0 | I79: 0.246312
A80: ## QueuePool | B80: 3 | C80: 1451600 | D80: 500 | E80: 2903200 | F80: 1 | G80: 0.000867 | H80: 0 | I80: 0.249057
A81: ## QueuePool | B81: 3 | C81: 1457900 | D81: 500 | E81: 2915800 | F81: 1 | G81: 0.000859 | H81: 0 | I81: 0.250242
A82: ## QueuePool | B82: 3 | C82: 1129900 | D82: 500 | E82: 2259800 | F82: 1 | G82: 0.001197 | H82: 0 | I82: 0.274181
A83: ## QueuePool | B83: 3 | C83: 1133000 | D83: 500 | E83: 2266000 | F83: 1 | G83: 0.001176 | H83: 0 | I83: 0.275944
A84: ## QueuePool | B84: 3 | C84: 1131200 | D84: 500 | E84: 2262400 | F84: 1 | G84: 0.001186 | H84: 0 | I84: 0.278303
A85: ## QueuePool | B85: 3 | C85: 1136300 | D85: 500 | E85: 2272600 | F85: 1 | G85: 0.001175 | H85: 0 | I85: 0.279785
A86: ## QueuePool | B86: 3 | C86: 1136800 | D86: 500 | E86: 2273600 | F86: 1 | G86: 0.001177 | H86: 0 | I86: 0.28182
A87: ## QueuePool | B87: 3 | C87: 1135200 | D87: 500 | E87: 2270400 | F87: 1 | G87: 0.001179 | H87: 0 | I87: 0.2841
A88: ## QueuePool | B88: 3 | C88: 1137900 | D88: 500 | E88: 2275800 | F88: 1 | G88: 0.001164 | H88: 0 | I88: 0.285808
A89: ## QueuePool | B89: 3 | C89: 1138200 | D89: 500 | E89: 2276400 | F89: 1 | G89: 0.00118 | H89: 0 | I89: 0.287827
A90: ## QueuePool | B90: 3 | C90: 1136500 | D90: 500 | E90: 2273000 | F90: 1 | G90: 0.001169 | H90: 0 | I90: 0.290065
A91: ## QueuePool | B91: 3 | C91: 1128500 | D91: 500 | E91: 2257000 | F91: 1 | G91: 0.001198 | H91: 0 | I91: 0.293142
A92: ## QueuePool | B92: 4 | C92: 934700 | D92: 500 | E92: 1869400 | F92: 2 | G92: 0.002001 | H92: 0 | I92: 0.353639
A93: ## QueuePool | B93: 4 | C93: 937200 | D93: 500 | E93: 1874400 | F93: 1 | G93: 0.001975 | H93: 0 | I93: 0.355953
A94: ## QueuePool | B94: 4 | C94: 938500 | D94: 500 | E94: 1877000 | F94: 1 | G94: 0.001982 | H94: 0 | I94: 0.358481
A95: ## QueuePool | B95: 4 | C95: 939600 | D95: 500 | E95: 1879200 | F95: 1 | G95: 0.001986 | H95: 0 | I95: 0.361032
A96: ## QueuePool | B96: 4 | C96: 932100 | D96: 500 | E96: 1864200 | F96: 1 | G96: 0.001987 | H96: 0 | I96: 0.365212
A97: ## QueuePool | B97: 4 | C97: 941500 | D97: 500 | E97: 1883000 | F97: 1 | G97: 0.001938 | H97: 0 | I97: 0.366042
A98: ## QueuePool | B98: 4 | C98: 935900 | D98: 500 | E98: 1871800 | F98: 1 | G98: 0.001993 | H98: 0 | I98: 0.369839
A99: ## QueuePool | B99: 4 | C99: 935900 | D99: 500 | E99: 1871800 | F99: 1 | G99: 0.001955 | H99: 0 | I99: 0.372473
A100: ## QueuePool | B100: 4 | C100: 934700 | D100: 500 | E100: 1869400 | F100: 1 | G100: 0.001977 | H100: 0 | I100: 0.375355
A101: ## QueuePool | B101: 4 | C101: 937400 | D101: 500 | E101: 1874800 | F101: 1 | G101: 0.001966 | H101: 0 | I101: 0.377428
A102: ## QueuePool | B102: 4 | C102: 926600 | D102: 500 | E102: 1853200 | F102: 1 | G102: 0.002016 | H102: 0 | I102: 0.359584
A103: ## QueuePool | B103: 4 | C103: 918600 | D103: 500 | E103: 1837200 | F103: 1 | G103: 0.002066 | H103: 0 | I103: 0.363996
A104: ## QueuePool | B104: 4 | C104: 922200 | D104: 500 | E104: 1844400 | F104: 1 | G104: 0.002054 | H104: 0 | I104: 0.366101
A105: ## QueuePool | B105: 4 | C105: 922700 | D105: 500 | E105: 1845400 | F105: 3 | G105: 0.002042 | H105: 0 | I105: 0.368807
A106: ## QueuePool | B106: 4 | C106: 915400 | D106: 500 | E106: 1830800 | F106: 1 | G106: 0.00208 | H106: 0 | I106: 0.373072
A107: ## QueuePool | B107: 4 | C107: 926700 | D107: 500 | E107: 1853400 | F107: 9 | G107: 0.002031 | H107: 0 | I107: 0.37384
A108: ## QueuePool | B108: 4 | C108: 927700 | D108: 500 | E108: 1855400 | F108: 2 | G108: 0.002024 | H108: 0 | I108: 0.376358
A109: ## QueuePool | B109: 4 | C109: 919000 | D109: 500 | E109: 1838000 | F109: 1 | G109: 0.00205 | H109: 0 | I109: 0.380836
A110: ## QueuePool | B110: 4 | C110: 922300 | D110: 500 | E110: 1844600 | F110: 1 | G110: 0.002023 | H110: 0 | I110: 0.382806
A111: ## QueuePool | B111: 4 | C111: 921000 | D111: 500 | E111: 1842000 | F111: 1 | G111: 0.00203 | H111: 0 | I111: 0.385717
A112: ## QueuePool | B112: 4 | C112: 917300 | D112: 500 | E112: 1834600 | F112: 3 | G112: 0.002069 | H112: 0 | I112: 0.360283
A113: ## QueuePool | B113: 4 | C113: 915700 | D113: 500 | E113: 1831400 | F113: 3 | G113: 0.002054 | H113: 0 | I113: 0.363462
A114: ## QueuePool | B114: 4 | C114: 922500 | D114: 500 | E114: 1845000 | F114: 1 | G114: 0.002042 | H114: 0 | I114: 0.364929
A115: ## QueuePool | B115: 4 | C115: 920000 | D115: 500 | E115: 1840000 | F115: 1 | G115: 0.002047 | H115: 0 | I115: 0.368214
A116: ## QueuePool | B116: 4 | C116: 915600 | D116: 500 | E116: 1831200 | F116: 1 | G116: 0.00205 | H116: 0 | I116: 0.371865
A117: ## QueuePool | B117: 4 | C117: 912500 | D117: 500 | E117: 1825000 | F117: 1 | G117: 0.002044 | H117: 0 | I117: 0.375229
A118: ## QueuePool | B118: 4 | C118: 913800 | D118: 500 | E118: 1827600 | F118: 1 | G118: 0.002054 | H118: 0 | I118: 0.377691
A119: ## QueuePool | B119: 4 | C119: 910100 | D119: 500 | E119: 1820200 | F119: 1 | G119: 0.002064 | H119: 0 | I119: 0.381175
A120: ## QueuePool | B120: 4 | C120: 913200 | D120: 500 | E120: 1826400 | F120: 1 | G120: 0.002042 | H120: 0 | I120: 0.383201
A121: ## QueuePool | B121: 4 | C121: 915400 | D121: 500 | E121: 1830800 | F121: 1 | G121: 0.002067 | H121: 0 | I121: 0.385431
A122: ## QueuePool | B122: 5 | C122: 939900 | D122: 500 | E122: 1879800 | F122: 1 | G122: 0.002524 | H122: 0 | I122: 0.409861
A123: ## QueuePool | B123: 5 | C123: 930500 | D123: 500 | E123: 1861000 | F123: 1 | G123: 0.002556 | H123: 0 | I123: 0.415016
A124: ## QueuePool | B124: 5 | C124: 937000 | D124: 500 | E124: 1874000 | F124: 1 | G124: 0.002511 | H124: 0 | I124: 0.416599
A125: ## QueuePool | B125: 5 | C125: 932400 | D125: 500 | E125: 1864800 | F125: 1 | G125: 0.002509 | H125: 0 | I125: 0.420618
A126: ## QueuePool | B126: 5 | C126: 934800 | D126: 500 | E126: 1869600 | F126: 1 | G126: 0.002505 | H126: 0 | I126: 0.42305
A127: ## QueuePool | B127: 5 | C127: 929600 | D127: 500 | E127: 1859200 | F127: 1 | G127: 0.002515 | H127: 0 | I127: 0.427185
A128: ## QueuePool | B128: 5 | C128: 940400 | D128: 500 | E128: 1880800 | F128: 1 | G128: 0.002503 | H128: 0 | I128: 0.427662
A129: ## QueuePool | B129: 5 | C129: 931000 | D129: 500 | E129: 1862000 | F129: 1 | G129: 0.002527 | H129: 0 | I129: 0.432745
A130: ## QueuePool | B130: 5 | C130: 935200 | D130: 500 | E130: 1870400 | F130: 1 | G130: 0.002512 | H130: 0 | I130: 0.434672
A131: ## QueuePool | B131: 5 | C131: 929800 | D131: 500 | E131: 1859600 | F131: 1 | G131: 0.002532 | H131: 0 | I131: 0.438826
A132: ## QueuePool | B132: 5 | C132: 1043200 | D132: 500 | E132: 2086400 | F132: 1 | G132: 0.002263 | H132: 0 | I132: 0.379833
A133: ## QueuePool | B133: 5 | C133: 1045000 | D133: 500 | E133: 2090000 | F133: 1 | G133: 0.002257 | H133: 0 | I133: 0.382468
A134: ## QueuePool | B134: 5 | C134: 1046900 | D134: 500 | E134: 2093800 | F134: 1 | G134: 0.002262 | H134: 0 | I134: 0.385069
A135: ## QueuePool | B135: 5 | C135: 1042300 | D135: 500 | E135: 2084600 | F135: 1 | G135: 0.002241 | H135: 0 | I135: 0.388811
A136: ## QueuePool | B136: 5 | C136: 1049000 | D136: 500 | E136: 2098000 | F136: 1 | G136: 0.002274 | H136: 0 | I136: 0.390489
A137: ## QueuePool | B137: 5 | C137: 1046800 | D137: 500 | E137: 2093600 | F137: 1 | G137: 0.002268 | H137: 0 | I137: 0.39379
A138: ## QueuePool | B138: 5 | C138: 1044700 | D138: 500 | E138: 2089400 | F138: 1 | G138: 0.002269 | H138: 0 | I138: 0.397052
A139: ## QueuePool | B139: 5 | C139: 1045500 | D139: 500 | E139: 2091000 | F139: 1 | G139: 0.002264 | H139: 0 | I139: 0.399742
A140: ## QueuePool | B140: 5 | C140: 1046700 | D140: 500 | E140: 2093400 | F140: 1 | G140: 0.002255 | H140: 0 | I140: 0.402325
A141: ## QueuePool | B141: 5 | C141: 1044800 | D141: 500 | E141: 2089600 | F141: 1 | G141: 0.00228 | H141: 0 | I141: 0.405512
A142: ## QueuePool | B142: 5 | C142: 1087500 | D142: 500 | E142: 2175000 | F142: 1 | G142: 0.002172 | H142: 0 | I142: 0.37169
A143: ## QueuePool | B143: 5 | C143: 1088600 | D143: 500 | E143: 2177200 | F143: 1 | G143: 0.002153 | H143: 0 | I143: 0.374389
A144: ## QueuePool | B144: 5 | C144: 1085500 | D144: 500 | E144: 2171000 | F144: 1 | G144: 0.002179 | H144: 0 | I144: 0.377817
A145: ## QueuePool | B145: 5 | C145: 1087100 | D145: 500 | E145: 2174200 | F145: 2 | G145: 0.002177 | H145: 0 | I145: 0.380422
A146: ## QueuePool | B146: 5 | C146: 1081100 | D146: 500 | E146: 2162200 | F146: 1 | G146: 0.002166 | H146: 0 | I146: 0.384305
A147: ## QueuePool | B147: 5 | C147: 1087100 | D147: 500 | E147: 2174200 | F147: 1 | G147: 0.002161 | H147: 0 | I147: 0.386052
A148: ## QueuePool | B148: 5 | C148: 1090000 | D148: 500 | E148: 2180000 | F148: 1 | G148: 0.00216 | H148: 0 | I148: 0.388328
A149: ## QueuePool | B149: 5 | C149: 1090500 | D149: 500 | E149: 2181000 | F149: 1 | G149: 0.002159 | H149: 0 | I149: 0.39101
A150: ## QueuePool | B150: 5 | C150: 1082400 | D150: 500 | E150: 2164800 | F150: 1 | G150: 0.002173 | H150: 0 | I150: 0.395228
A151: ## QueuePool | B151: 5 | C151: 1082900 | D151: 500 | E151: 2165800 | F151: 1 | G151: 0.002171 | H151: 0 | I151: 0.397875
A152: ## QueuePool | B152: 6 | C152: 1005100 | D152: 500 | E152: 2010200 | F152: 1 | G152: 0.002834 | H152: 0 | I152: 0.426678
A153: ## QueuePool | B153: 6 | C153: 1009000 | D153: 500 | E153: 2018000 | F153: 1 | G153: 0.002853 | H153: 0 | I153: 0.42919
A154: ## QueuePool | B154: 6 | C154: 1010900 | D154: 500 | E154: 2021800 | F154: 1 | G154: 0.002834 | H154: 0 | I154: 0.432079
A155: ## QueuePool | B155: 6 | C155: 1002700 | D155: 500 | E155: 2005400 | F155: 1 | G155: 0.002871 | H155: 0 | I155: 0.437138
A156: ## QueuePool | B156: 6 | C156: 1007900 | D156: 500 | E156: 2015800 | F156: 1 | G156: 0.002843 | H156: 0 | I156: 0.439257
A157: ## QueuePool | B157: 6 | C157: 1011100 | D157: 500 | E157: 2022200 | F157: 1 | G157: 0.00284 | H157: 0 | I157: 0.441788
A158: ## QueuePool | B158: 6 | C158: 1005100 | D158: 500 | E158: 2010200 | F158: 1 | G158: 0.002861 | H158: 0 | I158: 0.446321
A159: ## QueuePool | B159: 6 | C159: 1005300 | D159: 500 | E159: 2010600 | F159: 1 | G159: 0.002859 | H159: 0 | I159: 0.449469
A160: ## QueuePool | B160: 6 | C160: 1007400 | D160: 500 | E160: 2014800 | F160: 1 | G160: 0.002854 | H160: 0 | I160: 0.452167
A161: ## QueuePool | B161: 6 | C161: 1008200 | D161: 500 | E161: 2016400 | F161: 1 | G161: 0.00285 | H161: 0 | I161: 0.455129
A162: ## QueuePool | B162: 6 | C162: 1026500 | D162: 500 | E162: 2053000 | F162: 1 | G162: 0.002812 | H162: 0 | I162: 0.424114
A163: ## QueuePool | B163: 6 | C163: 1025600 | D163: 500 | E163: 2051200 | F163: 1 | G163: 0.002821 | H163: 0 | I163: 0.427611
A164: ## QueuePool | B164: 6 | C164: 1022800 | D164: 500 | E164: 2045600 | F164: 1 | G164: 0.002819 | H164: 0 | I164: 0.431474
A165: ## QueuePool | B165: 6 | C165: 1029700 | D165: 500 | E165: 2059400 | F165: 1 | G165: 0.00281 | H165: 0 | I165: 0.433281
A166: ## QueuePool | B166: 6 | C166: 1024700 | D166: 500 | E166: 2049400 | F166: 1 | G166: 0.002798 | H166: 0 | I166: 0.437546
A167: ## QueuePool | B167: 6 | C167: 1021400 | D167: 500 | E167: 2042800 | F167: 1 | G167: 0.002817 | H167: 0 | I167: 0.441454
A168: ## QueuePool | B168: 6 | C168: 1027700 | D168: 500 | E168: 2055400 | F168: 1 | G168: 0.002796 | H168: 0 | I168: 0.443263
A169: ## QueuePool | B169: 6 | C169: 1027500 | D169: 500 | E169: 2055000 | F169: 1 | G169: 0.002802 | H169: 0 | I169: 0.446456
A170: ## QueuePool | B170: 6 | C170: 1026100 | D170: 500 | E170: 2052200 | F170: 1 | G170: 0.002824 | H170: 0 | I170: 0.44991
A171: ## QueuePool | B171: 6 | C171: 1025500 | D171: 500 | E171: 2051000 | F171: 1 | G171: 0.002818 | H171: 0 | I171: 0.453161
A172: ## QueuePool | B172: 6 | C172: 926300 | D172: 500 | E172: 1852600 | F172: 1 | G172: 0.003108 | H172: 0 | I172: 0.455054
A173: ## QueuePool | B173: 6 | C173: 926000 | D173: 500 | E173: 1852000 | F173: 1 | G173: 0.003109 | H173: 0 | I173: 0.458531
A174: ## QueuePool | B174: 6 | C174: 923600 | D174: 500 | E174: 1847200 | F174: 1 | G174: 0.003128 | H174: 0 | I174: 0.46252
A175: ## QueuePool | B175: 6 | C175: 921400 | D175: 500 | E175: 1842800 | F175: 1 | G175: 0.003133 | H175: 0 | I175: 0.466443
A176: ## QueuePool | B176: 6 | C176: 925800 | D176: 500 | E176: 1851600 | F176: 1 | G176: 0.003124 | H176: 0 | I176: 0.468678
A177: ## QueuePool | B177: 6 | C177: 923800 | D177: 500 | E177: 1847600 | F177: 1 | G177: 0.003126 | H177: 0 | I177: 0.472504
A178: ## QueuePool | B178: 6 | C178: 924400 | D178: 500 | E178: 1848800 | F178: 1 | G178: 0.003117 | H178: 0 | I178: 0.475639
A179: ## QueuePool | B179: 6 | C179: 924200 | D179: 500 | E179: 1848400 | F179: 1 | G179: 0.003136 | H179: 0 | I179: 0.478975
A180: ## QueuePool | B180: 6 | C180: 928400 | D180: 500 | E180: 1856800 | F180: 8 | G180: 0.003113 | H180: 0 | I180: 0.481449
A181: ## QueuePool | B181: 6 | C181: 924600 | D181: 500 | E181: 1849200 | F181: 1 | G181: 0.003128 | H181: 0 | I181: 0.485668
A182: ## QueuePool | B182: 8 | C182: 972500 | D182: 500 | E182: 1945000 | F182: 1 | G182: 0.004003 | H182: 0 | I182: 0.531543
A183: ## QueuePool | B183: 8 | C183: 964100 | D183: 500 | E183: 1928200 | F183: 1 | G183: 0.00403 | H183: 0 | I183: 0.537615
A184: ## QueuePool | B184: 8 | C184: 967800 | D184: 500 | E184: 1935600 | F184: 1 | G184: 0.004014 | H184: 0 | I184: 0.540314
A185: ## QueuePool | B185: 8 | C185: 971100 | D185: 500 | E185: 1942200 | F185: 1 | G185: 0.003993 | H185: 0 | I185: 0.543084
A186: ## QueuePool | B186: 8 | C186: 965300 | D186: 500 | E186: 1930600 | F186: 1 | G186: 0.004005 | H186: 0 | I186: 0.548377
A187: ## QueuePool | B187: 8 | C187: 972300 | D187: 500 | E187: 1944600 | F187: 1 | G187: 0.003997 | H187: 0 | I187: 0.550045
A188: ## QueuePool | B188: 8 | C188: 963000 | D188: 500 | E188: 1926000 | F188: 1 | G188: 0.004023 | H188: 0 | I188: 0.556322
A189: ## QueuePool | B189: 8 | C189: 968100 | D189: 500 | E189: 1936200 | F189: 1 | G189: 0.004034 | H189: 0 | I189: 0.558477
A190: ## QueuePool | B190: 8 | C190: 967900 | D190: 500 | E190: 1935800 | F190: 1 | G190: 0.004008 | H190: 0 | I190: 0.562111
A191: ## QueuePool | B191: 8 | C191: 967200 | D191: 500 | E191: 1934400 | F191: 1 | G191: 0.004025 | H191: 0 | I191: 0.565882
A192: ## QueuePool | B192: 8 | C192: 834300 | D192: 500 | E192: 1668600 | F192: 1 | G192: 0.004675 | H192: 0 | I192: 0.545611
A193: ## QueuePool | B193: 8 | C193: 833500 | D193: 500 | E193: 1667000 | F193: 1 | G193: 0.004673 | H193: 0 | I193: 0.550136
A194: ## QueuePool | B194: 8 | C194: 831300 | D194: 500 | E194: 1662600 | F194: 2 | G194: 0.004688 | H194: 0 | I194: 0.555113
A195: ## QueuePool | B195: 8 | C195: 831400 | D195: 500 | E195: 1662800 | F195: 1 | G195: 0.004694 | H195: 0 | I195: 0.559293
A196: ## QueuePool | B196: 8 | C196: 834900 | D196: 500 | E196: 1669800 | F196: 2 | G196: 0.004674 | H196: 0 | I196: 0.562301
A197: ## QueuePool | B197: 8 | C197: 834600 | D197: 500 | E197: 1669200 | F197: 3 | G197: 0.004675 | H197: 0 | I197: 0.566588
A198: ## QueuePool | B198: 8 | C198: 829800 | D198: 500 | E198: 1659600 | F198: 1 | G198: 0.004683 | H198: 0 | I198: 0.57233
A199: ## QueuePool | B199: 8 | C199: 836000 | D199: 500 | E199: 1672000 | F199: 1 | G199: 0.00466 | H199: 0 | I199: 0.574276
A200: ## QueuePool | B200: 8 | C200: 831300 | D200: 500 | E200: 1662600 | F200: 1 | G200: 0.004703 | H200: 0 | I200: 0.579966
A201: ## QueuePool | B201: 8 | C201: 833800 | D201: 500 | E201: 1667600 | F201: 1 | G201: 0.0047 | H201: 0 | I201: 0.58314
A202: ## QueuePool | B202: 8 | C202: 874100 | D202: 500 | E202: 1748200 | F202: 1 | G202: 0.004445 | H202: 0 | I202: 0.53889
A203: ## QueuePool | B203: 8 | C203: 869500 | D203: 500 | E203: 1739000 | F203: 1 | G203: 0.004475 | H203: 0 | I203: 0.544439
A204: ## QueuePool | B204: 8 | C204: 871300 | D204: 500 | E204: 1742600 | F204: 1 | G204: 0.004454 | H204: 0 | I204: 0.547956
A205: ## QueuePool | B205: 8 | C205: 871800 | D205: 500 | E205: 1743600 | F205: 1 | G205: 0.004455 | H205: 0 | I205: 0.55185
A206: ## QueuePool | B206: 8 | C206: 870800 | D206: 500 | E206: 1741600 | F206: 1 | G206: 0.004461 | H206: 0 | I206: 0.556192
A207: ## QueuePool | B207: 8 | C207: 870600 | D207: 500 | E207: 1741200 | F207: 1 | G207: 0.004469 | H207: 0 | I207: 0.560259
A208: ## QueuePool | B208: 8 | C208: 870000 | D208: 500 | E208: 1740000 | F208: 1 | G208: 0.00447 | H208: 0 | I208: 0.564426
A209: ## QueuePool | B209: 8 | C209: 870100 | D209: 500 | E209: 1740200 | F209: 1 | G209: 0.004459 | H209: 0 | I209: 0.56833
A210: ## QueuePool | B210: 8 | C210: 868800 | D210: 500 | E210: 1737600 | F210: 1 | G210: 0.004491 | H210: 0 | I210: 0.57269
A211: ## QueuePool | B211: 8 | C211: 874400 | D211: 500 | E211: 1748800 | F211: 3 | G211: 0.004444 | H211: 0 | I211: 0.574774
A212: ## QueuePool | B212: 10 | C212: 860600 | D212: 500 | E212: 1721200 | F212: 1 | G212: 0.005694 | H212: 0 | I212: 0.615254
A213: ## QueuePool | B213: 10 | C213: 858800 | D213: 500 | E213: 1717600 | F213: 1 | G213: 0.005706 | H213: 0 | I213: 0.620513
A214: ## QueuePool | B214: 10 | C214: 862700 | D214: 500 | E214: 1725400 | F214: 1 | G214: 0.005661 | H214: 0 | I214: 0.623664
A215: ## QueuePool | B215: 10 | C215: 860000 | D215: 500 | E215: 1720000 | F215: 1 | G215: 0.005676 | H215: 0 | I215: 0.629169
A216: ## QueuePool | B216: 10 | C216: 861900 | D216: 500 | E216: 1723800 | F216: 1 | G216: 0.005671 | H216: 0 | I216: 0.632971
A217: ## QueuePool | B217: 10 | C217: 860500 | D217: 500 | E217: 1721000 | F217: 2 | G217: 0.005672 | H217: 0 | I217: 0.637964
A218: ## QueuePool | B218: 10 | C218: 861500 | D218: 500 | E218: 1723000 | F218: 1 | G218: 0.005642 | H218: 0 | I218: 0.642003
A219: ## QueuePool | B219: 10 | C219: 860600 | D219: 500 | E219: 1721200 | F219: 1 | G219: 0.005684 | H219: 0 | I219: 0.646748
A220: ## QueuePool | B220: 10 | C220: 863100 | D220: 500 | E220: 1726200 | F220: 1 | G220: 0.005654 | H220: 0 | I220: 0.650173
A221: ## QueuePool | B221: 10 | C221: 861300 | D221: 500 | E221: 1722600 | F221: 1 | G221: 0.005643 | H221: 0 | I221: 0.655173
A222: ## QueuePool | B222: 10 | C222: 879800 | D222: 500 | E222: 1759600 | F222: 1 | G222: 0.005534 | H222: 0 | I222: 0.625602
A223: ## QueuePool | B223: 10 | C223: 874000 | D223: 500 | E223: 1748000 | F223: 2 | G223: 0.005572 | H223: 0 | I223: 0.632113
A224: ## QueuePool | B224: 10 | C224: 878200 | D224: 500 | E224: 1756400 | F224: 1 | G224: 0.005553 | H224: 0 | I224: 0.634988
A225: ## QueuePool | B225: 10 | C225: 875400 | D225: 500 | E225: 1750800 | F225: 1 | G225: 0.005569 | H225: 0 | I225: 0.640366
A226: ## QueuePool | B226: 10 | C226: 879300 | D226: 500 | E226: 1758600 | F226: 1 | G226: 0.005564 | H226: 0 | I226: 0.643283
A227: ## QueuePool | B227: 10 | C227: 873000 | D227: 500 | E227: 1746000 | F227: 1 | G227: 0.005584 | H227: 0 | I227: 0.64991
A228: ## QueuePool | B228: 10 | C228: 879200 | D228: 500 | E228: 1758400 | F228: 1 | G228: 0.005556 | H228: 0 | I228: 0.65189
A229: ## QueuePool | B229: 10 | C229: 879100 | D229: 500 | E229: 1758200 | F229: 1 | G229: 0.005532 | H229: 0 | I229: 0.656157
A230: ## QueuePool | B230: 10 | C230: 877100 | D230: 500 | E230: 1754200 | F230: 1 | G230: 0.005563 | H230: 0 | I230: 0.661125
A231: ## QueuePool | B231: 10 | C231: 875300 | D231: 500 | E231: 1750600 | F231: 1 | G231: 0.005576 | H231: 0 | I231: 0.666004
A232: ## QueuePool | B232: 10 | C232: 1072100 | D232: 500 | E232: 2144200 | F232: 1 | G232: 0.004538 | H232: 0 | I232: 0.539375
A233: ## QueuePool | B233: 10 | C233: 1074600 | D233: 500 | E233: 2149200 | F233: 1 | G233: 0.004506 | H233: 0 | I233: 0.542913
A234: ## QueuePool | B234: 10 | C234: 1076900 | D234: 500 | E234: 2153800 | F234: 1 | G234: 0.004515 | H234: 0 | I234: 0.546479
A235: ## QueuePool | B235: 10 | C235: 1080000 | D235: 500 | E235: 2160000 | F235: 1 | G235: 0.004503 | H235: 0 | I235: 0.549805
A236: ## QueuePool | B236: 10 | C236: 1078900 | D236: 500 | E236: 2157800 | F236: 3 | G236: 0.004482 | H236: 0 | I236: 0.55419
A237: ## QueuePool | B237: 10 | C237: 1069900 | D237: 500 | E237: 2139800 | F237: 1 | G237: 0.004531 | H237: 0 | I237: 0.560572
A238: ## QueuePool | B238: 10 | C238: 1082300 | D238: 500 | E238: 2164600 | F238: 1 | G238: 0.004496 | H238: 0 | I238: 0.56137
A239: ## QueuePool | B239: 10 | C239: 1069500 | D239: 500 | E239: 2139000 | F239: 1 | G239: 0.004545 | H239: 0 | I239: 0.568729
A240: ## QueuePool | B240: 10 | C240: 1077900 | D240: 500 | E240: 2155800 | F240: 1 | G240: 0.004513 | H240: 0 | I240: 0.570479
A241: ## QueuePool | B241: 10 | C241: 1068700 | D241: 500 | E241: 2137400 | F241: 3 | G241: 0.004549 | H241: 0 | I241: 0.576943
A242: ## QueuePool | B242: 12 | C242: 1011400 | D242: 500 | E242: 2022800 | F242: 1 | G242: 0.005829 | H242: 0 | I242: 0.608271
A243: ## QueuePool | B243: 12 | C243: 1010400 | D243: 500 | E243: 2020800 | F243: 1 | G243: 0.005813 | H243: 0 | I243: 0.613329
A244: ## QueuePool | B244: 12 | C244: 1008000 | D244: 500 | E244: 2016000 | F244: 1 | G244: 0.005815 | H244: 0 | I244: 0.618776
A245: ## QueuePool | B245: 12 | C245: 1008900 | D245: 500 | E245: 2017800 | F245: 1 | G245: 0.005824 | H245: 0 | I245: 0.62319
A246: ## QueuePool | B246: 12 | C246: 1009500 | D246: 500 | E246: 2019000 | F246: 1 | G246: 0.005817 | H246: 0 | I246: 0.627656
A247: ## QueuePool | B247: 12 | C247: 1007700 | D247: 500 | E247: 2015400 | F247: 1 | G247: 0.005835 | H247: 0 | I247: 0.632844
A248: ## QueuePool | B248: 12 | C248: 1009300 | D248: 500 | E248: 2018600 | F248: 3 | G248: 0.005822 | H248: 0 | I248: 0.63698
A249: ## QueuePool | B249: 12 | C249: 1011600 | D249: 500 | E249: 2023200 | F249: 1 | G249: 0.005813 | H249: 0 | I249: 0.640807
A250: ## QueuePool | B250: 12 | C250: 1010500 | D250: 500 | E250: 2021000 | F250: 1 | G250: 0.005832 | H250: 0 | I250: 0.645687
A251: ## QueuePool | B251: 12 | C251: 1008300 | D251: 500 | E251: 2016600 | F251: 1 | G251: 0.005823 | H251: 0 | I251: 0.65088
A252: ## QueuePool | B252: 12 | C252: 979600 | D252: 500 | E252: 1959200 | F252: 1 | G252: 0.00601 | H252: 0 | I252: 0.617477
A253: ## QueuePool | B253: 12 | C253: 979000 | D253: 500 | E253: 1958000 | F253: 1 | G253: 0.005996 | H253: 0 | I253: 0.622501
A254: ## QueuePool | B254: 12 | C254: 973900 | D254: 500 | E254: 1947800 | F254: 1 | G254: 0.006033 | H254: 0 | I254: 0.628943
A255: ## QueuePool | B255: 12 | C255: 975300 | D255: 500 | E255: 1950600 | F255: 1 | G255: 0.006042 | H255: 0 | I255: 0.63328
A256: ## QueuePool | B256: 12 | C256: 977700 | D256: 500 | E256: 1955400 | F256: 1 | G256: 0.005993 | H256: 0 | I256: 0.637223
A257: ## QueuePool | B257: 12 | C257: 971300 | D257: 500 | E257: 1942600 | F257: 1 | G257: 0.00606 | H257: 0 | I257: 0.64404
A258: ## QueuePool | B258: 12 | C258: 976100 | D258: 500 | E258: 1952200 | F258: 1 | G258: 0.006023 | H258: 0 | I258: 0.647125
A259: ## QueuePool | B259: 12 | C259: 979600 | D259: 500 | E259: 1959200 | F259: 1 | G259: 0.005975 | H259: 0 | I259: 0.650577
A260: ## QueuePool | B260: 12 | C260: 971200 | D260: 500 | E260: 1942400 | F260: 1 | G260: 0.006045 | H260: 0 | I260: 0.657994
A261: ## QueuePool | B261: 12 | C261: 972200 | D261: 500 | E261: 1944400 | F261: 1 | G261: 0.006044 | H261: 0 | I261: 0.662234
A262: ## QueuePool | B262: 12 | C262: 960200 | D262: 500 | E262: 1920400 | F262: 1 | G262: 0.006123 | H262: 0 | I262: 0.634369
A263: ## QueuePool | B263: 12 | C263: 963600 | D263: 500 | E263: 1927200 | F263: 1 | G263: 0.006114 | H263: 0 | I263: 0.638057
A264: ## QueuePool | B264: 12 | C264: 954800 | D264: 500 | E264: 1909600 | F264: 1 | G264: 0.006151 | H264: 0 | I264: 0.645771
A265: ## QueuePool | B265: 12 | C265: 960200 | D265: 500 | E265: 1920400 | F265: 1 | G265: 0.006135 | H265: 0 | I265: 0.648699
A266: ## QueuePool | B266: 12 | C266: 965100 | D266: 500 | E266: 1930200 | F266: 1 | G266: 0.006102 | H266: 0 | I266: 0.651748
A267: ## QueuePool | B267: 12 | C267: 955100 | D267: 500 | E267: 1910200 | F267: 1 | G267: 0.006149 | H267: 0 | I267: 0.659827
A268: ## QueuePool | B268: 12 | C268: 955700 | D268: 500 | E268: 1911400 | F268: 1 | G268: 0.006141 | H268: 0 | I268: 0.664259
A269: ## QueuePool | B269: 12 | C269: 962400 | D269: 500 | E269: 1924800 | F269: 1 | G269: 0.006109 | H269: 0 | I269: 0.666541
A270: ## QueuePool | B270: 12 | C270: 951400 | D270: 500 | E270: 1902800 | F270: 1 | G270: 0.006186 | H270: 0 | I270: 0.674981
A271: ## QueuePool | B271: 12 | C271: 959400 | D271: 500 | E271: 1918800 | F271: 1 | G271: 0.006155 | H271: 0 | I271: 0.676723
A272: ## QueuePool | B272: 14 | C272: 937800 | D272: 500 | E272: 1875600 | F272: 1 | G272: 0.007327 | H272: 0 | I272: 0.720961
A273: ## QueuePool | B273: 14 | C273: 939200 | D273: 500 | E273: 1878400 | F273: 1 | G273: 0.007328 | H273: 0 | I273: 0.725492
A274: ## QueuePool | B274: 14 | C274: 934600 | D274: 500 | E274: 1869200 | F274: 1 | G274: 0.007353 | H274: 0 | I274: 0.732312
A275: ## QueuePool | B275: 14 | C275: 935900 | D275: 500 | E275: 1871800 | F275: 1 | G275: 0.007354 | H275: 0 | I275: 0.736811
A276: ## QueuePool | B276: 14 | C276: 939900 | D276: 500 | E276: 1879800 | F276: 1 | G276: 0.007314 | H276: 0 | I276: 0.740199
A277: ## QueuePool | B277: 14 | C277: 931800 | D277: 500 | E277: 1863600 | F277: 1 | G277: 0.007386 | H277: 0 | I277: 0.74836
A278: ## QueuePool | B278: 14 | C278: 932100 | D278: 500 | E278: 1864200 | F278: 1 | G278: 0.00738 | H278: 0 | I278: 0.753155
A279: ## QueuePool | B279: 14 | C279: 931400 | D279: 500 | E279: 1862800 | F279: 1 | G279: 0.00738 | H279: 0 | I279: 0.75832
A280: ## QueuePool | B280: 14 | C280: 933700 | D280: 500 | E280: 1867400 | F280: 2 | G280: 0.007359 | H280: 0 | I280: 0.762247
A281: ## QueuePool | B281: 14 | C281: 935500 | D281: 500 | E281: 1871000 | F281: 1 | G281: 0.007323 | H281: 0 | I281: 0.766307
A282: ## QueuePool | B282: 14 | C282: 1002000 | D282: 500 | E282: 2004000 | F282: 1 | G282: 0.006856 | H282: 0 | I282: 0.68823
A283: ## QueuePool | B283: 14 | C283: 1010500 | D283: 500 | E283: 2021000 | F283: 1 | G283: 0.006803 | H283: 0 | I283: 0.690275
A284: ## QueuePool | B284: 14 | C284: 1002600 | D284: 500 | E284: 2005200 | F284: 1 | G284: 0.006839 | H284: 0 | I284: 0.697906
A285: ## QueuePool | B285: 14 | C285: 1008500 | D285: 500 | E285: 2017000 | F285: 1 | G285: 0.006805 | H285: 0 | I285: 0.700734
A286: ## QueuePool | B286: 14 | C286: 1011900 | D286: 500 | E286: 2023800 | F286: 1 | G286: 0.006766 | H286: 0 | I286: 0.704376
A287: ## QueuePool | B287: 14 | C287: 1011600 | D287: 500 | E287: 2023200 | F287: 1 | G287: 0.006788 | H287: 0 | I287: 0.709282
A288: ## QueuePool | B288: 14 | C288: 1005100 | D288: 500 | E288: 2010200 | F288: 1 | G288: 0.006846 | H288: 0 | I288: 0.716366
A289: ## QueuePool | B289: 14 | C289: 1008200 | D289: 500 | E289: 2016400 | F289: 1 | G289: 0.00681 | H289: 0 | I289: 0.720009
A290: ## QueuePool | B290: 14 | C290: 1005400 | D290: 500 | E290: 2010800 | F290: 1 | G290: 0.006827 | H290: 0 | I290: 0.725729
A291: ## QueuePool | B291: 14 | C291: 1008900 | D291: 500 | E291: 2017800 | F291: 1 | G291: 0.006822 | H291: 0 | I291: 0.729163
A292: ## QueuePool | B292: 14 | C292: 1000600 | D292: 500 | E292: 2001200 | F292: 1 | G292: 0.006894 | H292: 0 | I292: 0.668456
A293: ## QueuePool | B293: 14 | C293: 1004900 | D293: 500 | E293: 2009800 | F293: 1 | G293: 0.006843 | H293: 0 | I293: 0.672135
A294: ## QueuePool | B294: 14 | C294: 1009600 | D294: 500 | E294: 2019200 | F294: 1 | G294: 0.006791 | H294: 0 | I294: 0.675613
A295: ## QueuePool | B295: 14 | C295: 1005100 | D295: 500 | E295: 2010200 | F295: 1 | G295: 0.006847 | H295: 0 | I295: 0.682161
A296: ## QueuePool | B296: 14 | C296: 1002600 | D296: 500 | E296: 2005200 | F296: 1 | G296: 0.00687 | H296: 0 | I296: 0.688022
A297: ## QueuePool | B297: 14 | C297: 1004800 | D297: 500 | E297: 2009600 | F297: 1 | G297: 0.006837 | H297: 0 | I297: 0.692225
A298: ## QueuePool | B298: 14 | C298: 1011700 | D298: 500 | E298: 2023400 | F298: 1 | G298: 0.006785 | H298: 0 | I298: 0.69476
A299: ## QueuePool | B299: 14 | C299: 1006200 | D299: 500 | E299: 2012400 | F299: 1 | G299: 0.006822 | H299: 0 | I299: 0.701535
A300: ## QueuePool | B300: 14 | C300: 1004500 | D300: 500 | E300: 2009000 | F300: 1 | G300: 0.006834 | H300: 0 | I300: 0.706979
A301: ## QueuePool | B301: 14 | C301: 1010600 | D301: 500 | E301: 2021200 | F301: 1 | G301: 0.006805 | H301: 0 | I301: 0.709653
A302: ## QueuePool | B302: 16 | C302: 957600 | D302: 500 | E302: 1915200 | F302: 1 | G302: 0.008223 | H302: 0 | I302: 0.823143
A303: ## QueuePool | B303: 16 | C303: 961500 | D303: 500 | E303: 1923000 | F303: 1 | G303: 0.0082 | H303: 0 | I303: 0.826447
A304: ## QueuePool | B304: 16 | C304: 958300 | D304: 500 | E304: 1916600 | F304: 1 | G304: 0.008232 | H304: 0 | I304: 0.832783
A305: ## QueuePool | B305: 16 | C305: 960400 | D305: 500 | E305: 1920800 | F305: 1 | G305: 0.008206 | H305: 0 | I305: 0.83679
A306: ## QueuePool | B306: 16 | C306: 963300 | D306: 500 | E306: 1926600 | F306: 1 | G306: 0.008189 | H306: 0 | I306: 0.840416
A307: ## QueuePool | B307: 16 | C307: 955300 | D307: 500 | E307: 1910600 | F307: 1 | G307: 0.008245 | H307: 0 | I307: 0.848798
A308: ## QueuePool | B308: 16 | C308: 959400 | D308: 500 | E308: 1918800 | F308: 2 | G308: 0.008201 | H308: 0 | I308: 0.851828
A309: ## QueuePool | B309: 16 | C309: 961000 | D309: 500 | E309: 1922000 | F309: 1 | G309: 0.00819 | H309: 0 | I309: 0.855917
A310: ## QueuePool | B310: 16 | C310: 954800 | D310: 500 | E310: 1909600 | F310: 1 | G310: 0.008264 | H310: 0 | I310: 0.863489
A311: ## QueuePool | B311: 16 | C311: 959100 | D311: 500 | E311: 1918200 | F311: 1 | G311: 0.008206 | H311: 0 | I311: 0.866301
A312: ## QueuePool | B312: 16 | C312: 992400 | D312: 500 | E312: 1984800 | F312: 1 | G312: 0.007942 | H312: 0 | I312: 0.723066
A313: ## QueuePool | B313: 16 | C313: 985100 | D313: 500 | E313: 1970200 | F313: 1 | G313: 0.008008 | H313: 0 | I313: 0.731237
A314: ## QueuePool | B314: 16 | C314: 988400 | D314: 500 | E314: 1976800 | F314: 1 | G314: 0.007992 | H314: 0 | I314: 0.735468
A315: ## QueuePool | B315: 16 | C315: 989800 | D315: 500 | E315: 1979600 | F315: 1 | G315: 0.007969 | H315: 0 | I315: 0.74035
A316: ## QueuePool | B316: 16 | C316: 993200 | D316: 500 | E316: 1986400 | F316: 1 | G316: 0.007939 | H316: 0 | I316: 0.744433
A317: ## QueuePool | B317: 16 | C317: 991500 | D317: 500 | E317: 1983000 | F317: 1 | G317: 0.007957 | H317: 0 | I317: 0.750392
A318: ## QueuePool | B318: 16 | C318: 996200 | D318: 500 | E318: 1992400 | F318: 5 | G318: 0.007923 | H318: 0 | I318: 0.754092
A319: ## QueuePool | B319: 16 | C319: 996100 | D319: 500 | E319: 1992200 | F319: 1 | G319: 0.00793 | H319: 0 | I319: 0.75937
A320: ## QueuePool | B320: 16 | C320: 990200 | D320: 500 | E320: 1980400 | F320: 2 | G320: 0.007963 | H320: 0 | I320: 0.766841
A321: ## QueuePool | B321: 16 | C321: 995700 | D321: 500 | E321: 1991400 | F321: 1 | G321: 0.00792 | H321: 0 | I321: 0.769881
A322: ## QueuePool | B322: 16 | C322: 953400 | D322: 500 | E322: 1906800 | F322: 1 | G322: 0.008267 | H322: 0 | I322: 0.735166
A323: ## QueuePool | B323: 16 | C323: 936900 | D323: 500 | E323: 1873800 | F323: 1 | G323: 0.008411 | H323: 0 | I323: 0.74726
A324: ## QueuePool | B324: 16 | C324: 946000 | D324: 500 | E324: 1892000 | F324: 1 | G324: 0.008351 | H324: 0 | I324: 0.749251
A325: ## QueuePool | B325: 16 | C325: 949900 | D325: 500 | E325: 1899800 | F325: 1 | G325: 0.008287 | H325: 0 | I325: 0.753233
A326: ## QueuePool | B326: 16 | C326: 933600 | D326: 500 | E326: 1867200 | F326: 1 | G326: 0.008433 | H326: 0 | I326: 0.765309
A327: ## QueuePool | B327: 16 | C327: 941900 | D327: 500 | E327: 1883800 | F327: 1 | G327: 0.008364 | H327: 0 | I327: 0.767399
A328: ## QueuePool | B328: 16 | C328: 945800 | D328: 500 | E328: 1891600 | F328: 1 | G328: 0.008325 | H328: 0 | I328: 0.771232
A329: ## QueuePool | B329: 16 | C329: 937900 | D329: 500 | E329: 1875800 | F329: 1 | G329: 0.008402 | H329: 0 | I329: 0.779878
A330: ## QueuePool | B330: 16 | C330: 945500 | D330: 500 | E330: 1891000 | F330: 1 | G330: 0.008331 | H330: 0 | I330: 0.782082
A331: ## QueuePool | B331: 16 | C331: 949600 | D331: 500 | E331: 1899200 | F331: 1 | G331: 0.008302 | H331: 0 | I331: 0.785693

Sheet: stack
A2: ## StackObjectPool | B2: 1 | C2: 1255400 | D2: 500 | E2: 2510800 | F2: 1 | G2: 0.000335 | H2: 0 | I2: 0.145019
A3: ## StackObjectPool | B3: 1 | C3: 1256200 | D3: 500 | E3: 2512400 | F3: 1 | G3: 0.000326 | H3: 0 | I3: 0.146092
A4: ## StackObjectPool | B4: 1 | C4: 1259100 | D4: 500 | E4: 2518200 | F4: 1 | G4: 0.000337 | H4: 0 | I4: 0.147073
A5: ## StackObjectPool | B5: 1 | C5: 1261200 | D5: 500 | E5: 2522400 | F5: 1 | G5: 0.00033 | H5: 0 | I5: 0.148068
A6: ## StackObjectPool | B6: 1 | C6: 1258500 | D6: 500 | E6: 2517000 | F6: 1 | G6: 0.000339 | H6: 0 | I6: 0.149367
A7: ## StackObjectPool | B7: 1 | C7: 1261600 | D7: 500 | E7: 2523200 | F7: 1 | G7: 0.000327 | H7: 0 | I7: 0.150274
A8: ## StackObjectPool | B8: 1 | C8: 1259700 | D8: 500 | E8: 2519400 | F8: 1 | G8: 0.000323 | H8: 0 | I8: 0.151458
A9: ## StackObjectPool | B9: 1 | C9: 1258500 | D9: 500 | E9: 2517000 | F9: 1 | G9: 0.000334 | H9: 0 | I9: 0.152627
A10: ## StackObjectPool | B10: 1 | C10: 1258900 | D10: 500 | E10: 2517800 | F10: 1 | G10: 0.000329 | H10: 0 | I10: 0.153677
A11: ## StackObjectPool | B11: 1 | C11: 1260600 | D11: 500 | E11: 2521200 | F11: 1 | G11: 0.000326 | H11: 0 | I11: 0.154631
A12: ## StackObjectPool | B12: 1 | C12: 1257400 | D12: 500 | E12: 2514800 | F12: 1 | G12: 0.000343 | H12: 0 | I12: 0.144797
A13: ## StackObjectPool | B13: 1 | C13: 1259200 | D13: 500 | E13: 2518400 | F13: 1 | G13: 0.000326 | H13: 0 | I13: 0.145817
A14: ## StackObjectPool | B14: 1 | C14: 1259000 | D14: 500 | E14: 2518000 | F14: 1 | G14: 0.000326 | H14: 0 | I14: 0.146944
A15: ## StackObjectPool | B15: 1 | C15: 1260100 | D15: 500 | E15: 2520200 | F15: 1 | G15: 0.00034 | H15: 0 | I15: 0.148031
A16: ## StackObjectPool | B16: 1 | C16: 1254000 | D16: 500 | E16: 2508000 | F16: 1 | G16: 0.000331 | H16: 0 | I16: 0.149502
A17: ## StackObjectPool | B17: 1 | C17: 1258900 | D17: 500 | E17: 2517800 | F17: 1 | G17: 0.000346 | H17: 0 | I17: 0.150364
A18: ## StackObjectPool | B18: 1 | C18: 1254300 | D18: 500 | E18: 2508600 | F18: 1 | G18: 0.000334 | H18: 0 | I18: 0.151744
A19: ## StackObjectPool | B19: 1 | C19: 1254900 | D19: 500 | E19: 2509800 | F19: 1 | G19: 0.000331 | H19: 0 | I19: 0.152794
A20: ## StackObjectPool | B20: 1 | C20: 1256600 | D20: 500 | E20: 2513200 | F20: 1 | G20: 0.000328 | H20: 0 | I20: 0.15376
A21: ## StackObjectPool | B21: 1 | C21: 1258300 | D21: 500 | E21: 2516600 | F21: 1 | G21: 0.000325 | H21: 0 | I21: 0.154711
A22: ## StackObjectPool | B22: 1 | C22: 1258000 | D22: 500 | E22: 2516000 | F22: 1 | G22: 0.000335 | H22: 0 | I22: 0.144845
A23: ## StackObjectPool | B23: 1 | C23: 1255300 | D23: 500 | E23: 2510600 | F23: 1 | G23: 0.000331 | H23: 0 | I23: 0.146136
A24: ## StackObjectPool | B24: 1 | C24: 1253700 | D24: 500 | E24: 2507400 | F24: 1 | G24: 0.000333 | H24: 0 | I24: 0.147365
A25: ## StackObjectPool | B25: 1 | C25: 1262200 | D25: 500 | E25: 2524400 | F25: 1 | G25: 0.000338 | H25: 0 | I25: 0.148012
A26: ## StackObjectPool | B26: 1 | C26: 1262800 | D26: 500 | E26: 2525600 | F26: 1 | G26: 0.000331 | H26: 0 | I26: 0.149091
A27: ## StackObjectPool | B27: 1 | C27: 1263400 | D27: 500 | E27: 2526800 | F27: 1 | G27: 0.000328 | H27: 0 | I27: 0.150151
A28: ## StackObjectPool | B28: 1 | C28: 1261100 | D28: 500 | E28: 2522200 | F28: 1 | G28: 0.000336 | H28: 0 | I28: 0.151403
A29: ## StackObjectPool | B29: 1 | C29: 1262400 | D29: 500 | E29: 2524800 | F29: 1 | G29: 0.000322 | H29: 0 | I29: 0.152384
A30: ## StackObjectPool | B30: 1 | C30: 1262300 | D30: 500 | E30: 2524600 | F30: 1 | G30: 0.000332 | H30: 0 | I30: 0.153475
A31: ## StackObjectPool | B31: 1 | C31: 1260300 | D31: 500 | E31: 2520600 | F31: 1 | G31: 0.000332 | H31: 0 | I31: 0.154672
A32: ## StackObjectPool | B32: 2 | C32: 493700 | D32: 500 | E32: 987400 | F32: 1 | G32: 0.00194 | H32: 0 | I32: 0.348532
A33: ## StackObjectPool | B33: 2 | C33: 499900 | D33: 500 | E33: 999800 | F33: 1 | G33: 0.001894 | H33: 0 | I33: 0.349089
A34: ## StackObjectPool | B34: 2 | C34: 496100 | D34: 500 | E34: 992200 | F34: 1 | G34: 0.001899 | H34: 0 | I34: 0.353122
A35: ## StackObjectPool | B35: 2 | C35: 502300 | D35: 500 | E35: 1004600 | F35: 1 | G35: 0.001899 | H35: 0 | I35: 0.353631
A36: ## StackObjectPool | B36: 2 | C36: 499300 | D36: 500 | E36: 998600 | F36: 1 | G36: 0.001883 | H36: 0 | I36: 0.357336
A37: ## StackObjectPool | B37: 2 | C37: 500600 | D37: 500 | E37: 1001200 | F37: 1 | G37: 0.0019 | H37: 0 | I37: 0.359524
A38: ## StackObjectPool | B38: 2 | C38: 500900 | D38: 500 | E38: 1001800 | F38: 1 | G38: 0.001897 | H38: 0 | I38: 0.362045
A39: ## StackObjectPool | B39: 2 | C39: 500500 | D39: 500 | E39: 1001000 | F39: 1 | G39: 0.00191 | H39: 0 | I39: 0.364817
A40: ## StackObjectPool | B40: 2 | C40: 496500 | D40: 500 | E40: 993000 | F40: 1 | G40: 0.001934 | H40: 0 | I40: 0.368913
A41: ## StackObjectPool | B41: 2 | C41: 495100 | D41: 500 | E41: 990200 | F41: 1 | G41: 0.001899 | H41: 0 | I41: 0.371995
A42: ## StackObjectPool | B42: 2 | C42: 487200 | D42: 500 | E42: 974400 | F42: 1 | G42: 0.001954 | H42: 0 | I42: 0.35787
A43: ## StackObjectPool | B43: 2 | C43: 484300 | D43: 500 | E43: 968600 | F43: 1 | G43: 0.001986 | H43: 0 | I43: 0.361696
A44: ## StackObjectPool | B44: 2 | C44: 487300 | D44: 500 | E44: 974600 | F44: 1 | G44: 0.001966 | H44: 0 | I44: 0.363297
A45: ## StackObjectPool | B45: 2 | C45: 489500 | D45: 500 | E45: 979000 | F45: 1 | G45: 0.001949 | H45: 0 | I45: 0.365158
A46: ## StackObjectPool | B46: 2 | C46: 486100 | D46: 500 | E46: 972200 | F46: 1 | G46: 0.001963 | H46: 0 | I46: 0.369101
A47: ## StackObjectPool | B47: 2 | C47: 487700 | D47: 500 | E47: 975400 | F47: 1 | G47: 0.001946 | H47: 0 | I47: 0.371126
A48: ## StackObjectPool | B48: 2 | C48: 485200 | D48: 500 | E48: 970400 | F48: 1 | G48: 0.001977 | H48: 0 | I48: 0.374727
A49: ## StackObjectPool | B49: 2 | C49: 485500 | D49: 500 | E49: 971000 | F49: 1 | G49: 0.001988 | H49: 0 | I49: 0.377255
A50: ## StackObjectPool | B50: 2 | C50: 484600 | D50: 500 | E50: 969200 | F50: 1 | G50: 0.001971 | H50: 0 | I50: 0.380206
A51: ## StackObjectPool | B51: 2 | C51: 488900 | D51: 500 | E51: 977800 | F51: 1 | G51: 0.00197 | H51: 0 | I51: 0.381123
A52: ## StackObjectPool | B52: 2 | C52: 508700 | D52: 500 | E52: 1017400 | F52: 1 | G52: 0.001871 | H52: 0 | I52: 0.344872
A53: ## StackObjectPool | B53: 2 | C53: 489500 | D53: 500 | E53: 979000 | F53: 1 | G53: 0.001955 | H53: 0 | I53: 0.35434
A54: ## StackObjectPool | B54: 2 | C54: 503400 | D54: 500 | E54: 1006800 | F54: 1 | G54: 0.001893 | H54: 0 | I54: 0.352113
A55: ## StackObjectPool | B55: 2 | C55: 490300 | D55: 500 | E55: 980600 | F55: 1 | G55: 0.001966 | H55: 0 | I55: 0.35953
A56: ## StackObjectPool | B56: 2 | C56: 503900 | D56: 500 | E56: 1007800 | F56: 1 | G56: 0.001911 | H56: 0 | I56: 0.35733
A57: ## StackObjectPool | B57: 2 | C57: 488300 | D57: 500 | E57: 976600 | F57: 1 | G57: 0.001954 | H57: 0 | I57: 0.365674
A58: ## StackObjectPool | B58: 2 | C58: 512800 | D58: 500 | E58: 1025600 | F58: 1 | G58: 0.001882 | H58: 0 | I58: 0.359459
A59: ## StackObjectPool | B59: 2 | C59: 486800 | D59: 500 | E59: 973600 | F59: 1 | G59: 0.001993 | H59: 0 | I59: 0.371624
A60: ## StackObjectPool | B60: 2 | C60: 514400 | D60: 500 | E60: 1028800 | F60: 1 | G60: 0.00188 | H60: 0 | I60: 0.364107
A61: ## StackObjectPool | B61: 2 | C61: 489700 | D61: 500 | E61: 979400 | F61: 1 | G61: 0.001962 | H61: 0 | I61: 0.375797
A62: ## StackObjectPool | B62: 3 | C62: 461200 | D62: 500 | E62: 922400 | F62: 1 | G62: 0.003163 | H62: 0 | I62: 0.448045
A63: ## StackObjectPool | B63: 3 | C63: 465900 | D63: 500 | E63: 931800 | F63: 1 | G63: 0.003127 | H63: 0 | I63: 0.449274
A64: ## StackObjectPool | B64: 3 | C64: 464100 | D64: 500 | E64: 928200 | F64: 1 | G64: 0.003137 | H64: 0 | I64: 0.453615
A65: ## StackObjectPool | B65: 3 | C65: 465400 | D65: 500 | E65: 930800 | F65: 1 | G65: 0.003133 | H65: 0 | I65: 0.456426
A66: ## StackObjectPool | B66: 3 | C66: 465600 | D66: 500 | E66: 931200 | F66: 1 | G66: 0.003112 | H66: 0 | I66: 0.459726
A67: ## StackObjectPool | B67: 3 | C67: 467800 | D67: 500 | E67: 935600 | F67: 1 | G67: 0.003104 | H67: 0 | I67: 0.462015
A68: ## StackObjectPool | B68: 3 | C68: 464900 | D68: 500 | E68: 929800 | F68: 1 | G68: 0.003115 | H68: 0 | I68: 0.466802
A69: ## StackObjectPool | B69: 3 | C69: 464200 | D69: 500 | E69: 928400 | F69: 1 | G69: 0.003119 | H69: 0 | I69: 0.47048
A70: ## StackObjectPool | B70: 3 | C70: 464200 | D70: 500 | E70: 928400 | F70: 1 | G70: 0.00313 | H70: 0 | I70: 0.473795
A71: ## StackObjectPool | B71: 3 | C71: 464400 | D71: 500 | E71: 928800 | F71: 1 | G71: 0.003131 | H71: 0 | I71: 0.476986
A72: ## StackObjectPool | B72: 3 | C72: 465600 | D72: 500 | E72: 931200 | F72: 1 | G72: 0.003104 | H72: 0 | I72: 0.443119
A73: ## StackObjectPool | B73: 3 | C73: 464300 | D73: 500 | E73: 928600 | F73: 1 | G73: 0.003104 | H73: 0 | I73: 0.447222
A74: ## StackObjectPool | B74: 3 | C74: 461500 | D74: 500 | E74: 923000 | F74: 1 | G74: 0.003142 | H74: 0 | I74: 0.452065
A75: ## StackObjectPool | B75: 3 | C75: 460600 | D75: 500 | E75: 921200 | F75: 1 | G75: 0.003124 | H75: 0 | I75: 0.455946
A76: ## StackObjectPool | B76: 3 | C76: 462300 | D76: 500 | E76: 924600 | F76: 1 | G76: 0.003119 | H76: 0 | I76: 0.458521
A77: ## StackObjectPool | B77: 3 | C77: 465700 | D77: 500 | E77: 931400 | F77: 1 | G77: 0.003122 | H77: 0 | I77: 0.460248
A78: ## StackObjectPool | B78: 3 | C78: 458800 | D78: 500 | E78: 917600 | F78: 1 | G78: 0.003173 | H78: 0 | I78: 0.467105
A79: ## StackObjectPool | B79: 3 | C79: 460000 | D79: 500 | E79: 920000 | F79: 1 | G79: 0.003161 | H79: 0 | I79: 0.469871
A80: ## StackObjectPool | B80: 3 | C80: 461600 | D80: 500 | E80: 923200 | F80: 1 | G80: 0.00313 | H80: 0 | I80: 0.472382
A81: ## StackObjectPool | B81: 3 | C81: 463500 | D81: 500 | E81: 927000 | F81: 1 | G81: 0.003135 | H81: 0 | I81: 0.474726
A82: ## StackObjectPool | B82: 3 | C82: 424000 | D82: 500 | E82: 848000 | F82: 1 | G82: 0.003425 | H82: 0 | I82: 0.466789
A83: ## StackObjectPool | B83: 3 | C83: 430600 | D83: 500 | E83: 861200 | F83: 1 | G83: 0.00337 | H83: 0 | I83: 0.466821
A84: ## StackObjectPool | B84: 3 | C84: 428500 | D84: 500 | E84: 857000 | F84: 1 | G84: 0.003368 | H84: 0 | I84: 0.471548
A85: ## StackObjectPool | B85: 3 | C85: 425300 | D85: 500 | E85: 850600 | F85: 1 | G85: 0.003412 | H85: 0 | I85: 0.476909
A86: ## StackObjectPool | B86: 3 | C86: 429100 | D86: 500 | E86: 858200 | F86: 1 | G86: 0.003384 | H86: 0 | I86: 0.478343
A87: ## StackObjectPool | B87: 3 | C87: 428500 | D87: 500 | E87: 857000 | F87: 1 | G87: 0.003419 | H87: 0 | I87: 0.482235
A88: ## StackObjectPool | B88: 3 | C88: 429500 | D88: 500 | E88: 859000 | F88: 1 | G88: 0.003376 | H88: 0 | I88: 0.485166
A89: ## StackObjectPool | B89: 3 | C89: 429300 | D89: 500 | E89: 858600 | F89: 1 | G89: 0.003392 | H89: 0 | I89: 0.48876
A90: ## StackObjectPool | B90: 3 | C90: 425900 | D90: 500 | E90: 851800 | F90: 1 | G90: 0.003372 | H90: 0 | I90: 0.494131
A91: ## StackObjectPool | B91: 3 | C91: 427400 | D91: 500 | E91: 854800 | F91: 1 | G91: 0.003369 | H91: 0 | I91: 0.496667
A92: ## StackObjectPool | B92: 4 | C92: 465200 | D92: 500 | E92: 930400 | F92: 1 | G92: 0.004187 | H92: 0 | I92: 0.517434
A93: ## StackObjectPool | B93: 4 | C93: 465000 | D93: 500 | E93: 930000 | F93: 1 | G93: 0.004185 | H93: 0 | I93: 0.521573
A94: ## StackObjectPool | B94: 4 | C94: 462900 | D94: 500 | E94: 925800 | F94: 1 | G94: 0.004234 | H94: 0 | I94: 0.526789
A95: ## StackObjectPool | B95: 4 | C95: 463500 | D95: 500 | E95: 927000 | F95: 1 | G95: 0.004203 | H95: 0 | I95: 0.530425
A96: ## StackObjectPool | B96: 4 | C96: 466500 | D96: 500 | E96: 933000 | F96: 1 | G96: 0.004174 | H96: 0 | I96: 0.532649
A97: ## StackObjectPool | B97: 4 | C97: 464700 | D97: 500 | E97: 929400 | F97: 1 | G97: 0.004192 | H97: 0 | I97: 0.537592
A98: ## StackObjectPool | B98: 4 | C98: 463400 | D98: 500 | E98: 926800 | F98: 1 | G98: 0.00418 | H98: 0 | I98: 0.542214
A99: ## StackObjectPool | B99: 4 | C99: 465000 | D99: 500 | E99: 930000 | F99: 1 | G99: 0.004172 | H99: 0 | I99: 0.545121
A100: ## StackObjectPool | B100: 4 | C100: 464800 | D100: 500 | E100: 929600 | F100: 1 | G100: 0.004189 | H100: 0 | I100: 0.549066
A101: ## StackObjectPool | B101: 4 | C101: 464900 | D101: 500 | E101: 929800 | F101: 1 | G101: 0.004166 | H101: 0 | I101: 0.552789
A102: ## StackObjectPool | B102: 4 | C102: 474100 | D102: 500 | E102: 948200 | F102: 1 | G102: 0.004115 | H102: 0 | I102: 0.513511
A103: ## StackObjectPool | B103: 4 | C103: 474000 | D103: 500 | E103: 948000 | F103: 1 | G103: 0.004124 | H103: 0 | I103: 0.517565
A104: ## StackObjectPool | B104: 4 | C104: 475100 | D104: 500 | E104: 950200 | F104: 1 | G104: 0.00413 | H104: 0 | I104: 0.520944
A105: ## StackObjectPool | B105: 4 | C105: 473000 | D105: 500 | E105: 946000 | F105: 1 | G105: 0.004123 | H105: 0 | I105: 0.526033
A106: ## StackObjectPool | B106: 4 | C106: 474600 | D106: 500 | E106: 949200 | F106: 1 | G106: 0.004111 | H106: 0 | I106: 0.529045
A107: ## StackObjectPool | B107: 4 | C107: 473100 | D107: 500 | E107: 946200 | F107: 1 | G107: 0.00412 | H107: 0 | I107: 0.533756
A108: ## StackObjectPool | B108: 4 | C108: 477200 | D108: 500 | E108: 954400 | F108: 1 | G108: 0.004101 | H108: 0 | I108: 0.535302
A109: ## StackObjectPool | B109: 4 | C109: 476200 | D109: 500 | E109: 952400 | F109: 1 | G109: 0.004078 | H109: 0 | I109: 0.539656
A110: ## StackObjectPool | B110: 4 | C110: 476600 | D110: 500 | E110: 953200 | F110: 1 | G110: 0.004087 | H110: 0 | I110: 0.543205
A111: ## StackObjectPool | B111: 4 | C111: 476600 | D111: 500 | E111: 953200 | F111: 1 | G111: 0.004081 | H111: 0 | I111: 0.546948
A112: ## StackObjectPool | B112: 4 | C112: 465000 | D112: 500 | E112: 930000 | F112: 1 | G112: 0.004209 | H112: 0 | I112: 0.515025
A113: ## StackObjectPool | B113: 4 | C113: 465600 | D113: 500 | E113: 931200 | F113: 1 | G113: 0.004197 | H113: 0 | I113: 0.518754
A114: ## StackObjectPool | B114: 4 | C114: 462800 | D114: 500 | E114: 925600 | F114: 1 | G114: 0.004246 | H114: 0 | I114: 0.524385
A115: ## StackObjectPool | B115: 4 | C115: 466600 | D115: 500 | E115: 933200 | F115: 1 | G115: 0.004203 | H115: 0 | I115: 0.526254
A116: ## StackObjectPool | B116: 4 | C116: 463700 | D116: 500 | E116: 927400 | F116: 1 | G116: 0.004216 | H116: 0 | I116: 0.531875
A117: ## StackObjectPool | B117: 4 | C117: 464300 | D117: 500 | E117: 928600 | F117: 1 | G117: 0.004204 | H117: 0 | I117: 0.535472
A118: ## StackObjectPool | B118: 4 | C118: 464700 | D118: 500 | E118: 929400 | F118: 1 | G118: 0.004226 | H118: 0 | I118: 0.539175
A119: ## StackObjectPool | B119: 4 | C119: 467900 | D119: 500 | E119: 935800 | F119: 1 | G119: 0.004176 | H119: 0 | I119: 0.5412
A120: ## StackObjectPool | B120: 4 | C120: 466300 | D120: 500 | E120: 932600 | F120: 1 | G120: 0.004175 | H120: 0 | I120: 0.545965
A121: ## StackObjectPool | B121: 4 | C121: 465400 | D121: 500 | E121: 930800 | F121: 1 | G121: 0.004209 | H121: 0 | I121: 0.550331
A122: ## StackObjectPool | B122: 5 | C122: 443400 | D122: 500 | E122: 886800 | F122: 1 | G122: 0.005519 | H122: 0 | I122: 0.593596
A123: ## StackObjectPool | B123: 5 | C123: 450900 | D123: 500 | E123: 901800 | F123: 1 | G123: 0.005434 | H123: 0 | I123: 0.593236
A124: ## StackObjectPool | B124: 5 | C124: 450300 | D124: 500 | E124: 900600 | F124: 1 | G124: 0.005445 | H124: 0 | I124: 0.5982
A125: ## StackObjectPool | B125: 5 | C125: 448700 | D125: 500 | E125: 897400 | F125: 1 | G125: 0.005447 | H125: 0 | I125: 0.603793
A126: ## StackObjectPool | B126: 5 | C126: 450400 | D126: 500 | E126: 900800 | F126: 1 | G126: 0.005406 | H126: 0 | I126: 0.607121
A127: ## StackObjectPool | B127: 5 | C127: 450700 | D127: 500 | E127: 901400 | F127: 1 | G127: 0.005445 | H127: 0 | I127: 0.611388
A128: ## StackObjectPool | B128: 5 | C128: 448800 | D128: 500 | E128: 897600 | F128: 1 | G128: 0.005457 | H128: 0 | I128: 0.617118
A129: ## StackObjectPool | B129: 5 | C129: 450500 | D129: 500 | E129: 901000 | F129: 1 | G129: 0.005443 | H129: 0 | I129: 0.620355
A130: ## StackObjectPool | B130: 5 | C130: 448400 | D130: 500 | E130: 896800 | F130: 1 | G130: 0.005486 | H130: 0 | I130: 0.626202
A131: ## StackObjectPool | B131: 5 | C131: 449500 | D131: 500 | E131: 899000 | F131: 1 | G131: 0.005453 | H131: 0 | I131: 0.629779
A132: ## StackObjectPool | B132: 5 | C132: 464200 | D132: 500 | E132: 928400 | F132: 1 | G132: 0.005274 | H132: 0 | I132: 0.577603
A133: ## StackObjectPool | B133: 5 | C133: 460700 | D133: 500 | E133: 921400 | F133: 1 | G133: 0.005338 | H133: 0 | I133: 0.584378
A134: ## StackObjectPool | B134: 5 | C134: 463100 | D134: 500 | E134: 926200 | F134: 1 | G134: 0.005293 | H134: 0 | I134: 0.587385
A135: ## StackObjectPool | B135: 5 | C135: 461500 | D135: 500 | E135: 923000 | F135: 1 | G135: 0.005298 | H135: 0 | I135: 0.592887
A136: ## StackObjectPool | B136: 5 | C136: 463100 | D136: 500 | E136: 926200 | F136: 1 | G136: 0.005258 | H136: 0 | I136: 0.596287
A137: ## StackObjectPool | B137: 5 | C137: 462400 | D137: 500 | E137: 924800 | F137: 1 | G137: 0.005307 | H137: 0 | I137: 0.601168
A138: ## StackObjectPool | B138: 5 | C138: 464600 | D138: 500 | E138: 929200 | F138: 1 | G138: 0.005252 | H138: 0 | I138: 0.604106
A139: ## StackObjectPool | B139: 5 | C139: 462700 | D139: 500 | E139: 925400 | F139: 1 | G139: 0.005282 | H139: 0 | I139: 0.609692
A140: ## StackObjectPool | B140: 5 | C140: 463100 | D140: 500 | E140: 926200 | F140: 1 | G140: 0.005247 | H140: 0 | I140: 0.613719
A141: ## StackObjectPool | B141: 5 | C141: 463500 | D141: 500 | E141: 927000 | F141: 1 | G141: 0.005271 | H141: 0 | I141: 0.617735
A142: ## StackObjectPool | B142: 5 | C142: 473500 | D142: 500 | E142: 947000 | F142: 1 | G142: 0.005145 | H142: 0 | I142: 0.571085
A143: ## StackObjectPool | B143: 5 | C143: 476200 | D143: 500 | E143: 952400 | F143: 1 | G143: 0.005113 | H143: 0 | I143: 0.573936
A144: ## StackObjectPool | B144: 5 | C144: 473800 | D144: 500 | E144: 947600 | F144: 1 | G144: 0.005156 | H144: 0 | I144: 0.579851
A145: ## StackObjectPool | B145: 5 | C145: 474400 | D145: 500 | E145: 948800 | F145: 1 | G145: 0.005169 | H145: 0 | I145: 0.583927
A146: ## StackObjectPool | B146: 5 | C146: 473500 | D146: 500 | E146: 947000 | F146: 1 | G146: 0.005172 | H146: 0 | I146: 0.588889
A147: ## StackObjectPool | B147: 5 | C147: 474900 | D147: 500 | E147: 949800 | F147: 1 | G147: 0.005161 | H147: 0 | I147: 0.592393
A148: ## StackObjectPool | B148: 5 | C148: 475500 | D148: 500 | E148: 951000 | F148: 1 | G148: 0.005148 | H148: 0 | I148: 0.596351
A149: ## StackObjectPool | B149: 5 | C149: 476200 | D149: 500 | E149: 952400 | F149: 1 | G149: 0.005128 | H149: 0 | I149: 0.6002
A150: ## StackObjectPool | B150: 5 | C150: 475900 | D150: 500 | E150: 951800 | F150: 1 | G150: 0.005144 | H150: 0 | I150: 0.604658
A151: ## StackObjectPool | B151: 5 | C151: 475500 | D151: 500 | E151: 951000 | F151: 1 | G151: 0.005129 | H151: 0 | I151: 0.609137
A152: ## StackObjectPool | B152: 6 | C152: 431800 | D152: 500 | E152: 863600 | F152: 1 | G152: 0.006839 | H152: 0 | I152: 0.662039
A153: ## StackObjectPool | B153: 6 | C153: 433200 | D153: 500 | E153: 866400 | F153: 1 | G153: 0.006801 | H153: 0 | I153: 0.666093
A154: ## StackObjectPool | B154: 6 | C154: 432300 | D154: 500 | E154: 864600 | F154: 1 | G154: 0.006822 | H154: 0 | I154: 0.671881
A155: ## StackObjectPool | B155: 6 | C155: 434100 | D155: 500 | E155: 868200 | F155: 1 | G155: 0.006796 | H155: 0 | I155: 0.675536
A156: ## StackObjectPool | B156: 6 | C156: 432200 | D156: 500 | E156: 864400 | F156: 1 | G156: 0.006819 | H156: 0 | I156: 0.682036
A157: ## StackObjectPool | B157: 6 | C157: 434500 | D157: 500 | E157: 869000 | F157: 1 | G157: 0.006799 | H157: 0 | I157: 0.685208
A158: ## StackObjectPool | B158: 6 | C158: 433200 | D158: 500 | E158: 866400 | F158: 1 | G158: 0.006777 | H158: 0 | I158: 0.691156
A159: ## StackObjectPool | B159: 6 | C159: 434100 | D159: 500 | E159: 868200 | F159: 1 | G159: 0.006775 | H159: 0 | I159: 0.695328
A160: ## StackObjectPool | B160: 6 | C160: 432400 | D160: 500 | E160: 864800 | F160: 1 | G160: 0.006829 | H160: 0 | I160: 0.701577
A161: ## StackObjectPool | B161: 6 | C161: 435000 | D161: 500 | E161: 870000 | F161: 1 | G161: 0.006784 | H161: 0 | I161: 0.70431
A162: ## StackObjectPool | B162: 6 | C162: 453600 | D162: 500 | E162: 907200 | F162: 1 | G162: 0.006479 | H162: 0 | I162: 0.641882
A163: ## StackObjectPool | B163: 6 | C163: 451400 | D163: 500 | E163: 902800 | F163: 1 | G163: 0.006535 | H163: 0 | I163: 0.648502
A164: ## StackObjectPool | B164: 6 | C164: 453400 | D164: 500 | E164: 906800 | F164: 1 | G164: 0.00652 | H164: 0 | I164: 0.652089
A165: ## StackObjectPool | B165: 6 | C165: 451500 | D165: 500 | E165: 903000 | F165: 1 | G165: 0.006543 | H165: 0 | I165: 0.658447
A166: ## StackObjectPool | B166: 6 | C166: 452000 | D166: 500 | E166: 904000 | F166: 1 | G166: 0.006504 | H166: 0 | I166: 0.663006
A167: ## StackObjectPool | B167: 6 | C167: 450400 | D167: 500 | E167: 900800 | F167: 1 | G167: 0.006528 | H167: 0 | I167: 0.669079
A168: ## StackObjectPool | B168: 6 | C168: 451000 | D168: 500 | E168: 902000 | F168: 1 | G168: 0.006523 | H168: 0 | I168: 0.673494
A169: ## StackObjectPool | B169: 6 | C169: 452900 | D169: 500 | E169: 905800 | F169: 1 | G169: 0.00652 | H169: 0 | I169: 0.676913
A170: ## StackObjectPool | B170: 6 | C170: 453000 | D170: 500 | E170: 906000 | F170: 1 | G170: 0.006503 | H170: 0 | I170: 0.681626
A171: ## StackObjectPool | B171: 6 | C171: 451700 | D171: 500 | E171: 903400 | F171: 1 | G171: 0.006555 | H171: 0 | I171: 0.68739
A172: ## StackObjectPool | B172: 6 | C172: 459500 | D172: 500 | E172: 919000 | F172: 1 | G172: 0.006448 | H172: 0 | I172: 0.640756
A173: ## StackObjectPool | B173: 6 | C173: 457700 | D173: 500 | E173: 915400 | F173: 1 | G173: 0.006412 | H173: 0 | I173: 0.64699
A174: ## StackObjectPool | B174: 6 | C174: 457900 | D174: 500 | E174: 915800 | F174: 1 | G174: 0.006412 | H174: 0 | I174: 0.651786
A175: ## StackObjectPool | B175: 6 | C175: 458600 | D175: 500 | E175: 917200 | F175: 1 | G175: 0.006413 | H175: 0 | I175: 0.656193
A176: ## StackObjectPool | B176: 6 | C176: 458200 | D176: 500 | E176: 916400 | F176: 1 | G176: 0.00643 | H176: 0 | I176: 0.661358
A177: ## StackObjectPool | B177: 6 | C177: 457600 | D177: 500 | E177: 915200 | F177: 1 | G177: 0.006429 | H177: 0 | I177: 0.666631
A178: ## StackObjectPool | B178: 6 | C178: 458400 | D178: 500 | E178: 916800 | F178: 1 | G178: 0.006414 | H178: 0 | I178: 0.670847
A179: ## StackObjectPool | B179: 6 | C179: 457800 | D179: 500 | E179: 915600 | F179: 1 | G179: 0.006459 | H179: 0 | I179: 0.67608
A180: ## StackObjectPool | B180: 6 | C180: 457900 | D180: 500 | E180: 915800 | F180: 1 | G180: 0.006414 | H180: 0 | I180: 0.680734
A181: ## StackObjectPool | B181: 6 | C181: 456900 | D181: 500 | E181: 913800 | F181: 1 | G181: 0.006422 | H181: 0 | I181: 0.686174
A182: ## StackObjectPool | B182: 8 | C182: 441900 | D182: 500 | E182: 883800 | F182: 1 | G182: 0.008952 | H182: 0 | I182: 0.750318
A183: ## StackObjectPool | B183: 8 | C183: 443100 | D183: 500 | E183: 886200 | F183: 1 | G183: 0.008912 | H183: 0 | I183: 0.755225
A184: ## StackObjectPool | B184: 8 | C184: 439800 | D184: 500 | E184: 879600 | F184: 1 | G184: 0.008993 | H184: 0 | I184: 0.763961
A185: ## StackObjectPool | B185: 8 | C185: 442400 | D185: 500 | E185: 884800 | F185: 1 | G185: 0.008938 | H185: 0 | I185: 0.767558
A186: ## StackObjectPool | B186: 8 | C186: 442500 | D186: 500 | E186: 885000 | F186: 1 | G186: 0.008949 | H186: 0 | I186: 0.773279
A187: ## StackObjectPool | B187: 8 | C187: 442100 | D187: 500 | E187: 884200 | F187: 1 | G187: 0.008944 | H187: 0 | I187: 0.779388
A188: ## StackObjectPool | B188: 8 | C188: 442200 | D188: 500 | E188: 884400 | F188: 1 | G188: 0.008917 | H188: 0 | I188: 0.785
A189: ## StackObjectPool | B189: 8 | C189: 443800 | D189: 500 | E189: 887600 | F189: 1 | G189: 0.008898 | H189: 0 | I189: 0.789241
A190: ## StackObjectPool | B190: 8 | C190: 442500 | D190: 500 | E190: 885000 | F190: 1 | G190: 0.008908 | H190: 0 | I190: 0.796015
A191: ## StackObjectPool | B191: 8 | C191: 440600 | D191: 500 | E191: 881200 | F191: 1 | G191: 0.008956 | H191: 0 | I191: 0.803323
A192: ## StackObjectPool | B192: 8 | C192: 439100 | D192: 500 | E192: 878200 | F192: 1 | G192: 0.009009 | H192: 0 | I192: 0.764665
A193: ## StackObjectPool | B193: 8 | C193: 440200 | D193: 500 | E193: 880400 | F193: 1 | G193: 0.00895 | H193: 0 | I193: 0.769547
A194: ## StackObjectPool | B194: 8 | C194: 441000 | D194: 500 | E194: 882000 | F194: 1 | G194: 0.008971 | H194: 0 | I194: 0.77466
A195: ## StackObjectPool | B195: 8 | C195: 440200 | D195: 500 | E195: 880400 | F195: 1 | G195: 0.008971 | H195: 0 | I195: 0.781128
A196: ## StackObjectPool | B196: 8 | C196: 439100 | D196: 500 | E196: 878200 | F196: 1 | G196: 0.008998 | H196: 0 | I196: 0.787837
A197: ## StackObjectPool | B197: 8 | C197: 439700 | D197: 500 | E197: 879400 | F197: 1 | G197: 0.009008 | H197: 0 | I197: 0.792999
A198: ## StackObjectPool | B198: 8 | C198: 440100 | D198: 500 | E198: 880200 | F198: 1 | G198: 0.008993 | H198: 0 | I198: 0.798292
A199: ## StackObjectPool | B199: 8 | C199: 440600 | D199: 500 | E199: 881200 | F199: 1 | G199: 0.008949 | H199: 0 | I199: 0.803428
A200: ## StackObjectPool | B200: 8 | C200: 441100 | D200: 500 | E200: 882200 | F200: 1 | G200: 0.008955 | H200: 0 | I200: 0.808529
A201: ## StackObjectPool | B201: 8 | C201: 438900 | D201: 500 | E201: 877800 | F201: 1 | G201: 0.009013 | H201: 0 | I201: 0.816094
A202: ## StackObjectPool | B202: 8 | C202: 431300 | D202: 500 | E202: 862600 | F202: 1 | G202: 0.009135 | H202: 0 | I202: 0.763797
A203: ## StackObjectPool | B203: 8 | C203: 428800 | D203: 500 | E203: 857600 | F203: 1 | G203: 0.009186 | H203: 0 | I203: 0.771992
A204: ## StackObjectPool | B204: 8 | C204: 433900 | D204: 500 | E204: 867800 | F204: 1 | G204: 0.009092 | H204: 0 | I204: 0.773343
A205: ## StackObjectPool | B205: 8 | C205: 426600 | D205: 500 | E205: 853200 | F205: 1 | G205: 0.009231 | H205: 0 | I205: 0.785827
A206: ## StackObjectPool | B206: 8 | C206: 433400 | D206: 500 | E206: 866800 | F206: 1 | G206: 0.0091 | H206: 0 | I206: 0.785453
A207: ## StackObjectPool | B207: 8 | C207: 430600 | D207: 500 | E207: 861200 | F207: 1 | G207: 0.009159 | H207: 0 | I207: 0.793793
A208: ## StackObjectPool | B208: 8 | C208: 434800 | D208: 500 | E208: 869600 | F208: 1 | G208: 0.009078 | H208: 0 | I208: 0.795675
A209: ## StackObjectPool | B209: 8 | C209: 428300 | D209: 500 | E209: 856600 | F209: 1 | G209: 0.009185 | H209: 0 | I209: 0.807398
A210: ## StackObjectPool | B210: 8 | C210: 432000 | D210: 500 | E210: 864000 | F210: 1 | G210: 0.009155 | H210: 0 | I210: 0.809606
A211: ## StackObjectPool | B211: 8 | C211: 438100 | D211: 500 | E211: 876200 | F211: 1 | G211: 0.009037 | H211: 0 | I211: 0.809552
A212: ## StackObjectPool | B212: 10 | C212: 420600 | D212: 500 | E212: 841200 | F212: 1 | G212: 0.011728 | H212: 0 | I212: 0.867076
A213: ## StackObjectPool | B213: 10 | C213: 421500 | D213: 500 | E213: 843000 | F213: 1 | G213: 0.01173 | H213: 0 | I213: 0.872895
A214: ## StackObjectPool | B214: 10 | C214: 422100 | D214: 500 | E214: 844200 | F214: 1 | G214: 0.011696 | H214: 0 | I214: 0.878953
A215: ## StackObjectPool | B215: 10 | C215: 421800 | D215: 500 | E215: 843600 | F215: 1 | G215: 0.011714 | H215: 0 | I215: 0.885902
A216: ## StackObjectPool | B216: 10 | C216: 421400 | D216: 500 | E216: 842800 | F216: 1 | G216: 0.011725 | H216: 0 | I216: 0.892912
A217: ## StackObjectPool | B217: 10 | C217: 421400 | D217: 500 | E217: 842800 | F217: 1 | G217: 0.011692 | H217: 0 | I217: 0.899436
A218: ## StackObjectPool | B218: 10 | C218: 419000 | D218: 500 | E218: 838000 | F218: 1 | G218: 0.011792 | H218: 0 | I218: 0.908521
A219: ## StackObjectPool | B219: 10 | C219: 423000 | D219: 500 | E219: 846000 | F219: 1 | G219: 0.011702 | H219: 0 | I219: 0.910663
A220: ## StackObjectPool | B220: 10 | C220: 423200 | D220: 500 | E220: 846400 | F220: 1 | G220: 0.011673 | H220: 0 | I220: 0.916836
A221: ## StackObjectPool | B221: 10 | C221: 424500 | D221: 500 | E221: 849000 | F221: 1 | G221: 0.011661 | H221: 0 | I221: 0.921778
A222: ## StackObjectPool | B222: 10 | C222: 453500 | D222: 500 | E222: 907000 | F222: 1 | G222: 0.010911 | H222: 0 | I222: 0.830502
A223: ## StackObjectPool | B223: 10 | C223: 457700 | D223: 500 | E223: 915400 | F223: 1 | G223: 0.010826 | H223: 0 | I223: 0.833205
A224: ## StackObjectPool | B224: 10 | C224: 455800 | D224: 500 | E224: 911600 | F224: 1 | G224: 0.010878 | H224: 0 | I224: 0.841428
A225: ## StackObjectPool | B225: 10 | C225: 455100 | D225: 500 | E225: 910200 | F225: 1 | G225: 0.010894 | H225: 0 | I225: 0.848519
A226: ## StackObjectPool | B226: 10 | C226: 454100 | D226: 500 | E226: 908200 | F226: 1 | G226: 0.010918 | H226: 0 | I226: 0.855855
A227: ## StackObjectPool | B227: 10 | C227: 457000 | D227: 500 | E227: 914000 | F227: 1 | G227: 0.01084 | H227: 0 | I227: 0.859466
A228: ## StackObjectPool | B228: 10 | C228: 452800 | D228: 500 | E228: 905600 | F228: 1 | G228: 0.010892 | H228: 0 | I228: 0.869727
A229: ## StackObjectPool | B229: 10 | C229: 455200 | D229: 500 | E229: 910400 | F229: 1 | G229: 0.010877 | H229: 0 | I229: 0.873678
A230: ## StackObjectPool | B230: 10 | C230: 453300 | D230: 500 | E230: 906600 | F230: 1 | G230: 0.010942 | H230: 0 | I230: 0.881733
A231: ## StackObjectPool | B231: 10 | C231: 457500 | D231: 500 | E231: 915000 | F231: 1 | G231: 0.010855 | H231: 0 | I231: 0.883839
A232: ## StackObjectPool | B232: 10 | C232: 454000 | D232: 500 | E232: 908000 | F232: 1 | G232: 0.010919 | H232: 0 | I232: 0.83244
A233: ## StackObjectPool | B233: 10 | C233: 454600 | D233: 500 | E233: 909200 | F233: 1 | G233: 0.010867 | H233: 0 | I233: 0.838397
A234: ## StackObjectPool | B234: 10 | C234: 453100 | D234: 500 | E234: 906200 | F234: 1 | G234: 0.010925 | H234: 0 | I234: 0.846262
A235: ## StackObjectPool | B235: 10 | C235: 452900 | D235: 500 | E235: 905800 | F235: 1 | G235: 0.010921 | H235: 0 | I235: 0.852876
A236: ## StackObjectPool | B236: 10 | C236: 453900 | D236: 500 | E236: 907800 | F236: 1 | G236: 0.010912 | H236: 0 | I236: 0.858316
A237: ## StackObjectPool | B237: 10 | C237: 453900 | D237: 500 | E237: 907800 | F237: 1 | G237: 0.010901 | H237: 0 | I237: 0.864643
A238: ## StackObjectPool | B238: 10 | C238: 454500 | D238: 500 | E238: 909000 | F238: 1 | G238: 0.010871 | H238: 0 | I238: 0.87034
A239: ## StackObjectPool | B239: 10 | C239: 452800 | D239: 500 | E239: 905600 | F239: 1 | G239: 0.010928 | H239: 0 | I239: 0.878216
A240: ## StackObjectPool | B240: 10 | C240: 453200 | D240: 500 | E240: 906400 | F240: 1 | G240: 0.01094 | H240: 0 | I240: 0.884037
A241: ## StackObjectPool | B241: 10 | C241: 453000 | D241: 500 | E241: 906000 | F241: 1 | G241: 0.010912 | H241: 0 | I241: 0.890382
A242: ## StackObjectPool | B242: 12 | C242: 423400 | D242: 500 | E242: 846800 | F242: 1 | G242: 0.014015 | H242: 0 | I242: 0.943178
A243: ## StackObjectPool | B243: 12 | C243: 423100 | D243: 500 | E243: 846200 | F243: 1 | G243: 0.014025 | H243: 0 | I243: 0.950915
A244: ## StackObjectPool | B244: 12 | C244: 425000 | D244: 500 | E244: 850000 | F244: 1 | G244: 0.013974 | H244: 0 | I244: 0.956123
A245: ## StackObjectPool | B245: 12 | C245: 423200 | D245: 500 | E245: 846400 | F245: 1 | G245: 0.014062 | H245: 0 | I245: 0.965464
A246: ## StackObjectPool | B246: 12 | C246: 422900 | D246: 501 | E246: 844112 | F246: 2 | G246: 0.014055 | H246: 0 | I246: 0.973075
A247: ## StackObjectPool | B247: 12 | C247: 420600 | D247: 500 | E247: 841200 | F247: 1 | G247: 0.014118 | H247: 0 | I247: 0.98294
A248: ## StackObjectPool | B248: 12 | C248: 422400 | D248: 500 | E248: 844800 | F248: 1 | G248: 0.014044 | H248: 0 | I248: 0.987977
A249: ## StackObjectPool | B249: 12 | C249: 421500 | D249: 500 | E249: 843000 | F249: 1 | G249: 0.014076 | H249: 0 | I249: 0.996121
A250: ## StackObjectPool | B250: 12 | C250: 422000 | D250: 500 | E250: 844000 | F250: 1 | G250: 0.014057 | H250: 0 | I250: 1.002566
A251: ## StackObjectPool | B251: 12 | C251: 423000 | D251: 501 | E251: 844311 | F251: 1 | G251: 0.014038 | H251: 0 | I251: 1.008365
A252: ## StackObjectPool | B252: 12 | C252: 441600 | D252: 500 | E252: 883200 | F252: 1 | G252: 0.013431 | H252: 0 | I252: 0.922506
A253: ## StackObjectPool | B253: 12 | C253: 439500 | D253: 500 | E253: 879000 | F253: 1 | G253: 0.01352 | H253: 0 | I253: 0.931988
A254: ## StackObjectPool | B254: 12 | C254: 441100 | D254: 500 | E254: 882200 | F254: 1 | G254: 0.013484 | H254: 0 | I254: 0.937516
A255: ## StackObjectPool | B255: 12 | C255: 440500 | D255: 500 | E255: 881000 | F255: 1 | G255: 0.013496 | H255: 0 | I255: 0.94532
A256: ## StackObjectPool | B256: 12 | C256: 441800 | D256: 500 | E256: 883600 | F256: 1 | G256: 0.013436 | H256: 0 | I256: 0.951019
A257: ## StackObjectPool | B257: 12 | C257: 438800 | D257: 500 | E257: 877600 | F257: 1 | G257: 0.013551 | H257: 0 | I257: 0.961337
A258: ## StackObjectPool | B258: 12 | C258: 440800 | D258: 500 | E258: 881600 | F258: 1 | G258: 0.013457 | H258: 0 | I258: 0.966144
A259: ## StackObjectPool | B259: 12 | C259: 439600 | D259: 500 | E259: 879200 | F259: 1 | G259: 0.013526 | H259: 0 | I259: 0.974427
A260: ## StackObjectPool | B260: 12 | C260: 441300 | D260: 500 | E260: 882600 | F260: 1 | G260: 0.013438 | H260: 0 | I260: 0.979433
A261: ## StackObjectPool | B261: 12 | C261: 439700 | D261: 500 | E261: 879400 | F261: 1 | G261: 0.01353 | H261: 0 | I261: 0.988083
A262: ## StackObjectPool | B262: 12 | C262: 432600 | D262: 500 | E262: 865200 | F262: 1 | G262: 0.013747 | H262: 0 | I262: 0.939486
A263: ## StackObjectPool | B263: 12 | C263: 431700 | D263: 500 | E263: 863400 | F263: 1 | G263: 0.013725 | H263: 0 | I263: 0.947734
A264: ## StackObjectPool | B264: 12 | C264: 431700 | D264: 500 | E264: 863400 | F264: 1 | G264: 0.01378 | H264: 0 | I264: 0.954976
A265: ## StackObjectPool | B265: 12 | C265: 430300 | D265: 500 | E265: 860600 | F265: 1 | G265: 0.013811 | H265: 0 | I265: 0.96372
A266: ## StackObjectPool | B266: 12 | C266: 431200 | D266: 500 | E266: 862400 | F266: 1 | G266: 0.013799 | H266: 0 | I266: 0.969854
A267: ## StackObjectPool | B267: 12 | C267: 432300 | D267: 500 | E267: 864600 | F267: 1 | G267: 0.013736 | H267: 0 | I267: 0.975685
A268: ## StackObjectPool | B268: 12 | C268: 431900 | D268: 500 | E268: 863800 | F268: 1 | G268: 0.01376 | H268: 0 | I268: 0.983159
A269: ## StackObjectPool | B269: 12 | C269: 430500 | D269: 500 | E269: 861000 | F269: 1 | G269: 0.01381 | H269: 0 | I269: 0.991743
A270: ## StackObjectPool | B270: 12 | C270: 430800 | D270: 500 | E270: 861600 | F270: 1 | G270: 0.013784 | H270: 0 | I270: 0.998325
A271: ## StackObjectPool | B271: 12 | C271: 431800 | D271: 500 | E271: 863600 | F271: 1 | G271: 0.013777 | H271: 0 | I271: 1.004053
A272: ## StackObjectPool | B272: 14 | C272: 443700 | D272: 500 | E272: 887400 | F272: 1 | G272: 0.015693 | H272: 0 | I272: 1.003673
A273: ## StackObjectPool | B273: 14 | C273: 443800 | D273: 500 | E273: 887600 | F273: 1 | G273: 0.015667 | H273: 0 | I273: 1.011336
A274: ## StackObjectPool | B274: 14 | C274: 443800 | D274: 500 | E274: 887600 | F274: 1 | G274: 0.015671 | H274: 0 | I274: 1.019055
A275: ## StackObjectPool | B275: 14 | C275: 443000 | D275: 500 | E275: 886000 | F275: 1 | G275: 0.015688 | H275: 0 | I275: 1.027636
A276: ## StackObjectPool | B276: 14 | C276: 443800 | D276: 500 | E276: 887600 | F276: 1 | G276: 0.015678 | H276: 0 | I276: 1.034316
A277: ## StackObjectPool | B277: 14 | C277: 443300 | D277: 500 | E277: 886600 | F277: 1 | G277: 0.015685 | H277: 0 | I277: 1.04245
A278: ## StackObjectPool | B278: 14 | C278: 443500 | D278: 500 | E278: 887000 | F278: 1 | G278: 0.015651 | H278: 0 | I278: 1.049697
A279: ## StackObjectPool | B279: 14 | C279: 441000 | D279: 500 | E279: 882000 | F279: 1 | G279: 0.015773 | H279: 0 | I279: 1.060132
A280: ## StackObjectPool | B280: 14 | C280: 441100 | D280: 500 | E280: 882200 | F280: 3 | G280: 0.015781 | H280: 0 | I280: 1.067513
A281: ## StackObjectPool | B281: 14 | C281: 442700 | D281: 500 | E281: 885400 | F281: 1 | G281: 0.015695 | H281: 0 | I281: 1.072922
A282: ## StackObjectPool | B282: 14 | C282: 419000 | D282: 500 | E282: 838000 | F282: 1 | G282: 0.016597 | H282: 0 | I282: 1.025578
A283: ## StackObjectPool | B283: 14 | C283: 419500 | D283: 500 | E283: 839000 | F283: 1 | G283: 0.016524 | H283: 0 | I283: 1.032997
A284: ## StackObjectPool | B284: 14 | C284: 419400 | D284: 501 | E284: 837126 | F284: 1 | G284: 0.016588 | H284: 0 | I284: 1.041117
A285: ## StackObjectPool | B285: 14 | C285: 419400 | D285: 500 | E285: 838800 | F285: 1 | G285: 0.016552 | H285: 0 | I285: 1.049036
A286: ## StackObjectPool | B286: 14 | C286: 419200 | D286: 501 | E286: 836727 | F286: 1 | G286: 0.01656 | H286: 0 | I286: 1.057148
A287: ## StackObjectPool | B287: 14 | C287: 418200 | D287: 500 | E287: 836400 | F287: 1 | G287: 0.016602 | H287: 0 | I287: 1.066225
A288: ## StackObjectPool | B288: 14 | C288: 418200 | D288: 501 | E288: 834731 | F288: 1 | G288: 0.016585 | H288: 0 | I288: 1.073975
A289: ## StackObjectPool | B289: 14 | C289: 418200 | D289: 500 | E289: 836400 | F289: 1 | G289: 0.016609 | H289: 0 | I289: 1.081679
A290: ## StackObjectPool | B290: 14 | C290: 418000 | D290: 500 | E290: 836000 | F290: 1 | G290: 0.016639 | H290: 0 | I290: 1.0896
A291: ## StackObjectPool | B291: 14 | C291: 418800 | D291: 501 | E291: 835928 | F291: 1 | G291: 0.016588 | H291: 0 | I291: 1.096152
A292: ## StackObjectPool | B292: 14 | C292: 420300 | D292: 500 | E292: 840600 | F292: 1 | G292: 0.01655 | H292: 0 | I292: 1.032071
A293: ## StackObjectPool | B293: 14 | C293: 419700 | D293: 501 | E293: 837725 | F293: 1 | G293: 0.016581 | H293: 0 | I293: 1.040804
A294: ## StackObjectPool | B294: 14 | C294: 421100 | D294: 500 | E294: 842200 | F294: 1 | G294: 0.016464 | H294: 0 | I294: 1.046966
A295: ## StackObjectPool | B295: 14 | C295: 421000 | D295: 500 | E295: 842000 | F295: 1 | G295: 0.016513 | H295: 0 | I295: 1.054946
A296: ## StackObjectPool | B296: 14 | C296: 421800 | D296: 500 | E296: 843600 | F296: 1 | G296: 0.016501 | H296: 0 | I296: 1.061744
A297: ## StackObjectPool | B297: 14 | C297: 421200 | D297: 500 | E297: 842400 | F297: 1 | G297: 0.016531 | H297: 0 | I297: 1.070251
A298: ## StackObjectPool | B298: 14 | C298: 421800 | D298: 501 | E298: 841916 | F298: 1 | G298: 0.016475 | H298: 0 | I298: 1.077164
A299: ## StackObjectPool | B299: 14 | C299: 420800 | D299: 500 | E299: 841600 | F299: 1 | G299: 0.016526 | H299: 0 | I299: 1.086078
A300: ## StackObjectPool | B300: 14 | C300: 422300 | D300: 500 | E300: 844600 | F300: 1 | G300: 0.016479 | H300: 0 | I300: 1.091721
A301: ## StackObjectPool | B301: 14 | C301: 421400 | D301: 501 | E301: 841118 | F301: 1 | G301: 0.01649 | H301: 0 | I301: 1.100405
A302: ## StackObjectPool | B302: 16 | C302: 427000 | D302: 501 | E302: 852295 | F302: 1 | G302: 0.018611 | H302: 0 | I302: 1.088169
A303: ## StackObjectPool | B303: 16 | C303: 427700 | D303: 501 | E303: 853693 | F303: 1 | G303: 0.018543 | H303: 0 | I303: 1.095774
A304: ## StackObjectPool | B304: 16 | C304: 427100 | D304: 500 | E304: 854200 | F304: 1 | G304: 0.018614 | H304: 0 | I304: 1.104997
A305: ## StackObjectPool | B305: 16 | C305: 429100 | D305: 501 | E305: 856487 | F305: 1 | G305: 0.018539 | H305: 0 | I305: 1.110796
A306: ## StackObjectPool | B306: 16 | C306: 428300 | D306: 501 | E306: 854890 | F306: 1 | G306: 0.018566 | H306: 0 | I306: 1.120151
A307: ## StackObjectPool | B307: 16 | C307: 428800 | D307: 501 | E307: 855888 | F307: 1 | G307: 0.018526 | H307: 0 | I307: 1.127742
A308: ## StackObjectPool | B308: 16 | C308: 427100 | D308: 500 | E308: 854200 | F308: 1 | G308: 0.018609 | H308: 0 | I308: 1.138188
A309: ## StackObjectPool | B309: 16 | C309: 428000 | D309: 500 | E309: 856000 | F309: 1 | G309: 0.018586 | H309: 0 | I309: 1.145135
A310: ## StackObjectPool | B310: 16 | C310: 426700 | D310: 501 | E310: 851697 | F310: 1 | G310: 0.018617 | H310: 0 | I310: 1.154966
A311: ## StackObjectPool | B311: 16 | C311: 428000 | D311: 501 | E311: 854291 | F311: 1 | G311: 0.0186 | H311: 0 | I311: 1.161247
A312: ## StackObjectPool | B312: 16 | C312: 483100 | D312: 500 | E312: 966200 | F312: 1 | G312: 0.016477 | H312: 0 | I312: 1.025016
A313: ## StackObjectPool | B313: 16 | C313: 483300 | D313: 500 | E313: 966600 | F313: 1 | G313: 0.016451 | H313: 0 | I313: 1.0328
A314: ## StackObjectPool | B314: 16 | C314: 480600 | D314: 501 | E314: 959281 | F314: 1 | G314: 0.016579 | H314: 0 | I314: 1.043669
A315: ## StackObjectPool | B315: 16 | C315: 483500 | D315: 501 | E315: 965070 | F315: 1 | G315: 0.016457 | H315: 0 | I315: 1.048413
A316: ## StackObjectPool | B316: 16 | C316: 482200 | D316: 500 | E316: 964400 | F316: 1 | G316: 0.016487 | H316: 0 | I316: 1.057649
A317: ## StackObjectPool | B317: 16 | C317: 482400 | D317: 500 | E317: 964800 | F317: 1 | G317: 0.016501 | H317: 0 | I317: 1.065203
A318: ## StackObjectPool | B318: 16 | C318: 482200 | D318: 500 | E318: 964400 | F318: 1 | G318: 0.016499 | H318: 0 | I318: 1.073139
A319: ## StackObjectPool | B319: 16 | C319: 483600 | D319: 501 | E319: 965269 | F319: 1 | G319: 0.016474 | H319: 0 | I319: 1.079244
A320: ## StackObjectPool | B320: 16 | C320: 482400 | D320: 500 | E320: 964800 | F320: 1 | G320: 0.01648 | H320: 0 | I320: 1.088185
A321: ## StackObjectPool | B321: 16 | C321: 483000 | D321: 501 | E321: 964072 | F321: 1 | G321: 0.016468 | H321: 0 | I321: 1.095054
A322: ## StackObjectPool | B322: 16 | C322: 441500 | D322: 500 | E322: 883000 | F322: 1 | G322: 0.018039 | H322: 0 | I322: 1.066956
A323: ## StackObjectPool | B323: 16 | C323: 440300 | D323: 501 | E323: 878842 | F323: 1 | G323: 0.018083 | H323: 0 | I323: 1.076838
A324: ## StackObjectPool | B324: 16 | C324: 440000 | D324: 501 | E324: 878244 | F324: 1 | G324: 0.018095 | H324: 0 | I324: 1.085572
A325: ## StackObjectPool | B325: 16 | C325: 440300 | D325: 501 | E325: 878842 | F325: 1 | G325: 0.018079 | H325: 0 | I325: 1.0935
A326: ## StackObjectPool | B326: 16 | C326: 441600 | D326: 501 | E326: 881437 | F326: 1 | G326: 0.018016 | H326: 0 | I326: 1.100109
A327: ## StackObjectPool | B327: 16 | C327: 440900 | D327: 500 | E327: 881800 | F327: 1 | G327: 0.018031 | H327: 0 | I327: 1.10914
A328: ## StackObjectPool | B328: 16 | C328: 441500 | D328: 500 | E328: 883000 | F328: 1 | G328: 0.018032 | H328: 0 | I328: 1.116491
A329: ## StackObjectPool | B329: 16 | C329: 440400 | D329: 500 | E329: 880800 | F329: 1 | G329: 0.018074 | H329: 0 | I329: 1.125939
A330: ## StackObjectPool | B330: 16 | C330: 440700 | D330: 500 | E330: 881400 | F330: 1 | G330: 0.01806 | H330: 0 | I330: 1.13355
A331: ## StackObjectPool | B331: 16 | C331: 441000 | D331: 501 | E331: 880240 | F331: 1 | G331: 0.017989 | H331: 0 | I331: 1.141075